id,text,text_el,is_criticism,topic-context,subtopic-context,sentiment,polarization-definition,populism-definition,ner-limited
10,"Friends and friends citizens of Agrinio. This is the image of indifference and arrogance that the Mitsotakis government and Mr Mitsotakis himself have shown throughout the four years. He knew nothing and everything was someone else's fault. He knew nothing himself. He needs more proof. To realize that we can't go on with this understatement any longer. Citizens of Agrinio, citizens of Aitoloakarnania, next Sunday we have a chance. We have the opportunity at the ballot box. We have the opportunity to punish those who, for four years now, with their arrogance and indifference, have led us into a painful situation, but we also have the opportunity to pave the way for a progressive government, a government of progressive cooperation, not only to punish, but to take responsibility to put society back on its feet, to reinvigorate the economy, to change this framework of inequalities and to breathe life into the dreams of the new generation, the hopes of the great majority of society. ","Φίλες και φίλοι πολίτες του Αγρινίου. Αυτή την εικόνα της αδιαφορίας και της αλαζονείας η κυβέρνηση Μητσοτάκη και ο ίδιος ο κύριος Μητσοτάκης την έδειχνε σε όλη την τετραετία. Τίποτα δεν ήξερε και για όλα κάποιος άλλος έφταιγε. Τίποτα δεν ήξερε ο ίδιος. Χρειάζεται άλλη απόδειξη. Για να συνειδητοποιήσουμε ότι δεν πάει άλλο με αυτήν την υποτιμητική συμπεριφορά. Πολίτες του Αγρινίου, πολίτες της Αιτωλοακαρνανίας, την επόμενη Κυριακή έχουμε την ευκαιρία. Έχουμε την ευκαιρία στην κάλπη. Να τιμωρήσουμε αυτούς που 4 χρόνια τώρα, με την αλαζονεία και την αδιαφορία τους μας οδήγησαν σε μια κατάσταση οδυνηρή, αλλά έχουμε και την ευκαιρία να ανοίξουμε το δρόμο σε μια προοδευτική κυβέρνηση, κυβέρνηση προοδευτικής συνεργασίας, όχι μόνο για να τιμωρήσουμε, αλλά για να αναλάβουμε την ευθύνη να ξαναστήσουμε την κοινωνία στα πόδια της, να ξανατονώσουμε την οικονομία να, να αλλάξουμε αυτό το πλαίσιο των ανισοτήτων και να δώσουμε πνοή πνοή στα όνειρα της νέας γενιάς, στις ελπίδες της μεγάλης κοινωνικής πλειοψηφίας. ",political agenda,other,election spending,-0.6,0.2,0.2,"[['agrinio', 'location', '0.9'], ['mitsotakis', 'person', '1.0'], ['mitsotakis', 'person', '1.0'], ['aitoloakarnania', 'location', '0.9']]"
11,"So we will not forget everything that has happened in this four-year period. Nor will we forget the crime of Tempe. Nor will we forget the rape of democracy and the rule of law through illegal surveillance. Mitsotakis was avoiding. Like the devil on incense to come to a debate. And he probably knew something that he was avoiding. He still avoids the invitation to come and debate today, but he decided and accepted the 6 political leaders meeting, thinking he would be able to hide behind the other 4. But at the first zorik question, he was stunned and he testified without a beating, his monk, everything he had been trying to keep hidden for 9 months now. In connection with the great wiretapping scandal. He confessed to the scandal and the rape of democracy and the rule of law. He admitted that there was no national reason for the wiretapping. But I want to ask myself once again here from Agrinio. If there was no national reason for the interceptions, then why did he invoke national secrecy for nine months to conceal the truth from the parliamentary committee of inquiry? Why, if there was no national reason, did the prosecutor of the NSA, Mrs Vlachou, illegally sign the provisions for the surveillance of citizens? Half the political system, political leaders, ministers, even the heads of the armed forces. And why is this lady still in her position? Where does she keep Mr Mitsotakis? Why, too, and what exactly did the Prosecutor of the Supreme Court, Mr Doyakos, do to identify the perpetrators? And why why why? There is no indictment 9 months today for these illegal acts. So, to conclude, it is not only a scandal, it is a crime against democracy, against the rule of law, against the rights of the citizen and it is also a felony under the criminal code. A felony that they are trying to cover up by manipulating the judiciary and now they are attempting to wash away their blunders with the vote of the people.","Δεν θα ξεχάσουμε λοιπόν όλα όσα έγιναν αυτή την τετραετία. Δεν θα ξεχάσουμε ούτε το έγκλημα των Τεμπών. Ούτε το βιασμό της δημοκρατίας και του κράτους δικαίου με τις παράνομες παρακολουθήσεις. Ο Μητσοτάκης απέφευγε. Σαν το διάολο το λιβάνι να έρθει σε ένα debate. Και μάλλον κάτι ήξερε που το απέφευγε. Αποφεύγει ακόμα και σήμερα την πρόσκληση να έρθει να αντιπαρατεθούμε, αλλά αποφάσισε και δέχθηκε να βρεθούμε οι 6 πολιτικοί αρχηχοί, νομίζοντας ότι θα καταφέρει να κρυφτεί πίσω από τους άλλους 4. Στην πρώτη ζορικη ερώτηση όμως έπαθε τρικυμία και μαρτύρησε δίχως ξύλο, μοναχός του, όλα όσα προσπαθούσε να κρατήσει κρυφά 9 μήνες τώρα. Σε σχέση με το μεγάλο σκάνδαλο των υποκλοπών. Ομολόγησε το σκάνδαλο και το βιασμό της δημοκρατίας και του κράτους δικαίου. Παραδέχθηκε ότι δεν υπήρξε κανένας εθνικός λόγος για τις παρακολουθήσεις. Θέλω όμως να αναρωτηθώ για άλλη μια φορά εδώ από το Αγρίνιο. Αν δεν υπήρξε εθνικός λόγος για τις παρακολουθήσεις, τότε γιατί επί 9 μήνες επικαλείτο το εθνικό απόρρητο για να συγκαλύψει την αλήθεια στην εξεταστική επιτροπή της Βουλής; Για ποιο λόγο, εφόσον δεν υπήρξε εθνικός λόγος, η εισαγγελέας της ΕΥΠ, η κυρια βλαχου, υπέγραφε παρανόμως τις διατάξεις για να παρακολουθούνται πολίτες; Το μισό πολιτικό σύστημα, πολιτικοί αρχηγοί, υπουργοί, ακόμα και οι αρχηγοί των ενόπλων δυνάμεων. Και για ποιο λόγο η κυρία αυτή παραμένει ακόμα στη θέση της; Πού τον κρατάει τον κύριο Μητσοτάκη; Για ποιο λόγο επίσης και τι ακριβώς έκανε ο Εισαγγελέας του Αρείου Πάγου, ο κύριος Ντογιάκος, για να εντοπίσει τους δράστες; Και γιατί γιατί; Δεν υπάρχει καμία απαγγελία κατηγορίας 9 μήνες σήμερα για αυτές τις παράνομες πράξεις. Για να τελειώνουμε λοιπόν, δεν είναι μόνο σκάνδαλο, είναι έγκλημα κατά της δημοκρατίας, του κράτους δικαίου, κατά των δικαιωμάτων του πολίτη και είναι και κακούργημα, σύμφωνα με τον ποινικό κώδικα. Κακούργημα που προσπαθούν να συγκαλύψουν χειραγωγώντας τη δικαιοσύνη και τώρα επιχειρούν να ξεπλυθούν και να ξεπλύνουν τα ατοπήματα τους με την ψήφο του λαού. ",criticism,other,wiretapping,-0.8,0.6,0.2,"[['tempe', 'location', '0.5'], ['mitsotakis', 'person', '1.0'], ['6 political leaders meeting', 'group of people', '0.8'], ['agrinio', 'location', '0.5'], ['nsa', 'organization', '0.6'], ['mrs vlachou', 'person', '0.6'], ['prosecutor of the supreme court', 'organization', '0.6']]"
12,"So today I want to address not you, but the conservative citizens, the honest New Democrats. We have important ideological differences, but I believe that a very large part of these conservative citizens are honest and feel ashamed of this family that governs them, that governs us and that governs their party. They are ashamed of the wiretapping scandal, of the violation of the rule of law, of the rape of democracy, of the widening of inequalities. I don't want to ask them. Mr Mitsotakis, it is clear, wants to be washed away with your vote. Will you wash him out with your vote; will you be complicit in the rape of democracy? Will you give him a blank cheque to carry on doing the same and worse, to become possibly even more dangerous? It is obvious that there will be no light and no catharsis if Mr Mitsotakis does not pay the price for his actions, that is, if he is not defeated in the elections of 21 May. We therefore call on the citizens not to be complicit in this crime.","Θέλω λοιπόν σήμερα να απευθυνθώ όχι σε εσάς, αλλά στους συντηρητικούς πολίτες, στους έντιμους Νεοδημοκράτες. Έχουμε σημαντικές ιδεολογικές διαφορές, αλλά πιστεύω ότι ένα πολύ μεγάλο μέρος αυτών των συντηρητικών πολιτών είναι έντιμοι και αισθάνονται ντροπή για αυτή την οικογένεια που τους κυβερνούν, που μας κυβερνά και που διοικεί το κόμμα τους. Αισθάνονται ντροπή για το σκάνδαλο των υποκλοπών, για την παραβίαση του κράτους δικαίου, για το βιασμό της δημοκρατίας, για τη διεύρυνση των ανισοτήτων. Δε θέλω να τους ρωτήσω. Ο κύριος Μητσοτάκης, είναι σαφές, θέλει να ξεπλυθεί με την ψήφο σας. Θα τον ξεπλύνετε με την ψήφο σας; θα γίνετε συνένοχοι στο βιασμό της δημοκρατίας; Θα του δώσετε λευκή επιταγή, να συνεχίσει τα ίδια και χειρότερα, να γίνει ενδεχομένως και ακόμα πιο επικίνδυνος; Είναι φανερό ότι φως και κάθαρση δεν πρόκειται να υπάρξει αν ο κύριος Μητσοτάκης δεν πληρώσει το τίμημα των πράξεών του, αν δηλαδή δεν ηττηθεί στις εκλογές της 21ης του Μάη. Καλούμε λοιπόν τους πολίτες να μην γίνουν συνένοχοι σε αυτό το έγκλημα. ",criticism,elections,election spending,-0.8,0.3,0.3,"[['new democrats', 'group of people', '0.6'], ['mitsotakis', 'person', '1.0'], ['conservative citizens', 'group of people', '0.8'], ['wiretapping scandal', 'organization', '0.4'], ['rule of law', 'organization', '0.6'], ['democracy', 'organization', '0.8'], ['inequalities', 'organization', '0.6'], ['21 may', 'date', '1.0.']]"
13,"And I want to send this message not only to conservative voters, but I also want this message to reach Mr.Androulakis of Kinal.And let me ask. How will the perpetrators of the parastate really be taken to prison, as he rightly demanded the day before yesterday, with a government of the New Democracy of Mr Mitsotakis? How can you leave equal distances for the next day between the man who was watching you, because he wanted to control you, on the one hand, and the prospect of a progressive government that will bring about a catharsis and hold the perpetrators of the parastate to account, on the other? So from here, from democratic Agrinio, from democratic Agrinio, from the city of great democratic traditions, I want to remind those who consider themselves to be the exclusive intellectual property of the legacy and the slogans of the democratic party and of the great leader of the democratic party, Andreas Papandreou, of something. And let me remind them that Andreas Papandreou never saw a front, he never had a front in the progressive forces. He had only one front, the Right. The worst Right we have ever had is the one we have today, that's why we. I personally have only one front, Mr Mitsotakis's Right, no one else's. And I extend my hand to all the progressive forces of the country, to the progressive citizens. And I ask them, what is the crucial stakes of this battle? That on May 23rd, Mr. Mitsotakis is not in the Mansion, that we have a progressive coalition government on May 22nd to bring about change.","Και αυτό το μήνυμα θέλω να το στείλω όχι μονάχα συντηρητικούς ψηφοφόρους, αλλά αυτό το μήνυμα θέλω να φτάσει και στον κύριο Ανδρουλάκη του ΚΙΝΑΛ. Και να ρωτήσω. Πώς αλήθεια θα οδηγηθούν οι υπαίτιοι του παρακράτους στη φυλακή, όπως ευλόγως ζήτησε προχθές, με κυβέρνηση της Νέας Δημοκρατίας του κυρίου Μητσοτάκη; Πώς γίνεται να αφήνετε ίσες αποστάσεις για την επόμενη μέρα ανάμεσα σε αυτόν που σας παρακολουθούσε, γιατί ήθελε να σας ελέγχει από τη μια, και στην προοπτική μιας προοδευτικής κυβέρνησης που θα φέρει την κάθαρση και θα θέσει τους υπαίτιους του παρακράτους προ των ευθυνών τους, από την άλλη; Για αυτό λοιπόν από δω, από το δημοκρατικό Αγρίνιο, από το δημοκρατικό Αγρίνιο, από την από την πόλη των μεγάλων δημοκρατικών παραδόσεων, θέλω να θυμίσω κάτι σε όσους θεωρούν ότι έχουν την αποκλειστική πνευματική ιδιοκτησία της παρακαταθήκης και των συνθημάτων της δημοκρατικής παράταξης αλλά και του ίδιου του μεγάλου ηγέτη της δημοκρατικής παράταξης του Ανδρέα Παπανδρέου. Και να τους θυμίσω, ο Ανδρέας Παπανδρέου δεν είχε ποτέ δει μέτωπο, δεν είχε ποτέ μέτωπο στις προοδευτικές δυνάμεις. Ένα ήταν το μέτωπό του, η Δεξιά. Η χειρότερη Δεξιά που είχαμε ποτέ είναι η σημερινή, για αυτό και εμείς. Εγώ προσωπικά ένα μόνο μετώπο έχω, τη Δεξιά του κυρίου Μητσοτάκη, κανέναν άλλον. Και απλώνω απλώνω το χέρι σε όλες τις προοδευτικές δυνάμεις του τόπου, στους προοδευτικούς πολίτες. Και τους ρωτώ, ποιο είναι το κρίσιμο διακύβευμα αυτής της μάχης; Να μην είναι στις 23 του Μάη να μην είναι ο κύριος Μητσοτάκης στο Μέγαρο μαξίμου, να έχουμε προοδευτική κυβέρνηση συνεργασίας στις 22 του Μάη για να φέρουμε την αλλαγή. ",political agenda,elections,other,0.0,0.3,0.0,"[['mr. androulakis', 'person', '1.0'], ['new democracy', 'political party', '1.0'], ['mitsotakis', 'person', '1.0'], ['parastate', 'group of people', '1.0'], ['agrinio', 'location', '1.0'], ['democratic party', 'organization', '1.0'], ['andreas papandreou', 'person', '1.0'], ['right', 'political party', '1.0'], ['may 23rd', 'date', '1.0'], ['may 22nd', 'date', '1.0']]"
14,"To put society back on its feet, to bring hope to young people, to support the weak. This is our front. This is our vision and this is what will be put into practice with the vote of the Greek people next Sunday.","Να ξαναστήσουμε την κοινωνία στα πόδια της, να φέρουμε την ελπίδα στις νέες και στους νέους, να στηρίξουμε τους αδύναμους. Αυτό είναι το δικό μας μέτωπο. Αυτό είναι το δικό μας όραμα και αυτό θα γίνει πράξη με την ψήφο του ελληνικού λαού την ερχόμενη Κυριακή. ",political agenda,elections,youth,0.8,0.0,0.2,"[['greek people', 'group of people', '1.0'], ['greece', 'country', '1.0'], ['sunday', 'date', '1.0']]"
15,"But I want to tell you one more thing. I told you earlier that Mr Mitsotakis does not care. That is half the truth. He does not care about the many, he cares about a few and powerful, he cares about a privileged few. It is no accident. Very few days ago a video saw the light of day on the Internet. With an employer next to the Minister of Development, where he was gleefully threatening and blackmailing workers that if they don't vote for New Democracy and vote for Syriza, they will be fired. This man has a point, because if SYRIZA becomes the first party next Sunday and we have a government of progressive cooperation, the easy money from the public purse that he has been receiving all this time will be cut off. It is a waste of billions. Sky-high profits privatizing the PPC, hospitals, water. Distribution of Recovery Fund resources to big conglomerates, blue grasshoppers, so called the party cadres' assault on public money and public positions. These are Mr Mitsotakis's projects. How can he not care? He cares, but he cares for the few and the privileged. 15 listed companies with more than a billion in profits each, a twenty-year record of profitability, are Mr Mitsotakis' work, and that too at a time when households cannot make it through the third week of the month. So how can he not care? He cares, but for some powerful people and they in turn care in order to gain another four years which will translate into profit for themselves. They support him because he has the state coffers, they vote for him, they fund him, they craft his image in the media, so it's pretty simple.","Θέλω όμως να σας πω και κάτι ακόμα. Σας είπα πιο πριν ότι ο κύριος Μητσοτάκης δεν νοιάζεται. Είναι η μισή αλήθεια. Δεν νοιάζεται για τους πολλούς, νοιάζεται για κάποιους λίγους και ισχυρούς, νοιάζεται για κάποιους προνομιούχους. Δεν είναι τυχαίο. Πολύ πριν από λίγες ημέρες είδε τη δημοσιότητα στο Διαδίκτυο ένα βίντεο. Με έναν εργοδότη δίπλα από τον υπουργό Αναπτύξεως, όπου ήταν περιχαρής να απειλεί και να εκβιάζει τους εργαζόμενους, ότι αν δεν ψηφίσουν τη Νέα Δημοκρατία και ψηφίσουν τον ΣΥΡΙΖΑ θα απολυθούν. Ο άνθρωπος αυτός έχει τα δίκια του εδώ που τα λέμε, διότι αν βγει πρώτο κόμμα ο ΣΥΡΙΖΑ την άλλη Κυριακή και έχουμε κυβέρνηση προοδευτικής συνεργασίας, θα του κοπεί το εύκολο χρήμα από το δημόσιο ταμείο που έπαιρνε όλο το προηγούμενο διάστημα. Αισχροκέρδεια δισεκατομμυρίων. Ουρανοκατέβατα κέρδη ιδιωτικοποίηση της ΔΕΗ, των νοσοκομείων, του νερού. Διανομή των πόρων του Ταμείου Ανάκαμψης σε μεγάλους ομίλους, γαλάζιες ακρίδες, έτσι ονομάστηκε η εφόρμηση των κομματικών στελεχών στο δημόσιο χρήμα και στις δημόσιες θέσεις. Αυτά είναι τα έργα του κυρίου Μητσοτάκη. Πώς δε νοιάζεται λοιπό; Νοιάζεται, αλλά νοιάζεται για λίγους και προνομιούχους. 15 εισηγμένες στο χρηματιστήριο με πάνω από ένα δισεκατομμύριο κέρδη κάθε μία, ρεκόρ κερδοφορίας εικοσαετίας, έργο του κυρίου Μητσοτάκη είναι και αυτό την ώρα που τα νοικοκυριά δεν μπορούν να βγάλουν την τρίτη εβδομάδα του μήνα. Πως δεν νοιάζεται λοιπόν; Νοιάζεται, αλλά για κάποιους ισχυρούς και αυτοί με τη σειρά τους νοιάζονται για να κερδίσει άλλη μια τετραετία που θα μεταφραστεί σε κέρδος για τους ίδιους. Τον στηρίζουν γιατί τους διαθέτει τα ταμεία του κράτους, τον ψηφίζουν, το χρηματοδοτούν, φιλοτεχνούν την εικόνα του στα μέσα ενημέρωσης, οπότε τα πράγματα είναι πολύ απλά. ",criticism,other,other,-0.8,0.7,0.8,"[['mr mitsotakis', 'person', '1.0'], ['new democracy', 'political party', '0.6'], ['syriza', 'political party', '0.7'], ['minister of development', 'person', '0.8'], ['ppp', 'organization', '0.5'], ['recovery fund', 'organization', '0.4']]"
