id,text,text_el,is_criticism,topic-context,subtopic-context,sentiment,polarization-definition,populism-definition,ner-limited
16,"What exactly do we want to happen next Sunday night? Who will be the ones in the streets celebrating the people's victory? The democratic citizens? Or the cartels and the powerful? Who do we want smiling next Sunday? The energy companies, the cartels of the powerful or do we want the democratic people in the streets hoping for a better tomorrow? I am sure, from your rally today, from your overwhelming presence here in Agrinio today, that next Sunday the people will be celebrating. You will be celebrating, all of us will be celebrating the victory of democracy, the return of justice, the victory of the people. 7 days left for the worst right-wing government the country has ever seen to go. So we will go strong in these 7 days we will go strong to bring victory. And we will win next Sunday. We will win, because we have no choice.","Τι ακριβώς θέλουμε να συμβεί την άλλη Κυριακή το βράδυ; Ποιοι να είναι αυτοί που θα πανηγυρίζουν στους δρόμους τη νίκη του λαού; Οι δημοκρατικοί πολίτες; Ή τα καρτέλ και οι ισχυροί; Ποιοι θέλουμε να χαμογελούνε την άλλη Κυριακή; Οι εταιρείες της ενέργειας, τα καρτέλ των ισχυρών ή θέλουμε να είναι ο λαός ο δημοκρατικός στους δρόμους που θα ελπίζει σε ένα καλύτερο αύριο; Είμαι βέβαιος, από τη σημερινή σας συγκέντρωση, από τη σημερινή σας συγκλονιστική παρουσία εδώ στο Αγρίνιο, ότι την άλλη Κυριακή ο λαός θα πανηγυρίζει. Εσείς θα πανηγυρίζετε, όλοι μας θα πανηγυρίζουμε την νίκη της δημοκρατίας, την επιστροφή της δικαιοσύνης, τη νίκη του λαού. 7 μέρες έμειναν για να φύγει η χειρότερη κυβέρνηση της δεξιάς που έχει δει ο τόπος. Θα πάμε γερά λοιπόν τις 7 αυτές μέρες θα πάμε γερά για να φέρουμε τη νίκη. Και θα νικήσουμε την άλλη Κυριακή. Θα νικήσουμε, γιατί δεν έχουμε άλλη επιλογή.",political agenda,elections,election spending,0.6,0.7,0.75,"[['next sunday night', 'date', '1.0'], ['democratic citizens', 'group of people', '0.6'], ['cartels', 'organization', '0.7'], ['powerful', 'group of people', '0.4'], ['democratic people', 'group of people', '0.6'], ['energy companies', 'organization', '0.6'], ['streets', 'location', '1.0'], ['cartels', 'organization', '0.7'], ['democratic people', 'group of people', '0.6'], ['agrinio', 'location', '1.0'], ['democracy', 'organization', '0.5'], ['justice', 'organization', '0.6'], ['people', 'group of people', '1.0'], ['right-wing government', 'organization', '0.6'], ['country', 'country', '1.0']]"
17,"He asked me. The day before yesterday a new kid. How do you see things? I said how do you see things? I see a SYRIZA victory, he replied. I said why? Can't you see that they keep presenting polls that say the opposite? He replied, I see a SYRIZA victory because I and all my friends will vote for SYRIZA. Secondly, I see a SYRIZA victory because there is no other way. Because it is our only hope to stay in this country, not to emigrate, not to go abroad. And I take this answer not only as a message of optimism, but also as a heavy responsibility. We have a heavy responsibility to turn the dreams of these young people, the aspirations of these young people, into reality. We have a heavy responsibility. We are obliged not only to win, but also to rebuild our country on solid foundations of social justice, to give perspective to the dreams of the new generation.","Με ρώτησε. Προχθές ένα νέο παιδί. Πως βλέπεις τα πράγματα; Του λέω εσύ πως τα βλέπεις; Βλέπω νίκη του ΣΥΡΙΖΑ μου απαντά. Του λέω γιατί; Δεν βλέπεις ότι παρουσιάζουν διαρκώς μετρήσεις που λένε το αντίθετο; Μου απάντησε, βλέπω νίκη του ΣΥΡΙΖΑ γιατί και εγώ και όλοι μου οι φίλοι ΣΥΡΙΖΑ θα ψηφίσουμε. Δεύτερον, βλέπω νίκη του ΣΥΡΙΖΑ γιατί δεν γίνεται αλλιώς. Γιατί είναι η μόνη μας ελπίδα να μείνουμε σε αυτόν τον τόπο, να μην ξενιτευτούμε, να μην βγούμε στο εξωτερικό. Και παίρνω αυτή την απάντηση, όχι μονάχα ως ένα μήνυμα αισιοδοξίας, αλλά και ως μια βαριά ευθύνη. Έχουμε βαριά ευθύνη τα όνειρα αυτών των νέων ανθρώπων, τις προσδοκίες αυτών των νέων ανθρώπων, να τις κάνουμε πράξη. Έχουμε βαριά ευθύνη. Είμαστε υποχρεωμένοι όχι μόνο να νικήσουμε, αλλά και να ξαναχτίσουμε την πατρίδα μας σε βάσεις στέρεες με κοινωνική δικαιοσύνη, για να δώσουμε προοπτική στα όνειρα της νέας γενιάς. ",political agenda,elections,youth,0.6,0.0,0.2,"[['new kid', 'person', '0.60'], ['syriza', 'political party', '1.00'], ['syriza', 'organization', '0.80'], ['country', 'location', '0.80'], ['abroad', 'location', '0.60'], ['new generation', 'group of people', '0.60']]"
18,"We have an obligation to win and we will win because the Greeks do not deserve to spend another four years in injustice, in indifference, in the arrogance of power. And why? To remember a nice old slogan, to remember a nice old slogan, Greece does not belong to a few families that rule us. Greece does not belong to a few rich and powerful people. Greece belongs to all Greeks. You know, these slogans belong to the democratic and progressive party, they are our common heritage. But we do not say them to recapture the glories of the past. We say them because today they have been made dramatically relevant again by the worst right-wing party since the post-war period, the right-wing party of Mr Mitsotakis. Some of the younger people do not remember what the Right means, and Mr Mitsotakis has reminded us of this four years ago with his behaviour and has reminded us that, in the end, the Right means inequality, it means injustice, it means authoritarianism, it means obscenity, it means family rule. All of which we want to put an end to with our vote next Sunday.","Έχουμε υποχρέωση να νικήσουμε και θα νικήσουμε γιατί δεν αξίζει στις Ελληνίδες και στους Έλληνες άλλα 4 χρόνια να περάσουνε μια ζωή στην αδικία, στην αδιαφορία, στην αλαζονεία της εξουσίας. Και γιατί; Για να θυμηθώ ένα ωραίο παλιό σύνθημα, για να θυμηθώ ένα ωραίο παλιό σύνθημα, η Ελλάδα δεν ανήκει σε λίγες οικογένειες που μας κυβερνάνε. Η Ελλάδα δεν ανήκει σε λίγους πλούσιους και ισχυρούς. Η Ελλάδα ανήκει σε όλους τους Έλληνες. Ξέρετε, τα συνθήματα αυτά ανήκουνε στην δημοκρατική και προοδευτική παράταξη, είναι κοινή μας παρακαταθήκη. Δεν τα λέμε όμως για να μηρυκάζουμε τις δόξες του παρελθόντος. Τα λέμε, γιατί σήμερα τα έχει κάνει ξανά δραματικά επίκαιρα η χειρότερη Δεξιά από τη Μεταπολίτευση και μετά, η Δεξιά του κυρίου Μητσοτάκη. Κάποιοι νεότεροι δεν θυμούνται τι σημαίνει Δεξιά, μας το θύμισε 4 χρόνια τώρα ο κύριος Μητσοτάκης με τη συμπεριφορά του και μας θύμισε ότι τελικά Δεξιά σημαίνει ανισότητες, σημαίνει αδικία, σημαίνει αυταρχισμός, σημαίνει αισχροκέρδεια, σημαίνει οικογενειοκρατία. Όλα αυτά στα οποία θέλουμε να βάλουμε ένα τέλος με την ψήφο μας την επόμενη Κυριακή. ",criticism,other,inequality,0.4,0.6,0.5,"[['greeks', 'location', '0.6'], ['democratic and progressive party', 'political party', '0.9'], ['mr mitsotakis', 'person', '0.7'], ['right-wing party', 'political party', '0.8'], ['sunday', 'date', '0.5']]"
19,"The dilemma then. The dilemma that we have before us at the ballot box. The dilemma we have before the ballot box is indeed whether this change, which is not a change in government, is a change in our lives, in our income, in our rights. So the dilemma we have is one. Mitsotakis again for another four years or change in our lives? Mitsotakis again or justice everywhere? This is the main dilemma next Sunday.","Το δίλημμα λοιπόν. Το δίλημμα που έχουμε μπροστά στην κάλπη. Το δίλημμα που έχουμε μπροστά στην κάλπη είναι πράγματι αν αυτή η αλλαγή που δεν είναι αλλαγής της κυβέρνησης, είναι αλλαγή στη ζωή μας, στο εισόδημα, στα δικαιώματα. Το δίλημμα λοιπόν που έχουμε είναι ένα. Μητσοτάκης ξανά άλλα 4 χρόνια ή αλλαγή στη ζωή μας; Μητσοτάκης ξανά ή δικαιοσύνη παντού; Αυτό είναι το βασικό δίλημμα της επόμενης Κυριακής. ",political agenda,other,election spending,0.0,0.2,0.1,"[['mitsotakis', 'person', '0.9'], ['sunday', 'date', '0.9']]"
20,"SYRIZA has put its cards on the table, its programme. We submitted the contract for change, a contract with 11 articles, which is permeated by an inviolable condition, justice. But what is the fourfold? Shall I say I of this contract? Let me say it simply and clearly so that you can convey it during these seven days that have been left in every village, in every citizen, in every café, in every home. What a victory of SYRIZA in the elections and a progressive party and a progressive government means a wage increase, a price reduction, a regulation of debts and a fair, efficient, strong social state next to the citizen. This means.","Ο ΣΥΡΙΖΑ άνοιξε τα χαρτιά του, το πρόγραμμα του. Καταθέσαμε το συμβόλαιο για την αλλαγή, ένα συμβόλαιο 11 άρθρων που το διαπερνάει ένας απαράβατος όρος, η δικαιοσύνη. Ποιο είναι όμως το τετράπτυχο; Θα πω Εγώ αυτού του συμβολαίου; Να σας το πω απλά και κατανοητά για να μπορέσετε να το μεταφέρετε τις 7 αυτές μέρες που έμειναν σε κάθε χωριό, σε κάθε πολίτη, σε κάθε καφενείο, σε κάθε σπίτι. Τι σημαίνει νίκη του ΣΥΡΙΖΑ στις εκλογές και προοδευτική παράταξη και προοδευτική κυβέρνηση σημαίνει αύξηση μισθών, μείωση τιμών, ρύθμιση χρεών και ένα δίκαιο, αποτελεσματικό, ισχυρό κοινωνικό κράτος δίπλα στον πολίτη. Αυτό σημαίνει.",political agenda,other,other,0.4,0.0,0.0,"[['syriza', 'organization', '1.0'], ['wage increase', 'group of people', '0.6'], ['price reduction', 'group of people', '0.6'], ['regulation of debts', 'group of people', '0.6'], ['social state', 'organization', '0.6'], ['citizen', 'group of people', '0.4']]"
21,"But some people were very worried. And they told us that our program is too expensive. And it doesn't work. Really, is their program of 10 billion in direct awards to day laborers a program that's coming off; their program that in a year and a half gave subsidies to energy companies alone of over 10 billion is a program that's coming off? We can of course answer in another way. Those who left the country bankrupt, with a 15% 100 deficit in 2009 and plunged us into bankruptcy. Those who left the coffers empty in 2015. The ones whose party owes 400 million in loans and unpaid loans to the banks. They want to talk to us about bills, that we took the country out of the memoranda, that we sanitized the public, the public finances, that we left 37 billion in the public coffers. And they have the audacity to talk to us and tell us it's not working?","Κάποιοι όμως ανησύχησαν πολύ. Και μας είπανε ότι το πρόγραμμά μας κοστίζει πολύ. Και δεν βγαίνει. Αλήθεια, το δικό τους πρόγραμμα των 10 δισεκατομμυρίων απευθείας αναθέσεων σε ημέτερους είναι πρόγραμμα που βγαίνει το δικό τους πρόγραμμα που σε ενάμιση χρόνο δώσανε επιδοτήσεις μόνο στις εταιρείες ενέργειας πάνω από 10 δις είναι πρόγραμμα που βγαίνει; Ξέρουμε βέβαια να απαντήσουμε και με άλλο τρόπο. Αυτοί που άφησαν τη χώρα χρεοκοπημένη, με 15% 100 έλλειμμα το 2009 και μας βύθισαν στη χρεοκοπία. Αυτοί που άφησαν τα ταμεία άδεια το 2015. Αυτοί που το κόμμα τους χρωστάει 400 εκατομμύρια δανεικά και αγύριστα στις τράπεζες. Θέλουν να μιλήσουν σε μας για λογαριασμούς, που βγάλαμε τη χώρα από τα μνημόνια που εξυγιάναμε τα δημόσια, τα δημόσια οικονομικά, που αφήσαμε 37 δισεκατομμύρια στα δημόσια ταμεία. Κι έχουν το θράσος να μιλάνε σε μας και να μας λένε ότι δεν βγαίνει; ",criticism,economy,austerity,0.5,0.2,0.0,"[['1. people', 'person', '0.6'], ['2. program', 'organization', '0.8'], ['3. day laborers', 'group of people', '0.4'], ['4. energy companies', 'organization', '0.6'], ['5. country', 'location', '0.9'], ['6. party', 'political party', '0.7'], ['7. banks', 'organization', '0.5'], ['8. memoranda', 'date', '0.5'], ['9. public finances', 'organization', '0.6'], ['10. coffers', 'organization', '0.6'], ['11. subsidies', 'organization', '0.6']]"
22,"Well, I want to make it clear once again. We will implement our programme to the hilt and we will implement it to the hilt, because it is a disgrace that those who have wasted 60 billion over the last three years, thanks to the pandemic, have left nothing of substance for society. Leaving the public hospitals, the welfare state in tatters. Leaving small and medium-sized businesses at the mercy, they have no right to talk to us when we say that we will give a €2,000 salary to the first doctor appointed to rebuild the hospitals so that citizens can have decent care.","Ε, λοιπόν, θέλω για άλλη μια φορά να ξεκαθαρίσω. Εμείς θα υλοποιήσουμε μέχρι κεραίας το πρόγραμμά μας και θα το υλοποιήσουμε μέχρι κεραίας, διότι είναι ντροπή αυτοί που σπατάλησανε 60 δισεκατομμύρια την τελευταία τριετία, ελέω της πανδημίας, χωρίς να αφήσουν τίποτα ουσιαστικό για την κοινωνία. Αφήνοντας διαλυμένα τα δημόσια νοσοκομεία, το κοινωνικό κράτος. Αφήνοντας στο έλεος τη μικρομεσαία επιχειρηματικότητα, δεν έχουν το δικαίωμα να μιλάνε σε εμάς, όταν λέμε ότι θα δώσουμε 2000 € μισθό στο πρώτο διοριζόμενο γιατρό για να ξαναστήσουμε τα νοσοκομεία, για να μπορούν οι πολίτες να έχουν αξιοπρεπή περίθαλψη. ",political agenda,health,other,-0.3,0.0,0.2,"[['€2', '000', 'date', '100%'], ['three years', 'date', '100%'], ['pandemic', 'group of people', '70%'], ['society', 'group of people', '60%'], ['public hospitals', 'organization', '90%'], ['welfare state', 'organization', '90%'], ['small and medium-sized businesses', 'group of people', '80%'], ['doctor', 'person', '100%']]"
23,They can't talk to us about where you're going to get the money when we say we're going to give a 10% raise to civil servants who haven't seen a raise in 14 years. They can't tell us if the finger when we say we'll give back the thirteenth pension to the pensioner that you took away.,"Δεν μπορούν να μιλάνε σε εμάς πού θα βρείτε τα λεφτά, όταν λέμε Θα δώσουμε μια αύξηση 10% στους δημοσίους υπαλλήλους που έχουν να δουν 14 χρόνια. Δεν μπορούν να μας πουν αν το δάχτυλο όταν λέμε θα δώσουμε πίσω τη δέκατη τρίτη σύνταξης στον συνταξιούχο που εσείς στερήσατε. ",political agenda,pensioners,pensions,-1.0,0.5,0.2,"[['civil servants', 'group of people', '0.6'], ['pensioner', 'person', '0.4'], ['thirteenth pension', 'date', '0.4']]"
24,They can't wag their finger at us when we say that there will be an end to this party of obscenity and sky-high prices for electricity at the supermarket for petrol. It costs you though.,Δεν μπορούν να μας κουνάνε το δάχτυλο όταν λέμε ότι θα μπει ένα τέλος σε αυτό το πάρτι της αισχροκέρδειας και της με τις τιμές στα ύψη στο ρεύμα στο σουπερμάρκετ στη βενζίνη. Κοστίζει όμως το σου. ,political agenda,energy,electricity,-0.7,0.2,0.0,[]
25,"It costs, it's true; our program, to be honest, costs. Do you know who it costs? It's costing the funds that won't take the homes of 700,000 households who have bought their mortgages at 20% of their value and want to get out at 100%. It costs the energy and food cartels the fuel cartels. It costs them and it will cost the day laborers who won't get direct assignments.","Κοστίζει, είναι αλήθεια. το πρόγραμμά μας να είμαι ειλικρινής, κοστίζει. Ξέρετε σε ποιους κοστίζει; Κοστίζει στα funds που δεν θα πάρουν κοψοχρονιά τα σπίτια 700.000 νοικοκυριών που έχουν αγοράσει τα δάνεια τους στο 20% της αξίας τους και θέλουν να βγάλουν στο 100%. Κοστίζει στα καρτέλ της ενέργειας και των τροφίμων στα καρτέλ των καυσίμων. Κοστίζει σε αυτούς και θα κοστίσει στους ημέτερους που δεν θα παίρνουν απευθείας αναθέσεις. ",political agenda,privatization,mortgages,-0.6,0.1,0.2,"[['700', '000 households', 'group of people', '0.5'], ['energy and food cartels', 'organization', '0.5'], ['fuel cartels', 'organization', '0.5'], ['day laborers', 'group of people', '0.5']]"
26,"But I want to tell you. In addition to the 11 articles, we already have the first legislative act ready. Because justice must be speeded up. And the legislative act that we have ready to sign before the Parliament is even constituted has 3 articles. Its first article says suspension of the auctions of first homes. Until the law that definitively regulates and protects the first home is passed, which has the signature of the politician who linked her name to the protection of the first home, Lucas Katseli.","Θέλω όμως να σας πω. Ότι πέρα από τα 11 άρθρα, έχουμε ήδη έτοιμη την πρώτη πράξη νομοθετικού περιεχομένου. Γιατί η δικαιοσύνη πρέπει να επισπευτεί. Και η πράξη νομοθετικού περιεχομένου που έχουμε έτοιμη να την υπογράψουμε πριν ακόμα συγκροτηθεί η Βουλή έχει 3 άρθρα. Το πρώτο της άρθρο λέει αναστολή των πλειστηριασμών πρώτης κατοικίας. Μέχρις ότου ψηφιστεί ο νόμος που ρυθμίζει οριστικά και προστατεύει την πρώτη κατοικία που έχει και την υπογραφή της πολιτικού που συνέδεσε το όνομά της με την προστασία της πρώτης κατοικίας, της Λούκας της Κατσέλη. ",political agenda,other,foreclosures,0.3,0.2,0.0,"[['lucas katseli', 'person', '1.0'], ['parliament', 'organization', '0.5']]"
27,"The second article calls for a reduction in VAT and excise duty, a reduction in VAT to 6% for all foodstuffs and a zero rate for basic and subsistence foodstuffs.","Το δεύτερο άρθρο λέει μείωση του ΦΠΑ και του ειδικού φόρου κατανάλωσης, μείωση του ΦΠΑ στο 6% για όλα τα τρόφιμα και σε μηδενικό συντελεστή για τρόφιμα βασικής ανάγκης και διαβίωσης. ",political agenda,economy,cost of living,1.0,0.0,0.0,[]
28,"The third article says to abolish the minimum university entrance requirement from these national exams, so that our children who are now studying know that no artificial cut-off will limit their access to public universities.","Το τρίτο άρθρο λέει κατάργηση της ελάχιστης βάσης εισαγωγής στα πανεπιστήμια από αυτές τις πανελλαδικές εξετάσεις, ώστε τα παιδιά μας που τώρα διαβάζουν να γνωρίζουν ότι κανένας τεχνητός κόφτης δεν θα τους περιορίσει την πρόσβαση στα δημόσια πανεπιστήμια. ",political agenda,education,higher education,0.5,0.0,0.0,"[['national exams', 'organization', '0.5'], ['children', 'group of people', '0.5'], ['public universities', 'organization', '0.5.']]"
