id,text,text_el,is_criticism,topic-context,subtopic-context,sentiment,polarization-definition,populism-definition,ner-limited
18,"Friends, comrades, and companions, in the past period, peoples in several countries have mobilized and gone on nationwide strikes. Similarly, in our country, the past years have been marked by major strike mobilizations in sectors and workplaces. And if one conclusion can be drawn, it is that no bourgeois government, no matter how many deputies it has, is omnipotent when there is a workers' and people's movement, when there is a strong KKE! A strong KKE means a strong workers' movement, strong people to put obstacles, to delay, to have conquests, as we have done so far. With the magnificent mobilizations and strikes in March, with the basic demand that the responsibilities for the crime of Tempe should not be covered up. The thousands of young mouths chanting 'PASOK-Syrizas-New Democracy, this crime has a history' record a dynamic that must not be broken. On the contrary, it must grow stronger, spread out, and become an organized current of assertion. And the impetus for this can only be given by a much stronger KKE in the June elections.","Φίλες και φίλοι, συντρόφισσες και σύντροφοι, Το προηγούμενο διάστημα οι λαοί σε αρκετές χώρες κινητοποιήθηκαν, προχώρησαν σε πανεθνικές απεργίες. Αντίστοιχα και στη χώρα μας τα προηγούμενα χρόνια σημαδεύτηκαν από μεγάλες απεργιακές κινητοποιήσεις σε κλάδους και χώρους δουλειάς. Και αν κάτι προκύπτει σαν συμπέρασμα είναι ότι καμιά αστική κυβέρνηση, όσους βουλευτές κι αν έχει, δεν είναι παντοδύναμη, όταν υπάρχει εργατικό - λαϊκό κίνημα, όταν υπάρχει δυνατό ΚΚΕ! Και δυνατό ΚΚΕ σημαίνει δυνατό εργατικό κίνημα, δυνατός λαός να βάλει εμπόδια, να καθυστερήσει, να έχει και κατακτήσεις. Έτσι όπως κάναμε μέχρι τώρα. Με τις μεγαλειώδεις κινητοποιήσεις και απεργίες του Μαρτίου, με βασικό αίτημα-προσταγή να μη συγκαλυφθούν οι ευθύνες για το έγκλημα των Τεμπών. Τα χιλιάδες νεανικά στόματα που φώναζαν «ΠΑΣΟΚ-ΣΥΡΙΖΑ-Νέα Δημοκρατία, αυτό το έγκλημα έχει ιστορία», καταγράφουν μια δυναμική που δεν πρέπει να κοπάσει. Αντιθέτως, πρέπει να δυναμώσει, να απλωθεί και να γίνει οργανωμένο ρεύμα διεκδίκησης. Και ώθηση σε αυτό μπορεί να δώσει, μόνο ένα πολύ πιο δυνατό ΚΚΕ στις εκλογές του Ιούνη.",political agenda,elections,other,0.0,0.2,0.0,"[['friends', 'person', '0.7'], ['comrades', 'group of people', '0.7'], ['companions', 'group of people', '0.7'], ['countries', 'location', '0.7'], ['our country', 'location', '0.7'], ['sectors', 'group of people', '0.7'], ['workplaces', 'location', '0.7'], ['bourgeois government', 'organization', '0.7'], ['workers', 'group of people', '0.7'], ['kke', 'political party', '1.0'], ['march', 'date', '0.7'], ['tempe', 'location', '0.7'], ['young', 'group of people', '0.7'], ['pasok', 'political party', '0.7'], ['syrizas', 'political party', '0.7'], ['new democracy', 'political party', '0.7'], ['june elections', 'date', '0.7.']]"
19,"With the struggles for the protection of people's health, together with struggles for wages, collective agreements, and the right to work, health workers, LARCO, COSCO, E-food, Malamatina, Varvaressos, Kavala's oil and fertilizer workers, construction workers, miners, and workers from other branches and workplaces became protagonists. They struggled to prevent workplaces from becoming ""special economic zones"" without rights and safety measures for workers, with laws that Adonis Georgiades voted for, which SYRIZA also supported. As a result, we are mourning one dead and two crippled workers in the Perama Zone. It is significant that a large part of the Shipbuilding Collective Labour Agreement, which the union managed to sign after struggles in 2017, relates to health and safety measures. The previous Syriza government and the next ND government did not make this CBA compulsory, but the workers made it compulsory with their struggle after the new employer crime, as it is one step before their collective agreement has the force of law for all companies. We are proud that in these and so many other struggles, the KKE and its deputies were in front.","Με τους αγώνες για την προστασία της υγείας του λαού μαζί με τους αγώνες για το μεροκάματο, για συλλογικές συμβάσεις, για το δικαίωμα στην εργασία. Έτσι έγιναν πρωταγωνιστές οι υγειονομικοί, οι εργάτες στη ΛΑΡΚΟ, της COSCO, της E-food, της Μαλαματίνα, του Βαρβαρέσου, των πετρελαίων και των λιπασμάτων της Καβάλας, των οικοδόμων, των μεταλλεργατών και άλλων κλάδων και χώρων δουλειάς. Με τους αγώνες για να μην μετατραπούν οι χώροι δουλειάς σε «ειδικές οικονομικές ζώνες», χωρίς δικαιώματα και μέτρα ασφαλείας για τους εργαζόμενους, με αυτούς τους νόμους του Άδωνι Γεωργιάδη που ψήφιζε και ο ΣΥΡΙΖΑ. Με αποτέλεσμα, να θρηνούμε πάλι έναν νεκρό και δύο σακατεμένους εργάτες στη Ζώνη του Περάματος. Είναι χαρακτηριστικό ότι ένα μεγάλο μέρος της Συλλογικής Σύμβασης Εργασίας της Ναυπηγοεπισκευής που κατάφερε να υπογράψει το συνδικάτο μετά από αγώνες το 2017, αφορά στα μέτρα υγιεινής και ασφάλειας. Αυτή την ΣΣΕ δεν την έκαναν υποχρεωτική η προηγούμενη κυβέρνηση του ΣΥΡΙΖΑ και η επόμενη της ΝΔ.  Υποχρεωτική την έκαναν οι εργάτες με την πάλη τους αμέσως μετά το καινούριο εργοδοτικό έγκλημα, αφού είναι ένα βήμα πριν αποκτήσει η συλλογική τους σύμβαση ισχύ νόμου για όλες τις επιχειρήσεις. Είμαστε περήφανοι που σε αυτούς και άλλους τόσους αγώνες, το ΚΚΕ, οι βουλευτές του, ήταν μπροστά. ",,employment,workers' rights,0.0,0.2,0.0,"[['larco', 'organization', '1.0'], ['cosco', 'organization', '1.0'], ['e-food', 'organization', '1.0'], ['malamatina', 'organization', '1.0'], ['varvaressos', 'organization', '1.0'], ['kavala', 'location', '1.0'], ['syriza', 'political party', '1.0'], ['adonis georgiades', 'person', '1.0'], ['perama zone', 'location', '1.0'], ['shipbuilding collective labour agreement', 'organization', '1.0'], ['syriza government', 'organization', '1.0'], ['nd government', 'organization', '1.0'], ['cba (collective bargaining agreement)', 'organization', '1.0'], ['kke (communist party of greece)', 'group of people', '1.0']]"
20,"The corrected text = The KKE is not waiting for the elections to start the militant opposition. They are already on the streets every day, even where people's houses are being auctioned off. We managed to cancel 10 auctions last week alone.",Γιατί το ΚΚΕ δεν περιμένει καν τις εκλογές για να ξεκινήσει τη μαχητική αντιπολίτευση. Είναι ήδη κάθε μέρα στους δρόμους. Όπως είναι και εκεί που πλειστηριάζονται λαϊκά σπίτια. Έτσι καταφέραμε να ακυρώσουμε 10 πλειστηριασμούς μόνο την περασμένη βδομάδα.,political agenda,employment,other,0.7,0.0,0.0,"[['kke', 'organization', '1.0'], ['10', 'date', '1.0']]"
21,"We are proud because, with the contribution of the communists, workers in many workplaces did not relegate their just demands to the second presence of the expectation of governmental changes and fought the battle in tough confrontation with the employers and the laws that support them. They did not put up with the false big talk of more capitalist investment as a solution to their problems. They did not step on the banana peel for struggles at the limits of the economy's endurance, namely the profits of the business groups. They did not see the workers' bargaining with the employers over how much less we will lose as a solution, as the leadership of the GSEE and ADEDY calls for. We all together, with a strong KKE and mass struggles, can impose our rights, the abolition of all the anti-worker laws of the ND, SYRIZA, and PASOK on Collective Labour Agreements and wages. The restoration of collective bargaining by adopting the demands of the trade unions for increases above €850 and at the same time the restoration of triennial wages. This practically means that a worker with a three-year contract will see their salary increase to €935 today, not in 2027 as promised by ND, although this became a summer dream after the Commission's recommendations. This proposal is linked to the other proposals of the KKE for a fixed daily working time, 7 hours, 5 days, 35 hours, and no unpaid overtime, with the restoration of Sunday holidays. It is linked to the proposal for an inflation-based wage adjustment clause. With the restoration of the 13th and 14th salaries in the public sector, about which the South West, PASOK, and SYRIZA say nothing, and the granting of all salary scales. With a strong KKE and mass workers' struggles, we can impose the restoration of the sectoral collective labour agreements and their compulsory nature without terms and conditions, which is a basic condition for increasing wages in all scales. This is the only pro-people's answer.","Είμαστε περήφανοι γιατί με την συμβολή των κομμουνιστών οι εργαζόμενοι σε πολλούς χώρους δουλειάς: Δεν παρέπεμψαν τις δίκαιες διεκδικήσεις τους στη δευτέρα παρουσία της προσμονής για κυβερνητικές εναλλαγές και έδωσαν τη μάχη σε σκληρή κόντρα με την εργοδοσία και τους νόμους που την στηρίζουν. Δεν ανέχτηκαν τα ψεύτικα τα λόγια τα μεγάλα για περισσότερες καπιταλιστικές επενδύσεις ως λύση για τα προβλήματα τους. Δεν πάτησαν την μπανανόφλουδα για αγώνες στα όρια των αντοχών της οικονομίας, δηλαδή τα κέρδη των επιχειρηματικών ομίλων. Δεν είδαν ως λύση τα παζάρια των εργαζομένων με την εργοδοσία για το πόσα λιγότερα θα χάσουμε, όπως καλεί η ηγετική ομάδα της ΓΣΕΕ και ΑΔΕΔΥ. Για αυτό χρειάζεται ακόμα πιο δυνατό ΚΚΕ. _06Εμείς όλοι μαζί, με ισχυρό ΚΚΕ και μαζικούς αγώνες μπορούμε να επιβάλουμε τα δίκια μας, την κατάργηση όλων των αντεργατικών νόμων της ΝΔ, του ΣΥΡΙΖΑ και του ΠΑΣΟΚ για τις Συλλογικές Συμβάσεις Εργασίας και τους μισθούς. Την επαναφορά των συλλογικών διαπραγματεύσεων υιοθετώντας τα αιτήματα των συνδικάτων για αυξήσεις πάνω από 850€ και ταυτόχρονη επαναφορά των τριετιών. Αυτό πρακτικά σημαίνει ότι ένας εργαζόμενους με μια τριετία θα δει τον μισθό του να αυξάνεται στα 935€ σήμερα και όχι το 2027 που υπόσχεται η ΝΔ, αν και αυτό έγινε όνειρο θερινό μετά τις συστάσεις της Κομισιόν. Αυτή η πρόταση είναι συνδεδεμένη με τις υπόλοιπες προτάσεις του ΚΚΕ για σταθερό ημερήσιο χρόνο δουλειάς, 7ωρο, 5νθήμερο, 35ωρο και χωρίς απλήρωτες υπερωρίες, με την επαναφορά της Κυριακής αργίας. Είναι συνδεδεμένη με την πρόταση για ρήτρα αναπροσαρμογής των μισθών με βάση τον πληθωρισμό. Με την επαναφορά του 13ου και 14ου μισθού στο δημόσιο, για τους οποίους η ΝΔ , ΠΑΣΟΚ και ο ΣΥΡΙΖΑ δε λένε κουβέντα και τη χορήγηση όλων των μισθολογικών κλιμακίων. Με ισχυρό το ΚΚΕ και μαζικούς εργατικούς αγώνες μπορούμε να επιβάλουμε την επαναφορά και των κλαδικών συλλογικών συμβάσεων εργασίας και την υποχρεωτικότητα τους χωρίς όρους και προϋποθέσεις που αποτελεί βασική προϋπόθεση για να αυξηθούν οι μισθοί σε όλες τις κλίμακες. Αυτή είναι η μόνη φιλολαϊκή απάντηση.",political agenda,employment,workers' rights,1.0,0.2,0.3,"[['kke', 'organization', '1.0'], ['gsee', 'organization', '1.0'], ['adedy', 'organization', '1.0'], ['nd', 'political party', '1.0'], ['syriza', 'political party', '1.0'], ['pasok', 'political party', '1.0'], ['europe', 'location', '1.0'], ['public sector', 'organization', '1.0']]"
22,"Friends, companions, and comrades, only together with the KKE can we make a difference. It knows how to confront the governments, the ruling class, and their anti-people policies. We must multiply pockets of resistance and unite in a nationwide movement of questioning and conflict. We can save people's homes and small businesses from the funds and the ""vultures"" who exploit the laws of ND, PASOK, and SYRIZA to carry out new evictions. We can fight for collective labor agreements with wage increases and measures to protect workers' lives, against the legislative arsenal of the ND, SYRIZA, and PASOK governments that protect the profits of employers.","Φίλες και φίλοι, 
συντρόφισσες και σύντροφοι,
Μόνο μαζί με το ΚΚΕ μπορούμε να πάμε αλλιώς. Γιατί ξέρει και μπορεί να τα βάλει με τις κυβερνήσεις, την άρχουσα τάξη και την αντιλαϊκή πολιτική! Για να πολλαπλασιαστούν οι εστίες αντίστασης, για να συνενωθούν σε ένα πανελλαδικό κίνημα αμφισβήτησης και σύγκρουσης. Μπορούμε να σώσουμε τη λαϊκή κατοικία και τους μικρούς επαγγελματίες από τα funds και τα «κοράκια», που ετοιμάζουν νέες εξώσεις αξιοποιώντας τους νόμους της ΝΔ, του ΠΑΣΟΚ, του ΣΥΡΙΖΑ. Μπορούμε να παλέψουμε για Συλλογικές Συμβάσεις Εργασίας με αυξήσεις και μέτρα προστασίας της ζωής των εργαζομένων, κόντρα στο νομοθετικό οπλοστάσιο των κυβερνήσεων της ΝΔ, του ΣΥΡΙΖΑ, του ΠΑΣΟΚ που προστατεύουν τα κέρδη της εργοδοσίας.",political agenda,employment,workers' rights,0.2,0.2,0.8,"[['kke', 'organization', '1.0'], ['nd', 'political party', '1.0'], ['pasok', 'political party', '1.0'], ['syriza', 'political party', '1.0'], ['greece', 'country', '1.0']]"
23,"We can fight against the deterioration of the conditions of education for children from families of the people, and against further privatization of education at all levels.","Μπορούμε να παλέψουμε ενάντια στην υποβάθμιση των όρων μόρφωσης των παιδιών των λαϊκών οικογενειών, στην παραπέρα ιδιωτικοποίηση της Εκπαίδευσης σε όλες τις βαθμίδες.",political agenda,other,higher education,0.5,0.0,0.0,[]
24,"We can fight against imperialist wars and Greece's involvement in US-NATO plans, which New Democracy, PASOK, and SYRIZA all agree with.","Μπορούμε να παλέψουμε ενάντια στους ιμπεριαλιστικούς πολέμους, την εμπλοκή της Ελλάδας στα σχέδια των ΗΠΑ - ΝΑΤΟ, με τα οποία συμφωνούν η ΝΔ, το ΠΑΣΟΚ, ο ΣΥΡΙΖΑ.",political agenda,external affairs,other,-0.5,0.2,0.0,"[['greece', 'location', '1.0'], ['us-nato', 'organization', '1.0'], ['new democracy', 'political party', '0.33'], ['pasok', 'political party', '0.33'], ['syriza', 'political party', '0.33']]"
25,"We keep hope alive by strengthening collective struggles against compromise and disillusionment cultivated by the forces of social democracy, thus also feeding New Democracy. Only together with the KKE can we create cracks in the negative correlation. Everything changes when the many decide with their actions! You know where the KKE will be the next day, unlike ghost parties that ""noisily"" appear and ""quietly"" withdraw when they have completed their mission on behalf of the system. There is no time to waste. Much less do we have votes to lose, such as those of the so-called small parties, the ""disposable parties"", such as those now out of parliament. They are parties that are recruited to be used in various games within the bourgeois political system, and then with the same ease that they appeared, they are withdrawn. Like now, the Hellenic Solution, where the leader of this party is tried and tested against popular interests. MP for LAOS when the government of ND, PASOK, LAOS brought in the 2nd memorandum. Member of ND when the government of ND, PASOK, DIMAR was implementing it. Just so we don't forget.","Κρατάμε ζωντανή την ελπίδα, δυναμώνοντας τους συλλογικούς αγώνες κόντρα στον συμβιβασμό και την απογοήτευση που καλλιεργούν οι δυνάμεις της σοσιαλδημοκρατίας, τροφοδοτώντας έτσι και τη ΝΔ. Μόνο μαζί με το ΚΚΕ μπορούμε να δημιουργήσουμε ρωγμές στον αρνητικό συσχετισμό. Όλα αλλάζουν όταν το αποφασίζουν με τη δράση τους οι πολλοί! Ξέρετε πού θα είναι το ΚΚΕ την επόμενη μέρα, σε αντίθεση με κόμματα-φαντάσματα που με «θόρυβο» εμφανίζονται και «αθόρυβα» αποσύρονται όταν έχουν ολοκληρώσει την αποστολή τους για λογαριασμό του συστήματος. Δεν έχουμε χρόνο για χάσιμο. Και πολύ περισσότερο δεν έχουμε και ψήφο για χάσιμο όπως είναι αυτή στα λεγόμενα μικρά κόμματα, τα “κόμματα μιας χρήσης”, όπως αυτά που τώρα έμειναν εκτός βουλής. Είναι κόμματα που επιστρατεύονται για να αξιοποιηθούν σε διάφορα παιχνίδια στο πλαίσιο του αστικού πολιτικού συστήματος, και στη συνέχεια με την ίδια ευκολία που εμφανίστηκαν με την ίδια αποσύρονται. Όπως τώρα η Ελληνική Λύση που ο αρχηγός αυτού του κόμματος είναι δοκιμασμένος ενάντια στα λαϊκά συμφέροντα. Βουλευτής του ΛΑΟΣ, όταν η κυβέρνηση ΝΔ, ΠΑΣΟΚ, ΛΑΟΣ έφερε το 2ο μνημόνιο. Μέλος της ΝΔ όταν η κυβέρνηση ΝΔ, ΠΑΣΟΚ, ΔΗΜΑΡ το υλοποιούσε. Έτσι για να μην ξεχνιόμαστε. ",criticism,democracy,other,-0.5,0.9,0.2,"[['forces of social democracy', 'organization', '0.5'], ['new democracy', 'political party', '0.5'], ['kke', 'political party', '0.5'], ['ghost parties', 'group of people', '0.5'], ['system', 'organization', '0.5'], ['small parties', 'group of people', '0.5'], ['hellenic solution', 'organization', '0.5'], ['nd', 'political party', '1.0'], ['pasok', 'political party', '1.0'], ['laos', 'political party', '1.0'], ['dimar', 'political party', '1.0'], ['2nd memorandum', 'date', '1.0']]"
26,"Remember that in the last 15 years we have had LAOS, DIMAR, ANEL, POTAMI, CENTRIST UNION, MERA25, all of whom entered parliament, deceived and seduced the people, especially young people, giving a breath of life to the rotten system. These parties are so ""young"" that they propose radical measures for the working people, such as NIKI, which proposes forced labor with increased deductions for those who owe loans. In other words, slave labor so that the banks do not lose a single euro.","Θυμηθείτε τα τελευταία 15 χρόνια είχαμε ΛΑΟΣ, ΔΗΜΑΡ, ΑΝΕΛ, ΠΟΤΑΜΙ, ΕΝΩΣΗ ΚΕΝΤΡΩΩΝ, ΜΕΡΑ25, που μπήκαν στη βουλή, εγκλώβισαν και παρέσυραν λαϊκό κόσμο, νέους και νέες, δίνοντας ανάσα βοήθειας στο σάπιο σύστημα. Τόσο «νέα» είναι αυτά τα κόμματα που έχουν ρηξικέλευθες προτάσεις για τους εργαζόμενους: Όπως η ΝΙΚΗ που προτείνει καταναγκαστική εργασία με αυξημένες κρατήσεις γι’ αυτούς που χρωστάνε δάνειο. Δηλαδή σκλαβοπάζαρο για να μην χάσουν οι τράπεζες ούτε ευρώ.",criticism,debt,bank regulations,-0.6,0.2,0.7,"[['laos', 'organization', '0.7'], ['dimar', 'organization', '0.7'], ['anel', 'organization', '0.7'], ['potami', 'organization', '0.7'], ['centrist union', 'organization', '0.7'], ['mera25', 'organization', '0.7'], ['niki', 'organization', '0.7']]"
