id,text,text_el,is_criticism,topic-context,subtopic-context,sentiment,polarization-definition,populism-definition,ner-limited
19,"The big construction groups are literally getting rich with the support of the state: Through concession contracts, PPPs, preferential terms for the tendering of large projects, even with bonuses of tens of millions of euros when they are not late in implementing their contractual obligations. But do all of us, the employed and self-employed, tenants and those who are struggling to repay their mortgages, really have any reason to continue on the path that has brought us to our current situation? We must and can think in terms of the experience we have accumulated over the years, in terms of what life itself has taught us. And life proves time and again that the class bias of government policy is always determined by the needs of capital and the steely laws of profit. Life proves that no matter how many governments change, the train of bourgeois governance is and will continue to move firmly on the tracks set by the ruling class and the EU's commitments. Let us consider that the current, dead-end road for us is not, after all, a one-way street as it is presented to us. To think outside the blinders, outside the walls of the current rotten system. We argue that there is a way out, socialism!","Οι μεγάλοι κατασκευαστικοί όμιλοι θησαυρίζουν κυριολεκτικά με τη στήριξη του κράτους: Μέσα απ’ τις συμβάσεις παραχώρησης, τις ΣΔΙΤ, τους προνομιακούς όρους δημοπράτησης μεγάλων έργων, ακόμα και με πριμ δεκάδων εκατ. Ευρώ, όταν δεν καθυστερούν να υλοποιήσουν τις συμβατικές τους υποχρεώσεις. Αλήθεια, όμως, εμείς όλοι οι μισθωτοί και οι αυτοαπασχολούμενοι, οι ενοικιαστές και όσοι αγωνίζονται να ξεπληρώσουν το στεγαστικό τους δάνειο, έχουμε κανένα λόγο να συνεχίσουμε στο δρόμο που μας έφερε στη σημερινή κατάσταση; Εμείς, πρέπει και μπορούμε να σκεφτούμε με βάση την πείρα που συσσωρεύσαμε όλα αυτά τα χρόνια, με βάση όσα μας δίδαξε η ίδια η ζωή. Και η ζωή αποδεικνύει συνεχώς, ότι το ταξικό πρόσημο της κυβερνητικής πολιτικής, καθορίζεται πάντοτε απ’ τις ανάγκες του κεφαλαίου και τους ατσάλινους νόμους του κέρδους. Η ζωή αποδεικνύει, ότι όσες κυβερνήσεις κι αν αλλάξουν, το τρένο της αστικής διακυβέρνησης, κινείται και θα κινείται σταθερά στις ράγες που καθορίζει η άρχουσα τάξη και οι δεσμεύσεις της ΕΕ. Να σκεφτούμε, ότι ο σημερινός, αδιέξοδος για εμάς δρόμος, δεν είναι τελικά μονόδρομος, όπως μας παρουσιάζεται. Να σκεφτούμε έξω από τις παρωπίδες, έξω απ’ τα τείχη του σημερινού σάπιου συστήματος. Υποστηρίζουμε ότι υπάρχει διέξοδος, ο σοσιαλισμός!",political agenda,other,other,-0.8,0.95,0.2,"[['construction groups', 'group of people', '0.9'], ['state', 'organization', '0.7'], ['ppps', 'organization', '0.5'], ['tenants', 'group of people', '0.6'], ['mortgages', 'organization', '0.4'], ['government', 'organization', '0.8'], ['capital', 'organization', '0.6'], ['ruling class', 'group of people', '0.7'], ['eu', 'organization', '0.5'], ['socialism', 'political party', '0.7']]"
20,"Friends, there is a way out. We firmly believe that surely there can be again, a higher organisation of society, where land, water, housing, fuel, energy, energy, labour power itself, are not commodities. There was the Soviet Union in the last century, where, for example, social rights to work, to housing, to heating, to health, to education of a high standard were guaranteed in practice. There were countries where socialism was built, where no one was homeless and no one suffered from the cold, despite the harsh winter. Where there was no insecurity about 'what would happen if I got fired'. Where there were large open spaces and huge green parks in the cities. Where students were not concerned about the problem of housing and their education was truly free. Where traffic did not stop at the first heavy rain and the first snow. Where the state apparatus could evacuate entire cities within hours when a major accident of great magnitude occurred.There were guaranteed rights that capitalism cannot and will not guarantee, no matter how many decades pass. After all, humanity has known it for 500 years now, since it began to replace the previous social system, feudalism.We can imagine today, in the 21st century, the radical improvement that socialism can bring to our lives. We can more easily document the radical improvement that central scientific planning will bring, driven by social well-being rather than by securing capitalist profit. On the ground of social ownership of land, water and the means of production, modern safe housing, urban renewal and expansion, and overall land use will be planned with the whole of the people's needs in mind. With the daily active role of the workers in making and controlling decisions.","Φίλες και φίλοι, Υπάρχει διέξοδος. Πιστεύουμε ακράδαντα ότι ασφαλώς και μπορεί να υπάρξει ξανά, μια ανώτερη οργάνωση της κοινωνίας, όπου η γη, το νερό, η κατοικία, τα καύσιμα, η ενέργεια, η ίδια η εργατική δύναμη, δε θα αποτελούν εμπορεύματα. Υπήρξε τον προηγούμενο αιώνα η Σοβιετική Ένωση, όπου, για παράδειγμα, ήταν κατοχυρωμένα στην πράξη, τα κοινωνικά δικαιώματα στην εργασία, στην κατοικία, στη θέρμανση, στην υγεία, στη μόρφωση υψηλού επιπέδου. Υπήρξαν χώρες όπου οικοδομήθηκε ο σοσιαλισμός, όπου κανείς δεν ήταν άστεγος και δεν υπέφερε απ’ το κρύο, παρά το βαρύ χειμώνα. Όπου δεν υπήρχε ανασφάλεια για το «τι θα γίνει αν απολυθώ». Όπου υπήρχαν στις πόλεις μεγάλοι ελεύθεροι χώροι και τεράστια πάρκα πρασίνου. Όπου τους φοιτητές δεν τους απασχολούσε το πρόβλημα της στέγης και η μόρφωσή τους ήταν πραγματικά δωρεάν. Όπου δε σταματούσε η κυκλοφορία στην πρώτη δυνατή βροχή και στο πρώτο χιόνι. Όπου ο κρατικός μηχανισμός μπορούσε να εκκενώσει μέσα σε λίγες ώρες ολόκληρες πόλεις όταν συνέβαινε κάποιο σοβαρό ατύχημα μεγάλης έκτασης.Υπήρξαν κατοχυρωμένα δικαιώματα που δεν μπορεί ούτε και πρόκειται να διασφαλίσει ο καπιταλισμός, όσες δεκαετίες κι αν περάσουν. Άλλωστε η ανθρωπότητα τον γνωρίζει πλέον, εδώ και 500 χρόνια, από τότε που άρχισε να αντικαθιστά το προηγούμενο κοινωνικό σύστημα, τη φεουδαρχία.Μπορούμε σήμερα, στον 21ο αιώνα, να φανταστούμε τη ριζική βελτίωση που μπορεί να φέρει στη ζωή μας ο σοσιαλισμός. Πιο εύκολα μπορούμε να τεκμηριώσουμε τη ριζική βελτίωση που θα φέρει ο κεντρικός επιστημονικός σχεδιασμός, με γνώμονα την κοινωνική ευημερία και όχι τη διασφάλιση του καπιταλιστικού κέρδους. Στο έδαφος της κοινωνικής ιδιοκτησίας της γης, του νερού και των μέσων παραγωγής, θα σχεδιάζονται οι σύγχρονες ασφαλείς κατοικίες, οι αναπλάσεις και οι επεκτάσεις στις πόλεις και συνολικά οι χρήσεις της γης, με γνώμονα το σύνολο των λαϊκών αναγκών. Με τον καθημερινό ενεργό ρόλο των εργαζομένων στη λήψη και στον έλεγχο των αποφάσεων. ",political agenda,other,other,0.5,0,0,[]
21,"There will be a balanced development of construction to meet the needs of housing, infrastructure projects, support for industrial and agricultural production. Human-friendly cities will be formed, with sufficient green lungs and zones of popular sports and cultural activity. Integrated plans will be implemented for the management of water resources, waste and civil protection, with the development of modern standards and regulations. More generally, spatial planning will be based on scientific research to diagnose new social needs. All this can be done immediately, as soon as the people realise their power and decide to walk the path of subversion, hand in hand with other peoples. And the power of the people is proven in all cases: From the villages saved from the fires in Evia, in the Peloponnese, in Mytilene, to the great wave of solidarity with the peoples of Syria and Turkey after the recent earthquakes. This supremacy of the new society of socialism, to provide a radical solution to the question of housing and other popular problems, is illuminated by the contemporary subversive power programme of the KKE.","Θα υπάρξει ισόμετρη ανάπτυξη κατασκευών για την κάλυψη των αναγκών στέγασης, των έργων υποδομής, τη στήριξη της βιομηχανικής και αγροτικής παραγωγής. Θα διαμορφωθούν πόλεις, φιλικές στον άνθρωπο, με επαρκείς πνεύμονες πρασίνου και ζώνες λαϊκού αθλητισμού και πολιτιστικής δραστηριότητας. Θα υλοποιηθούν ολοκληρωμένα σχέδια για τη διαχείριση των υδάτινων πόρων, των αποβλήτων, για την πολιτική προστασία με την εκπόνηση σύγχρονων προδιαγραφών και κανονισμών. Γενικότερα ο χωροταξικός σχεδιασμός θα διαμορφώνεται στη βάση των επιστημονικών ερευνών για τη διάγνωση των νέων κοινωνικών αναγκών. Όλα αυτά, μπορούν να γίνουν άμεσα, μόλις ο λαός συνειδητοποιήσει τη δύναμή του και αποφασίσει να βαδίσει το δρόμο της ανατροπής, χέρι- χέρι και με άλλους λαούς. Και η δύναμη του λαού αποδεικνύεται σ’ όλες τις περιπτώσεις: Από τα χωριά που σώθηκαν απ’ τις πυρκαγιές στην Εύβοια, στην Πελοπόννησο, στη Μυτιλήνη, μέχρι το μεγάλο κύμα αλληλεγγύης στους λαούς της Συρίας και της Τουρκίας μετά τους πρόσφατους σεισμούς. Αυτή την υπεροχή της νέας κοινωνίας του σοσιαλισμού, για να δοθεί ριζική λύση στο ζήτημα της στέγασης και τα υπόλοιπα λαϊκά προβλήματα, φωτίζει το σύγχρονο ανατρεπτικό Πρόγραμμα εξουσίας του ΚΚΕ. ",political agenda,housing,other,0.8,0,0,"[['kke', 'organization', '1.0'], ['evia', 'location', '0.7'], ['peloponnese', 'location', '0.7'], ['mytilene', 'location', '0.7'], ['syria', 'country', '0.7'], ['turkey', 'country', '0.7']]"
22,"We have a plan for today and tomorrow. And of course we are not waiting passively for a great day to dawn to implement it.The forces of the KKE are stepping forward today to organize a great popular counter-offensive that will open the road to subversion. We are stepping forward to prevent homes from being left without electricity and to prevent the auctions of first homes. Our action inspires and helps popular families to stand up and reach out to their neighbors, to working people as a whole, to break the climate of fear and passivity. ""Fear nothing and no one,"" says a resident whose house is currently threatened for auction after a militant initiative spearheaded by the KKE. We are agitating that ""the houses of the people can ultimately only be saved by the popular uprising, saved by the people, with their solidarity and struggle"". We fight daily against the robbery of the workers' and people's income. We call on the people to turn their backs on the blackmailing and deceptive dilemmas. Not to choose between losing their homes or losing what they have and keeping what they don't have. Not to choose whether the auctions and the out-of-court settlements will become a law of the ND or SYRIZA government, but to fight with the KKE for the real abolition of house auctions and the cancellation of a large part of the debt of wage earners and the self-employed!","Έχουμε σχέδιο για το σήμερα και το αύριο. Και ασφαλώς δεν περιμένουμε παθητικά να ξημερώσει κάποια μεγάλη μέρα για να το εφαρμόσουμε.Οι δυνάμεις του ΚΚΕ μπαίνουμε σήμερα μπροστά για να οργανωθεί μια μεγάλη λαϊκή αντεπίθεση, που θα ανοίξει το δρόμο της ανατροπής. Μπαίνουμε μπροστά για να μη μείνουν σπίτια χωρίς ρεύμα και για να εμποδίσουμε τους πλειστηριασμούς πρώτης κατοικίας. Η δράση μας εμπνέει και βοηθά λαϊκές οικογένειες να σηκώσουν το ανάστημά τους και να απευθυνθούν στους γείτονές τους, συνολικά στους εργαζόμενους, για να σπάσει το κλίμα του φόβου και της παθητικότητας. «Μη φοβάστε τίποτα και κανέναν», δηλώνει χαρακτηριστικά ένας κάτοικος που το σπίτι του απειλείται σήμερα για πλειστηριασμό μετά από μια αγωνιστική πρωτοβουλία, με μπροστάρη το ΚΚΕ. Προβάλλουμε αγωνιστικά ότι «τα σπίτια του λαού μπορεί τελικά να τα σώσει μόνο ο λαϊκός ξεσηκωμός, να τα σώσει ο λαός, με την αλληλεγγύη και τον αγώνα του». Δίνουμε καθημερινά τη μάχη ενάντια στη ληστεία του εργατικού και λαϊκού εισοδήματος. Καλούμε το λαό να γυρίσει την πλάτη του στα εκβιαστικά και απατηλά διλήμματα. Να μην επιλέξει αν θα χάσει το σπίτι του ή ό,τι έχει και δεν έχει, για να το κρατήσει. Να μην επιλέξει, αν οι πλειστηριασμοί και οι εξωδικαστικές ρυθμίσεις, θα γίνουν με νόμο της κυβέρνησης της ΝΔ ή του ΣΥΡΙΖΑ, αλλά να αγωνιστεί με το ΚΚΕ για την πραγματική κατάργηση των πλειστηριασμών των σπιτιών και τη διαγραφή μεγάλου μέρους του χρέους των μισθωτών και των αυτοαπασχολούμενων!",political agenda,housing,home protection,0.6,0.2,0.5,"[['kke', 'organization', '1.0'], ['popular counter-offensive', 'group of people', '1.0'], ['working people', 'group of people', '1.0'], ['resident', 'person', '0.9'], ['nd', 'political party', '0.8'], ['syriza', 'political party', '0.8'], ['kke', 'organization', '1.0']]"
23,"The increase in rents, mortgage interest and taxes in recent years completes this nightmare scenario, which plunges popular households into uncertainty and despair. And these increases are not going to stop, they will continue. The ECB has already proceeded to raise the base rate by 4% in a year, in order to curb the galloping inflation in the Eurozone. To curb inflation, which the EU's own policy in the previous period increased by borrowing to provide large state packages to support its conglomerates and manage the crisis. It has been shown once again that any medicine for one symptom of the great patient, capitalism, becomes a poison for the other. There is no magic formula for the pro-popular transformation of a rotting system. The increase in the ECB interest rate, among other things, leads to a constant increase in mortgage rates. Thus, from 1.5% in 2021, the interest rate on a mortgage loan could exceed 4.5% this year.","Η αύξηση των ενοικίων, των τόκων των στεγαστικών δανείων και των φόρων τα προηγούμενα χρόνια, ολοκληρώνει αυτό το εφιαλτικό σκηνικό, που βυθίζει στην αβεβαιότητα και στην απόγνωση τα λαϊκά νοικοκυριά. Και αυτές οι αυξήσεις δεν πρόκειται να σταματήσουν, θα συνεχιστούν. Η ΕΚΤ έχει ήδη προχωρήσει στην εκτίναξη του βασικού επιτοκίου κατά 4% μέσα σ’ ένα χρόνο, για να συγκρατήσει τον πληθωρισμό που καλπάζει στην Ευρωζώνη. Να συγκρατήσει τον πληθωρισμό, που αύξησε η ίδια η πολιτική της ΕΕ την προηγούμενη περίοδο, με το δανεισμό, για να δοθούν μεγάλα κρατικά πακέτα στήριξης των ομίλων της και διαχείρισης της κρίσης. Αποδείχθηκε για άλλη μια φορά ότι κάθε φάρμακο για το ένα σύμπτωμα του μεγάλου ασθενούς, του καπιταλισμού, γίνεται δηλητήριο για το άλλο. Δεν υπάρχει μαγική συνταγή φιλολαϊκής μεταμόρφωσης ενός συστήματος που σαπίζει. Η αύξηση του επιτοκίου της ΕΚΤ, εκτός των άλλων, οδηγεί σε συνεχή αύξηση των επιτοκίων των στεγαστικών δανείων. Έτσι, από το 1,5% το 2021 το επιτόκιο ενός στεγαστικού δανείου μπορεί να ξεπεράσει φέτος το 4,5%. ",criticism,economy,interest rates,-0.9,0,0.4,"[['ecb', 'organization', '1.0'], ['eurozone', 'location', '1.0'], ['eu', 'organization', '1.0'], ['capitalism', 'group of people', '0.5'], ['popular households', 'group of people', '1.0'], ['conglomerates', 'organization', '1.0'], ['2021', 'date', '1.0']]"
24,"Friends, Compañeras and Compañeros, With these thoughts, I wish you good strength and health, good luck in our struggle.
By presenting our positions on the issue of people's housing and the protection of people's housing today, we contribute as a party to make the final straight to the elections more meaningful than the cockfights, false dilemmas, blackmail and chic confrontations between the parties that are mainly responsible for the current tragic situation.In the elections of May 21, we fight to make the KKE even stronger, so that the people themselves are strong!
","Φίλες και φίλοι,Συντρόφισσες και σύντροφοι, Με αυτές τις σκέψεις, σας εύχομαι καλή δύναμη και υγεία, καλή συνέχεια στον αγώνα μας.
Παρουσιάζοντας τις θέσεις μας για το ζήτημα της λαϊκής στέγης και την προστασία της λαϊκής κατοικίας σήμερα, συμβάλουμε ως κόμμα, να αποκτήσει η τελική ευθεία προς τις εκλογές ουσιαστικότερο περιεχόμενο, σε σχέση με τις κοκορομαχίες, τα ψεύτικα διλήμματα, τους εκβιασμούς και τις σικέ αντιπαραθέσεις ανάμεσα στα κόμματα που έχουν την βασική ευθύνη για την σημερινή τραγική κατάσταση.Στις εκλογές της 21ης Μαΐου, παλεύουμε για να γίνει ακόμα πιο δυνατό το ΚΚΕ, για να είναι δυνατός ο ίδιος ο λαός! 
",political agenda,elections,other,0,0,0,"[['none', 'as the text does not mention any named entities of the specified types.']]"