id,text,text_el,is_criticism,topic-context,subtopic-context,sentiment,polarization-definition,populism-definition,ner-limited
9,"SYRIZA tries to show the problem in the alleged ""non-engagement"" of the creditors rather than seeing the settlement procedures themselves! According to him, everything is the fault of some ""speculators"", excessive profit... Thus, he brings back the reheated soup, that the alleged ""regulated"" profit... of the banks will address this serious problem! He claims that the ""binding nature of the regulations"" and their reasoned rejection by the banks will improve the situation, for the benefit of the workers! Divestment of other assets and maximum squeezing of the over-indebted popular households! At the same time, SYRIZA presents a supposedly ""radical"" and comprehensive housing policy programme, with which it claims it will tackle the problem of people's housing!What does its programme provide for? In fact, it proposes the state subsidy to those big landlords who have vacant, unused buildings and their conversion into housing complexes!In simpler words, it proposes the imprisonment of young and poor people's families in areas where they do not want to live, and at the same time, it proposes state support to the banks and big capital that owns these properties... Which, in order to renovate them, it proposes state-guaranteed rents and tax exemptions. Hey, no Mr. Tsipras! The poor people, the working classes, are not second-class people, as you probably understand them. They do not want to live in the Land Bank, where the wealthy do not live, where the tourist capital does not want to live, where there is no economic interest from business.","Ο ΣΥΡΙΖΑ προσπαθεί να εμφανίσει το πρόβλημα στην τάχα “μη δέσμευση” των πιστωτών απ’ το να δει τις ίδιες τις διαδικασίες των ρυθμίσεων! Κατ’ αυτόν, για όλα φταίνε κάποιοι “κερδοσκόποι”, το υπερβολικό κέρδος… Ξαναφέρνει έτσι, την ξανασταμένη σούπα, πως το τάχα κάποιο “ρυθμισμένο” κέρδος... των τραπεζών, θα αντιμετωπίσει το σοβαρό αυτό πρόβλημα!!! Υποστηρίζει πως η “δεσμευτικότητα -δήθεν- των ρυθμίσεων” και η αιτιολογημένη απόρριψή τους απ’ τις τράπεζες, θα βελτιώσουν την κατάσταση, προς όφελος των εργαζόμενων!Υποστηρίζει δηλαδή, για να εξηγούμαστε, την πιστή εφαρμογή του νόμου που προβλέπει: Εκποιήσεις άλλων περιουσιακών στοιχείων και μέγιστο ξεζούμισμα των υπερχρεωμένων λαϊκών νοικοκυριών! Την ίδια στιγμή, ο ΣΥΡΙΖΑ εμφανίζει ένα τάχα “ριζοσπαστικό” και ολοκληρωμένο πρόγραμμα στεγαστικής πολιτικής, με το οποίο ισχυρίζεται, ότι θα αντιμετωπίσει το πρόβλημα της λαϊκής στέγης!Τι προβλέπει το πρόγραμμα του; Στην πραγματικότητα, προβλέπει την κρατική επιδότηση όσων μεγαλοϊδιοκτητών έχουν κενά, ανεκμετάλλευτα κτήρια και την μετατροπή τους σε οικιστικά συγκροτήματα!Με πιο απλά λόγια, προτείνει τον εγκλωβισμό νέων και φτωχών λαϊκών οικογενειών, σε περιοχές στις οποίες δεν θέλουν να κατοικήσουν και παράλληλα, προτείνει κρατική στήριξη στις τράπεζες και στο μεγάλο κεφάλαιο που έχει στην ιδιοκτησία του αυτά τα ακίνητα… Τα οποία για να τα αναπαλαιώσει, προβλέπει κρατικά εγγυημένα ενοίκια, και φοροαπαλλαγές. Ε, όχι κ. Τσίπρα! Τα φτωχά λαϊκά στρώματα, οι εργαζόμενοι, δεν είναι άνθρωποι δεύτερης κατηγορίας, όπως πιθανά τους καταλαβαίνετε εσείς. Δεν θέλουν να κατοικήσουν στην Τράπεζα Γης, εκεί που δεν κατοικούν οι εύποροι, εκεί που δεν θέλει το τουριστικό κεφάλαιο, εκεί που δεν υπάρχει οικονομικό ενδιαφέρον απ’ τις επιχειρήσεις.",criticism,housing,affordable housing,-0.8,0.6,0.4,"[['syriza', 'organization', '1.0'], ['creditors', 'group of people', '1.0'], ['speculators', 'group of people', '1.0'], ['banks', 'organization', '1.0'], ['workers', 'group of people', '1.0'], ['popular households', 'group of people', '1.0'], ['housing policy programme', 'organization', '1.0'], ['state', 'organization', '1.0'], ['landlords', 'group of people', '1.0'], [""young and poor people's families"", 'group of people', '1.0'], ['mr. tsipras', 'person', '1.0'], ['working classes', 'group of people', '1.0'], ['land bank', 'location', '1.0']]"
10,"Friends, What does all the above prove?That the ""tsunami"" of auctions and losses of family property will continue, after the elections, whatever government is formed. That the people's homes can only be saved by the popular uprising and that is why a strong KKE is needed to organise the popular counter-attack. This state appears incapable of protecting the first home and securing our right to housing. All governments appear incapable of ensuring civil protection so that we stop burning in the summer and drowning in the winter!In fact, the state and its governments are too capable of ensuring the profits of the conglomerates and for the same reason they sacrifice our needs. The present state is hostile to us because it is the state of the dictatorship of capital. And this does not only concern the most obvious aspects, such as the undermining of strikes and the repression of demonstrations. It is about all aspects of our lives.","Φίλες και φίλοι,Τι αποδεικνύουν όλα όσα προαναφέραμε;Ότι το «τσουνάμι» των πλειστηριασμών και των απωλειών οικογενειακής περιουσίας θα συνεχιστεί, μετά τις εκλογές, όποια κυβέρνηση κι αν σχηματιστεί. Ότι τα σπίτια του λαού μπορεί να τα σώσει μόνο ο λαϊκός ξεσηκωμός και γι’ αυτό χρειάζεται ισχυρό ΚΚΕ για την οργάνωση της λαϊκής αντεπίθεσης. Αυτό το κράτος εμφανίζεται ανίκανο να προστατεύσει την πρώτη κατοικία και να διασφαλίσει το δικαίωμά μας στη στέγαση. Όλες οι κυβερνήσεις εμφανίζονται ως ανίκανες να διασφαλίσουν την πολιτική προστασία, ώστε να σταματήσουμε να καιγόμαστε το καλοκαίρι και να πνιγόμαστε το χειμώνα!Στην πραγματικότητα, το κράτος και οι κυβερνήσεις του, είναι πολύ ικανό για να διασφαλίζει τα κέρδη των ομίλων και για τον ίδιο λόγο θυσιάζει τις δικές μας ανάγκες. Το σημερινό κράτος είναι εχθρικό απέναντί μας γιατί είναι το κράτος της δικτατορίας του κεφαλαίου. Και αυτό δεν αφορά μόνο τις πιο φανερές πλευρές, όπως την υπονόμευση των απεργιών και την καταστολή των διαδηλώσεων. Αφορά όλες τις πλευρές της ζωής μας. ",political agenda,housing,privatization of public goods,-0.9,0.1,0.7,"[['kke', 'political party', '1.0'], ['greece', 'country', '1.0']]"
11,"In 2020, the government of the New Democracy, with the new Bankruptcy Code, untied the hands of the creditors to seize and sell off a large part of the property of those who cannot afford to service their loans. In February 2023, a decision of the Supreme Court allowed the Management Companies, the servicers, who have taken over the affairs of the funds, to take legal actions themselves involving auctions. A decision that proved, among other things, what the representatives of the capital mean when they call for the judiciary to become a ""source of confidence"" for investments. The new programme of the Southwest for 'housing for the young' also has the same character: The support of banks and construction capital. What does the programme provide for? State-subsidized loans, which banks will give to young workers to buy property, much of which is owned by banks and construction capital. The new workers will turn into the new borrowers - with state-guaranteed loans - this time, and will wait for the next crisis and the collapse of their wages, only to then turn into the next period's over-indebted too. And yet, the limits and conditions imposed end up excluding the most vulnerable, while pushing young people into areas far from where they wish to live. The real beneficiary of the scheme is again the banks... The banks, who will make thousands of new and multi-secured loans from a thousand sides, while getting rid of properties that currently remain unsold.","Το 2020, η κυβέρνηση της ΝΔ με το νέο Πτωχευτικό Κώδικα, έλυσε τα χέρια στους δανειστές, να δεσμεύουν και να εκποιούν μεγάλο μέρος της περιουσίας, όσων δεν μπορούν να ανταπεξέλθουν στην εξυπηρέτηση των δανείων τους. Το Φλεβάρη του 2023, με απόφαση του Αρείου Πάγου, δόθηκε η δυνατότητα στις Εταιρίες Διαχείρισης, τους servicers, που έχουν αναλάβει υποθέσεις των funds, να προχωρούν οι ίδιοι σε δικαστικές ενέργειες που αφορούν πλειστηριασμούς. Μια απόφαση, που απέδειξε, εκτός των άλλων, τι εννοούν οι εκπρόσωποι του κεφαλαίου, όταν ζητούν να μετατραπεί η Δικαιοσύνη, σε «πηγή εμπιστοσύνης» για τις επενδύσεις. Το νέο πρόγραμμα της ΝΔ για την “στέγη των νέων”, έχει επίσης τον ίδιο χαρακτήρα: Την στήριξη των τραπεζών και του κατασκευαστικού κεφαλαίου. Τι προβλέπει το πρόγραμμα; Επιδοτούμενα από το κράτος δάνεια, που θα δώσουν οι τράπεζες σε νέους εργαζόμενους, για να αγοράσουν ακίνητα, μεγάλο κομμάτι των οποίων ανήκει στις τράπεζες και στο κατασκευαστικό κεφάλαιο. Οι νέοι εργαζόμενοι θα μετατραπούν στους νέους δανειολήπτες - με κρατικά εγγυημένα δάνεια – αυτή τη φορά, και θα περιμένουν την επόμενη κρίση και την καταβαράθρωση του μισθού τους, για να μετατραπούν κι αυτοί στη συνέχεια σε υπερχρεωμένους της επόμενης περιόδου. Κι έτσι όμως, τα όρια και οι προϋποθέσεις που τίθενται, τελικά αποκλείουν τους πιο ευάλωτους, ενώ σπρώχνουν νέους ανθρώπους σε περιοχές, μακριά από εκεί που επιθυμούν να κατοικήσουν. Ο πραγματικός ωφελημένος του προγράμματος είναι πάλι οι τράπεζες… Οι τράπεζες, που θα δώσουν χιλιάδες νέα και πολυ-διασφαλισμένα από χίλιες μεριές δάνεια, ενώ παράλληλα θα ξεφορτωθούν ακίνητα που σήμερα παραμένουν απούλητα. ",criticism,housing,bank regulations,-0.8,0.6,0.1,"[['2020', 'date', '1.0'], ['new democracy', 'political party', '0.7'], ['supreme court', 'organization', '0.7'], ['management companies', 'organization', '0.5'], ['southwest', 'location', '0.7'], ['banks', 'organization', '1.0'], ['construction capital', 'organization', '0.7']]"
12,"Friends, SYRIZA is criticizing the New Democracy government for having ostensibly overturned, during its days, the pro-people's framework that it supposedly had. It claims that the auctions of first homes have just been liberalised. But the truth is that until now, auctions could be carried out directly by the funds and tens of thousands of such auctions were carried out.
The Supreme Court's decision merely made it legally easier for the new 'crows' who help the biggest 'predators', the fund management companies, the servicers. The role of these companies is already provided for in Law 4354/2015 passed by the SYRIZA government.SYRIZA also claims that only the ND government ensures tax relief for funds and servicers...
Because it provides for loan transfers under the older law of 2023, not 2015. The truth of course, is that both laws, provide tax exemptions for stamp duties and registration fees in the public registers and tax, in essence, the income from loan management in the same way. The 2015 Law also explicitly provides that funds may be domiciled in any non-EU country. Finally, SYRIZA claims that its own framework shielded the borrower in the case of the first home... But it is not telling the truth on this either. SYRIZA's law introduced the term ""uncooperative borrower"" which should not be protected!!! This is also how the competent governmental directorate formed by the Stathakis Law, i.e. the Special Secretariat for the Management of Private Debt, defined which are considered as ""most vulnerable households"" and which are considered as ""reasonable living expenses"".","Φίλες και φίλοι,Ο ΣΥΡΙΖΑ ασκεί κάλπικη κριτική στην κυβέρνηση της ΝΔ γιατί τάχα ανέτρεψε, επί των ημερών της, το φιλολαϊκό πλαίσιο που δήθεν αυτός είχε. Προβάλλει, ότι μόλις τώρα απελευθερώθηκαν οι πλειστηριασμοί πρώτης κατοικίας. Η αλήθεια όμως είναι, ότι μέχρι σήμερα, πλειστηριασμοί μπορούσαν να γίνουν, απευθείας από τα funds και έγιναν δεκάδες χιλιάδες τέτοιοι. 
Η απόφαση του Αρείου Πάγου, διευκόλυνε απλώς νομικά τα νέα «κοράκια» που βοηθούν τα μεγαλύτερα «αρπακτικά», τις Εταιρίες Διαχείρισης των funds, τους servicers. Ο ρόλος αυτών των εταιριών προβλέπεται ήδη στο Ν. 4354/2015 που ψήφισε η κυβέρνηση του ΣΥΡΙΖΑ.Ισχυρίζεται επίσης ο ΣΥΡΙΖΑ, ότι μόνο η κυβέρνηση της ΝΔ διασφαλίζει φοροελαφρύνσεις για τα funds και τους servicers… 
Επειδή προβλέπει τις μεταβιβάσεις των δανείων με τον παλαιότερο νόμο του 2023 και όχι του 2015. Η αλήθεια βέβαια είναι, ότι και οι δύο νόμοι, προβλέπουν φοροαπαλλαγές για τα τέλη χαρτόσημου και τα τέλη καταχώρησης στα δημόσια βιβλία και φορολογούν στην ουσία, με τον ίδιο τρόπο, το εισόδημα από τη διαχείριση δανείων. Ο Νόμος του 2015 προβλέπει επίσης ρητά ότι τα funds μπορούν να εδρεύουν σε οποιαδήποτε χώρα εκτός ΕΕ. Τέλος, ο ΣΥΡΙΖΑ ισχυρίζεται, ότι το δικό του πλαίσιο θωράκιζε το δανειολήπτη στην περίπτωση της πρώτης κατοικίας... Ούτε σ’ αυτό όμως, λέει την αλήθεια. Ο νόμος του ΣΥΡΙΖΑ εισήγαγε τον όρο του «μη συνεργάσιμου δανειολήπτη» που δεν πρέπει να προστατεύεται!!! Έτσι οριοθετήθηκαν, επίσης από την αρμόδια κρατική διεύθυνση που διαμόρφωσε ο νόμος Σταθάκη, δηλαδή, την Ειδική Γραμματεία Διαχείρισης του Ιδιωτικού Χρέους, ποια θεωρούνται ως «πιο ευάλωτα νοικοκυριά» και ποιες θεωρούνται «εύλογες δαπάνες διαβίωσής» τους. ",criticism,housing,electronic auctions,-0.4,0,0.2,"[['syriza', 'organization', '1.0'], ['new democracy', 'political party', '1.0'], ['supreme court', 'organization', '0.8'], ['law 4354/2015', 'organization', '0.8'], ['law 2023', 'organization', '0.6'], ['law 2015', 'organization', '0.6'], ['eu', 'organization', '0.6'], ['stathakis law', 'organization', '0.8'], ['special secretariat for the management of private debt', 'organization', '1.0.']]"
13,"According to these provisions, over-indebted households are simply given the right to survive, their food and basic necessities are guaranteed, and the banks can take everything else. That is why the banks accepted the Stathakis law and we had 'the police and bailiffs' raids on houses in general and first homes in particular. This is how we finally arrived at the latest regulations, which the Mitsotakis government is provocatively presenting as measures to protect over-indebted households. What do they provide for? A reduction in the interest rate for borrowers that is constantly increasing..., and the obligation of creditors, such as banks, to justify the rejection of proposals for out-of-court settlement of loans of the relevant platform. Formally and technically, these platform proposals are automatically formulated on the basis of an algorithm. What is behind all of the above?The economic violence of the system that, taking advantage of the reactive framework formed by ND, SYRIZA and PASOK, says to the over-indebted household ""give us everything you have or you will lose your house""!The recent changes of the government, in essence, make it easier for the banks and the ""crows"" to get as much as they can. Cutting interest rates makes it easier for the banks to continue to bleed and without legal impediments. In case the borrower 'does not cooperate', he will lose his house and become a 'tenant in his own house'. The notorious algorithm of the out-of-court mechanism is in fact shaped according to the profitability requirements of the banks and funds. And if the proposal does not satisfy the lenders, they can reject it with a simple legal justification! All they have to do is to state in practice that the debtor can liquidate property of greater value. Already the competent Ministry admits that the rejection rate of applications to the out-of-court mechanism is as high as 46% for creditors and 44% for debtors. In any case, the legislative framework protects creditors by providing that they should not be in a worse position than they would be in if the auction were implemented, unless they themselves consent to this option. We have even reached the point where banks and funds are lending again, to some bankrupt households, to buy their house back, in the auctions organised by the 'crows' themselves.","Σύμφωνα με αυτές τις προβλέψεις, στα υπερχρεωμένα νοικοκυριά δίνεται απλώς το δικαίωμα επιβίωσης, διασφαλίζονται οι δαπάνες για διατροφή και βασικές ανάγκες, και όλα τα υπόλοιπα μπορούν να τα πάρουν οι τράπεζες. Γι’ αυτό αποδέχτηκαν το νόμο Σταθάκη οι τράπεζες και είχαμε «τα ντου» της αστυνομίας και δικαστικών επιμελητών σε κατοικίες γενικά και πρώτες κατοικίες ειδικά. Έτσι φτάσαμε τελικά στις τελευταίες ρυθμίσεις, τις οποίες η κυβέρνηση Μητσοτάκη προβάλλει προκλητικά, ως μέτρα προστασίας των υπερχρεωμένων νοικοκυριών. Τι προβλέπουν; Μια μείωση του επιτοκίου των δανειοληπτών που συνεχώς αυξάνεται…, και την υποχρέωση των πιστωτών, όπως είναι οι τράπεζες, να αιτιολογούν την απόρριψη προτάσεων εξωδικαστικού διακανονισμού των δανείων της σχετικής πλατφόρμας. Τυπικά και τεχνικά, αυτές οι προτάσεις της πλατφόρμας, διαμορφώνονται αυτόματα στη βάση ενός αλγόριθμου. Τι κρύβεται πίσω απ’ όλα όσα προαναφέραμε;Η οικονομική βία του συστήματος που, αξιοποιώντας το αντιδραστικό πλαίσιο που διαμόρφωσαν ΝΔ, ΣΥΡΙΖΑ και ΠΑΣΟΚ, λέει στο υπερχρεωμένο νοικοκυριό «δώσε μας ό,τι έχεις και δεν έχεις, αλλιώς θα χάσεις το σπίτι σου»!Οι πρόσφατες αλλαγές της κυβέρνησης, στην ουσία, διευκολύνουν τις τράπεζες και τα «κοράκια» να πάρουν όσα περισσότερα μπορούν. Η μείωση των επιτοκίων διευκολύνει τις τράπεζες να συνεχίσουν την αφαίμαξη και μάλιστα χωρίς νομικά κωλύματα. Σε περίπτωση που ο δανειολήπτης «δε συνεργάζεται», θα χάσει το σπίτι του και θα μετατραπεί σε «νοικάρη στο ίδιο του το σπίτι». Ο περιβόητος αλγόριθμος του εξωδικαστικού μηχανισμού, διαμορφώνεται στην ουσία, σύμφωνα με τις απαιτήσεις κερδοφορίας των τραπεζών και των funds. Κι αν η πρόταση, δεν ικανοποιεί τους δανειστές, αυτοί μπορούν με μια απλή νομική αιτιολόγηση να την απορρίψουν! Αρκεί στην πράξη να αναφέρουν ότι ο οφειλέτης μπορεί να ρευστοποιήσει περιουσία μεγαλύτερης αξίας. Ήδη το αρμόδιο Υπουργείο ομολογεί, ότι το ποσοστό απόρριψης αιτήσεων στον εξωδικαστικό μηχανισμό, φτάνει το 46% για τους πιστωτές και το 44% για τους οφειλέτες. Σε κάθε περίπτωση, το νομοθετικό πλαίσιο προστατεύει τους πιστωτές, προβλέποντας ότι δεν πρέπει να βρεθούν σε χειρότερη θέση απ’ αυτή που θα βρίσκονταν, αν υλοποιούσαν τον πλειστηριασμό, εκτός αν οι ίδιοι συναινέσουν σε αυτή την επιλογή. Φτάσαμε μάλιστα στο σημείο, οι τράπεζες και τα funds να δανειοδοτούν ξανά, ορισμένα χρεοκοπημένα νοικοκυριά, για να ξαναγοράσουν το σπίτι τους, στους πλειστηριασμούς που διοργανώνουν τα ίδια τα «κοράκια».",criticism,debt,bank regulations,-0.9,0.8,0.2,"[['stathakis', 'person', '0.5'], ['mitsotakis', 'person', '1.0'], ['nd', 'political party', '1.0'], ['syriza', 'political party', '1.0'], ['pasok', 'political party', '1.0'], ['greece', 'country', '1.0']]"
