id,text,text_el,is_criticism,topic-context,subtopic-context,sentiment,polarization-definition,populism-definition,ner-limited
7,"Friends, yes, we have a front, we have a front with all of them. Because, quite simply, we have a front against authoritarianism and misery in public debate. We have a front against the organised gangs of the Internet. We have a front against those who, for the sake of the chair, for the sake of power, are capable of saying the same and the opposite and sacrificing the public interest of the Greek people. Friends, they have the audacity to play with the memory of Andreas Papandreou, our founder. Let us make it clear from here. Let us make it clear here in Thessaloniki. Andreas Papandreou, who belongs to the history of the democratic, progressive history of this country. Andreas Papandreou, Mr Tsipras, cannot be exploited by those who talk about dangerous theories about Prespes and the Aegean. Andreas Papandreou and the patriotic PASOK do not go hand in hand with the Aegean Prespes, Mr Tsipras. Andreas Papandreou and this patriotic people's movement are not going with the dangerous theories that there are no borders at sea. So leave our founder, our historical leader, the greatest politician of Greece since the Second World War, Andreas Papandreou, alone in history. This political giant has nothing to do with your dangerous adventurism. But he has the audacity to lecture us on how New Democracy will fall. Who? Its major sponsor, who every week will say something to give Mr Mitsotakis a field to run on. On the one hand, local currencies, on the other, the Evros fence, which they suddenly say yes, but that European taxpayers should not pay for it. Admittedly, this is the big issue for Syriza and various other things that simply show a need. Fight every day on 21 May to have its real opponent, New Democracy, because with Mr Tsipras and his company, Mr Mitsotakis feels completely safe.","Φίλες και φίλοι, ναι, έχουμε μέτωπο, έχουμε μέτωπο με όλους αυτούς. Γιατί πολύ απλά, έχουμε μέτωπο με τον αυταρχισμό και την αθλιότητα στο δημόσιο διάλογο. Έχουμε μέτωπο απέναντι στις οργανωμένες συμμορίες του Διαδικτύου. Έχουμε μέτωπο απέναντι σε αυτούς που για την καρέκλα, για την εξουσία είναι ικανοί να πούνε το ίδιο και το αντίθετο και να θυσιάζουν το δημόσιο συμφέρον του ελληνικού λαού. Φίλες και φίλοι, έχουν θράσος να παίζουν και με τη μνήμη του Ανδρέα Παπανδρέου, του ιδρυτή μας. Ας το ξεκαθαρίσουμε και από δω. Ας το ξεκαθαρίσουμε και εδώ από τη Θεσσαλονίκη. Ανδρέας Παπανδρέου, που ανήκει στην ιστορία τη δημοκρατική προοδευτική ιστορία του τόπου. Δεν μπορεί ο Ανδρέας Παπανδρέου, κύριε Τσίπρα να γίνεται εκμεταλλεύσιμο προϊόν από αυτούς που μιλούν για επικίνδυνες θεωρίες περί Πρεσπών του Αιγαίου. Δεν πάει μαζί ο Ανδρέας Παπανδρέου και το πατριωτικό ΠΑΣΟΚ με τις Πρέσπες του Αιγαίου, κύριε Τσίπρα. Δεν πάει ο Ανδρέας Παπανδρέου και το πατριωτικό λαογέννητο αυτό κίνημα με τις επικίνδυνες θεωρίας ότι στη θάλασσα δεν υπάρχουν σύνορα. Αφήστε λοιπόν ήσυχο στην ιστορία τον ιδρυτή μας, τον ιστορικό ηγέτη, τον μεγαλύτερο πολιτικό της Ελλάδας, μετά το Δεύτερο Παγκόσμιο Πόλεμο, τον Ανδρέα Παπανδρέου. Δεν έχει σχέση ο πολιτικός αυτός γίγαντας με τους επικίνδυνους τυχοδιωκτισμούς σας. Έχει όμως θράσος να μας κάνει μαθήματα για το πώς θα πέσει η Νέα Δημοκρατία. Ποιος; Ο μεγάλος χορηγός της, που κάθε εβδομάδα θα πούνε και κάτι για να δώσουν πεδίο στον κύριο Μητσοτάκη. Τη μία τα τοπικά νομίσματα, την άλλη το φράχτη στον Έβρο που ξαφνικά λένε ναι, αλλά να μην το πληρώσουν οι Ευρωπαίοι φορολογούμενοι. Ομολογουμένως αυτό είναι το μεγάλο θέμα του ΣΥΡΙΖΑ και διάφορα άλλα που απλά δείχνουν μια ανάγκη. Αγωνιστείτε καθημερινά 21 Μαΐου να έχει τον πραγματικό της αντίπαλο, η Νέα Δημοκρατία, γιατί με τον κύριο Τσίπρα και την παρέα του ο κύριος Μητσοτάκης νιώθει την απόλυτη ασφάλεια. ",criticism,elections,borders,-0.4,0.6,0.2,"[['thessaloniki', 'location', '1.0'], ['greek people', 'group of people', '0.8'], ['andreas papandreou', 'person', '1.0'], ['pasok', 'political party', '1.0'], ['prespes', 'location', '0.6'], ['aegean', 'location', '0.6'], ['greece', 'country', '1.0'], ['new democracy', 'political party', '1.0'], ['mr mitsotakis', 'person', '1.0'], ['european', 'organization', '0.5'], ['syriza', 'political party', '1.0'], ['21 may', 'date', '1.0']]"
8,"But, friends, let's go to our programme that wants to give a new breath to the Greek economy. The programme, the social democratic programme, the programme of Democratic Socialism, the programme that reduces inequalities and creates opportunities and hopes for all Greek children, for all families. One promises things that cannot be done and the other hides what is going to happen with his budgetary choices. They boast about growth, about good statistics, when in reality our performance is unfortunately negative, as the OECD figures show. More than two and a half million Greeks are currently threatened with poverty and social exclusion, according to official figures. They praise that they reduced taxes, but the taxes paid by citizens in 2022 were 5 billion more than the targets. If this is not overtaxation, what is it? And even more so if we put on the table that most of these taxes are due to VAT consumption and special taxes that beat up the weakest, the workers, the unemployed and the middle class. They say they have increased the minimum wage by 20% and dispute the OECD figures of a 7.4% reduction in real wages. Unemployment, they say, is falling, but the new jobs are mostly €400 part-time jobs. This growth that has Mr Mitsotakis' name on it is creating real estate with internal loans. In a few years, with this policy, we will be foreigners in our country. Students will not be able to rent a house with dignity in the centre of Thessaloniki and the centre of Athens. Young couples will not be able to build their future with dignity and have children. And on the other hand, Mr Tsipras thinks that the economy is a cow that gives out milk without ever being fed.","Φίλες και φίλοι, ας πάμε όμως στο πρόγραμμά μας αυτό που θέλει να δώσει μια άλλη πνοή στην ελληνική οικονομία. Το πρόγραμμα, το σοσιαλδημοκρατικό, το πρόγραμμα του Δημοκρατικού Σοσιαλισμού, το πρόγραμμα που μειώνει τις ανισότητες και δημιουργεί ευκαιρίες και ελπίδες για όλα τα ελληνόπουλα, για όλες τις οικογένειες. Ο ένας υπόσχεται πράγματα που δεν μπορούν να γίνουν και ο άλλος κρύβει αυτά που πρόκειται να συμβούν με τις δημοσιονομικές του επιλογές. Πανηγυρίζουν για μια ανάπτυξη, για τις καλές στατιστικές, ενώ στην πραγματικότητα οι πρωτιές μας δυστυχώς είναι αρνητικές, όπως αποδεικνύουν τα στοιχεία του ΟΟΣΑ. Περισσότερο από δυόμισι εκατομμύρια Έλληνες και Ελληνίδες απειλούνται σήμερα με φτώχεια και κοινωνικό αποκλεισμό, σύμφωνα με τα επίσημα στοιχεία. Επαίρονται ότι μείωσαν τους φόρους, αλλά οι φόροι που πλήρωσαν οι πολίτες το 2022 ήταν 5 δισεκατομμύρια παραπάνω από τους στόχους. Αν αυτό δεν είναι υπερφορολόγηση, τι είναι; Και μάλιστα εάν βάλουμε στο τραπέζι ότι το μεγαλύτερο ποσοστό αυτών των φόρων είναι λόγω κατανάλωσης ΦΠΑ και ειδικοί φόροι που δέρνουν τους πιο αδύναμους, τους εργαζόμενους, τους ανέργους και τη μεσαία τάξη. Λένε ότι αύξησαν τον κατώτατο μισθό κατά 20% και αμφισβητούν τα στοιχεία του ΟΟΣΑ για τη μείωση των πραγματικών μισθών κατά 7,4%. Η ανεργία, λένε μειώνεται, όμως οι νέες δουλειές είναι επί το πλείστον δουλειές των 400€ της μερικής απασχόλησης. Αυτή η ανάπτυξη που έχει το όνομα του κυρίου Μητσοτάκη δημιουργεί real estate με εσωτερικά δανεικά. Σε λίγα χρόνια, με αυτή την πολιτική, θα είμαστε ξένοι στην πατρίδα μας. Δεν θα μπορούν οι φοιτητές να ενοικιάσουν ένα σπίτι με αξιοπρέπεια στο Κέντρο της Θεσσαλονίκης και στο Κέντρο της Αθήνας. Δεν θα μπορεί το νέο ζευγάρι να χτίσει το μέλλον του με αξιοπρέπεια και να κάνει παιδιά. Και από την άλλη, ο κύριος Τσίπρας νομίζει ότι η οικονομία είναι μια αγελάδα που μοιράζει γάλα χωρίς να την ταΐζεις ποτέ. ",criticism,economy,economic equity,-0.8,0.2,0.2,"[['greek', 'location', '1.0'], ['democratic socialism', 'organization', '1.0'], ['oecd', 'organization', '1.0'], ['greeks', 'group of people', '0.8'], ['vat', 'organization', '0.7'], ['workers', 'group of people', '0.8'], ['unemployed', 'group of people', '1.0'], ['middle class', 'group of people', '0.8'], ['minimum wage', 'date', '0.7'], ['oecd', 'organization', '1.0'], ['mitsotakis', 'person', '1.0'], ['thessaloniki', 'location', '1.0'], ['athens', 'location', '1.0'], ['tsipras', 'person', '1.0']]"
9,"So it is time for us, the democratic party, to put an end to these outdated models of power and create a broad social alliance for a strong Greece of the future, so that we can become a normal European country again. This is our vision, a normal European country that respects the citizen, respects the environment and that growth is sustainable and socially just for all Greeks. We have a duty to build a modern welfare state with high-quality benefits and services, not a youth pass. Mr Mitsotakis cannot disregard the young generation in this way, a young generation with few opportunities and many skills, and just before the elections try to buy consciences with EUR 150. This shows the quality of New Democracy's politics.","Ήρθε λοιπόν η ώρα, εμείς η δημοκρατική παράταξη να τελειώνουμε με αυτά τα παρωχημένα μοντέλα εξουσίας και να δημιουργήσουμε μία πλατιά κοινωνική συμμαχία για την ισχυρή Ελλάδα του μέλλοντος, ώστε να ξαναγίνουμε μια κανονική ευρωπαϊκή χώρα. Αυτό είναι το όραμα μας, μια κανονική ευρωπαϊκή χώρα που θα σέβεται τον πολίτη, θα σέβεται το περιβάλλον και η ανάπτυξη θα είναι βιώσιμη και κοινωνικά δίκαιη για όλες τις Ελληνίδες και όλους τους Έλληνες. Έχουμε χρέος να φτιάξουμε ένα σύγχρονο κοινωνικό κράτος υψηλής ποιότητας παροχών και υπηρεσιών και όχι τα youth pass. Δεν μπορεί ο κύριος Μητσοτάκης να περιφρονεί κατ' αυτόν τον τρόπο τη νέα γενιά, μια νέα γενιά με λιγοστές ευκαιρίες και πολλά εφόδια και λίγο πριν τις εκλογές να προσπαθεί με 150€ να εξαγοράσει συνειδήσεις. Αυτό δείχνει την ποιότητα του πολιτεύεσθαι της Νέας Δημοκρατίας. ",political agenda,social state,youth,0.52,0.2,0.0,"[['democratic party', 'organization', '1.0'], ['greece', 'country', '1.0'], ['european country', 'location', '1.0'], ['greeks', 'group of people', '1.0'], ['mitsotakis', 'person', '1.0'], ['new democracy', 'political party', '1.0'], ['eur 150', 'date', '1.0']]"
10,"Also the green transition. The green transition, for Mr Mitsotakis, is a business for the few.","Επίσης, η πράσινη μετάβαση. Η πράσινη μετάβαση, για τον κύριο Μητσοτάκη, είναι μια μπίζνα για λίγους. ",criticism,energy,other,-0.4,0.1,0.0,"[['mr mitsotakis', 'person', '0.95'], ['green transition', 'organization', '0.9']]"
11,"For us, it is a policy that makes Greece a country at the forefront of sustainable development and gives priority to the weakest, to the middle class, to the real producers, farmers, manufacturers, to make choices with photovoltaics, renewable sources, with a fair democratized energy transition that will not lead to new energy poverty.","Για μας, είναι μια πολιτική που κάνει την Ελλάδα μια χώρα μπροστάρη της αειφόρου ανάπτυξης και δίνει προτεραιότητα στους πιο αδύναμους, στη μεσαία τάξη, στους πραγματικούς παραγωγούς, τους αγρότες, τους μεταποιητές, να κάνουν επιλογές με φωτοβολταϊκά, ανανεώσιμες πηγές, με μια δίκαιη εκδημοκρατισμένη μετάβαση στην ενέργεια που δεν θα οδηγήσει σε νέα ενεργειακή φτώχεια.",political agenda,energy,green energy,0.6,0.0,0.0,"[['greece', 'location', '0.8'], ['middle class', 'group of people', '0.6'], ['farmers', 'group of people', '0.6'], ['manufacturers', 'group of people', '0.6']]"
12,"With strong public health and education. The state is staffed by open international competitions, if PASOK is strong. It is my commitment to meritocracy and transparency in the public sector and not to say that after Tempe we have come this far, but after Tempe they will continue the same, with no commitment that hospitals and organisations will be staffed by open international competitions because they simply want to continue the client state of failed MPs and agents.","Με ισχυρή δημόσια υγεία και παιδεία. Το κράτος στελεχώνεται με ανοικτούς διεθνείς διαγωνισμούς, αν το ΠΑΣΟΚ είναι ισχυρό. Είναι δέσμευσή μου η αξιοκρατία και η διαφάνεια στο δημόσιο τομέα και όχι να λέμε μετά τα Τέμπη ως εδώ αλλά και μετά τα Τέμπη να συνεχίζουν τα ίδια, χωρίς να δεσμεύονται ότι τα νοσοκομεία και οι οργανισμοί θα στελεχωθούν με ανοιχτούς διεθνείς διαγωνισμούς γιατί θέλουν πολύ απλά να συνεχίσουν το πελατειακό κράτος των αποτυχημένων βουλευτών και των παραγόντων. ",criticism,transparency,other,,0.0,0.0,"[['pasok', 'political party', '0.85'], ['tempe', 'location', '0.75']]"
13,"This state is undermining the efforts and sacrifices of the Greek people. This is the state that led to Tempe. This is the state that the Transparency Authority pointed to in October 21 for the huge responsibilities for not having a telecommunications system, and this is the state that Mr Karamanlis hid in his drawer so that they would not be brought to justice. And instead of going home he is decorating the ballot papers of the New Democracy in Serres. This is political ethics and this is contempt for the families of the victims of Tempi.",Αυτό το κράτος είναι υπονομευτής των κόπων και των θυσιών του ελληνικού λαού. Αυτό το κράτος οδήγησε στα Τέμπη. Αυτό το κράτος έδειξε η Αρχή Διαφάνειας τον Οκτώβριο του '21 για τις τεράστιες ευθύνες που δεν έγινε τηλεδιοίκηση και αυτό το κράτος έκρυψε ο κύριος Καραμανλής στο συρτάρι του για να μην πάνε στη δικαιοσύνη. Και αντί να πάει στο σπίτι του κοσμεί τα ψηφοδέλτια της Νέας Δημοκρατίας στις Σέρρες. Αυτό είναι το πολιτικό ήθος και αυτή είναι η περιφρόνηση των οικογενειών των θυμάτων των Τεμπών.,criticism,accountability,other,-0.9,0.2,0.2,"[['greek people', 'group of people', '1.0'], ['tempe', 'location', '1.0'], ['transparency authority', 'organization', '1.0'], ['october 21', 'date', '1.0'], ['telecommunications system', 'organization', '1.0'], ['mr karamanlis', 'person', '1.0'], ['new democracy', 'political party', '1.0'], ['serres', 'location', '1.0'], ['tempi', 'location', '1.0']]"
14,"Friends. But what should we do? We must find a public space and create the conditions for a just development. For dividends. We cannot follow the policy of the New Democracy. The New Republic put a 5% across the board. And I start from this because there has been a very big discussion about where the parties will get the money and Mr Mitsotakis even proposes that we take our programmes to the general accounting office of the state. We say to the Budget Office of the House of Representatives. Let us see who is telling the truth.  But let us start from the simple. Why 5% on dividends? What does the 2022 data say? 150 listed companies have quadrupled their profits when in '22 the weakest Greek and the middle class were impoverished. This policy cannot continue to coddle the domestic oligarchy. Despite the energy crisis and high inflation, they will distribute a record dividend of two and a half billion euros.","Φίλες και φίλοι. Τι πρέπει να κάνουμε όμως; Πρέπει να βρούμε δημόσια αίθουσα και να δημιουργήσουμε τις συνθήκες μιας δίκαιης ανάπτυξης. Για τα μερίσματα. Εμείς δεν μπορούμε να ακολουθήσουμε την πολιτική της Νέας Δημοκρατίας. Η Νέα Δημοκρατία έβαλε ένα 5% οριζόντια. Και ξεκινάω από αυτό διότι έχει γίνει μια πολύ μεγάλη συζήτηση για το πού θα βρουν τα κόμματα τα χρήματα και προτείνει μάλιστα ο κύριος Μητσοτάκης να πάμε τα προγράμματά μας στο γενικό λογιστήριο του κράτους. Εμείς λέμε στο Γραφείο προϋπολογισμού της Βουλής. Για να δούμε ποιος λέει την αλήθεια;  Αλλά ας εκκινήσουμε από το απλό. Γιατί 5% στα μερίσματα; Τι λένε τα στοιχεία του 2022; 150 εισηγμένες εταιρείες έχουν τετραπλασιάσει τα κέρδη της, όταν το '22 φτωχοποιήθηκε ο πιο αδύναμος Έλληνας και η μεσαία τάξη. Αυτή η πολιτική δεν μπορεί να συνεχίζεται χαϊδέματος της εγχώριας ολιγαρχίας. Παρά την ενεργειακή κρίση και τον υψηλό πληθωρισμό, θα διανείμουν μερίσματα ρεκόρ δυόμισι δισεκατομμυρίων ευρώ. ",criticism,economy,other,-0.6,0.0,0.0,"[['friends', 'group of people', '0.5'], ['new democracy', 'political party', '0.5'], ['new republic', 'political party', '0.5'], ['mr mitsotakis', 'person', '0.5'], ['budget office of the house of representatives', 'organization', '1.0'], ['2022', 'date', '1.0'], ['greek', 'country', '1.0'], ['150 listed companies', 'organization', '0.5'], ['two and a half billion euros', 'organization', '0.5']]"
15,"What do we propose? Up to 50.000€, 5% on dividends. And above 50,000, the tax is graduated to the highest level, 15%.","Εμείς τι προτείνουμε; Μέχρι 50.000€, 5% στα μερίσματα. Και πάνω από 50.000, κλιμακωτά ο φόρος να φτάνει στο υψηλότερο επίπεδο, το 15%. ",political agenda,economy,,0.0,0.0,0.0,"[['50.000€', 'date', '100%'], ['5%', 'date', '100%'], ['15%', 'date', '100%']]"
16,"Also, banks. The banks, we've given billions for their capital adequacy. They too profited in the crisis, when the interest rate on deposits and mortgages was the highest in Europe.","Επίσης, τράπεζες. Οι τράπεζες, έχουμε δώσει δισεκατομμύρια για την κεφαλαιακή τους επάρκεια. Κερδοσκόπησαν και αυτές μέσα στην κρίση, όταν το επιτόκιο καταθέσεων και στεγαστικών δανείων είχε τη μεγαλύτερη διαφορά σε όλη την Ευρώπη. ",criticism,economy,banking profits,0.2,0.0,0.0,"[['banks', 'organization', '1.0'], ['europe', 'location', '0.5']]"
17,"What do we say? What Spain did. Tax the super profits as long as they don't change their policy to financially support the middle class and the new generation, their entrepreneurship.","Εμείς τι λέμε; Ό,τι έκανε και η Ισπανία. Φορολόγηση των υπερκερδών όσο δεν αλλάζουν πολιτική για να στηρίξουν χρηματοδοτικά τη μεσαία τάξη και τη νέα γενιά, την επιχειρηματικότητά της. ",political agenda,economy,tax cuts,0.5,0.0,0.0,"[['spain', 'location', '0.7'], ['middle class', 'group of people', '0.7'], ['new generation', 'group of people', '0.7']]"
