id,text,text_el,is_criticism,topic-context,subtopic-context,sentiment,polarization-definition,populism-definition,ner-limited
23,"We said if we don't sit down and talk so you don't talk to us later on about progressive governance and so on because progressive governance will do? You're up against Hercules, that market dream with the red loans. Do you know how long it took them to set this up 6 years the Frankfurt predators at the European Central Bank studied it, first they piloted it in Italy and then brought it here we what? From Monday morning until Wednesday afternoon we will agree on how to replace this Herculean dream of the Energy Exchange of the Super Fund. So when they tell us to come together in government, to get rid of Mitsotakis, do you know what they are saying? Come and legalise the grab. The plundering of people and nature in Greece, what does the leadership of Syriza tell us when they refer us to them after the elections? It says go to Chania, talk to the people and the youth. Talk to them about the abolition of the Energy Exchange. Talk to them about abolishing Hercules. Talk to them about the Demeter, which abolishes the fees that the bankers charge you to use your pensions, your salaries, to make payments to the shops. Talk to them about the need for no mining, not only in Crete, but also in Epirus, nor in the Aegean and the Eastern Mediterranean. Talk to them about reclaiming, which only in the Day 25 Alliance for Rupture we talk about, about creating a new Non-Aligned movement. No Putin, no NATO. Go to Cuba, go to Mexico, make these alliances, with Brazil, with President Lula. And then May 21 in the evening, maybe 22, on Monday, come and make me Prime Minister, make us Ministers, so we don't do any of this. That's what we're being told, do you realise that? They weren't slaughtered. We're not going to do that.","Είπαμε παιδιά αμα δεν κάτσουμε να μιλήσουμε για να μη μας μιλάτε μετά για συγκυβέρνηση προοδευτική διακυβέρνηση και τα λοιπά γιατι προοδευτική διακυβέρνηση θα κάνει; Έχεις απέναντί σου τον Ηρακλή αυτό το όνειδος της αγοράς με τα κόκκινα δάνεια. Ξέρετε πόσο καιρό τους πήρε να το στήσουμε αυτό 6 χρόνια το μελετάγανε τα αρπακτικά της Φρανκφούρτης στην Ευρωπαϊκή Κεντρική Τράπεζα, πρώτα το εφάρμοσαν δοκιμαστικά πιλοτικά στην Ιταλία και μετά το φέρανε εδώ εμείς τι; Από τη Δευτέρα το πρωί μέχρι Τετάρτη το απόγευμα θα συμφωνήσουμε πως θα αντικαταστήσουμε αυτό το όνειδος του Ηρακλή, του Χρηματιστηρίου Ενέργειας του Υπερταμείου. Όταν λοιπόν μας λένε ελάτε μωρέ να συγκυβερνήσουμε, να φύγει ο Μητσοτάκης ξέρετε τι μας λένε; Ελάτε να νομιμοποιήσετε την αρπαγή. Τη λεηλασία ανθρώπων και φύσης στην Ελλάδα τι μας λέει η ηγεσία του ΣΥΡΙΖΑ όταν μας παραπέμπει και μετά τις εκλογές; Λέει πήγαινε στα Χανιά, μίλησε στον κόσμο και τη νεολαία. Μιλήστε τους για την κατάργηση του Χρηματηστηρίου Ενέργειας. Μιλήστε τους για την κατάργηση του Ηρακλή. Μιλήστε τους για το Δήμητρα, το οποίο καταργεί τα χαράτσια, που σας χρεώνουν οι τραπεζίτες για να χρησιμοποιείτε τις συντάξεις σας, τους μισθούς σας, να κάνετε πληρωμές στα μαγαζιά. Μιλήστε τους για την ανάγκη να μην γίνει καμία εξόρυξη, οχι μόνο στην Κρήτη, αλλά και στην Ήπειρο, ούτε στο Αιγαίο και στην Ανατολική Μεσόγειο. Μιλήστε τους για την ανάκγη, που μόνο στο Μέρα 25 Συμμαχία για τη Ρήξη μιλάμε για αυτό, για τη δημιουργία ενός νέυ κινήματος Αδέσμευτων. Ούτε Πούτιν, ούτε ΝΑΤΟ. Πηγαίντε στην Κούβα, πηγαίντε στο Μεξικό, φτιάξτε αυτές τις συμμαχίες, με την Βραζιλία, με τον πρόεδρο Λούλα. Και μετά 21η Μαϊου το βράδυ, άντε 22, τη Δευτέρα, ελάτε να με κάνετε πρωθυπουργό, να μας κάνετε Υπουργούς, για να μην κάνουμε τίποτ από όλα αυτά. Αυτό μας λένε, το συνειδητοποιείτε; Δεν σφάξανε. Δεν θα το κάνουμε εμείς αυτό.",political agenda,elections,other,-0.2,0.1,0.2,"[['hercules', 'organization', '1.0'], ['european central bank', 'organization', '1.0'], ['italy', 'location', '1.0'], ['energy exchange', 'organization', '1.0'], ['super fund', 'organization', '1.0'], ['mitsotakis', 'person', '1.0'], ['greece', 'country', '1.0'], ['syriza', 'political party', '1.0'], ['chania', 'location', '1.0'], ['demeter', 'organization', '1.0'], ['day 25 alliance for rupture', 'group of people', '1.0'], ['non-aligned movement', 'organization', '1.0'], ['putin', 'person', '1.0'], ['nato', 'organization', '1.0'], ['cuba', 'country', '1.0'], ['mexico', 'country', '1.0'], ['brazil', 'country', '1.0'], ['president lula', 'person', '1.0'], ['may 21', 'date', '1.0'], ['monday', 'date', '1.0'], ['prime minister', 'position', '1.0'], ['ministers', 'group of people', '1.0.']]"
24,"There are too many people out there. Who are highly skeptical of parties. I understand them. We sympathize with them, they have every right. After the people were overthrown on the night of the referendum. When a Radical Left party asked the people to be brave. And the people showed unbelievable bravery, they went against all the international centres of oligarchy without borders, they went against the European Central Bank with its closed banks, they went against Brussels, they went against Berlin, he went against Washington, against the International Monetary Fund, against the mass deception media that terrorized him in his living rooms in his house with the TVs every night and told him if you vote no, we will have Armageddon. And these people voted 63% No Pasaran voted no pass. Don't back down, they were telling me here in Chania. I remember 25/03 I had come with Danae. And we were then with the others, with Polakis and the others,break. Don't back down. Do not dare to betray. That night they subverted the people in the name of the Left, how with Meimarakis do you remember Pavlopoulos in the presidential palace? PASOK. Potami. And with the KKE, which came out through the representative of the General Secretary Dimitris Koutsoumbas, outside the Presidential Palace. And what did he say at that moment when the Greek people's no was overturned? What are you waiting for? It was logical. No denunciation of the overthrow of the people, not even by the representative of the Communist Party of Greece. Look at the first video on Youtube there is still there it is sad.","Υπάρχουν πάρα πολλοί άνθρωποι εκεί έξω. Που είναι ιδιαίτερα σκεπτικιστές με κόμματα. Τους καταλαβαίνω. Τους συμπονούμε έχουν κάθε δίκιο. Μετά την ανατροπή του λαού το βράδυ του δημοψηφίσματος. Όταν ένα κόμμα της Ριζοσπαστικής Αριστεράς ζήτησε από τον κόσμο να δείξει γενναιότητα. Κι ο κόσμος έδειξε ανέλπιστη γενναιότητα, πήγε κόντρα σε όλα τα διεθνή κέντρα της ολιγαρχίας χωρίς σύνορα, πήγε κόντρα στην Ευρωπαϊκή Κεντρική Τράπεζα με τις κλειστές τράπεζες, πήγε κόντρα στις Βρυξέλλες, πήγε κόντρα στο Βερολίνο, πήγε κόντρα στην Ουάσινγκτον στο Διεθνές Νομισματικό Ταμείο, στα μέσα μαζικής εξαπάτησης που τον τρομοκρατούσαν στα σαλόνια του στο σπίτι του μέσα με τις τηλεοράσεις κάθε βράδυ και του λέγανε αν ψηφίσεις, όχι, θα έχουμε Αρμαγεδδώνα. Και αυτός ο λαός ψήφισε 63% No Pasaran ψήφισε δεν θα περάσουνε. Μην κάνετε πίσω ρήξη μου λέγανε εδώ στην στα Χανιά Θυμάμαι 25/03 είχαμε έρθει με τη Δανάη. Και ήμασταν τότε και με τους υπόλοιπους, με τον Πολάκη και τους άλλους,ρήξη. Μην κάνετε πίσω. Μην τολμήσετε να προδώσετε. Εκείνο το βράδυ ανέτρεψαν το λαό στο όνομα της Αριστεράς, πως με τον Μειμαράκη θυμάστε στο προεδρικό Μέγαρο τον Παυλόπουλο; Το ΠΑΣΟΚ. Το Ποτάμι. Και με το ΚΚΕ, το οποίο βγήκε μέσω του εκπροσώπου του Γενικού Γραμματέα Δημήτρη Κουτσούμπα, έξω από το Προεδρικό Μέγαρο. Και τι είπε εκείνη την στιγμή που ανατρεπόταν το όχι του ελληνικού λαού; Τι περιμένετε; Λογικό ήταν. Καμία καταγγελία της ανατροπής του λαού ούτε από τον εκπρόσωπο του Κομμουνιστικού Κόμματος Ελλάδας. Κοιτάξτε το πρώτο βίντεο στο Youtube υπάρχει ακόμα είναι θλιβερό. ",criticism ,democracy,other,0.0,0.1,0.5,"[['chania', 'location', '0.8'], ['radical left party', 'political party', '0.8'], ['european central bank', 'organization', '0.8'], ['brussels', 'location', '0.8'], ['berlin', 'location', '0.8'], ['washington', 'location', '0.8'], ['international monetary fund', 'organization', '0.8'], ['pasok', 'political party', '0.8'], ['potami', 'political party', '0.8'], ['kke', 'political party', '0.8'], ['general secretary dimitris koutsoumbas', 'person', '0.8'], ['greek', 'country', '0.8'], ['25/03', 'date', '0.8'], ['pavlopoulos', 'person', '0.8'], ['danae', 'person', '0.8'], ['polakis', 'person', '0.8']]"
25,"We are here because we succeeded 4 years ago, with the help of many of you. I thank you from the bottom of my soul that you were together then and those of you who were together then and those of you who put the NO vote back in Parliament because that NO vote was not just a no vote, it was the resistance of a small people against a large, relentless army of oligarchs and predators. We bled and sweated the jersey for 4 years in Parliament. A handful of MPs and women MPs. We testified. Solid, technocratic and politically progressive proposed laws, amendment after amendment we did work that normally if you look at the volume, the volume and the quality of the work, you would think that these were 70 MPs. It can't be 5 or 6. We were 5, 6. And the most pleasing thing. After our first consultative conference. We made a mass call. For unity for unity of the left we opened the doors of our party, the arms of all of us. Our souls to people who were unaffected people, wounded people, who like us had been wounded that night of the referendum, some had been idiots, some had gone to the water movements, trade union movements, movements, women's ecological movements, refugee movements. And of course tremendous joy, and I see many, many of you here today that the People's Unity has joined us, that the children of Arras are with us. That we are the Maya for the new great left for the militant disobedient disobedient selfless left, which uses the next election and the election after that to lay the foundations for a left that will not compromise, that will not bow its head, but that will govern will have the claims of a government program, which. Technocratically sound on the one hand and politically radical on the other, it will be able to create a new left proposal that will pay its debt to the International Left, to our comrades in Brazil, Mexico, Germany, Germany, Britain, Ireland, India, Africa. People of the left who were so hurt by our capitulation in 2015, because the only way to be a patriot is to be an internationalist and the only way to be an internationalist is to be a patriot. This election is a dress rehearsal. Do not make the mistake of believing that a government will be formed. Mitsotakis wants to burn them. He wants to roll another dice to get the 40 seat bonus of the rigged enhanced proportional representation. You know enhanced proportional representation is a little bit like enhanced interrogation the CIA when they brought back legally now after the Twin Towers, the torture on their agenda they didn't call it torture, they called it enhanced interrogation when Tsipras signed the fourth memorandum, the troika, they called it enhanced oversight.","Εμείς είμαστε εδώ επειδή καταφέραμε πριν από 4 χρόνια, με τη βοήθεια πολλών από εσάς. Πού σας ευχαριστώ από το βάθος της ψυχής μου που ήσασταν και τότε μαζί όσοι ήσασταν και τότε μαζί βάλαμε το όχι ξανά στη Βουλή γιατί εκείνο το ΟΧΙ δεν ήταν απλά ένα όχι ήταν η αντίσταση ενός μικρού λαού σε μια μεγάλη αδυσώπητη στρατιά ολιγαρχών και αρπακτικών. Ματώσαμε και ιδρώσαμε τη φανέλα 4 χρόνια στη Βουλή. Μια χούφτα βουλευτές και βουλευτίνες βουλευτές. Καταθέταμε. Άρτιες, τεχνοκρατικά και προοδευτικές πολιτικά προτάσεις νόμων, τροπολογίες τη μία μετά την άλλη κάναμε δουλειά που κανονικά αν δεις το όγκο, τον όγκο και την ποιότητα της δουλειάς, θα σκεφτείς ότι αυτοί ήταν 70 βουλευτές. Δεν μπορεί να τανε 5 6. Ήμασταν 5, 6. Και το πιο ευχάριστο. Μετά το πρώτο μας διαβουλευτικό συνέδριο. Κάναμε ένα παλλαϊκό κάλεσμα. Για ενότητα για ενότητα της αριστεράς ανοίξαμε τις πόρτες του κόμματος μας, τις αγκαλιές όλων μας. Τις ψυχές μας σε ανθρώπους ανέντακτους ανθρώπους, πληγωμένους, που όπως και εμείς είχαν πληγωθεί εκείνο το βράδυ του δημοψηφίσματος, κάποιοι είχαν ιδιωτεύσει, κάποιοι είχαν πάει στα κινήματα για το νερό, συνδικαλιστικά κινήματα, κινήματα, οικολογικά κινήματα γυναικών, κινήματα για τους πρόσφυγες. Και βέβαια τεράστια χαρά, και βλέπω πολλούς και πολλές από εσάς εδώ σήμερα που ήρθε μαζί μας η Λαϊκή Ενότητα που είναι μαζί μας τα παιδιά της Αρας. Που είμαστε η Μαγιά για τη νέα μεγάλη αριστερά για την αγωνιστική ανυπότακτη ανυπάκουη ανιδιοτελή αριστερά, η οποία χρησιμοποιεί τις επόμενες εκλογές και τις μεθεπόμενες εκλογές για να βάλουμε τα θεμέλια για μια αριστερά που δεν θα συμβιβαστεί, που δεν θα σκύψει το κεφάλι, αλλά που θα κυβερνήσει θα έχει αξιώσεις ενός κυβερνητικού προγράμματος, το οποίο. Άρτιο τεχνοκρατικά από τη μια μεριά και πολιτικά ριζοσπαστικό από την άλλη θα μπορέσει να δημιουργήσει μια νέα αριστερή πρόταση, η οποία θα ξεπληρώσει το χρέος της στη Διεθνή αριστερά, στους συντρόφους μας, στη Βραζιλία, στο Μεξικό, στη Γερμανία, στη Βρετανία, στην Ιρλανδία, στην Ινδία, στην Αφρική. Ανθρώπους της αριστεράς που τόσο πολύ πληγώθηκαν με τη δική μας συνθηκολόγηση το 2015, γιατί ο μόνος τρόπος να είσαι πατριώτης είναι να εισαι διεθνιστής και ο μόνος τρόπος να είσαι διεθνιστής είναι να είσαι πατριώτης. Αυτές οι εκλογές είναι πρόβα τζενεράλε. Μην κάνετε το λάθος να πιστεύετε ότι θα σχηματιστεί κυβέρνηση. Μητσοτάκης θέλει να τις κάψει. Θέλει να ρίξει άλλη μια ζαριά για να πάρει και το μπόνους των 40 εδρών της καλπονοθευτικού της ενισχυμένης αναλογικής. Ξέρετε το ενισχυμένη αναλογική είναι λίγο σαν το ενισχυμένη ανάκριση η CIA όταν ξαναέφερε νομίμως πλέον μετά τους Δίδυμους Πύργους, τα βασανιστήρια στην ατζέντα της δεν το ονόμασε βασανιστήρια, τα ονόμασε ενισχυμένη ανάκριση όταν ο Τσίπρας υπέγραψε το τέταρτο μνημόνιο, την τρόικα, την ονόμασε ενισχυμένη εποπτεία. ",political agenda,elections,election spending,0.0,0.2,0.6,"[['mps', 'group of people', '1.0'], ['women mps', 'group of people', '1.0'], [""people's unity"", 'organization', '1.0'], ['children of arras', 'group of people', '1.0'], ['maya', 'group of people', '1.0'], ['brazil', 'country', '1.0'], ['mexico', 'country', '1.0'], ['germany', 'country', '0.8'], ['britain', 'country', '0.8'], ['ireland', 'country', '0.8'], ['india', 'country', '0.8'], ['africa', 'location', '0.8'], ['2015', 'date', '1.0'], ['mitsotakis', 'person', '1.0'], ['tsipras', 'person', '1.0']]"
26,"Enhanced proportional representation means the end of democracy, it means the end of proportional representation, it means monstrosity. Mr Mitsotakis, you are demanding that you govern on your own authority against the 65% of the people who are against you, not to mention 75% if you include abstention.","Η ενισχυμένη αναλογική σημαίνει το τέλος της δημοκρατίας, σημαίνει το τέλος της αναλογικής, σημαίνει τερατογένεση. Κύριε Μητσοτάκη, απαιτείς να κυβερνείς αυτοδύναμα έχοντας κόντρα σου το 65% του λαού που σε έχει μαυρίσει για να μην πω το 75% αν βάλεις και την αποχή. ",criticism,elections,abstention,-0.9,0.0,0.2,"[['mr mitsotakis', 'person', '0.85'], ['65%', 'group of people', '0.9'], ['75%', 'group of people', '0.9']]"
27,"We are the only ones who honour the simple proportional representation. We are not a JPC, we do not say that we have a monopoly on truth, wisdom and purity because we respect people who are locked into other parties. Who are pure. Who want what we want and we ultimately want, who vote for Tsipras to prevent Mitsotakis from coming out, who may still be locked in because they remember Andreas Papandreou in PASOK who is in KKE because they respect his history, as we respect it by the way.","Εμείς είμαστε οι μόνοι που τιμούμε την απλή αναλογική. Εμείς δεν είμαστε ΚΚΕ, δεν λέμε ότι έχουμε το μονοπώλιο της αλήθειας, της σοφίας και της αγνότητας για αυτό, επειδή σεβόμαστε τους ανθρώπους που είναι εγκλωβισμένοι σε άλλα κόμματα. Που είναι αγνοί. Που θέλουν αυτό που θέλουμε και εμείς σε τελική ανάλυση που ψηφίζουν Τσίπρα για να μην βγει Μητσοτάκης που μπορεί να είναι ακόμα εγκλωβισμένοι γιατί θυμούνται τον Ανδρέα Παπανδρέου στο ΠΑΣΟΚ που είναι στο ΚΚΕ γιατί σέβονται την ιστορία του, όπως τη σεβόμαστε και εμείς παρεμπιπτόντως. ",political agenda,elections,other,0.5,0.2,0.2,"[['andreas papandreou', 'person', '0.7'], ['pasok', 'organization', '0.9'], ['kke', 'organization', '0.7'], ['tsipras', 'person', '0.7'], ['mitsotakis', 'person', '0.7'], ['greece', 'country', '1.0']]"
