id,text,text_el,is_criticism,topic-context,subtopic-context,sentiment,polarization-definition,populism-definition,ner-limited
24,"But I want to tell you something. This ballot box is not a simple proportional representation ballot box. What has happened is that this ballot is again a ballot of enhanced proportional representation, that is, as we had learned in all the previous years. What does that mean? 50 bonus seats to the first. So what does it mean? It means that at this moment, two opposing plans are in crisis with the Greek people. The plan of the New Democracy, which wants to continue this policy of plundering income, plundering society for the benefit of obscenity and profitability, privatization of health, energy, and even water in education, and on the other hand, the plan of Syriza.","Όμως θέλω να σας πω κάτι. Αυτή η κάλπη δεν είναι κάλπη, απλής αναλογικής. Ότι έγινε έγινε αυτή η κάλπη είναι ξανά κάλπη ενισχυμένης αναλογικής, δηλαδή όπως είχαμε μάθει όλα τα προηγούμενα χρόνια, τι σημαίνει αυτό; 50 έδρες μπόνους στον πρώτο. Τι σημαίνει λοιπόν αυτό; Σημαίνει ότι αυτή την ώρα, 2 σχέδια αντιπαραθετικά βρίσκονται σε κρίση απέναντι στον ελληνικό λαό. Το σχέδιο της Νέας Δημοκρατίας που θέλει να συνεχιστεί αυτή η πολιτική της λεηλασίας του εισοδήματος, της λεηλασίας της κοινωνίας προς όφελος της αισχροκέρδειας και της κερδοφορίας, της ιδιωτικοποίησης της υγείας, της ενέργειας, ακόμα και του νερού της παιδείας και από την άλλη το σχέδιο του ΣΥΡΙΖΑ.",criticism,privatization,election spending,-0.4,0.6,0,"[['new democracy', 'political party', '0.8'], ['greek people', 'group of people', '0.7'], ['syriza', 'political party', '0.8'], ['greek', 'location', '0.8']]"
25,"SYRIZA, the progressive alliance, is the only one that has an alternative plan of governance and program to that of New Democracy. The KKE is not interested in an alternative plan of governance. It says they are all the same - those who cut labor rights, reduce wages, dismantle the eight-hour working day, and impose unpaid overtime. The same as we who want a labor inspectorate, collective agreements, wage increases, and labor regularity. They don't care; they say so be it.","Ο ΣΥΡΙΖΑ προοδευτική συμμαχία είναι το μόνο, που έχει εναλλακτικό σχέδιο διακυβέρνησης και πρόγραμμα απέναντι σε αυτό της Νέας Δημοκρατίας. Το ΚΚΕ δεν ενδιαφέρεται για εναλλακτικό σχέδιο διακυβέρνησης, λέει το ίδιο είναι όλοι, το ίδιο είναι και αυτοί που κόβουν τα εργασιακά δικαιώματα που μειώνουν τους μισθούς που διαλύουν το οκτάωρο που επιβάλλουν απλήρωτες υπερωρίες. Το ίδιο και εμείς που θέλουμε σώμα επιθεώρησης εργασίας, συλλογικές συμβάσεις, αυξήσεις των μισθών, εργασιακή κανονικότητα. Δεν τους ενδιαφέρει, λένε ας είναι.",criticism,employment,workers' rights,0.4,0.1,0.1,"[['syriza', 'organization', '0.9'], ['new democracy', 'organization', '0.9'], ['kke', 'political party', '0.9.']]"
26,"On the other hand, what does PASOK-KINAL tell us? It tells us that we are not interested in progressive governance. During the election campaign, it told us that we could cooperate with New Democracy. We are interested in one thing: what should we become in place of SYRIZA? You don't easily become SYRIZA in place of SYRIZA because SYRIZA Progressive Alliance is a party that has been expressing social needs for a decade. It is not a complement to the right. SYRIZA will not become a complement to the right. It is and will remain a protest party, a power party, and it will claim until the last second to overturn the correlations. Are we not interested in becoming a complement to the right, as they once were to get Mr. Samaras as prime minister? We are not forgetting this. We are interested in being here.","Από την άλλη το ΠΑΣΟΚ ΚΙΝΑΛ τι μας λέει; Μας λέει ότι εμείς δεν ενδιαφερόμαστε για προοδευτική διακυβέρνηση, αν είναι να συνεργαστούμε, μας έλεγε προεκλογικά με τη νέα δημοκρατία μπορεί και να συνεργαστούμε, μας ενδιαφέρει ένα πράγμα, μας λέει στην αλήθεια, τί να γίνουμε ΣΥΡΙΖΑ στη θέση του ΣΥΡΙΖΑ; Δεν γίνεστε έτσι εύκολα ΣΥΡΙΖΑ στη θέση του ΣΥΡΙΖΑ, γιατί ο ΣΥΡΙΖΑ Προοδευτική Συμμαχία είναι ένα κόμμα που εδώ και μια δεκαετία εκφράζει τις κοινωνικές ανάγκες. Δεν είναι συμπλήρωμα της δεξιάς. Ούτε θα γίνει ο ΣΥΡΙΖΑ συμπλήρωμα της Δεξιάς, ούτε θα γίνει, διαμαρτυρίας είναι και θα παραμείνει, εξουσίας και θα διεκδικεί και θα διεκδικήσουμε μέχρι το τελευταίο δευτερόλεπτο την ανατροπή των συσχετισμών. Δεν μας ενδιαφέρει εμάς να γίνουμε συμπλήρωμα της δεξιάς, όπως γίνανε κάποτε αυτοί για να βγάλουν τον κύριο Σαμαρά πρωθυπουργό; Δεν τα ξεχνάμε αυτά εμάς μας ενδιαφέρει να είμαστε εδώ. ",criticism,elections,coalition,0,0.6,0,"[['pasok-kinal', 'political party', '1.0'], ['new democracy', 'political party', '1.0'], ['syriza', 'political party', '1.0'], ['progressive alliance', 'group of people', '1.0'], ['mr. samaras', 'person', '1.0']]"
27,"The pillar of the progressive party of the country. The main opponent of the right and its politicians. That is why in this battle we will fight to the last second to win, to achieve a victorious result. That is our goal. However, I must note that this is an enhanced proportional representation election, which means that the first party will receive 50 bonus seats. If New Democracy comes in first, they will be able to implement their program independently unless the May correlation is overturned by a coalition of parties. This would have a very negative impact on society and democracy.","Ο πυλώνας της προοδευτικής παράταξης του τόπου. Ο βασικός αντίπαλος της δεξιάς και των πολιτικών της. Γι αυτό σε αυτή τη μάχη θα αγωνιστούμε μέχρι το τελευταίο δευτερόλεπτο για να νικήσουμε, για να έχουμε ένα νικηφόρο αποτέλεσμα. Αυτός είναι ο στόχος μας. Έλεγα όμως, ότι είναι μια εκλογική αναμέτρηση ενισχυμένης αναλογικής, που σημαίνει ότι ο πρώτος θα πάρει 50 έδρες μπόνους, που σημαίνει ότι αν η νέα δημοκρατία έρθει η πρώτη. Θα εφαρμόσει το πρόγραμμά της με αυτοδυναμία αν δεν ανατραπεί δε και ο συσχετισμός του Μάη με παντοδύναμη. Αυτό θα είναι πολύ αρνητικό για την κοινωνία. Θα είναι πολύ αρνητικό και για τη δημοκρατία.",criticism,democracy,coalition,-0.4,0,0,"[['progressive party', 'political party', '0.7'], ['right', 'group of people', '0.5'], ['new democracy', 'political party', '0.5'], ['may', 'date', '0.3']]"
28,"Today, I want to address all progressive citizens who do not want a system of political instability and a non-functioning democracy. Those who have decided not to vote for Kyriakos Mitsotakis' New Democracy. Objectively speaking, with the system of enhanced proportional representation, every vote that does not go to New Democracy but is not directed to SYRIZA's ballot box is a vote that reinforces New Democracy's plan to be self-reliant, all-powerful, and to proceed with its plan of social plunder.","Θέλω λοιπόν σήμερα να απευθυνθώ σε όλους τους προοδευτικούς πολίτες. Σε όλους τους πολίτες που δεν θέλουνε ένα σύστημα πολιτικό αστάθειας και δημοκρατίας που δεν μπορεί να λειτουργήσει. Και έχουν αποφασίσει να μην ψηφίσουν τη νέα Δημοκρατία του Κυριάκου Μητσοτάκη. Αντικειμενικά λοιπόν τους λέω αντικειμενικά με το σύστημα της ενισχυμένης αναλογικής, πια κάθε ψήφος που δεν θα πάει στη νέα δημοκρατία, αλλά δεν θα κατευθυνθεί στην κάλπη του ΣΥΡΙΖΑ. Αντικειμενικά είναι ψήφος που ενισχύει το σχεδιασμό της νέας δημοκρατίας για να είναι αυτοδύναμη, να είναι παντοδύναμη και να προχωρήσει το σχέδιο της κοινωνικής λεηλασίας.",criticism,elections,abstention,-0.7,0.6,0.2,"[['kyriakos mitsotakis', 'person', '0.8'], ['new democracy', 'political party', '0.8'], ['syriza', 'political party', '0.8'], ['greece', 'country', '1.0']]"
29,"We call on progressive citizens, despite any disagreements or reservations they may have with us during these 15 days, to seriously consider supporting the only reliable force with their vote on June 25th. The stronger this force is, the greater the hopes for citizens, society, and the people - whether it be hopes of reversing the current correlation and winning, or simply the hope that there will be someone the next day who can hold Mr. Mitsotakis and the New Democracy accountable and prevent the implementation of an unpopular and anti-social program.","Καλούμε λοιπόν τους προοδευτικούς πολίτες, παρά τις διαφωνίες που μπορεί να έχουμε μαζί μας, παρά τις επιφυλάξεις που μπορεί να έχουν μαζί μας αυτές τις 15 μέρες να το σκεφτούν σοβαρά και στις 25 του Ιούνη να στηρίξουν με την ψήφο τους τη μόνη αξιόπιστη δύναμη που όσο πιο ισχυρή είναι τόσο μεγαλύτερες ελπίδες υπάρχουν για τον πολίτη, για την κοινωνία, για το λαό, είτε ελπίδες ανατροπής αυτού του συσχετισμού και νίκης, είτε σε κάθε περίπτωση. Ελπίδα να υπάρχει την επόμενη μέρα κάποιος που θα μπορεί να κοιτάει στα μάτια τον κύριο Μητσοτάκη και τη νέα δημοκρατία για να μην εφαρμόσουμε ένα πρόγραμμα αντιλαϊκό και αντικοινωνικό. ",criticism,elections,election spending,0.5,0.2,0.2,"[['mr. mitsotakis', 'person', '1.0'], ['new democracy', 'political party', '1.0']]"
30,"So today, since you are giving us courage with your presence, I want to give you confidence, strength, and faith in a victorious result in the elections on the twentieth Thursday of June. We will not stop fighting for a minute. We will not stop for a minute to highlight our proposal, our right, the rightness of our proposals and our positions. We will not stop for a minute, and my promise is one. We will not stop, and we will be together in the next day to fight our battles, our battle for society, our battle for the people, our battle for the peasantry, for the working class. We will be the support, the pillar of the people and the working class of the young people. At one time, a great philosopher, Althusser said, ""the future lasts a long time."" Be armed for that future. The future is not judged. In a moment, we will be strong, even stronger, because what doesn't kill you makes you stronger, and we will win because we are right. We will win. I invite you in these 15 days to fight this fight, not to lose a second. The reversal of the correlations is possible if we believe in it first. Let us fight the fight and convince the people around us to go to the ballot box with determination and optimism. The story will not end so easily. Lost races are races that are not fought, and we are determined to fight and win this race. Be well. Thank you very much for your presence, for your strength. Be well, good strength, good strength, good health! Thank you!","Θέλω λοιπόν σήμερα μιας και εσείς δίνετε κουράγιο σε εμάς με την παρουσία σας να δώσω και εγώ σε εσάς αυτοπεποίθηση, δύναμη, πίστη σε ένα νικηφόρο αποτέλεσμα στις εκλογές της εικοστής, Πέμπτης του Ιούνη. Δεν θα σταματήσουμε λεπτό να αγωνιζόμαστε, δεν θα σταματήσουμε λεπτό να αναδεικνύουμε την πρότασή μας, το δίκιο μας, το δίκιο των προτάσεων και των θέσεων μας. Δεν θα σταματήσουμε λεπτό και η υπόσχεση μου είναι μία. Δεν θα σταματήσουμε και θα είμαστε μαζί και την επόμενη μέρα να δίνουμε τις μάχες μας, τη μάχη μας για την κοινωνία, τη μάχη μας για το λαό, τη μάχη μας, για την αγροτιά, για την εργατική τάξη. Θα είμαστε το στήριγμα. Ο πυλώνας του λαού και της εργατικής τάξης των νέων ανθρώπων. Κάποια στιγμή, ένας σπουδαίος φιλόσοφος, ο Αλτουσέρ είχε πει, το μέλλον διαρκεί πολύ. Να είστε οπλισμένοι για αυτό το μέλλον. Δεν κρίνεται το μέλλον. Σε μια στιγμή θα είμαστε δυνατοί, ακόμα πιο δυνατή, διότι ότι δεν σε σκοτώνει, σε κάνει πιο δυνατό και θα νικήσουμε γιατί έχουμε δίκιο. Θα νικήσουμε. Σας καλώ αυτές τις 15 μέρες να δώσουμε αυτό τον αγώνα, να μη χάσουμε δευτερόλεπτο. Η ανατροπή των συσχετισμών είναι κάτι εφικτό αν το πιστέψουμε πρώτα εμείς. Να δώσουμε τον αγώνα και να πείσουμε τους ανθρώπους γύρω μας να πάνε στην κάλπη με αποφασιστικότητα και με αισιοδοξία. Δεν θα τελειώσει έτσι εύκολα η ιστορία. Χαμένοι αγώνες είναι οι αγώνες που δεν δίνονται και εμείς είμαστε αποφασισμένοι να το δώσουμε και να τον νικήσουμε αυτό τον αγώνα. Να είστε καλά. Σας ευχαριστώ θερμά για την παρουσία σας, για τη δύναμη που μας δίνετε να είστε καλά, καλή δύναμη, καλή δύναμη! υγεία! Σας ευχαριστώ!",political agenda,elections,election spending,0.8,0,0,"[['althusser', 'person', '0.5'], ['elections', 'date', '1.0'], ['twentieth thursday of june', 'date', '1.0'], ['society', 'group of people', '1.0'], ['peasantry', 'group of people', '1.0'], ['working class', 'group of people', '1.0'], ['young people', 'group of people', '1.0']]"