id,text,text_el,is_criticism,topic-context,subtopic-context,sentiment,polarization-definition,populism-definition,ner-limited
7,"Friends, we have a duty to talk about the big issue concerning the National Health System. We have seen what has happened in recent weeks with the ambulance service in Kos and New Makri. Why have we not supported the National Health System? Once upon a time, with the memoranda, too many resources were cut, and often unfairly. But today, with the Recovery Fund, with 20 billion in subsidies and 10 billion in loans, the country could have afforded to hire 700 rescuers so that in 67 places throughout the country, as I was informed by the management of the EKAB, there is only one ambulance for twenty-four hours, 3 eight-hour shifts, when hundreds of thousands of tourists are waiting in Kos and in places in mainland Greece with similar problems. It could have afforded to hire 1000 university police officers, who are nowhere to be found today, when they could have put private companies in charge of guarding the universities through a tender and recruited in the areas where the welfare state is hurting, in health and education. This is our difference in values from New Democracy. We, with George Gennimata and Paraskevas Avgerinos, founded the National Health System, and they are undermining it to the greatest extent possible. And they tell you that this issue of the National Health System is timeless. That's not what the evidence says. The figures say that in recent years we've been third in private health care spending across Europe. The figures have been disputed until recently by New Democracy officials on television. The day before yesterday, new figures came out. The country's position has worsened, second only to the Bulgarians in private spending, and the Greeks in the 27 countries of the European Union pay such a high proportion of private health spending because the NHS has collapsed. So, is this social justice?","Φίλες και φίλοι, έχουμε χρέος να μιλήσουμε για το μεγάλο ζήτημα που αφορά το Εθνικό Σύστημα Υγείας. Είδαμε τι έγινε τις τελευταίες εβδομάδες με το ΕΚΑΒ στην Κω στη νέα Μάκρη. Γιατί δεν έχουμε στηρίξει το Εθνικό Σύστημα Υγείας; Κάποτε με τα μνημόνια κόπηκαν πάρα πολλοί πόροι και πολλές φορές άδικα. Σήμερα όμως με το Ταμείο Ανάκαμψης; Με τα 20 δισεκατομμύρια επιδοτήσεων και τα 10 δισεκατομμύρια δανείων, η χώρα δεν είχε την πολυτέλεια να προσλάβει 700 διασώστες, με αποτέλεσμα σε 67 σημεία σε όλη τη χώρα, όπως με πληροφόρησε η διοίκηση του ΕΚΑΒ να υπάρχει μόνο ένα ασθενοφόρο για εικοσιτέσσερις ώρες, 3 οκτάωρες βάρδιες, όταν στην Κω περιμένουν εκατοντάδες χιλιάδες τουρίστες και σε μέρη της ηπειρωτικής Ελλάδας ανάλογα προβλήματα. Είχε την πολυτέλεια να προσλάβει 1000 άτομα πανεπιστημιακής αστυνομίας που δεν υπάρχουν πουθενά σήμερα, ενώ θα μπορούσαν με έναν διαγωνισμό να έχουν βάλει ιδιωτικές εταιρείες να φυλάσσουν τα πανεπιστήμια και οι προσλήψεις να γίνουν στους τομείς που πονάει το κοινωνικό κράτος, στην υγεία και την παιδεία. Αυτή είναι η αξιακή μας διαφορά από τη Νέα Δημοκρατία, ότι εμείς με τον Γιώργο Γεννηματά και τον Παρασκευά Αυγερινό ιδρύσαμε το Εθνικό Σύστημα Υγείας και αυτοί το υπονομεύουν σε μέγιστο βαθμό. Και σου λένε ότι ξέρετε, αυτό το ζήτημα του Εθνικού Συστήματος Υγείας είναι διαχρονικό. Άλλα λένε τα στοιχεία. Τα στοιχεία λένε ότι τα τελευταία χρόνια ήμασταν τρίτοι σε ιδιωτικές δαπάνες υγείας σε όλη την Ευρώπη. Αμφισβητούσαν τα στοιχεία μέχρι πρόσφατα στελέχη της Νέας Δημοκρατίας στα τηλεπαράθυρα. Προχθές βγήκαν τα νέα στοιχεία. Χειροτέρευσε η θέση της χώρας, δεύτεροι σε ιδιωτικές δαπάνες μόνο οι Βούλγαροι και οι Έλληνες στις 27 χώρες της Ευρωπαϊκής Ένωσης πληρώνουν τέτοιο ποσοστό ιδιωτικών δαπανών υγείας γιατί έχει καταρρεύσει το ΕΣΥ. Αυτή είναι, λοιπόν, η κοινωνική δικαιοσύνη; ",criticism,health,other,-0.6,0.2,0.2,"[['national health system', 'organization', '1.0'], ['kos', 'location', '1.0'], ['new makri', 'location', '1.0'], ['recovery fund', 'organization', '1.0'], ['ekab', 'organization', '1.0'], ['new democracy', 'political party', '1.0'], ['george gennimata', 'person', '1.0'], ['paraskevas avgerinos', 'person', '1.0'], ['europe', 'location', '1.0'], ['bulgarians', 'group of people', '1.0'], ['european union', 'organization', '1.0']]"
8,"What do we say? Not 2-4% of the Recovery Fund but 8-10%. Besides, the Portuguese, Spanish, and Italians with similar problems are giving more than that to have an extensive primary health care network. This was lacking in the pandemic era, so the wave-breaker is the public hospital and not the primary care, as in the rest of Europe. Salaries at the European Union average for health workers. We cannot continue with what is happening today, with doctors studying in Greece and leaving for Germany and France where there is a shortage of doctors. There must be salary incentives. And, of course, the mockery of heavy and unhealthy work must end. Our health workers should finally be included in the heavy and unhealthy category, as they deserve and as they should be, and as some people have committed themselves to, but have been fooled as thousands of Greeks have been fooled. And I am talking about the government of the New Democracy.","Εμείς τι λέμε; Όχι 2-4% του Ταμείου Ανάκαμψης αλλά 8-10%. Άλλωστε πάνω από αυτό δίνουν και οι Πορτογάλοι και οι Ισπανοί και οι Ιταλοί με ανάλογα προβλήματα για να έχουμε εκτεταμένο δίκτυο πρωτοβάθμιας υγείας. Αυτό έλειψε την εποχή της πανδημίας, με αποτέλεσμα κυματοθραύστης είναι το δημόσιο νοσοκομείο και όχι η πρωτοβάθμια, όπως στην υπόλοιπη Ευρώπη. Μισθοί στο μέσο όρο της Ευρωπαϊκής Ένωσης για τους υγειονομικούς. Δεν μπορεί να συνεχίζεται αυτό που συμβαίνει σήμερα, να σπουδάζουν γιατροί στην Ελλάδα και να φεύγουν στη Γερμανία και στη Γαλλία που έχουν έλλειψη γιατρών. Πρέπει να υπάρχουν κίνητρα μισθολογικά. Και βέβαια να τελειώσει η κοροϊδία με τα βαρέα και ανθυγιεινά. Να ενταχθούν επιτέλους στα βαρέα και ανθυγιεινά οι υγειονομικοί μας, όπως το αξίζουν και όπως πρέπει και όπως κάποιοι δεσμεύτηκαν, αλλά τους κορόιδεψαν όπως κορόιδεψαν χιλιάδες Έλληνες. Και μιλώ για την κυβέρνηση της Νέας Δημοκρατίας. ",political agenda,health,other,-0.4,0.0,0.0,"[['portuguese', 'group of people', '0.7'], ['spanish', 'group of people', '0.7'], ['italians', 'group of people', '0.7'], ['europe', 'location', '0.9'], ['european union', 'organization', '0.9'], ['greece', 'country', '0.9'], ['germany', 'country', '0.7'], ['france', 'country', '0.7'], ['new democracy', 'political party', '0.7']]"
9,"What else should we do? Welfare state, education. They are undermining the foundation. Is that the only problem? The major issue with our education system is that the school is no longer the center of gravity, but rather the tutorial. What are we doing to reverse this problem and make it less expensive for parents to send their children to university? We are introducing the national baccalaureate so that a child is not evaluated in 15 days, but in the last 2 years of high school, allowing for dignity and lower costs to attend the school of their choice, not just the one their family can afford. Our priority is public education as a driving force for social upward mobility of the Greek people, as it was in the 80s and 90s. This is the education we envision and when people ask about Article 16, obviously if there are some businessmen who want to invest in a private university, we will not stand in the way, but that is not our priority. Our priority is that the child of the weaker family and the middle class should be able, through public education at all levels, to succeed in life and make their dreams come true. This is our vision of a strong welfare state and not to hand over the welfare state to private individuals and speculators. However, public schooling has another aspect. In many parts of Greece, I meet parents, and I say this because it is the most tragic thing about this election campaign and my own personal experience, who have children on the autism spectrum. People in their 40s and 45s who tell me that their fear is what their children will do when they are gone. Imagine and put yourself in the shoes of a new 40 and 45 year old parent thinking about the end of life for their child. This is not a normal European state and we, PASOK, have prioritized special education structures to finally create the school of inclusion and not just give some allowances that do not go anywhere for these families. And, of course, remedial teaching to reduce learning inequalities in schools.","Τι άλλο πρέπει να κάνουμε; Κοινωνικό κράτος, παιδεία. Σκιαμαχούν για τη βάση του 10. Αυτό είναι μόνο το πρόβλημα; Το πρόβλημα το μεγάλο στην παιδεία μας είναι ότι πια δεν είναι κέντρο βάρους το σχολείο, αλλά το φροντιστήριο. Τι κάνουμε για να ανατρέψουμε αυτό το πρόβλημα και να πληρώνουν λιγότερα οι γονείς για να μπουν τα παιδιά τους στο πανεπιστήμιο; Φέρνουμε το εθνικό απολυτήριο ώστε ένα παιδί να μην κρίνεται σε 15 μέρες, αλλά στα 2 τελευταία χρόνια του λυκείου, ώστε να υπάρχει αξιοπρέπεια και χαμηλό κόστος για να μπεις στη σχολή που εσύ προτιμάς και όχι τη σχολή που επιβάλλει το πορτοφόλι της οικογένειας σου. Για μας είναι προτεραιότητα η δημόσια παιδεία ως κινητήριος μοχλός κοινωνικής ανοδικότητας του ελληνικού λαού, όπως έγινε τη δεκαετία του 80 και του 90. Αυτή την παιδεία εμείς οραματιζόμαστε και όταν κάποιοι ρωτούν για το άρθρο 16, προφανέστατα αν υπάρχουν κάποιοι επιχειρηματίες που θέλουν να επενδύσουν σε ένα ιδιωτικό πανεπιστήμιο, εμείς δεν θα μπούμε εμπόδιο, αλλά δεν είναι αυτό η προτεραιότητά μας. Προτεραιότητά μας είναι το παιδί της αδύναμης οικογένειας και της μεσαίας τάξης να μπορεί μέσω της δημόσιας παιδείας όλων των βαθμίδων να πετύχει στη ζωή του και να κάνει τα όνειρά του πραγματικότητα. Αυτό είναι το όραμά μας για ένα ισχυρό κοινωνικό κράτος και όχι να παραδώσουμε το κοινωνικό κράτος σε ιδιώτες και κερδοσκόπους. Φίλες και φίλοι, το δημόσιο σχολείο όμως έχει και άλλο χαρακτήρα. Σε πολλά μέρη της Ελλάδας συναντώ γονείς, και το λέω αυτό διότι είναι το πιο τραγικό αυτής της προεκλογικής εκστρατείας και της δικής μου προσωπικής εμπειρίας. Γονείς που έχουν παιδιά στο φάσμα του αυτισμού. Άνθρωποι 40-45 ετών που μου λένε ότι ο φόβος τους είναι τι θα κάνουν τα παιδιά τους όταν αυτοί φύγουν από τη ζωή. Φανταστείτε και ελάτε στη θέση ενός νέου γονέα 40 και 45 ετών, να σκέφτεται το τέλος της ζωής του για το παιδί του. Αυτό δεν είναι κανονικό ευρωπαϊκό κράτος και εμείς, το ΠΑΣΟΚ έχει προτεραιότητα τις δομές ειδικής αγωγής για να δημιουργήσουμε επιτέλους το σχολείο της συμπερίληψης και όχι μόνο και όχι μόνο να δίνουν κάποια επιδόματα που δεν φτάνουν πουθενά για αυτές τις οικογένειες. Και βέβαια, η ενισχυτική διδασκαλία για να μειωθούν οι μαθησιακές ανισότητες στα σχολεία. ",political agenda,education,higher education,0.0,0.0,0.0,"[['welfare state', 'organization', '0.65'], ['education', 'organization', '0.6'], ['school', 'organization', '0.7'], ['tutorial', 'organization', '0.6'], ['university', 'organization', '0.6'], ['national baccalaureate', 'organization', '0.7'], ['high school', 'organization', '0.6'], ['greek people', 'group of people', '0.7'], ['article 16', 'organization', '0.6'], ['private university', 'organization', '0.6'], ['middle class', 'group of people', '0.7'], ['public schooling', 'organization', '0.6'], ['greece', 'location', '0.75'], ['pasok', 'political party', '0.8']]"
10,"Friends, PASOK is well aware of the mistakes it has made in the past. It is not an unrepentant party. That is why I committed myself from the very first moment of my election to bring a new political ethos to the country and to build a new relationship of trust, especially with the younger generations who abhor parties as vulgar clientelistic mechanisms. This is why I said, and I believe that we should all do this in our country, that universal meritocracy in the selection of hospital and organization governors was tragically demonstrated in the unbelievable event, in the unbelievable tragedy of Tempe, where party members of New Democracy with no knowledge of trains, no knowledge of the OSE, held critical positions, but this happens throughout the public sector. So what are we saying? Every government, as soon as it is formed, for 2 months to hold an open international competition, to submit the CVs of Greeks from inside and outside the country, to be selected by an independent organization, by an independent group of scientists, and with a five-year term of office to serve you and not the respective Mansion of Maximou, as a hard clientele mechanism, a personal mechanism of a state prey of the respective Prime Minister. And of course, transparency everywhere.","Φίλες και φίλοι, το ΠΑΣΟΚ γνωρίζει πάρα πολύ καλά τα λάθη που έκανε στο παρελθόν. Δεν είναι ένα κόμμα αμετανόητο. Για αυτό δεσμεύτηκα από την πρώτη στιγμή της εκλογής μου να φέρουμε ένα νέο πολιτικό ήθος στον τόπο και για να οικοδομήσουμε μια νέα σχέση εμπιστοσύνης, ιδιαίτερα με τις νεότερες γενιές που αποστρέφονται τα κόμματα ως χυδαίους πελατειακούς μηχανισμούς. Για αυτό είπα και το θεωρώ ότι πρέπει να το κάνουμε όλοι στη χώρα μας, την καθολική αξιοκρατία στην επιλογή διοικητών νοσοκομείων και οργανισμών απεδείχθη και με τραγικό τρόπο στο απίστευτο γεγονός, στην απίστευτη τραγωδία των Τεμπών όπου κομματικά στελέχη της Νέας Δημοκρατίας χωρίς γνώση των τρένων, χωρίς γνώση του ΟΣΕ είχαν κρίσιμες θέσεις, αλλά αυτό συμβαίνει σε όλο το δημόσιο τομέα. Γι αυτό εμείς τι λέμε; Κάθε κυβέρνηση, μόλις σχηματίζεται, για 2 μήνες να κάνει ανοιχτό διεθνή διαγωνισμό, να κατατίθενται βιογραφικά Ελλήνων εντός και εκτός της χώρας, να γίνεται αξιοκρατικά επιλογή από έναν ανεξάρτητο οργανισμό, από μια ανεξάρτητη ομάδα επιστημόνων και με πενταετή θητεία να υπηρετούν εσάς και όχι το εκάστοτε Μέγαρο Μαξίμου, ως ένας σκληρός πελατειακός μηχανισμός, προσωπικός μηχανισμός ενός κράτους λάφυρο του εκάστοτε πρωθυπουργού. Και βέβαια, διαφάνεια παντού. ",political agenda,transparency,other,0.0,0.0,0.0,"[['friends', 'group of people', '1.0'], ['pasok', 'political party', '1.0'], ['new democracy', 'political party', '0.9'], ['tempe', 'location', '1.0'], ['greece', 'country', '1.0'], ['mansion of maximou', 'organization', '0.9'], ['prime minister', 'person', '1.0']]"
11,What is Mr. Mitsotakis' transparency? The 3700 temporary employees or the 10 billion in direct assignments?,Ποια είναι η διαφάνεια του κυρίου Μητσοτάκη; Οι 3700 μετακλητοί υπάλληλοι; Ή τα 10 δισεκατομμύρια απευθείας αναθέσεων;,criticism,transparency,corruption,-0.5,0.5,0.0,"[['mr. mitsotakis', 'person', '0.95'], ['temporary employees', 'group of people', '0.8'], ['direct assignments', 'organization', '0.6.']]"
12,"Transparency everywhere, competitions so that every Greek knows where every last euro of their tax goes. This means for us a new era of reconstruction of the Greek state, without continuing the pathologies that led us to the memoranda. Because if we do not put an end to it now, you can be sure that we will be led back into a fiscal adventure.","Διαύγεια παντού, διαγωνισμοί για να γνωρίζει ο κάθε Έλληνας πού πηγαίνει και το τελευταίο ευρώ του φόρου του. Αυτό σημαίνει για μας μια νέα εποχή αναδόμησης του ελληνικού κράτους, χωρίς να συνεχίζονται οι παθογένειες που μας οδήγησαν στα μνημόνια. Γιατί αν δεν βάλουμε τώρα τέλος να είστε σίγουροι ότι θα μας ξαναοδηγήσουν σε δημοσιονομική περιπέτεια. ",political agenda,transparency,austerity,,0.1,0.1,"[['greek', 'country', '1.0'], ['greek state', 'organization', '0.8'], ['memoranda', 'organization', '0.5']]"
13,"And I say this because the economic data is revealing. Of course, the economists, the experts, those who know things well, are hiding. We don't see them on TV anymore. Where are they to talk about the national debt? Where are they to talk about the external deficit? Where are they to talk about the trade deficit? About the structure of the tax system? Mitsotakis has loaded 50 billion in new debt on your backs, your children's, and future generations in 4 years. The external deficit is the largest since 2010. And when they say that this is happening all over Europe, they are lying. It is not happening all over Europe. Portugal, with similar issues as Greece, had a 1% deficit last year and a 1% surplus this year. Greece had a 12% deficit last year and a 9% deficit this year. Why is this debate not taking place? And some people ask us where we are going to get the money to support education. Where will we find the money to support health? And we say to them, let Mr Mitsotakis first tell us what he has done with the 50 billion in debt that he has put on the backs of the Greek people. Because I have never seen anywhere in the world where the opposition wants the opposition to apologize instead of the New Democracy government.","Και το λέω αυτό διότι τα στοιχεία της οικονομίας είναι αποκαλυπτικά. Κρύφτηκαν βέβαια οι οικονομολόγοι, οι expert, αυτοί που γνωρίζουν καλά τα πράγματα, δεν τους βλέπουμε πια στα κανάλια. Πού είναι να πουν για το δημόσιο χρέος; Πού είναι να πούνε για το εξωτερικό έλλειμμα; Πού είναι να μιλήσουν για το εμπορικό έλλειμμα; Για τη δομή του φορολογικού συστήματος; 50 δισεκατομμύρια νέο χρέος φόρτωσε σε 4 χρόνια ο Μητσοτάκης στις πλάτες τις δικές σας, των παιδιών σας και των επόμενων γενεών. Το εξωτερικό έλλειμμα είναι το μεγαλύτερο από το 2010. Και όταν λένε ότι αυτό συμβαίνει σε όλη την Ευρώπη, ψεύδονται. Δεν συμβαίνει σε όλη την Ευρώπη. Η Πορτογαλία με ανάλογα ζητήματα όπως η Ελλάδα είχε 1% έλλειμμα πέρσι και 1% πλεόνασμα φέτος. Η Ελλάδα είχε 12% έλλειμμα πέρσι και 9% έλλειμμα φέτος. Γιατί δεν γίνεται αυτή η συζήτηση; Και μας ρωτάνε κάποιοι πού θα βρείτε τα λεφτά για να στηρίξετε την παιδεία; Πού θα βρείτε τα λεφτά για να στηρίξετε την υγεία; Και τους απαντάμε, να μας πει πρώτα ο κύριος Μητσοτάκης τι έκανε 50 δισεκατομμύρια χρέος που φόρτωσε στις πλάτες του ελληνικού λαού. Γιατί δεν έχω ξαναδεί πουθενά στον κόσμο να θέλουν να απολογηθεί η αντιπολίτευση αντί να απολογείται η κυβέρνηση της Νέας Δημοκρατίας. ",criticism,economy,other,-0.8,0.1,0.4,"[['mitsotakis', 'person', '1.0'], ['greece', 'country', '1.0'], ['europe', 'location', '1.0'], ['portugal', 'country', '1.0'], ['new democracy', 'political party', '1.0']]"
