id,text,text_el,is_criticism,topic-context,subtopic-context,sentiment,polarization-definition,populism-definition,ner-limited
14,"Friends, we have a duty to speak up about everything - taxation, the economy, and competitiveness. We're being lied to when we're told that proposing a tax on the wealthy is a ""tax storm."" What we're proposing only affects 0.02% of the Greek population. How many of you can pass on up to 4.8 million euros tax-free to your children? Who does this policy really benefit? In a bankrupt Greece with hundreds of thousands of Greek children leaving the country, is it right that oligarchs can transfer up to 4.8 million euros tax-free? This only benefits 1000 families. We propose a cap of €800,000 per child or for both parents. This applies to everyone, including the middle class and those with higher incomes, except for the oligarchs. Is this really a ""tax storm""? When we're asked what we'll do with this money, our first priority is demographics - our villages and towns. Our population is aging, and we need to do something about it. We should follow the example of other European countries. In Greece, families without children and families with two children only have a 3-point difference in tax rates. The European average is 10 points. Why is this? Because Europe as a whole is facing a demographic crisis and can no longer afford to give tax breaks for not just 3 or 4 children, but even 2 children. Why can't we do the same? We're committed to tax fairness and supporting families, which means at least an 8-10 point reduction in taxes for families with 2 children. This is how we support families in our country, just like other states such as Portugal (10-11 points), the Czech Republic (14 points), and Ireland (15 points) support their demographics.","Φίλες και φίλοι, έχουμε χρέος να τα πούμε όλα. Και για το φορολογικό και για την οικονομία και για την ανταγωνιστικότητα. Μας ψέγουν γιατί προτείνουμε, λέει, φοροκαταιγίδα. Ό,τι προτείνουμε αφορά το 0,02 του ελληνικού λαού. Δεν ξέρω πόσοι ανάμεσά σας μπορούν να μεταβιβάσουν έως 4,8 εκατομμύρια ευρώ στα παιδιά τους αφορολόγητα. Ποιους αφορά αυτή η πολιτική; Είναι δυνατόν σε μια χρεοκοπημένη Ελλάδα με εκατοντάδες χιλιάδες Ελληνόπουλα φεύγουν στο εξωτερικό να υπάρχουν πολιτικές επιλογές που επιτρέπουν σε ολιγάρχες να μεταβιβάζουν έως 4,8 εκατομμύρια ευρώ αφορολόγητα; Αυτό υπηρετεί 1000 οικογένειες. Εμείς τι λέμε; Πλαφόν και για τους 2 γονείς ή 800.000€ για κάθε παιδί. Που να αφορά και τους μικρομεσαίους και τους αδύναμους και τη μεσαία τάξη και ανθρώπους με μεγαλύτερα εισοδήματα, αλλά όχι τους ολιγάρχες. Είναι αυτό φοροκαταιγίδα; Κι όταν μας λένε τι θα κάνετε αυτά τα χρήματα, για μας πρώτη προτεραιότητα είναι το δημογραφικό, τα χωριά μας, οι πόλεις μας. Γερνάει ο πληθυσμός. Τι κάνουμε; Μα να κάνουμε ό,τι κάνουν τα υπόλοιπα ευρωπαϊκά κράτη. Μια οικογένεια χωρίς παιδιά στην Ελλάδα και μια οικογένεια με 2 παιδιά στην Ελλάδα έχουν 3 μόνο μονάδες λιγότερο φορολογικό συντελεστή. Ο μέσος ευρωπαϊκός όρος είναι 10 μονάδες φορολογικού συντελεστή. Γιατί; Διότι όλη η Ευρώπη έχει δημογραφικό και δεν στηρίζουν πια μόνο τα 3 και τα 4 παιδιά, αλλά και τα 2 παιδιά με αφορολόγητα. Εμείς γιατί όχι; Εμείς δεσμευόμαστε ότι η φορολογική δικαιοσύνη και στήριξη της οικογένειας σημαίνει το λιγότερο 8-10 μονάδες λιγότερος φόρος για τις οικογένειες με 2 παιδιά. Αυτό είναι στήριξη της οικογένειας στη χώρα μας. Και βέβαια, το λέω αυτό γιατί αυτό συμβαίνει και στα υπόλοιπα κράτη. 10 μονάδες νομίζω ή 11 η Πορτογαλία, 14 η Τσεχία, 15 η Ιρλανδία για να στηρίξουν το δημογραφικό τους. ",political agenda,economy,other,0.5,0.1,0.1,"[['greece', 'location', '1.0'], ['friends', 'group of people', '1.0'], ['oligarchs', 'group of people', '0.6'], ['european countries', 'group of people', '1.0'], ['portugal', 'country', '1.0'], ['czech republic', 'country', '1.0'], ['ireland', 'country', '1.0']]"
15,"Black labor. What are we saying? SYRIZA tore the Greek people apart with social security contributions, but why look back?","Μαύρη εργασία. Τι λέμε; Όντως ο ΣΥΡΙΖΑ ξέσκισε τον ελληνικό λαό σε ασφαλιστικές εισφορές, αλλά γιατί να πάμε πίσω; ",criticism,employment,other,,0.5,0.0,"[['syriza', 'organization', '1.0'], ['greek', 'country', '1.0']]"
16,"Go ahead. Reduce social security contributions. Only then will young people learn that they can work without moonlighting. This is how our funds will be able to stand and how we will also get decent wages with lower social security contributions. These policies are not policies for the few. They are not a tax storm, they are social justice. It is just that those who are hitting PASOK and these proposals are the ones who will pay, the thousands of families that Mr Mitsotakis faithfully serves. We serve the country, we serve the Greek people, and we have other priorities. And of course, VAT on basic goods. We heard that too, populism. But is it populism to reduce VAT on a few basic goods so that the most vulnerable Greeks can buy their milk, their bread, and is it not populism that New Democracy in its 2019 program talks about reduced VAT in both categories?","Να πάμε μπροστά. Να μειώσουμε εκ νέου τις ασφαλιστικές εισφορές. Μόνο έτσι ο νέος θα μάθει ότι μπορεί να εργάζεται χωρίς μαύρη εργασία. Έτσι θα αντέξουν τα ταμεία μας και έτσι θα παίρνουμε και μισθούς αξιοπρέπειας με μικρότερες ασφαλιστικές εισφορές. Αυτές οι πολιτικές δεν είναι πολιτικές για τους λίγους. Δεν είναι φοροκαταιγίδα, είναι κοινωνική δικαιοσύνη. Απλά αυτοί που χτυπούν το ΠΑΣΟΚ και αυτές τις προτάσεις είναι αυτοί που θα πληρώσουν, οι χιλιάδες οικογένειες που υπηρετεί πιστά ο κύριος Μητσοτάκης. Εμείς υπηρετούμε την πατρίδα, εμείς υπηρετούμε τον ελληνικό λαό και έχουμε άλλες προτεραιότητες. Και βέβαια, ο ΦΠΑ στα βασικά αγαθά. Το ακούσαμε και αυτό, λαϊκισμός. Μα είναι λαϊκισμός να μειώσεις τον ΦΠΑ σε λίγα βασικά αγαθά για να μπορεί ο πιο ευάλωτος Έλληνας να αγοράζει το γάλα του, το ψωμί του και δεν είναι λαϊκισμός ότι η Νέα Δημοκρατία στο πρόγραμμά της του 2019 μιλάει για μειωμένο ΦΠΑ και στις 2 κατηγορίες; ",political agenda,economy,other,0.0,0.0,0.2,"[['pasok', 'political party', '0.6'], ['mr mitsotakis', 'person', '0.6'], ['new democracy', 'political party', '0.6'], ['greek', 'country', '0.6'], ['2019', 'date', '0.6']]"
17,"Then they could, now they can't? But what's going on? They tell you that we reduced the rates and the people gained 7 billion in 4 years. It's true. Of course, the rates were lowered more for the rich and less for the poor. What is our response? That in 2 years they got 5 billion more VAT and excise tax from the weakest and middle class.","Τότε μπορούσαν, τώρα δεν μπορούν; Αλλά τι συμβαίνει; Σας λένε ότι μειώσαμε τους συντελεστές και κέρδισε ο λαός στα 4 χρόνια 7 δισεκατομμύρια. Ισχύει. Βέβαια, οι συντελεστές μειώθηκαν περισσότερο για τους πλούσιους και λιγότερο προς τα κάτω. Εμείς τι απαντάμε; Ότι σε 2 χρόνια πήραν 5 δισεκατομμύρια παραπάνω ΦΠΑ και ειδικό φόρο κατανάλωσης από τους πιο αδύναμους και τη μεσαία τάξη. ",criticism,economy,tax cuts,-0.3,0.2,0.0,"[['rich', 'group of people', '0.8'], ['poor', 'group of people', '0.8'], ['weakest', 'group of people', '0.8'], ['middle class', 'group of people', '0.8'], ['vat', 'organization', '0.5'], ['excise tax', 'organization', '0.5']]"
18,"That is why we are discussing a different policy mix. These are not hypothetical scenarios or nonexistent concepts. If we examine the tax structure, our proposal aligns with what is occurring in all European countries: the establishment of a robust welfare state that promotes growth, production, and dignity. Our objective is equity. We strive for every citizen to sense that the state is supporting them and treating every individual and family with respect.","Για αυτό λοιπόν μιλάμε για ένα άλλο μείγμα πολιτικής και αυτά δεν είναι σενάρια ούτε είναι πράγματα τα οποία δεν υπάρχουν. Αν δείτε τη φορολογική δομή, ό,τι προτείνουμε, είναι αυτό που συμβαίνει σε όλες τις ευρωπαϊκές χώρες για να υπάρχει ισχυρό κοινωνικό κράτος, ανάπτυξη, παραγωγή και αξιοπρέπεια. Ο στόχος μας είναι η δικαιοσύνη. Ο στόχος μας είναι κάθε πολίτης να νιώθει ότι το κράτος του προσφέρει, ότι σέβεται τον κάθε πολίτη, την κάθε οικογένεια. ",political agenda,social state,tax cuts,0.75,0.0,0.0,"[['european countries', 'location', '0.9'], ['welfare state', 'organization', '0.8'], ['citizen', 'group of people', '0.6'], ['state', 'organization', '0.5']]"
19,"Friends, beyond taxation, health, and education, there are other significant issues that concern pensioners. We are not being catered to. We propose three measures, costing one billion 130 million. Firstly, the introduction of a new ESAS to replace the one abolished by Mr Tsipras, benefiting 350,000 low pensioners. Secondly, the abolition of the personal differential from 1/1/24 for four years, with a fiscal impact. In the fourth year, there is no cost to the budget, and the unfair provisions for disability and widow's pensions no longer exist, allowing those in need to receive the pensions they are entitled to. Civil servants need to catch up with inflation, which costs a billion 200 million. All these interventions, totaling 2.3 billion, are reasonable. We are not discussing the thirteenth pension, which costs 2.7 billion, as we do not want any citizen to feel that PASOK in this new era has made promises it cannot keep to win their vote. We speak with dignity and logic so that every citizen knows that PASOK wants to support them as best it can, but always in a fiscally secure way.","Φίλες και φίλοι. Πέρα όμως από τα φορολογικά, την υγεία, την παιδεία, υπάρχουν και άλλα πολύ μεγάλα ζητήματα που αφορούν τους συνταξιούχους. Εμείς δεν λαϊκίζουμε. Εμείς λέμε 3 μέτρα, 3 μέτρα κόστους ενός δισεκατομμυρίου 130 εκατομμυρίων. Το πρώτο είναι η καθιέρωση ενός νέου ΕΚΑΣ στη θέση αυτού που κατήργησε ο κύριος Τσίπρας. Ένα νέο ΕΚΑΣ για 350.000 χαμηλοσυνταξιούχους. Το δεύτερο η κατάργηση της προσωπικής διαφοράς από 1/1/24 για 4 χρόνια έχει δημοσιονομικό αποτύπωμα. Τον τέταρτο χρόνο δεν υπάρχει κανένα κόστος για τον προϋπολογισμό και βέβαια οι άδικες διατάξεις για τις συντάξεις αναπηρίας και χηρείας να μην υπάρχουν πλέον ώστε αυτοί οι άνθρωποι που είναι σε δύσκολη θέση να πάρουν τις συντάξεις που τους αναλογούν. Δημόσιοι υπάλληλοι. Πρέπει να φτάσουμε στο επίπεδο του πληθωρισμού και αυτό κοστίζει ένα δισεκατομμύριο 200 εκατομμύρια, άρα όλες αυτές οι παρεμβάσεις με 2,3 δισεκατομμύρια είναι λογικές. Δεν λέμε για δέκατη τρίτη σύνταξη γιατί είναι 2,7 δις, γιατί πάνω από όλα δεν θέλουμε να νιώσει κανένας πολίτης ότι το ΠΑΣΟΚ σε αυτή τη νέα εποχή είπε πράγματα που δεν μπορεί να κάνει για να υφαρπάξει την ψήφο του. Λέμε πράγματα συγκεκριμένα με αξιοπρέπεια, με λογική για να ξέρει κάθε πολίτης ότι το ΠΑΣΟΚ θέλει να τον στηρίξει όπως μπορεί, αλλά πάντα με τρόπο δημοσιονομικά ασφαλή. ",political agenda,pensioners,pensions,0.5,0.0,0.0,"[['mr tsipras', 'organization', '0.6'], ['esas', 'organization', '0.6'], ['pasok', 'political party', '0.9']]"
20,"Another huge issue that concerns both Crete and the rest of Greece is private debt. In the past, some people have said, ""Don't pay, we will bring Sesakhtia."" These were the golden sponsors of New Democracy who went to villages and towns and said, ""Don't pay your loans, we will find arrangements."" In 2015, as soon as they became the government, they sold billions of red loans with a law of SYRIZA-Independent Greeks to the funds' crows. As a result, cooperatives, individuals, small and medium-sized enterprises, and businesses are in a dire situation, blackmailed by these profit-making institutions.","Ένα άλλο ζήτημα τεράστιο που αφορά και την Κρήτη και την υπόλοιπη Ελλάδα είναι το ιδιωτικό χρέος. Έλεγαν κάποιοι στο παρελθόν, μην πληρώνετε, θα φέρουμε Σεισάχθεια. Είναι αυτοί οι χρυσοί χορηγοί της Νέας Δημοκρατίας που πήγαιναν σε χωριά και πόλεις και έλεγαν μην πληρώνετε τα δάνειά σας, θα βρούμε ρυθμίσεις. Και το 2015, μόλις έγιναν κυβέρνηση, πούλησαν δισεκατομμύρια κόκκινα δάνεια, με νόμο ΣΥΡΙΖΑ-Ανεξάρτητων Ελλήνων στα κοράκια των funds, με αποτέλεσμα συνεταιρισμοί, ιδιώτες, μικρομεσαίοι επιχειρήσεις, επιχειρήσεις να είναι σε μια δεινή κατάσταση, εκβιαζόμενοι από αυτά τα κερδοσκοπικά ιδρύματα. ",criticism,debt,debt regulations,-0.7,0.0,0.0,"[['crete', 'location', '1.0'], ['greece', 'country', '1.0'], ['sesakhtia', 'organization', '0.5'], ['new democracy', 'political party', '1.0'], ['2015', 'date', '1.0'], ['syriza-independent greeks', 'political party', '1.0']]"
21,"There must be universal protection of the main house for the vulnerable and the middle class. This is what PASOK did in 2010 to defend our weakest fellow citizens. Secondly, we must pass a law that sets criteria for negotiating with funds. These criteria should lead to regulation, and not leave the market unregulated. If we don't regulate the market, funds will drive thousands of businesses and cooperatives to extinction. We also believe that the banks' profit margin for consistent borrowers should be reduced. This will give all those who have not endured an incentive to have a second chance at dignity. It will also give those who have endured an incentive to continue to pay their loans. Finally, there are the 120 payments. If you go to the city of Rethymno tomorrow morning and ask small and medium-sized businesses, ""Did you join the 120 instalments made by New Democracy?"" You can be sure that they are counted on the fingers of one hand. This is simply not an arrangement for many, but for very few. We are committing ourselves to 120 instalments for everyone, for the tax authorities and the National Social Security Fund. This will regulate the market and provide liquidity for businesses. Our aim is to keep the small and medium-sized enterprise standing, with a perspective, and to keep it on its feet.","Εμείς τι λέμε; Πρέπει να υπάρξει καθολική προστασία της κύριας κατοικίας για τους ευάλωτους και τη μεσαία τάξη. Όπως έκανε το ΠΑΣΟΚ το 2010 για να υπερασπιστούμε τους πιο αδύναμους συνανθρώπους μας. Δεύτερον, πρέπει να ψηφίσουμε ένα νόμο που θα βάζει κριτήρια διαπραγματεύσεων με τα funds. Κριτήρια που οδηγούν σε ρυθμίσεις και όχι να αφήσουμε ανεξέλεγκτη την αγορά, με αποτέλεσμα τα funds να οδηγούν σε εξόντωση χιλιάδες επιχειρήσεις και συνεταιρισμούς. Επίσης, θεωρούμε ότι πρέπει να μειωθεί το περιθώριο κέρδους των τραπεζών για τους συνεπείς δανειολήπτες για να έχουν κίνητρα όλοι και αυτοί που δεν άντεξαν να έχουν μια δεύτερη ευκαιρία αξιοπρέπειας, αλλά και αυτοί που άντεξαν να έχουν κίνητρα να συνεχίσουν να πληρώνουν τα δάνεια τους. Και τέλος οι 120 δόσεις. Eίμαι σίγουρος ότι αν αύριο το πρωί πάτε στην πόλη του Ρεθύμνου και ρωτήσετε μικρομεσαίες επιχειρήσεις: Ενταχθήκατε στις 120 δόσεις που έκανε η Νέα Δημοκρατία; Να είστε σίγουροι ότι μετριούνται στα δάχτυλα του ενός χεριού αυτοί που θα συναντήσετε, διότι πολύ απλά δεν είναι μια ρύθμιση για πολλούς, αλλά για ελάχιστους. Εμείς δεσμευόμαστε 120 δόσεις για όλους, για εφορίες και ΕΦΚΑ για να ρυθμιστεί η αγορά και να υπάρχει ρευστότητα στις επιχειρήσεις. Στόχος μας να κρατήσουμε όρθια, με προοπτική, τη μικρομεσαία επιχείρηση. ",political agenda,debt,bank regulations,0.2,0.1,0.2,"[['pasok', 'organization', '1.0'], ['new democracy', 'political party', '1.0'], ['rethymno', 'location', '1.0'], ['national social security fund', 'organization', '1.0']]"
22,"Friends, regarding the demographic, I mentioned our tax policies earlier, but that is not all. We have a duty to support the family and the Greek mother. With a strong PASOK, I pledge that no child or family will be left out of nurseries and creative employment centers. This is how we support the Greek family in practice. Additionally, the amendment we proposed before the elections will be reintroduced after these elections to increase maternity allowance for freelance women.","Φίλες και φίλοι, το δημογραφικό. Είπα προηγουμένως τις φορολογικές μας πολιτικές, αλλά δεν είναι μόνο αυτές. Έχουμε χρέος να στηρίξουμε την οικογένεια, έχουμε χρέος να στηρίξουμε την Ελληνίδα μάνα. Γι αυτό με ένα ισχυρό ΠΑΣΟΚ δεσμεύομαι ότι κανένα παιδί, καμίας οικογένειας δεν θα μένει εκτός βρεφονηπιακών σταθμών και δημιουργικών κέντρων απασχόλησης. Έτσι στηρίζουμε εμπράκτως την ελληνική οικογένεια. Και δεύτερο, την τροπολογία που καταθέσαμε πριν τις εκλογές, θα την καταθέσουμε και μετά από αυτές τις εκλογές, ώστε να υπάρχει αύξηση του επιδόματος μητρότητας για τις γυναίκες ελεύθερες επαγγελματίες. ",political agenda,social state,maternity leave,0.8,0.0,0.0,"[['friends', 'person', '0.6'], ['pasok', 'organization', '0.9'], ['greek', 'location', '0.8'], ['sigma', 'political party', '0.2'], ['maternity allowance', 'date', '0.2.']]"
23,"And of course, there is the social housing program. Mr. Mitsotakis tried to imitate our proposal. But do you know what it reveals? That he disregards the great problems of the younger generation. When other states included tens of thousands of houses in the Recovery Fund, he included only 100 houses in the Recovery Fund, 70 in Athens and 30 in Thessaloniki. And when PASOK started talking about this issue, he said, ""I will make a program."" What is his program? He gives low-interest loans for young people to buy houses. If you ask, many have been approved to get loans, but the price of mobile phones today is higher than the loan amount, so this is again for the few, the haves.","Και βέβαια, το πρόγραμμα κοινωνικών κατοικιών. Ο κύριος Μητσοτάκης προσπάθησε να μιμηθεί την πρότασή μας. Αλλά ξέρετε, τι αποκαλύπτει ότι περιφρονεί τα μεγάλα προβλήματα της νέας γενιάς; Όταν τα υπόλοιπα κράτη ενέταξαν στο Ταμείο Ανάκαμψης δεκάδες χιλιάδες κατοικίες, ο ίδιος στο Ταμείο Ανάκαμψης ενέταξε 100 σπίτια, 70 στην Αθήνα και 30 στη Θεσσαλονίκη. Και όταν το ΠΑΣΟΚ άρχισε να μιλάει γι αυτό το θέμα, λέει, θα κάνω πρόγραμμα. Τι είναι το πρόγραμμα του; Δίνει χαμηλότοκα δάνεια για να αγοράσουν σπίτια οι νέοι. Αν ρωτήσετε, πολλοί έχουν εγκριθεί να πάρουν δάνεια, αλλά την τιμή που έχουν σήμερα τα κινητά δεν μπορεί το δάνειο να φτάσει, άρα αυτό πάλι είναι για τους λίγους, τους έχοντες. ",criticism,housing,affordable housing,-0.8,0.0,0.2,"[['mr. mitsotakis', 'person', '0.75'], ['pasok (panhellenic socialist movement)', 'political party', '1.0'], ['athens', 'location', '1.0'], ['thessaloniki', 'location', '1.0'], ['recovery fund', 'organization', '1.0'], ['greece', 'country', '1.0']]"
