id,text,text_el,is_criticism,topic-context,subtopic-context,sentiment,polarization-definition,populism-definition,ner-limited
24,"What are we saying? We are putting closed and new homes into a social pool with a target of 150,000 homes in 4 years, using a Recovery Fund, tax incentives, and reconstruction incentives. These homes will be used to house young couples and vulnerable Greeks with low rent. When these individuals are able to stand on their own feet, other families can move in. This is social justice and support for Greeks, rather than creating customers through low interest loans. This approach is being implemented in all European countries. Mr. Mitsotakis' approach has already failed.","Εμείς τι λέμε; Με Ταμείο Ανάκαμψης, με φορολογικά κίνητρα και κίνητρα ανακατασκευής, εντάσσουμε κλειστά σπίτια και νέες κατοικίες σε μία κοινωνική δεξαμενή στόχου 150.000 κατοικιών στα 4 χρόνια για να στεγάσουν νέα ζευγάρια και αδύναμους Έλληνες με χαμηλό ενοίκιο και όταν αυτοί οι άνθρωποι σταθούν όρθιοι στα πόδια τους να πηγαίνουν άλλες οικογένειες, αυτό είναι κοινωνική δικαιοσύνη και στήριξη των Ελλήνων και όχι να φτιάξεις πελάτες, δίνοντας χαμηλότοκα δάνεια. Αυτό που λέμε,  συμβαίνει σε όλα τα ευρωπαϊκά κράτη. Αυτό που κάνει ο κύριος Μητσοτάκης έχει αποτύχει ήδη.",political agenda,housing,affordable housing,0.41,0.0,0.0,"[['mr. mitsotakis', 'person', '0.8'], ['greeks', 'group of people', '0.6'], ['recovery fund', 'organization', '0.8'], ['european countries', 'location', '0.7'], ['150', '000 homes', 'group of people', '0.6'], ['4 years', 'date', '0.6']]"
25,"Friends, I cannot avoid mentioning the agricultural issues here in Rethymno. We are the party that has supported the peasantry since the 1980s, giving them dignity and prospects. Because blood is thicker than water, PASOK is here again to embrace the rural world of the country, providing incentives for competitiveness, production, and prospects so that our villages and the Greek countryside can thrive. The rural income lost in recent years amounts to 1.3 billion. 70% of our farmers have significant debts to public funds, EFKA, and banks. What are we proposing? We will reduce production costs, especially for agricultural inputs, with zero excise duty on agricultural oil during the crisis. We will implement two measures for agricultural supplies and oil.","Φίλες και φίλοι, δεν μπορώ εδώ από το Ρέθυμνο να μην αναφερθώ στα αγροτικά. Είμαστε το κόμμα που στήριξε την αγροτιά από τη δεκαετία του 80, της έδωσε αξιοπρέπεια και προοπτική και επειδή το αίμα νερό δεν γίνεται, είμαστε ξαναδώ εδώ ξανά το ΠΑΣΟΚ για να αγκαλιάσει τον αγροτικό κόσμο της χώρας, δίνοντας κίνητρα ανταγωνιστικότητας, παραγωγής, προοπτικής για να είναι ζωντανά τα χωριά μας, ζωντανή η ελληνική ύπαιθρος. Το αγροτικό εισόδημα που χάθηκε τα τελευταία χρόνια φτάνει το 1,3 δισεκατομμύρια. Το 70% των αγροτών μας έχει μεγάλες οφειλές σε δημόσια ταμεία, ΕΦΚΑ και τράπεζες. Εμείς τι λέμε; Μειώνουμε το κόστος παραγωγής ειδικά για τα αγροτικά εφόδια, με μηδενισμό του ειδικού φόρου κατανάλωσης στο αγροτικό πετρέλαιο την περίοδο της κρίσης. 2 μέτρα για αγροτικά εφόδια και πετρέλαιο. ",political agenda,agricultural policy,other,0.0,0.0,0.2,"[['rethymno', 'location', '1.0'], ['pasok', 'political party', '1.0'], ['greek', 'country', '1.0'], ['1980s', 'date', '1.0'], ['70%', 'group of people', '1.0'], ['efka', 'organization', '1.0']]"
26,"Secondly, priority is given to renewable energy parks for farmers, cooperatives, municipalities, and energy communities all over Greece, not just for the powerful at the expense of the democratization of electricity production. We say this because how can we have stable production costs if all this new development, new industry, and new electricity production is given only to the powerful? This only happens here. In all European countries, whether with small energy communities of producers, processors, and cooperatives, or with municipal energy communities, or with photovoltaics on roofs, they shield the vulnerable from energy poverty and the producer from rising production costs.","Δεύτερον, κατά προτεραιότητα εντάσσονται σε πάρκα ανανεώσιμων πηγών ενέργειας κτηνοτρόφοι, συνεταιριστές, δήμοι, ενεργειακές κοινότητες σε όλη την Ελλάδα και όχι οι ανανεώσιμες πηγές να είναι για τους 5 ισχυρούς εις βάρος του εκδημοκρατισμού της παραγωγής ηλεκτρικής ενέργειας. Και το λέμε αυτό, γιατί πώς θα έχουμε σταθερό κόστος παραγωγής αν όλη αυτή την ενιαία ανάπτυξη, τη νέα βιομηχανία, τη νέα παραγωγή ηλεκτρικής ενέργειας, τη δώσουμε μόνο σε ισχυρούς; Αυτό συμβαίνει μόνο εδώ. Σε όλες τις ευρωπαϊκές χώρες, είτε με μικρές ενεργειακές κοινότητες παραγωγών, μεταποιητών, συνεταιρισμών είτε με δημοτικές ενεργειακές κοινότητες είτε με φωτοβολταϊκά στις στέγες θωρακίζουν τον ευάλωτο από την ενεργειακή φτώχεια και τον παραγωγό από την αύξηση του κόστους παραγωγής. ",political agenda,energy,other,0.5,0.0,0.0,"[['greece', 'country', '1.0'], ['european countries', 'location', '1.0'], ['photovoltaics', 'organization', '0.5'], ['cooperatives', 'group of people', '0.5'], ['municipalities', 'group of people', '0.5'], ['producers', 'group of people', '0.5'], ['processors', 'group of people', '0.5']]"
27,"We have a different plan than that of New Democracy, a plan that serves the many, the producers, and not the oligarchs of the country. Mr. Mitsotakis constantly caresses the issue of energy. Look at what we heard when we talked about taxing the excess profits of power generators, suppliers, and banks. Shouldn't their excess profits be taxed? They received billions of euros in subsidies, and then we saw it in the PPC tariff, which we paid. Shouldn't they pay something too? What I want to say is, when the income of the Greek people fell in 2022, and real wages fell by 7%, how did they manage to triple their profits in the midst of an energy crisis? So, it is fair to tax their excess profits, and anyone who speculates at the expense of the country, the middle class, and the Greek people should know that the state is here to regulate the market and not to have a market that is a jungle for the few at the expense of the many. On this issue too, social democracy has solutions. It sets rules and regulates the market. It does not allow powerful interests to speculate at the expense of the people.","Εμείς έχουμε ένα άλλο σχέδιο από αυτό της Νέας Δημοκρατίας, ένα σχέδιο που υπηρετεί τους πολλούς, τους παραγωγούς και όχι τους ολιγάρχες της χώρας, όπως χαϊδεύει συνεχώς και με το θέμα της ενέργειας ο κύριος Μητσοτάκης. Δείτε τι ακούσαμε όταν είπαμε για φορολόγηση των υπερκερδών των ηλεκτροπαραγωγών, των προμηθευτών και των τραπεζών. Δεν πρέπει να φορολογηθούν τα υπερκέρδη τους; Δισεκατομμύρια ευρώ πήραν από επιδοτήσεις και τα είδαμε μετά στο τιμολόγιο της ΔΕΗ. Εμείς τα πληρώσαμε. Δεν πρέπει να πληρώσουν και αυτοί κάτι και τι θέλω να πω; Όταν το 2022 έπεσε το εισόδημα του ελληνικού λαού, 7% μειώθηκαν οι πραγματικοί μισθοί, αυτοί πώς κατάφεραν να τριπλασιάσουν τα κέρδη τους εν διαμέσω ενεργειακής κρίσης; Άρα, είναι δίκαιο να φορολογηθούν τα υπερκέρδη τους και όποιος κερδοσκοπεί εις βάρος της χώρας, της μεσαίας τάξης και του ελληνικού λαού, να ξέρει ότι το κράτος είναι εδώ για να ρυθμίζει την αγορά και όχι για να έχουμε μια αγορά η οποία θα είναι ζούγκλα για τους λίγους εις βάρος των πολλών. Και σε αυτό το θέμα η σοσιαλδημοκρατία έχει λύσεις, βάζει κανόνες και ρυθμίζει την αγορά. Δεν επιτρέπει σε ισχυρά συμφέροντα να κερδοσκοπούν εις βάρος των λαών. ",political agenda,energy,other,-0.4,0.6,0.6,"[['new democracy', 'organization', '1.00'], ['mr. mitsotakis', 'person', '1.00'], ['ppc', 'organization', '1.00'], ['greek people', 'group of people', '1.00'], ['greek', 'country', '1.00'], ['2022', 'date', '1.00']]"
28,"Friends, finally, on the subject of the agricultural sector. In the last few days, during the week before last, I was here in Rethymnon. I visited the agricultural cooperative with its famous cheeses. Prior to that, I had been to Chios, to the Mastic Research Centre with its highly specialised products. I also visited the Toplou monastery with its standardised wines and oil. Lastly, I went to the Honey Museum in Rhodes. I want to send a message with this experience. This message is for tourism entrepreneurs, but also for the country in general. Tourism does not mean celebrating when 25 million or 30 million travellers come to Greece. Tourism means setting measurable targets so that everyone wins - farmers, ranchers, processors, and workers. This is value-added tourism. This is not an invention of PASOK. Italy has been doing this for years, Spain has been doing this for years, and Portugal has been doing this since the economic crisis. When you visit their homelands, you taste their domestic products, become their ambassador, and then look for these products on the shelves of supermarkets all over Europe and the world. This is our vision for value-added tourism that joins forces with manufacturing and the primary sector. We can create new jobs all over Greece so that Greek children can stay here with good wages. We can have exports, a productive economy, and a strong society.","Φίλες και φίλοι, τέλος για το θέμα του αγροτικού τομέα. Τις τελευταίες μέρες, την προτελευταία εβδομάδα ήρθα εδώ στο Ρέθυμνο, πήγα στον αγροτικό συνεταιρισμό με τα ξακουστά τυριά. είχα βρεθεί προηγουμένως στη Χίο, στο Κέντρο Έρευνας Μαστίχας με τα ιδιαίτερα εξειδικευμένα προϊόντα, είχα πάει στην μονή Τοπλού με τα τυποποιημένα κρασιά, με το τυποποιημένο λάδι και μετά πήγα και στο Μουσείο Μελιού της Ρόδου. Θέλω με αυτή μου την πορεία να στείλω ένα μήνυμα. Και για τους επιχειρηματίες του τουρισμού, αλλά και για τη χώρα ευρύτερα. Τουρισμός δεν σημαίνει να πανηγυρίζουμε όταν έρχονται 25 εκατομμύρια ή 30 εκατομμύρια ταξιδιώτες στην Ελλάδα. Τουρισμός σημαίνει να βάλουν μετρήσιμους στόχους ώστε να κερδίζουν όλοι και οι κτηνοτρόφοι και οι αγρότες και οι μεταποιητές και οι εργαζόμενοι. Αυτός είναι ο τουρισμός της προστιθέμενης αξίας. Και αυτό βέβαια δεν είναι εφεύρημα του ΠΑΣΟΚ. Αυτό κάνει η Ιταλία χρόνια, αυτό κάνει η Ισπανία χρόνια, αυτό κάνουν και οι Πορτογάλοι μετά την οικονομική κρίση και όταν πας στις πατρίδες τους γεύεσαι τα εγχώρια προϋόντα, γίνεσαι πρεσβευτής τους και μετά αναζητάς αυτά τα προϊόντα στα ράφια των σούπερ μάρκετ όλης της Ευρώπης και όλου του κόσμου. Αυτό είναι το όραμά μας για ένα τουρισμό προστιθέμενης αξίας που ενώνει τις δυνάμεις με τη μεταποίηση, με τον πρωτογενή τομέα και δημιουργούμε νέες θέσεις εργασίας σε όλη την Ελλάδα για να μείνουν εδώ τα ελληνόπουλα με καλούς μισθούς για να έχουμε εξαγωγές, παραγωγική οικονομία και ισχυρή κοινωνία. ",political agenda,tourism,other,0.5,0.0,0.0,"[['rethymnon', 'location', '1.0'], ['chios', 'location', '1.0'], ['mastic research centre', 'organization', '0.8'], ['toplou monastery', 'organization', '0.8'], ['rhodes', 'location', '1.0'], ['greece', 'country', '1.0'], ['pasok', 'political party', '1.0'], ['italy', 'country', '1.0'], ['spain', 'country', '1.0'], ['portugal', 'country', '1.0']]"
29,"Friends, friends, I truly believe that the party on May 21st took a significant first step, especially since our political opponents, both of whom are now revealing their plan, wanted a small PASOK, a PASOK instrumentalized in their plans. They failed, and they failed because the sovereign people spoke. I call on these people to embrace the democratic progressive plan of justice for our country and to give us a new strong voice on June 25th. This party has never played to the extremes; that is why they call it the Democratic Party. It has never coddled Golden Dawn to get votes, nor has it struck at independent authorities or undermined justice and human rights. That is what you will find in Syriza and New Democracy. I hear Mr Mitsotakis saying, ""If I have 149, what am I going to do? Should I hold elections in August?"" So what is Mitsotakis saying? ""Vote for me so that I do not spoil your holidays."" Last month he was saying, ""Vote for me because Mr Androulakis did not come to meet me."" These are childish arguments. If the current electoral law had been in the previous result, New Democracy would have 172 seats, and let the mainstream media stop scaring the Greek people. Things are too simple. The danger is no longer instability, but the omnipotence of New Democracy, and I call for a strong mandate to be a strong opposition, a bulwark against the arrogance and the client state of Mr Mitsotakis' system of power. But even if the Greek people ultimately gave him 149 seats, Mr Mitsotakis has solutions. Mr Voridis in a top ministry. Mr Georgiades in a top ministry. Mr Plevris in a top ministry. Their daddy, Mr Karatzaferis, closely supports the supposedly liberal Mr Mitsotakis. Mr Kranidiotis is also close by. He closed down his far-right party, and he too supports the supposedly liberal Mr Mitsotakis. So, Mr Mitsotakis, do you have all these people in your party? Will Velopoulos or Niki spoil you? So you have choices in the far-right center because this is not a liberal center; this is for power. There are no principles, there are no values.","Φίλες, φίλες και φίλοι, πραγματικά πιστεύω ότι η παράταξη αυτή 21 Μαΐου έκανε ένα πρώτο μεγάλο βήμα, ιδιαίτερα όταν οι πολιτικοί μας αντίπαλοι, και αποκαλύπτουν τώρα και οι 2 το σχέδιό τους, ήθελαν ένα μικρό ΠΑΣΟΚ, ένα ΠΑΣΟΚ εργαλειοποιημένο στα σχέδιά τους. Απέτυχαν και απέτυχαν γιατί μίλησε ο κυρίαρχος λαός. Αυτόν τον λαό καλώ να αγκαλιάσει το δημοκρατικό προοδευτικό σχέδιο δικαιοσύνης για την πατρίδα μας και να μας δώσει νέα ισχυρή φωνή στις 25 Ιουνίου. Αυτό το κόμμα δεν έπαιξε ποτέ με τα άκρα, γι αυτό το λένε δημοκρατική παράταξη. Δεν χάιδεψε ποτέ ούτε Χρυσή Αυγή για να πάρει ψήφους ούτε χτύπησε ανεξάρτητες αρχές ούτε υπονόμευσε δικαιοσύνη και ανθρώπινα δικαιώματα. Αυτά θα τα συναντήσετε στο ΣΥΡΙΖΑ και τη Νέα Δημοκρατία. Ακούω τον κύριο Μητσοτάκη να λέει, και αν έχω 149, τι θα κάνω; Να κάνω εκλογές τον Αύγουστο; Δηλαδή τι λέει ο Μητσοτάκης; Ψηφίστε με, να μη σας χαλάσω τις διακοπές. Τον προηγούμενο μήνα έλεγε ψηφίστε με γιατί δεν ήρθε να με συναντήσει ο κύριος Ανδρουλάκης. Αυτά είναι παιδικά επιχειρήματα. Αν υπήρχε στο προηγούμενο αποτέλεσμα ο σημερινός εκλογικός νόμος, η Νέα Δημοκρατία θα έχει 172 έδρες και ας σταματήσουν τα συστημικά μίντια να φοβίζουν τον ελληνικό λαό. Τα πράγματα είναι πάρα πολύ απλά. Ο κίνδυνος πλέον δεν είναι η αστάθεια, αλλά η παντοδυναμία της Νέας Δημοκρατίας και ζητώ ισχυρή εντολή για να είμαστε ισχυρή αντιπολίτευση, ανάχωμα στην αλαζονεία και το πελατειακό κράτος του συστήματος εξουσίας του κυρίου Μητσοτάκη. Αλλά ακόμη κι αν ο ελληνικός λαός του έδωσε εν τέλει 149 έδρες, έχει λύσεις ο κύριος Μητσοτάκης. Ο κύριος Βορίδης σε κορυφαίο υπουργείο. Ο κύριος Γεωργιάδης σε κορυφαίο υπουργείο. Ο κύριος Πλεύρης σε κορυφαίο υπουργείο. Ο μπαμπάς τους, ο κύριος Καρατζαφέρης από κοντά στηρίζει το δήθεν φιλελεύθερο κύριο Μητσοτάκη. Από κοντά και ο κύριος Κρανιδιώτης. Έκλεισε το κόμμα του το ακροδεξιό, στηρίζει και αυτός το δήθεν φιλελεύθερο κύριο Μητσοτάκη. Άρα λοιπόν, κύριε Μητσοτάκη, έχετε όλους αυτούς στο κόμμα σας, ο Βελόπουλος ή η Νίκη θα σας χαλάσει; Έχετε λοιπόν επιλογές στην ακροδεξιά πολυκατοικία διότι αυτό δεν είναι φιλελεύθερο κέντρο, αυτό είναι για την εξουσία, δεν υπάρχουν αρχές, δεν υπάρχουν αξίες. ",criticism,elections,other,0.0,0.6,0.2,"[['may 21st', 'date', '0.6'], ['pasok', 'political party', '0.9'], ['syriza', 'political party', '0.7'], ['new democracy', 'political party', '0.9'], ['mr mitsotakis', 'person', '0.9'], ['mr androulakis', 'person', '0.5'], ['greek', 'nationality', '0.9'], ['mr voridis', 'person', '0.5'], ['mr georgiades', 'person', '0.5'], ['mr plevris', 'person', '0.5'], ['mr karatzaferis', 'person', '0.5'], ['mr kranidiotis', 'person', '0.5'], ['velopoulos', 'person', '0.5'], ['niki', 'person', '0.5']]"
30,"Here, we move forward with dignity, progress, and the support of the Greek people, based on principles and values. I urge all progressive democrats to join our efforts to make our island green again and strengthen our party, contributing to a strong democratic movement throughout Greece.","Εδώ λοιπόν επειδή υπάρχουν και αρχές και αξίες, προχωράμε με αξιοπρέπεια, με πρόοδο, με τα ψηφοδέλτιά μας, με τον ελληνικό λαό και ζητώ από το Ρέθυμνο να αγκαλιάσει την προσπάθεια μας κάθε προοδευτικός δημοκράτης για να ξαναγίνει το νησί μας πράσινο και η παράταξή μας ισχυρή. Ένα ισχυρό δημοκρατικό κίνημα σε όλη την Ελλάδα. ",political agenda,elections,green energy,,0.0,0.0,"[['greek', 'country', '1', 'progressive democrats', 'group of people', '1', 'our island', 'location', '0.8', 'party', 'organization', '0.8', 'greece', 'country', '0.7', 'democratic movement', 'organization', '0.'], ['']]"
