id,text,text_el,is_criticism,topic-context,subtopic-context,sentiment,polarization-definition,populism-definition,ner-limited
1,"I thank you from the bottom of my heart for your warm welcome. Today, we are sending a message of victory from Rethymno with the clear aim of giving Crete back the political color that suits it - the green of the Democratic Party, the green of hope, the green of optimism, the green of dignity. We are only 15 days away. PASOK is here, united and strong, the great winner on June 25th. The first step has been taken. We are going strong again to become the great rival of New Democracy. Friends, there are less than two weeks left, and we have only one road, only one path to travel - the path of daily struggle, of daily effort, home by home, city by city, village by village, in every workplace. We must ensure that the voice of progress, the voice of reason, the voice of responsibility prevails against the toxicity and division that New Democracy and SYRIZA have offered in recent years. But you know very well that Mr. Mitsotakis has made himself comfortable. He settled for an opposition sponsor, a golden sponsor. There is no other way to interpret the result after four years of great social inequalities, undermining of the welfare state, extensive corruption phenomena such as that of Mr. Patsis and others, wiretapping, the parastatal of wiretapping, the cover-up, the games with justice. Instead of New Democracy going down, New Democracy is going up. Why did this happen? Did the people see their lives getting better? The people feared the worst, and we are here to choose not based on fear but based on hope and the prospects of every family in the younger generations.","Σας ευχαριστώ από τα βάθη της καρδιάς μου για τη θερμή σας υποδοχή και στέλνουμε σήμερα από το Ρέθυμνο μήνυμα νίκης και στόχο καθαρό να ξαναδώσουμε στην Κρήτη το πολιτικό χρώμα που της ταιριάζει, το πράσινο της δημοκρατικής παράταξης, το πράσινο της ελπίδας, το πράσινο της αισιοδοξίας, το πράσινο της αξιοπρέπειας. Βρισκόμαστε μόλις 15 μέρες. Το ΠΑΣΟΚ είναι εδώ, ενωμένο, δυνατό 25 Ιουνίου ο μεγάλος νικητής. Το πρώτο βήμα έγινε. Πάμε ξανά δυνατά να γίνουμε ο μεγάλος αντίπαλος της Νέας Δημοκρατίας. Φίλες και φίλοι, έμειναν λιγότερες από 2 εβδομάδες και έχουμε μόνο ένα δρόμο, μόνο ένα μονοπάτι να διαβούμε. Το μονοπάτι του καθημερινού αγώνα, της καθημερινής προσπάθειας, σπίτι-σπίτι, πόλη-πόλη, χωριό-χωριό, σε κάθε εργασιακό χώρο να να ξανά ακουστεί δυναμικά η φωνή της προόδου, η φωνή της λογικής, η φωνή της υπευθυνότητας απέναντι στην τοξικότητα και τον διχασμό που προσέφερε η Νέα Δημοκρατία με τον ΣΥΡΙΖΑ τα τελευταία χρόνια. Αλλά ξέρετε πολύ καλά ότι βολεύτηκε ο κύριος Μητσοτάκης. Βολεύτηκε με μια αντιπολίτευση χορηγό, χρυσό χορηγό. Διότι δεν μπορούμε αλλιώς να ερμηνεύσουμε το αποτέλεσμα μετά από 4 χρόνια μεγάλων κοινωνικών ανισοτήτων, υπονόμευσης του κοινωνικού κράτους, εκτεταμένων φαινομένων διαφθοράς όπως του κυρίου Πάτση και άλλα βέβαια, τις υποκλοπές, το παρακράτος των υποκλοπών, τη συγκάλυψη, τα παιχνίδια με τη δικαιοσύνη και αντί η Νέα Δημοκρατία να κατρακυλά, η Νέα Δημοκρατία να ανεβαίνει. Γιατί συνέβη αυτό; Είδε ο λαός να καλυτερεύει τη ζωή του; Ο λαός φοβήθηκε τα χειρότερα και είμαστε εδώ για να επιλέξει όχι με γνώμονα το φόβο, αλλά με γνώμονα την ελπίδα και την προοπτική κάθε οικογένειας των νεότερων γενεών. ",criticism,elections,other,0.2,0.6,0.1,"[['rethymno', 'location', '0.8'], ['crete', 'location', '0.8'], ['democratic party', 'political party', '0.7'], ['pasok', 'organization', '0.7'], ['june 25th', 'date', '0.6'], ['new democracy', 'political party', '0.8'], ['syriza', 'political party', '0.6'], ['mitsotakis', 'person', '0.6'], ['patsis', 'person', '0.6']]"
2,"That is why we have a duty to revive the movement of Andreas Papandreou so that there is a choice of dignity, a choice of progress for every Greek. And I call on every Greek woman, every Greek democrat, every Greek progressive, from the democratic Rethymno, from Crete, the historical castle of the democratic party, to come and embrace our new effort. June 25, the goal is one: PASOK to become again the great movement of changes, of reforms that will give the Greek people a genuine hopeful perspective. We are tired of the years of toxicity, internet gangs, wishful thinking, populism, low quality of public debate. With our program, with our specific positions, with our proposals on the welfare state, on the economy, on taxation, on the revival of the agricultural sector, on competitive production, we have a duty to prove that there is a credible progressive force. And this is our great ambition, on election night, to be a strong, credible progressive force that can show the other way against maintenance, against the client state, against meritocracy, against opacity.","Για αυτό έχουμε χρέος να αναγεννήσουμε το κίνημα του Ανδρέα Παπανδρέου για να υπάρχει η επιλογή αξιοπρέπειας, επιλογή προόδου για κάθε Ελληνίδα και κάθε Έλληνα. Και καλώ εδώ από το δημοκρατικό Ρέθυμνο, από την Κρήτη, το ιστορικό κάστρο της δημοκρατικής παράταξης κάθε Ελληνίδα, κάθε Έλληνα δημοκράτη, προοδευτικό να έρθει να αγκαλιάσει τη νέα μας προσπάθεια. 25 Ιουνίου ο στόχος είναι ένας: το ΠΑΣΟΚ να ξαναγίνει το μεγάλο κίνημα των αλλαγών, των μεταρρυθμίσεων που θα δώσει στον ελληνικό λαό μια γνήσια ελπιδοφόρα προοπτική. Κουραστήκαμε τα χρόνια της τοξικότητας. Διαδικτυακές συμμορίες, ευχολόγια, λαϊκισμοί, χαμηλή ποιότητα δημόσιου διαλόγου. Έχουμε χρέος με το πρόγραμμά μας, με τις συγκεκριμένες θέσεις μας, με τις προτάσεις μας για το κοινωνικό κράτος, για την οικονομία, τη φορολογία, την ανάταση του αγροτικού τομέα, την ανταγωνιστική παραγωγή να αποδείξουμε ότι υπάρχει αξιόπιστη προοδευτική δύναμη. Και αυτή είναι η μεγάλη μας φιλοδοξία, το βράδυ της Κυριακής των εκλογών να είμαστε ισχυρή, αξιόπιστη προοδευτική δύναμη που θα μπορεί να δείξει τον άλλο δρόμο απέναντι στη συντήρηση, απέναντι στο πελατειακό κράτος, απέναντι στην αξιοκρατία, απέναντι στην αδιαφάνεια. ",political agenda,elections,other,0.75,0.2,0.2,"[['andreas papandreou', 'person', '0.90'], ['greek', 'group of people', '0.90'], ['greek woman', 'group of people', '0.90'], ['greek democrat', 'group of people', '0.90'], ['greek progressive', 'group of people', '0.90'], ['rethymno', 'location', '0.90'], ['crete', 'location', '0.90'], ['democratic party', 'organization', '0.90'], ['june 25', 'date', '0.90'], ['pasok', 'political party', '0.90'], ['greek people', 'group of people', '0.90'], ['toxicity', 'none', '0.25'], ['internet gangs', 'none', '0.25'], ['welfare state', 'none', '0.25'], ['economy', 'none', '0.25'], ['taxation', 'none', '0.25'], ['agricultural sector', 'none', '0.25'], ['competitive production', 'none', '0.25'], ['election night', 'date', '0.90'], ['client state', 'none', '0.25'], ['meritocracy', 'none', '0.25'], ['opacity', 'none', '0.25']]"
3,"Friends, in the last few days we have witnessed an unthinkable political conflict between New Democracy and Syriza. They have shown through this conflict that they are profoundly reckless. In the face of their ephemeral political interests and petty party interests, they do not even consider national issues, such as the sensitive issue of Thrace and the Greek Muslims. What have we seen? On the one hand, Mrs Bakoyannis speaking in a village in Komotini as if we were in the 1950s, with extreme right-wing despotic speech towards Greek citizens. We condemn this speech. It has nothing to do with a modern European country, gentlemen of the New Democracy. On the other hand, Mr Tsipras does not make things clear. Could it be that there are members of the Greek Parliament who are questioning the Treaty of Lausanne? But the Lausanne Treaty speaks of Greek Muslims. So let us be clear, let us stop the games of New Democracy and Syriza, the cheap election games.","Φίλες και φίλοι, τις τελευταίες μέρες έχουμε γίνει μάρτυρες μας μιας αδιανόητης πολιτικής σύγκρουσης μεταξύ της Νέας Δημοκρατίας και ΣΥΡΙΖΑ. Δείχνουν μέσα από αυτή τη σύγκρουση ότι είναι βαθιά τυχοδιώκτες. Ότι μπροστά στο εφήμερο πολιτικό συμφέρον, στο μικροκομματικό τους συμφέρον, δεν λογαριάζουν ούτε εθνικά ζητήματα, όπως το ευαίσθητο ζήτημα της Θράκης και των Ελλήνων μουσουλμάνων. Τι είδαμε; Από τη μια την κυρία Μπακογιάννη να μιλά σε ένα χωριό της Κομοτηνής λες και είμαστε στη δεκαετία του '50, με τον ακραίο δεξιό δεσποτικό λόγο απέναντι σε Έλληνες πολίτες. Καταδικάζουμε αυτό το λόγο. Δεν έχει να κάνει με μια σύγχρονη ευρωπαϊκή χώρα κύριοι της Νέας Δημοκρατίας. Και από την άλλη, τον κύριο Τσίπρα, ο οποίος δεν ξεκαθαρίζει τα πράγματα. Μπορεί να είναι βουλευτές του ελληνικού Κοινοβουλίου, κάποιοι που αμφισβητούν τη Συνθήκη της Λωζάνης; Μα η συνθήκη της Λωζάνης μιλάει για Έλληνες μουσουλμάνους. Ας είμαστε λοιπόν ξεκάθαροι, ας σταματήσουν τα παιχνίδια Νέα Δημοκρατία και ΣΥΡΙΖΑ, τα φτηνά προεκλογικά παιχνίδια. ",criticism,democracy,other,-0.6,0.2,0.2,"[['new democracy', 'organization', '1.0'], ['syriza', 'organization', '1.0'], ['thrace', 'location', '1.0'], ['greek muslims', 'group of people', '1.0'], ['mrs bakoyannis', 'person', '1.0'], ['komotini', 'location', '1.0'], ['greek citizens', 'group of people', '1.0'], ['mr tsipras', 'person', '1.0'], ['greek parliament', 'organization', '1.0'], ['treaty of lausanne', 'date', '1.0']]"
4,"And we say this because we, with our patriotic character and our sense of responsibility, have demonstrated the potential for unity among the people of Thrace, both Christians and Muslims. Andreas Papandreou broke down the barriers of shame, and Costas Simitis, with George Papandreou as Foreign Minister, enacted the 5 percent law that enabled hundreds of thousands of Greek Muslims to attend universities. After 20 years, the number of scientists in Thrace has increased fivefold. This party offers perspective and is committed to respecting human rights. It is a promising party of progress that stands in opposition to the unacceptable petty party attitudes that threaten to divide Greece for the benefit of small groups engaged in everyday political action. We envision Greece as a normal European country, not one that is ready to be divided at the slightest provocation.","Και το λέμε αυτό εμείς που με τον πατριωτικό μας χαρακτήρα, με την υπευθυνότητα μας δείξαμε την προοπτική για να είναι ενωμένος ο λαός της Θράκης, Χριστιανοί και μουσουλμάνοι. Ο Ανδρέας Παπανδρέου γκρέμισε τις μπάρες της ντροπής. Ο Κώστας Σημίτης με υπουργό Εξωτερικών τον Γιώργο Παπανδρέου έκανε το νόμο του 5 τοις χιλοίς που έβαλε στα πανεπιστήμια εκατοντάδες χιλιάδες Έλληνες μουσουλμάνους και μετά από 20 χρόνια έχουν πενταπλασιαστεί οι επιστήμονες στη Θράκη. Αυτό το κόμμα έδωσε προοπτική. Αυτό το κόμμα είναι το κόμμα του σεβασμού των ανθρωπίνων δικαιωμάτων. Αυτό το κόμμα είναι το ελπιδοφόρο κόμμα της προόδου, που μπροστά σ αυτές τις απαράδεκτες μικροκομματικές νοοτροπίες μπαίνει ανάχωμα, διότι εμείς οραματιζόμαστε την Ελλάδα κανονική ευρωπαϊκή χώρα και όχι μια χώρα έτοιμη να διχαστεί με το παραμικρό προς όφελος μικρών συμμοριών της καθημερινής πολιτικής δράσης. ",political agenda,human rights,other,0.8,0.2,0.0,"[['andreas papandreou', 'person', '0.75'], ['costas simitis', 'person', '0.75'], ['george papandreou', 'person', '0.75'], ['greek muslims', 'group of people', '0.75'], ['thrace', 'location', '0.75'], ['greece', 'country', '0.75'], ['5 percent law', 'organization', '0.75'], ['hundreds of thousands', 'group of people', '0.75'], ['scientists', 'group of people', '0.75'], ['promising party of progress', 'political party', '0.75'], ['small groups', 'group of people', '0.75'], ['human rights', 'organization', '0.75'], ['europe', 'location', '0.75']]"
5,"Friends, Mr. Tsipras must also answer why he did not pass the law on the election of the Mufti last summer. These are political questions, and let's stop with the conspiracies and innuendos. If they have something more to say, let them say it publicly to the Greek people to stop this game of dangerous impressions.","Φίλες και φίλοι, πρέπει να απαντήσει επίσης ο κύριος Τσίπρας, γιατί το καλοκαίρι πέρσι δεν ψήφισε τον νόμο για την εκλογή του Μουφτή. Αυτά είναι τα πολιτικά ερωτήματα και ας αφήσουν τις συνωμοσιολογίες και τα υπονοούμενα. Αν έχουν να πουν κάτι περισσότερο να το πουν δημοσίως στον ελληνικό λαό για να σταματήσει αυτό το παιχνίδι των επικίνδυνων εντυπώσεων. ",criticism,democracy,other,0.0,0.1,0.0,"[['mr. tsipras', 'person', '0.9'], ['mufti', 'group of people', '0.6'], ['greek people', 'group of people', '0.8'], ['greece', 'country', '0.7'], ['last summer', 'date', '0.6']]"
6,"But, friends, we have a duty to clarify some things about our national issues since we have opened this issue. Our movement, with a progressive and patriotic discourse, has stood at very critical moments. We put Cyprus in the European Union. With the Helsinki policy, we defined European Union-Turkey relations. But now that Turkey has no European prospects, what do we do? The whole political system, even if Kilicdaroglu and Erdogan were to come out, is directly challenging the sovereign rights of our country. And we keep hearing about armaments. We voted realistically to strengthen our country's deterrent power. We did not play populist games like Syriza, but until when will the arms rally continue? That is why PASOK's first priority is not this rally of competition with Turkey, but to stop the West from selling even one bullet to Turkey as long as it violates sovereign rights and does not respect good neighborly relations in Greece and Cyprus. The arms embargo is a top priority for a patriotic movement. Our partners must also understand why. Greece cannot pay billions of euros from the toil and sacrifice of the Greek people to guard the Euro-Turkish border, which is, of course, also Greek-Turkish. The same is true of other countries, Finland, Estonia, and Cyprus. What should we do? We must go further and further if we want a Europe of peoples and solidarity. We must stand up and play a leading role in the policy of Europe's single foreign policy, the Euroarmy, as with Frontex. The Greek borders must have a European army so that anyone who undermines good neighborly relations knows that they are not dealing with one or two peoples but with 27 peoples of the European Union. That is the big difference between our pro-Europeanism and the caresses that some people in Brussels give. We want Europe united, but with respect for the country in solidarity, not a Europe and a West that pampers Turkey and disregards the great weaknesses that exist in the European firmament. And I say this because after the experience of Ukraine, the ears of the European peoples are open to avoid a new adventure with revisionist leaders, as happened with Putin.","Φίλες και φίλοι, έχουμε χρέος όμως, μιας και ανοίξαμε το ζήτημα αυτό, να ξεκαθαρίσουμε κάποια πράγματα για τα εθνικά μας ζητήματα. Το κίνημά μας με λόγο προοδευτικό πατριωτικό έχει σταθεί σε πολύ κρίσιμες στιγμές. Εμείς βάλαμε την Κύπρο στην Ευρωπαϊκή Ένωση. Εμείς με την πολιτική του Ελσίνκι καθορίσαμε τις σχέσεις Ευρωπαϊκής Ένωσης-Τουρκίας, αλλά τώρα που δεν έχει καμία προοπτική ευρωπαϊκή η Τουρκία, τι κάνουμε; Όταν όλο το πολιτικό σύστημα ακόμη και αν έβγαινε ο Κιλιτσντάρογλου, και ο Ερντογάν αμφισβητούν ευθέως τα κυριαρχικά δικαιώματα της χώρας μας. Κι εμείς ακούμε συνεχώς για εξοπλισμούς. Εμείς ψηφίσαμε με ρεαλιστικό τρόπο την ενίσχυση της αποτρεπτικής δύναμης της χώρας μας. Δεν παίξαμε παιχνίδια λαϊκισμού όπως ο ΣΥΡΙΖΑ, αλλά ως πότε; Ως πότε θα συνεχίζεται το ράλι των εξοπλισμών; Γι αυτό, πρώτη προτεραιότητα του ΠΑΣΟΚ δεν είναι αυτό το ράλι ανταγωνισμού με την Τουρκία αλλά είναι να σταματήσει η Δύση να πουλά έστω και μια σφαίρα στην Τουρκία όσο αυτή καταπατά κυριαρχικά δικαιώματα και δεν σέβεται συνθήκες καλής γειτονίας στην Ελλάδα και στην Κύπρο. Το εμπάργκο όπλων είναι πρώτη προτεραιότητα για ένα πατριωτικό κίνημα. Γιατί άλλωστε πρέπει να καταλάβουν και οι εταίροι μας. Δεν μπορεί η Ελλάδα να πληρώνει δισεκατομμύρια ευρώ από τους κόπους και τις θυσίες του ελληνικού λαού για να φυλάσσουμε τα ευρωτουρκικά σύνορα που είναι βεβαίως και ελληνοτουρκικά. Το ίδιο συμβαίνει και με άλλες χώρες, τη Φιλανδία, την Εσθονία, την Κύπρο. Τι πρέπει να κάνουμε; Πρέπει να προχωρήσουμε παραιτέρω και παρακάτω αν θέλουμε την Ευρώπη των λαών και της αλληλεγγύης, πρέπει να σταθούμε όρθιοι και να πρωταγωνιστήσουμε στην πολιτική της ενιαίας εξωτερικής πολιτικής της Ευρώπης, του ευρωστρατού, όπως και με τη Frontex, τα ελληνικά σύνορα να έχουν ευρωπαϊκό στρατό για να γνωρίζει οποιοσδήποτε υπονομεύει τις συνθήκες καλής γειτονίας ότι δεν έχει απέναντί του ένα λαό ή 2 λαούς, αλλά 27 λαούς της Ευρωπαϊκής Ένωσης. Αυτή είναι η μεγάλη διαφορά του δικού μας φιλοευρωπαϊσμού από τα χάδια που κάνουν κάποιοι στις Βρυξέλλες. Εμείς θέλουμε την Ευρώπη ενωμένη αλλά με σεβασμό στη χώρα με αλληλεγγύη και όχι μια Ευρώπη και μια Δύση που θα χαϊδεύει την Τουρκία και θα περιφρονεί τις μεγάλες αδυναμίες που υπάρχουν στο ευρωπαϊκό στερέωμα. Και τα λέω αυτά, διότι μετά την εμπειρία της Ουκρανίας, τα αυτιά των ευρωπαϊκών λαών είναι ανοιχτά για να μην υπάρχει μια νέα περιπέτεια με αναθεωρητές ηγέτες, όπως έγινε με τον Πούτιν. ",political agenda,europe,other,-0.45,0.2,0.2,"[['kilicdaroglu', 'person', '0.5', 'erdogan', 'person', '0.5', 'pasok', 'organization', '0.5', 'syriza', 'organization', '0.5', 'greece', 'country', '1', 'cyprus', 'location', '1', 'turkey', 'country', '1', 'european union', 'organization', '1', 'helsinki', 'date', '1', 'west', 'location', '1', 'finland', 'country', '1', 'estonia', 'country', '1', 'frontex', 'organization', '1', 'brussels', 'location', '1', 'europe', 'organization', '1', 'euroarmy', 'organization', '1', 'ukraine', 'location', '1', 'putin', 'person', '1']]"
