id,text,text_el,is_criticism,topic-context,subtopic-context,sentiment,polarization-definition,populism-definition,ner-limited
9,"Let me pick out a few. I will make a special mention of the hospital, which I visited today, so that I can unveil the bust of Dimitris Kremastinos and at the same time commit that you will finally have a radiotherapy centre here in Rhodes. Its construction is under way immediately. Immediately. With funds from the Region and the Ministry of Health.New schools in your municipality. Kritinia and Gadoura dams. I just passed by a while ago -remember the visit to the National Theatre- it is being put out to tender immediately. Another of my commitments which is being put into practice.","Επιτρέψτε μου να ξεχωρίσω κάποια. Θα κάνω μια ειδική αναφορά στο νοσοκομείο, το οποίο επισκέφθηκα σήμερα, για να μπορέσω να αποκαλύψω την προτομή του Δημήτρη Κρεμαστινού και να δεσμευτώ ταυτόχρονα ότι θα αποκτήσετε επιτέλους ακτινοθεραπευτικό κέντρο εδώ στην Ρόδο. Η κατασκευή του δρομολογείται άμεσα. Άμεσα. Με πόρους της Περιφέρειας και του Υπουργείου Υγείας.Νέα σχολεία στον Δήμο σας. Φράγματα Κριτινίας και Γαδουρά. Πέρασα πριν από λίγο -θυμάστε την επίσκεψη στο Εθνικό Θέατρο- δημοπρατείται άμεσα. Άλλη μια δέσμευσή μου η οποία γίνεται πράξη.",political agenda,health,hospital privatization,1,0,0,"[['dimitris kremastinos', 'person', '1.0'], ['ministry of health', 'organization', '1.0'], ['rhodes', 'location', '1.0'], ['region', 'organization', '1.0'], ['kritinia', 'location', '1.0'], ['gadoura', 'location', '1.0'], ['national theatre', 'organization', '1.0']]"
10,"To add to these and the very important works that are being done throughout the Medieval City. The Ministry of Culture has a very important footprint here in the cultural legacy of Rhodes as a whole, the electrical interconnection of the islands, the waste management plants, with an important initiative of ""GR-eco Islands"". Very important things are happening in Halki and we are proving that the circular economy, renewable energy sources can ultimately benefit everyone, as the citizens of Halki have suddenly found that they are paying zero or very reduced electricity bills. This is the real benefit of the green transition and we can make it happen. And these are your, your local responses, Mr. Regional Governor, to the big projects that are going on everywhere, because, yes, Greece today has turned into a vast construction site.","Να προσθέσω σε αυτά και τα πολύ σημαντικά έργα τα οποία γίνονται σε όλη την Μεσαιωνική πόλη. Το Υπουργείο Πολιτισμού έχει ένα πολύ σημαντικό αποτύπωμα εδώ στην πολιτιστική παρακαταθήκη συνολικά της Ρόδου, την ηλεκτρική διασύνδεση των νησιών, τις μονάδες διαχείρισης απορριμμάτων, με σημαντικότατη πρωτοβουλία των «GR-eco Islands». Στη Χάλκη γίνονται πολύ σημαντικά πράγματα και αποδεικνύουμε πως η κυκλική οικονομία, οι ανανεώσιμες πηγές ενέργειας μπορούν τελικά να αποβούν προς όφελος όλων, καθώς διαπίστωσαν ξαφνικά οι δημότες της Χάλκης ότι πληρώνουν μηδενικούς ή πολύ μειωμένους λογαριασμούς ηλεκτρικού ρεύματος. Αυτό είναι το πραγματικό όφελος από την πράσινη μετάβαση και μπορούμε να το κάνουμε πράξη. Και αυτές είναι οι δικές σας, οι τοπικές σας απαντήσεις κ. Περιφερειάρχα στα μεγάλα έργα που γίνονται παντού, διότι, ναι, η Ελλάδα έχει μετατραπεί σήμερα σε ένα απέραντο εργοτάξιο.",political agenda,energy,other,0.45,0,0,"[['ministry of culture', 'organization', 'high probability'], ['rhodes', 'location', 'high probability'], ['gr-eco islands', 'organization', 'high probability'], ['halki', 'location', 'high probability'], ['greece', 'country', 'high probability']]"
11,"Everywhere I go I see projects that are being launched, projects that were stalled. Patras - Pyrgos in the Peloponnese. The BOAK in Crete, this crucial road axis. The other important roads, the E65, I am coming now from Thessaly. But, I want to make a specific reference to the way I understand the dividend of development to be shared by all.","Όπου κι αν πάω βλέπω έργα τα οποία δρομολογούνται, έργα τα οποία ήταν κολλημένα. Το Πάτρα – Πύργος στην Πελοπόννησο. Ο ΒΟΑΚ στην Κρήτη, αυτός ο τόσο κρίσιμος οδικός άξονας. Οι υπόλοιποι σημαντικοί δρόμοι, ο Ε65, έρχομαι τώρα από τη Θεσσαλία. Αλλά, θέλω να κάνω μία ειδική αναφορά στον τρόπο με τον οποίον αντιλαμβάνομαι το μέρισμα της ανάπτυξης να επιμερίζεται σε όλους.",political agenda,infrastructure,other,0,0,0,"[['patras', 'location', '0.6'], ['pyrgos', 'location', '0.6'], ['peloponnese', 'location', '0.6'], ['boak', 'organization', '0.6'], ['crete', 'location', '0.6'], ['e65', 'organization', '0.6'], ['thessaly', 'location', '0.6']]"
12,"I want to welcome especially here from Rhodes the new collective agreement signed with the hotels of Rhodes, with wages much higher than the national agreement. A contract, I stress, that the Ministry of Labour has declared compulsory, which now means that it is binding on all businesses. I think it is very important that a receptionist, a chambermaid, have a salary that is close to 1,200 euros per month and that is without bonuses. Because, yes, that is how salaries are ultimately increased. As unemployment decreases, as turnover increases, the response of businesses will be better wages for everyone. You can't have growth without boosting workers' incomes. And you here in Rhodes have begun to put that into practice.","Θέλω να χαιρετίσω ειδικά εδώ από τη Ρόδο τη νέα συλλογική σύμβαση που υπογράφηκε με τα ξενοδοχεία της Ρόδου, με αμοιβές πολύ μεγαλύτερες από την εθνική σύμβαση. Μία σύμβαση, τονίζω, που το Υπουργείο Εργασίας κήρυξε υποχρεωτική, το οποίο σημαίνει πια ότι δεσμεύει όλες τις επιχειρήσεις. Nομίζω ότι είναι πολύ σημαντικό ένας receptionist, μια καμαριέρα, να έχουν μισθό ο οποίος είναι κοντά στα 1.200 ευρώ το μήνα και αυτό χωρίς επιδόματα. Διότι, ναι, έτσι τελικά αυξάνονται οι μισθοί. Όσο μειώνεται η ανεργία, όσο αυξάνεται ο τζίρος, η απάντηση των επιχειρήσεων θα είναι καλύτεροι μισθοί για όλους. Δεν γίνεται ανάπτυξη χωρίς να τονώνουμε το εισόδημα των εργαζόμενων. Κι εσείς εδώ στη Ρόδο έχετε αρχίσει να το κάνετε πράξη.",political agenda,employment,workers' rights,0.9,0,0,"[['rhodes', 'location', '1.0'], ['ministry of labour', 'organization', '1.0'], ['national agreement', 'organization', '0.7'], ['1', '200 euros', 'date', '1.0']]"
13,"I am here with you today, friends, at this very beautiful gathering to share with you a few thoughts for the day ahead. Because, you know, elections are always about the future. Our credibility is judged in practice. You know better than I do how consistent we have been in what we have said to you.","Είμαι σήμερα εδώ μαζί σας, φίλες και φίλοι, σε αυτή την πολύ όμορφη συγκέντρωση για να μοιραστώ μαζί σας λίγες σκέψεις για την επόμενη μέρα. Γιατί, ξέρετε, οι εκλογές είναι πάντα για το μέλλον. Η δική μας αξιοπιστία κρίθηκε στην πράξη. Εσείς γνωρίζετε καλύτερα από εμένα πόσο συνεπείς ήμασταν σε αυτά τα οποία σας είπαμε.",political agenda,elections,election spending,0,0,0,"[['i', 'person', '0.9'], ['friends', 'group of people', '0.7'], ['elections', 'political party', '0.6'], ['future', 'date', '0.6']]"
14,"I have mentioned this only to emphasise that the relationship of trust that we have established, the contract of trust that we have signed, is still in place and therefore what I am going to tell you and what we want to do over the next four years, I am absolutely convinced that we can put it into practice.","Τα ανέφερα μόνο και μόνο για να τονίσω ότι η σχέση εμπιστοσύνης την οποία έχουμε δρομολογήσει, το συμβόλαιο εμπιστοσύνης το οποίο έχουμε υπογράψει, εξακολουθεί να είναι ενεργό και γι’ αυτό αυτά τα οποία θα σας πω και που θέλουμε να κάνουμε τα επόμενα τέσσερα χρόνια, είμαι απολύτως πεπεισμένος ότι μπορούμε να τα κάνουμε πράξη.",political agenda,elections,other,0.8,0,0,[]
15,"Just as I know that alongside successes there have always been gaps and mistakes and weaknesses. But I understand the responsibility of the leader as an obligation to assume this responsibility.  Whenever mistakes were made, I stood before you. I said to you ""I take responsibility and I am here to correct them"". I did not hide them under the carpet, nor did I make a fuss in front of the cameras to shrug off any responsibility. The economy, for example. Sure there were tax cuts, there were tax increases, but I know that wages remain low and inflation is still gnawing away at income. The National Health System has withstood the pandemic. Today is World Nurses Day. A big thank you to all NHS workers who gave their all to keep society upright and healthy during the pandemic years. We have made strides, but there are still shortages here in your hospital and health centres. We still have delays in operations, in appointments. The same is happening in the state. Gov.gr has been a tremendous achievement, you know that better than I do. All Greek citizens today save time and money without having to wait in queues. The EFKA now gives out pensions in two months where it used to take two and three years. But I have no illusions. I know that the deep state is lurking. There are still attitudes of 'pampering' and indifference. They've hurt us too much, they have to change. The same in education. We've already made 25,000 permanent appointments, 4,000 more are coming this year, and soon all our schools will be teaching with interactive whiteboards. This is huge progress in the way we teach our children. But the steps that have been taken must continue, must be accelerated even further. Because the needs on these two social fronts, education and health, never stop. Whatever shortcomings have been identified must become the priorities of our second four-year term. Old experiences should be combined with new expectations, so that the new programme we have presented for a productive, social, just, digital, green and strong Greece can become a reality.","Όπως ξέρω ότι δίπλα στις επιτυχίες εντοπίστηκαν πάντα και κενά και λάθη και αδυναμίες. Αντιλαμβάνομαι, όμως, την ευθύνη του ηγέτη ως υποχρέωση ανάληψης αυτή της ευθύνης.  Όποτε έγιναν λάθη, στάθηκα μπροστά σας. Σας είπα «αναλαμβάνω την ευθύνη και είμαι εδώ για να τα διορθώσω». Δεν τα έκρυψα κάτω από το χαλί, ούτε έστηνα φιέστες μπροστά σε κάμερες για να αποποιηθώ την όποια ευθύνη. Η οικονομία για παράδειγμα. Βεβαίως υπήρξαν φοροελαφρύνσεις, δόθηκαν αυξήσεις, όμως το ξέρω ότι οι μισθοί παραμένουν χαμηλοί και ο πληθωρισμός ροκανίζει ακόμα το εισόδημα. Το Εθνικό Σύστημα Υγείας άντεξε στην πανδημία. Σήμερα είναι Παγκόσμια Ημέρα Νοσηλευτών και Νοσηλευτριών. Ένα μεγάλο ευχαριστώ σε όλους τους εργαζόμενους του ΕΣΥ, που έδωσαν τα πάντα για να κρατήσουν την κοινωνία όρθια και υγιή τα χρόνια της πανδημίας. Έχουμε κάνει βήματα, αλλά υπάρχουν ακόμα ελλείψεις και εδώ στο νοσοκομείο σας και στα κέντρα υγείας. Έχουμε ακόμα καθυστερήσεις στις εγχειρήσεις, στα ραντεβού. Το ίδιο συμβαίνει και στο κράτος. Το gov.gr ήταν μία τεράστια κατάκτηση, το ξέρετε καλύτερα από μένα. Όλοι οι Έλληνες πολίτες σήμερα γλιτώνουν χρόνο και χρήμα χωρίς να χρειάζεται να περιμένουν στις ουρές. Ο ΕΦΚΑ βγάζει πια συντάξεις σε δύο μήνες από κει που ήθελε δύο και τρία χρόνια. Δεν έχω, όμως, αυταπάτες. Ξέρω ότι το βαθύ κράτος καραδοκεί. Υπάρχουν ακόμα νοοτροπίες «ωχαδερφισμού», αδιαφορίας. Μας πόνεσαν πολύ, πρέπει να αλλάξουν. Το ίδιο και στην Παιδεία. Κάναμε ήδη 25.000 μόνιμους διορισμούς, ακολουθούν άλλοι 4.000 αυτό το χρόνο, και σύντομα σε όλα τα σχολεία μας η διδασκαλία θα γίνεται με διαδραστικούς πίνακες. Τεράστια πρόοδος αυτή, στον τρόπο με τον οποίο μαθαίνουμε τα παιδιά μας. Όμως τα βήματα που έχουν γίνει πρέπει να συνεχιστούν, πρέπει να επιταχυνθούν ακόμα περισσότερο. Γιατί οι ανάγκες στα δύο αυτά κοινωνικά μέτωπα, στην παιδεία και την υγεία, δεν σταματούν ποτέ. Όποιες ελλείψεις εντοπίστηκαν πρέπει να γίνουν οι προτεραιότητες της δεύτερης τετραετίας μας. Παλιές εμπειρίες να ενωθούν με νέες προσδοκίες, ώστε το νέο πρόγραμμα το οποίο έχουμε παρουσιάσει για μία Ελλάδα παραγωγική, κοινωνική, δίκαιη, ψηφιακή, πράσινη και ισχυρή, να μπορεί να γίνει πράξη.",political agenda,health,other,0,0,0,"[['national health system', 'organization', '0.8'], ['world nurses day', 'date', '0.8'], ['nhs workers', 'group of people', '0.9'], ['gov.gr', 'organization', '0.8'], ['greek citizens', 'group of people', '0.8'], ['efka', 'organization', '0.8'], ['greek', 'country', '1.0'], ['education', 'organization', '0.7']]"
16,"Let me open a parenthesis here, friends. Our programme is fully costed. At the debate I issued a challenge - an invitation to all the political leaders, a challenge that goes without saying: send your programmes either to the General Accounting Office of the State or to the Bank of Greece, so that we can cost them, so that we can see who is finally talking with real numbers and who is giving you kelp for silk ribbons.","Να ανοίξω εδώ μία παρένθεση, φίλες και φίλοι. Το δικό μας πρόγραμμα είναι πλήρως κοστολογημένο. Στο ντιμπέιτ απηύθυνα μία πρόκληση - πρόσκληση προς όλους τους πολιτικούς αρχηγούς, αυτονόητη: στείλτε τα προγράμματά σας είτε στο Γενικό Λογιστήριο του κράτους, είτε στην Τράπεζα της Ελλάδος, να τα κοστολογήσουμε, να δούμε ποιος επιτέλους μιλάει με πραγματικούς αριθμούς και ποιος σας τάζει φύκια για μεταξωτές κορδέλες.",political agenda,elections,other,,0,0,"[['general accounting office', 'organization', '0.8'], ['bank of greece', 'organization', '0.8'], ['state', 'location', '0.6']]"
17,"We have yet to get an answer from SYRIZA, because we know very well that such a costing will reveal their monstrous lies and the extent of their deception of the Greek people. But I will say it again from Rhodes, 2023 is not 2015. We have seen the work, we do not want to see it again, Greece is looking only forward and does not want to turn back.","Από τον ΣΥΡΙΖΑ ακόμα να έχουμε απάντηση, επειδή γνωρίζουμε πολύ καλά ότι μία τέτοια κοστολόγηση θα αποκαλύψει τα τερατώδη ψέματά τους και το βαθμό της εξαπάτησης του ελληνικού λαού. Αλλά θα το ξαναπώ κι εδώ από τη Ρόδο, το 2023 δεν είναι 2015. Το έχουμε δει το έργο, δε θέλουμε να το ξαναδούμε, η Ελλάδα κοιτάει μόνο μπροστά και δε θέλει να γυρίσει πίσω.",political agenda,elections,other,0.7,0.6,0,"[['syriza', 'organization', '0.98'], ['greek people', 'group of people', '0.75'], ['rhodes', 'location', '0.90'], ['greece', 'country', '0.75'], ['2023', 'date', '0.95'], ['2015', 'date', '0.70']]"
18,"Of the objectives of our programme, I single out the one I spoke to you about before as the crowning goal: better incomes, better wages. The minimum wage will reach EUR 950 at the end of the four years, including all the related benefits. The average wage could reach EUR 1 500. We want to support families with children. The tax-free allowance is increased by EUR 1 000 for all families with children, and we increase family allowances in the public sector.","Από τους στόχους του προγράμματός μας ξεχωρίζω ως κορωνίδα αυτόν για τον οποίο σας μίλησα πριν: καλύτερα εισοδήματα, καλύτεροι μισθοί. Ο κατώτατος μισθός θα φτάσει τα 950 ευρώ στο τέλος της τετραετίας, συμπαρασύροντας μαζί και όλα τα σχετικά επιδόματα. Ο μέσος μισθός μπορεί να φτάσει τα 1.500 ευρώ. Θέλουμε να στηρίξουμε τις οικογένειες με παιδιά. Το αφορολόγητο αυξάνεται κατά 1.000 ευρώ για όλες τις οικογένειες με παιδιά, και αυξάνουμε τα οικογενειακά επιδόματα στο δημόσιο.",political agenda,employment,wages,0.78,0,0,"[['1. eur', 'organization', '0.8'], ['2. eur 950', 'organization', '0.9'], ['3. eur 1 500', 'organization', '0.9'], ['4. public sector', 'organization', '0.6'], ['5. children', 'group of people', '0.7']]"
19,"We reduce the presumption of living expenses by 30%. We give an additional 10% discount on ENFIA for all homes that were or will be insured against natural disasters. Because Climate Change is with us and we must anticipate in advance how we will protect our property. And we are phasing out the last memorandum tax, which is the business tax. We're getting that done as well.","Μειώνουμε τα τεκμήρια διαβίωσης κατά 30%. Δίνουμε πρόσθετη έκπτωση στον ΕΝΦΙΑ 10% για όλα τα σπίτια που ήταν ή θα είναι ασφαλισμένα από φυσικές καταστροφές. Γιατί η Κλιματική αλλαγή είναι μαζί μας και πρέπει να προβλέπουμε από πριν πώς θα προστατεύουμε την περιουσία μας. Και καταργούμε σταδιακά τον τελευταίο μνημονιακό φόρο, που είναι το τέλος επιτηδεύματος. Τελειώνουμε και με αυτό.",political agenda,housing,natural disasters,0.51,0,0,"[['enfia', 'organization', '0.5'], ['climate change', 'organization', '0.7'], ['memorandum tax', 'organization', '0.4']]"
20,"But in order to achieve all this, friends, we need to do what is happening here in Rhodes, in the Dodecanese: we need investment, we need high growth - it can exceed 3% on average. Unemployment will soon fall below 10% and private investment can increase by 70% in four years. So can public investment. Already, as I said, the whole of Greece has become a vast construction site. I was told, my dear George (Chatzimarkos), Mr. Regional Governor, by my friend Regional Governor Kostas Agorastos in Thessaly where I was, ""once, four years ago,"" he said, ""we were looking for projects. Now we are looking to find the companies that will do the projects that we have put out to tender."" This is the best indication of progress we have achieved over the years.","Για να τα πετύχουμε όλα αυτά όμως, φίλες και φίλοι, χρειάζεται να κάνουμε αυτό το οποίο γίνεται εδώ στη Ρόδο, στα Δωδεκάνησα: χρειαζόμαστε επενδύσεις, χρειαζόμαστε υψηλή ανάπτυξη - μπορεί να ξεπεράσει το 3% μεσοσταθμικά. Η ανεργία θα πέσει σύντομα κάτω από το 10% και οι ιδιωτικές επενδύσεις μπορούν να αυξηθούν κατά 70% μέσα σε τέσσερα χρόνια. Το ίδιο και οι δημόσιες επενδύσεις. Ήδη, όπως σας είπα, όλη η Ελλάδα έχει μετατραπεί σε ένα απέραντο εργοτάξιο. Μου έλεγε, αγαπητέ μου Γιώργο (Χατζημάρκο), κ. Περιφερειάρχη, ο φίλος Περιφερειάρχης Κώστας Αγοραστός στη Θεσσαλία που ήμουν, «κάποτε, πριν από τέσσερα χρόνια -μου λέει- ψάχναμε να βγουν έργα. Τώρα ψάχνουμε να βρούμε τις εταιρίες που θα κάνουν τα έργα τα οποία έχουμε δημοπρατήσει». Αυτή είναι η καλύτερη ένδειξη προόδου που έχουμε πετύχει όλα αυτά τα χρόνια.",political agenda,economy,investments,0.55,0,0,"[['rhodes', 'location', '0.8'], ['dodecanese', 'location', '0.7'], ['greece', 'country', '0.8'], ['george chatzimarkos', 'person', '0.6'], ['kostas agorastos', 'person', '0.6'], ['thessaly', 'location', '0.7'], ['political party', 'none'], ['organization', 'none'], ['group of people', 'none'], ['date', 'none']]"
