id,text,text_el,is_criticism,topic-context,subtopic-context,sentiment,polarization-definition,populism-definition,ner-limited
21,"I have already spoken to you about social Greece. Two main priorities: health and education. We cannot have patients suffering in corridors, waiting months for an operation. I am committed to rebuilding all the emergency departments in hospitals. We will rebuild 156 health centres from scratch. But the most important commitment: yes, we will hire 10,000 nurses and doctors to permanently fill the gaps that exist And we will find a way through telemedicine and through increased incentives to be able to staff especially our islands, I know there are difficulties today to find medical personnel who can serve our islanders, especially on the smaller islands.","Για την κοινωνική Ελλάδα σας μίλησα ήδη. Δύο βασικές προτεραιότητες: υγεία και παιδεία. Δεν γίνεται να ταλαιπωρούνται ασθενείς σε διαδρόμους, να περιμένουν μήνες για μια εγχείρηση. Έχω δεσμευτεί ότι  θα ανακατασκευάσουμε όλα τα τμήματα επειγόντων περιστατικών στα νοσοκομεία. Θα ξαναφτιάξουμε από την αρχή 156 κέντρα υγείας. Αλλά η πιο σημαντική δέσμευση: ναι, θα προσλάβουμε 10.000 νοσηλευτές και γιατρούς ώστε να καλύψουμε οριστικά τα κενά τα οποία υπάρχουν Και θα βρούμε τρόπο μέσω τηλεϊατρικής και μέσω αυξημένων κινήτρων να μπορέσουμε να στελεχώσουμε ειδικά τα νησιά μας, ξέρω ότι υπάρχουν δυσκολίες σήμερα να βρούμε ιατρικό προσωπικό το οποίο να μπορεί να εξυπηρετεί τους νησιώτες μας, ειδικά στα πιο μικρά νησιά.",political agenda,health,privatization of healthcare,0.5,0,0,"[['greece', 'location', '1.0'], ['156 health centres', 'organization', '0.6'], ['10', '000 nurses and doctors', 'group of people', '0.9']]"
22,"And one more word, which I always do, because I attach particular importance to screening. Health, you know, is not only taking care of the patient when he or she gets sick, it is also prevention. See the 'Fofi Gennimata' programme. More than 130,000 women have already had preventive mammograms. We went to them, the state went to them. It sent them a message and told them: ""you have a free benefit, go to a public or private health centre, get a mammogram"". Already 7,000 women have been identified with early breast cancer, with a very, very good chance of getting well. Preventive screening saves lives. A holistic approach to health does not start and end at the hospital; we will give 500 million for such screenings. It is very, very important that this programme continues and is completed with preventive screening for all diseases. We will save many lives in this way.","Και μια κουβέντα ακόμα την οποία την κάνω πάντα, γιατί αποδίδω ξεχωριστή σημασία στις προληπτικές εξετάσεις. Υγεία, ξέρετε, δεν είναι μόνο η φροντίδα του ασθενούς όταν αυτός αρρωστήσει, είναι και η πρόληψη. Δείτε το Πρόγραμμα «Φώφη Γεννηματά». Ήδη παραπάνω από 130.000 γυναίκες έχουν κάνει προληπτικές μαστογραφίες. Εμείς πήγαμε, το κράτος πήγε σε αυτές. Τους έστειλε ένα μήνυμα και τους είπε: «έχετε μία δωρεάν παροχή, πηγαίντε σε ένα δημόσιο ή ιδιωτικό κέντρο υγείας, κάντε μαστογραφία». Ήδη 7.000 γυναίκες έχουν εντοπιστεί με πρώιμο καρκίνο του μαστού, με πάρα πολύ καλές πιθανότητες να γίνουν καλά. Οι προληπτικές εξετάσεις σώζουν ζωές. Η ολιστική προσέγγιση της υγείας δεν αρχίζει και τελειώνει στο νοσοκομείο, 500 εκατομμύρια θα δώσουμε για τέτοιου είδους εξετάσεις. Είναι πάρα πολύ σημαντικό αυτό το πρόγραμμα να συνεχιστεί και να ολοκληρωθεί με προληπτικές εξετάσεις για όλα τα νοσήματα. Θα σώσουμε πολλές ζωές με αυτό τον τρόπο.",political agenda,health,other,0.8,0,0,"[['fofi gennimata', 'organization', '0.5'], ['130', '000 women', 'group of people', '0.7'], ['7', '000 women', 'group of people', '0.7'], ['the state', 'organization', '0.5'], ['public or private health centre', 'organization', '0.5'], ['early breast cancer', 'location', '0.5'], ['hospital', 'location', '0.5'], ['500 million', 'date', '0.7']]"
23,"On education, let me just say that it is my commitment to significantly increase the number of Model and Experimental schools, with teachers who will be better paid. Focusing on vocational education, tourism education. We already have shortages - you know better - in basic tourism professions. We will put the emphasis on tourism education. We will give young people new professional outlets for well-paid jobs. We will build a lot of new student housing. And from our universities - there we will not back down - we will eradicate all the hotbeds of lawlessness. We are with the libraries, not the sledgehammers. We want universities to be centres of education, of excellence, of creative dialogue, and not abbeys to which the various grocers will resort.","Για την Παιδεία να πω μόνο ότι αποτελεί δέσμευσή μου να αυξήσουμε σημαντικά τον αριθμό των Πρότυπων και των Πειραματικών σχολείων, με καθηγητές που θα έχουν καλύτερες αμοιβές. Δίνοντας βάρος στην επαγγελματική εκπαίδευση, στην τουριστική εκπαίδευση. Έχουμε ήδη ελλείψεις -το ξέρετε καλύτερα- σε βασικά τουριστικά επαγγέλματα. Θα δώσουμε βάρος στην τουριστική εκπαίδευση. Θα δώσουμε νέες επαγγελματικές διεξόδους στα νέα παιδιά για καλοπληρωμένες δουλειές. Θα κατασκευάσουμε πολλές νέες φοιτητικές στέγες. Και από τα πανεπιστήμιά μας -εκεί δεν θα κάνουμε πίσω- θα ξεριζώσουμε όλες τις εστίες ανομίας. Εμείς είμαστε με τις βιβλιοθήκες και όχι με τις βαριοπούλες. Θέλουμε τα πανεπιστήμια κέντρα εκπαίδευσης, αριστείας, δημιουργικού διαλόγου και όχι άβατα στα οποία θα καταφεύγουν οι διάφοροι μπαχαλάκηδες.",political agenda,education,other,0.7,0,0,"[['model and experimental schools', 'organization', '1.0'], ['teachers', 'group of people', '0.8'], ['vocational education', 'organization', '1.0'], ['tourism education', 'organization', '1.0'], ['tourism professions', 'occupation', '0.8'], ['young people', 'group of people', '0.8'], ['student housing', 'location', '0.8'], ['universities', 'organization', '1.0'], ['libraries', 'organization', '0.8']]"
24,"We have a lot of young people among us and the first thing the new couples tell me is: ""how am I going to get a house? Why should I be doomed or condemned to live in rent or worse, live with my parents until I'm 30?"" We've come up with an answer to this problem: for the first time, the My House programme gives young people significant financial incentives to own a home with a subsidised loan with a payment, mind you, much lower than what you would pay for a rental. Twenty-thousand of our young people will be able to own a home immediately with this program. Social consideration will follow. Do you know how much land we have right now, public land, that is essentially undeveloped? Why not give it to the private sector to build apartments? The developer will keep some and we will develop the rest so that we can give cheap houses to our youth. All of this is possible. We can do it.  These are not science fiction plans.","Έχουμε ανάμεσά μας πολλούς νέους και το πρώτο πράγμα που μου λένε τα νέα ζευγάρια είναι: «πώς θα αποκτήσω σπίτι; Γιατί πρέπει να είμαι καταδικασμένος ή καταδικασμένη να ζω στο ενοίκιο ή να ζω, ακόμα χειρότερα, με τους γονείς μου μέχρι τα 30». Ήρθαμε και δώσαμε μία απάντηση στο πρόβλημα αυτό: το πρόγραμμα «Σπίτι μου» δίνει για πρώτη φορά σημαντικά οικονομικά κίνητρα σε νέους να αποκτήσουν σπίτι με ένα επιδοτούμενο δάνειο με δόση, προσέξτε, πολύ μικρότερη από αυτή που θα πληρώνατε για ένα ενοίκιο. Είκοσι-χιλιάδες νέοι μας θα μπορέσουν να αποκτήσουν άμεσα σπίτι με αυτό το πρόγραμμα. Θα ακολουθήσει η κοινωνική αντιπαροχή. Ξέρετε πόσες εκτάσεις έχουμε αυτή τη στιγμή, δημόσιες, οι οποίες ουσιαστικά είναι ανεκμετάλλευτες; Γιατί να μην τις δώσουμε στον ιδιωτικό τομέα να κατασκευαστούν διαμερίσματα; Θα κρατήσει ο κατασκευαστής κάποια και εμείς θα αξιοποιήσουμε τα υπόλοιπα για να μπορέσουμε να δώσουμε φθηνά σπίτια στη νεολαία μας. Όλα αυτά είναι εφικτά. Μπορούμε να τα κάνουμε.  Δεν είναι σχέδια επιστημονικής φαντασίας.",political agenda,housing,affordable housing,0.8,0,0,"[['my house programme', 'organization', '1.0'], ['twenty-thousand', 'number', '1.0'], ['youth', 'group of people', '1.0']]"
25,"For a fair Greece I will say only two words for the weakest. Because a lady came to me and said, the minimum guaranteed income, our policy, is increasing by 8% and it is still increasing. It is our obligation, you know, from the social dividend, from the wealth we create, to always support the weakest. This is the legacy of the great party founded by Constantine Karamanlis. The social market economy. There is no growth without prosperity and there is no growth that does not at the same time shrink social inequalities.","Για τη δίκαιη Ελλάδα θα πω μόνο δυο κουβέντες για τους πιο αδύναμους. Γιατί ήρθε και με βρήκε μία κυρία και μου είπε, το Ελάχιστο Εγγυημένο Εισόδημα, δική μας πολιτική, αυξάνεται κατά 8% και εξακολουθεί να αυξάνεται. Είναι υποχρέωσή μας, ξέρετε, από το κοινωνικό μέρισμα, από τον πλούτο που δημιουργούμε, να στηρίζουμε πάντα τους πιο αδύναμους. Αυτή είναι η παρακαταθήκη της μεγάλης παράταξης που ίδρυσε ο Κωνσταντίνος Καραμανλής. Της κοινωνικής οικονομίας της αγοράς. Δεν υπάρχει ανάπτυξη χωρίς ευημερία και δεν υπάρχει ανάπτυξη που ταυτόχρονα δεν συρρικνώνει τις κοινωνικές ανισότητες.",political agenda,social state,other,0.5,0.1,0.2,"[['greece', 'location', '1.0'], ['lady', 'person', '0.9'], ['constantine karamanlis', 'person', '0.8'], ['social market economy', 'organization', '0.7']]"
26,"And of course, people with disabilities, I am particularly sensitive to this because of my mother, Marika Mitsotakis, who was the first to fight for the de-vitalisation of disability and I know that among us there are many friends of Constantine and Marika Mitsotakis. Because my father and my mother had many friends here in Rhodes. And I felt it was my duty to implement one of the flagship programmes, the Personal Assistant, and I thought it was our duty to be the ones to implement it. Do you know what it is for a person with a disability to have a person by their side for 8, 9, 10 hours a day? To be able to accompany them to their work, in their leisure time? To be able to free the family from the care and the need to be there for the disabled person all the time?","Και βέβαια, τα Άτομα με Αναπηρία, έχω ιδιαίτερη ευαισθησία σε αυτό λόγω της μητέρας μου, της Μαρίκας Μητσοτάκη, η οποία έδωσε πρώτη τον αγώνα για την αποθυματοποίηση της αναπηρίας και ξέρω ότι ανάμεσα μας είναι και πολλοί φίλοι του Κωνσταντίνου και της Μαρίκας Μητσοτάκη. Διότι είχαν πολλούς φίλους ο πατέρας μου και η μητέρα μου, εδώ, στην Ρόδο. Και θεώρησα χρέος μου ένα από τα εμβληματικά προγράμματα, τον Προσωπικό Βοηθό, να είμαστε εμείς αυτοί που θα το υλοποιήσουμε. Ξέρετε τι είναι για ένα άτομο με αναπηρία να έχει έναν άνθρωπο δίπλα του για 8, 9, 10 ώρες την ημέρα; Να μπορεί να τον συνοδεύει στην δουλειά του, στον ελεύθερο χρόνο του; Να μπορεί να αποδεσμεύεται η οικογένεια από την φροντίδα και από την ανάγκη να είναι δίπλα συνέχεια στο άτομα με αναπηρία;",political agenda,health,other,0.75,0,0,"[['1. marika mitsotakis', 'person', '1.0'], ['2. constantine and marika mitsotakis', 'group of people', '1.0'], ['3. rhodes', 'location', '1.0'], ['4. personal assistant', 'organization', '1.0'], ['5. family', 'group of people', '0.5'], ['6. disabled person', 'group of people', '0.5']]"
27,"These are real social breakthroughs for a genuine welfare state. And I will tell you only one thing about the state, to which I will not back down: evaluation everywhere and for everyone. I repeat: evaluation everywhere and for everyone. Good employees must be rewarded for their performance and weaknesses must be remedied.","Αυτές είναι πραγματικές κοινωνικές τομές για ένα ουσιαστικό κοινωνικό κράτος. Και για το κράτος ένα πράγμα θα σας πω μόνο, στο οποίο δεν κάνω πίσω: αξιολόγηση παντού και για όλους. Το επαναλαμβάνω, αξιολόγηση παντού και για όλους. Οι καλοί υπάλληλοι πρέπει να επιβραβεύονται για τις επιδόσεις τους και οι αδυναμίες πρέπει να θεραπεύονται.",political agenda,public sector,other,0.9,0,0,"[['1. welfare state', 'organization', '0.75'], ['2. employees', 'group of people', '0.6']]"
28,"We have talked about green Greece many times, especially on the small islands. We can put it into practice much faster. We will generate much more electricity from the sun and the wind - good time today, look what a beautiful sunny day with lots of wind. Think how much more electricity we can produce and how much less gas we need to import. Isn't that right? Because seven billion is what we all paid for gas imports. Never mind that we were geopolitically dependent on anyone who threatened to cut off our natural gas. We can provide cheap and clean energy for everyone. DOE programs are already running. You can see the great response to programs like Save Money, Change Water Heaters. There is a great demand. Why? Because this is how your own energy costs are ultimately reduced.","Για την πράσινη Ελλάδα τα έχουμε πει πολλές φορές, κατ’ εξοχήν στα μικρά νησιά. Μπορούμε να την κάνουμε πράξη πολύ πιο γρήγορα. Θα παράγουμε πολύ περισσότερο ρεύμα από τον ήλιο και τον άνεμο - καλή ώρα σήμερα, δείτε τι ωραία ηλιόλουστη μέρα με πολύ άνεμο. Σκεφτείτε πόσο παραπάνω ρεύμα μπορούμε να παράγουμε και πόσο λιγότερο φυσικό αέριο χρειάζεται να εισάγουμε. Έτσι δεν είναι; Γιατί επτά δισεκατομμύρια πληρώσαμε όλοι μας για εισαγωγές φυσικού αερίου. Αφήστε που ήμασταν γεωπολιτικά εξαρτημένοι από τον καθένα, ο οποίος μας απειλούσε ότι θα κόψει το φυσικό αέριο. Μπορούμε να παρέχουμε φθηνή και καθαρή ενέργεια για όλους. Τα προγράμματα του Υπουργείου Περιβάλλοντος τρέχουν ήδη. Βλέπετε την μεγάλη ανταπόκριση που υπάρχει σε προγράμματα όπως το «Εξοικονομώ», το «Αλλάζω Θερμοσίφωνα». Μεγάλη ζήτηση. Γιατί; Γιατί με αυτόν τον τρόπο μειώνεται, τελικά, το δικό σας ενεργειακό κόστος.",political agenda,energy,green energy,,0,0,"[['greece', 'location', '1.0'], ['islands', 'location', '1.0'], ['sun', 'date', '1.0'], ['wind', 'date', '1.0'], ['gas', 'date', '1.0'], ['doe', 'organization', '1.0'], ['save money', 'organization', '1.0']]"
29,"And we will resolve all the outstanding issues we have with the past, waste management, waste water treatment centres. We have secured funding for all of this so that we can really move to a Greece that protects this amazing environment, which we have an obligation to pass on to future generations.","Και θα λύσουμε όλες τις εκκρεμότητες που έχουμε με το παρελθόν, διαχείρισης αποβλήτων, κέντρα επεξεργασίας λυμάτων. Για όλα αυτά έχουμε εξασφαλισμένη χρηματοδότηση για να μπορέσουμε πραγματικά να περάσουμε σε μια Ελλάδα η οποία προστατεύει αυτό το καταπληκτικό περιβάλλον, που έχουμε εμείς υποχρέωση να παραδώσουμε έτσι όπως είναι, στις επόμενες γενιές.",political agenda,environment,other,0.8,0,0,"[['greece', 'location', '1.0']]"
30,"Finally, I have already told you about a strong Greece. The arms programmes will continue and the fence on Evros will be built. Our Coast Guard will continue to be equipped. I was in Lesvos today and I visited one of the new vessels that we have already received, with many capabilities. Thermal cameras allow us to see exactly what is happening at night. We have other vessels that we will receive and important equipment projects that will be completed.","Για την ισχυρή Ελλάδα, τέλος, σας τα είπα ήδη. Τα εξοπλιστικά προγράμματα θα συνεχιστούν και ο φράχτης στον Έβρο θα κατασκευαστεί. Το Λιμενικό μας θα συνεχίσει να εξοπλίζεται. Ήμουν σήμερα στη Λέσβο και επισκέφτηκα ένα από τα καινούργια σκάφη τα οποία έχουμε ήδη παραλάβει, με πολλές δυνατότητες. Θερμικές κάμερες μας επιτρέπουν να βλέπουμε ακριβώς τι γίνεται τη νύχτα. Έχουμε και άλλα σκάφη τα οποία θα παραλάβουμε και σημαντικά εξοπλιστικά προγράμματα που θα ολοκληρωθούν.",political agenda,national security,defense spending,0.6,0,0,"[['greece', 'country', '1.0'], ['evros', 'location', '1.0'], ['coast guard', 'organization', '1.0'], ['lesvos', 'location', '1.0']]"
31,"Let me also say a word about our need to explore our own natural wealth. For the first time in ten years, hydrocarbon exploration is taking place southwest of Crete and if there are exploitable deposits, we will be able to produce our own natural gas.",Να πω και μια κουβέντα για τη δική μας ανάγκη να εξερευνήσουμε τον δικό μας φυσικό πλούτο. Για πρώτη φορά μετά από δέκα χρόνια γίνονται έρευνες υδρογονανθράκων νοτιοδυτικά της Κρήτης και αν υπάρχουν αξιοποιήσιμα κοιτάσματα θα μπορέσουμε να παράγουμε εμείς το δικό μας φυσικό αέριο.,political agenda,energy,,0.4,0,0,"[['crete', 'location', '0.9'], ['greece', 'country', '0.7'], ['ten years', 'date', '0.6']]"
32,"And I don't even think there is a better time and place to remind you that elections are not only held in Greece. In two days they are also taking place in Turkey. The result of our ballot box will therefore also be a message to the other side. The result must exude stability and confidence. At the same time, however, it must also emphatically declare our own will, that the Greeks want a firm and experienced hand at the helm of the country.","Και δεν νομίζω μάλιστα ότι υπάρχει καλύτερος χρόνος και τόπος να θυμίσω ότι εκλογές δεν γίνονται μόνο στην Ελλάδα. Σε δύο μέρες γίνονται και στην Τουρκία. Το αποτέλεσμα, συνεπώς, της δικής μας κάλπης θα είναι κι ένα μήνυμα προς την άλλη όχθη. Το αποτέλεσμα πρέπει να αποπνέει σταθερότητα και σιγουριά. Ταυτόχρονα, ωστόσο, να δηλώνει εμφατικά και τη δική μας θέληση, ότι οι Ελληνίδες και οι Έλληνες θέλουν στιβαρό και έμπειρο χέρι στο τιμόνι της πατρίδας.",political agenda,elections,other,0.4,0,0,"[['greece', 'location', '1.0'], ['turkey', 'location', '1.0'], ['greeks', 'group of people', '0.5'], ['the other side', 'group of people', '0.5']]"
33,"In these elections, you will not only vote for the economy, for the welfare state, for what we do in the primary sector, what we do in tourism. You will also vote on who will manage the critical geopolitical challenges that we face, who will stand up to Turkey.","Σε αυτές τις εκλογές, δεν θα ψηφίσετε μόνο για την οικονομία, για το κοινωνικό κράτος, για το τι θα κάνουμε στον πρωτογενή τομέα, τι θα κάνουμε στον τουρισμό. Θα ψηφίσετε και για το ποιος θα διαχειριστεί τις κρίσιμες γεωπολιτικές προκλήσεις που έχουμε μπροστά μας, ποιος θα βρεθεί απέναντι στην Τουρκία.",political agenda,elections,other,,0,0,"[['turkey', 'location', '1.0']]"
