id,text,text_el,is_criticism,topic-context,subtopic-context,sentiment,polarization-definition,populism-definition,ner-limited
13,"I committed to three very simple things when I asked for your trust in 2019. I told you that I wanted to reduce taxes and contributions and, yes, I reduced taxes and contributions for every Greek woman and every Greek man. You all know this better than I do. I told you that I want to create jobs and put the country on a dynamic growth path and bring in investment. In Kefalonia alone - look, I was looking at the figures - there are investments of 150 million. Most of them in the tourism sector, but not only. And arrivals last year were 10% higher than in 2019 and this year is expected to be even better. This is income for the whole island and to support the overall economy of the island. Not only for tourism, for the primary sector, for cultural activities. Because that is how we understand regional development. So I have also kept this commitment.","Είχα δεσμευτεί για τρία πολύ απλά πράγματα όταν ζήτησα την εμπιστοσύνη σας το 2019. Σας είχα πει ότι θέλω να μειώσω φόρους και εισφορές και, ναι, μείωσα τους φόρους και τις εισφορές για κάθε Ελληνίδα και για κάθε Έλληνα. Το γνωρίζετε όλοι καλύτερα από μένα. Σας είχα πει ότι θέλω να δημιουργήσω θέσεις εργασίας και να βάλω τη χώρα σε μια δυναμική τροχιά ανάπτυξης και να φέρω επενδύσεις. Μόνο στην Κεφαλονιά -προσέξτε, έβλεπα τα στοιχεία- δρομολογούνται επενδύσεις 150 εκατομμυρίων. Οι περισσότερες στον τουριστικό τομέα, αλλά όχι μόνο. Και οι αφίξεις πέρυσι ήταν 10% αυξημένες σε σχέση με το 2019 και φέτος προβλέπεται ακόμα καλύτερη χρονιά. Αυτό είναι εισόδημα για όλο το νησί και για τη στήριξη συνολικά της οικονομίας του νησιού. Όχι μόνο για τον τουρισμό, για τον πρωτογενή τομέα, για τις δράσεις πολιτισμού. Διότι έτσι αντιλαμβανόμαστε εμείς την περιφερειακή ανάπτυξη. Τήρησα, λοιπόν, και αυτή τη δέσμευσή μου. ",political agenda,employment,tax cuts,0.8,0.0,0.0,"[['greek', 'organization', '1.0'], ['kefalonia', 'location', '1.0'], ['greek', 'country', '1.0'], ['2019', 'date', '1.0']]"
14,"My third commitment was that I want a strong and secure country. A country that protects its borders. We have protected the borders of the homeland effectively. Our homeland is no longer a ""no man's land"". We have, I believe, represented the country abroad with dignity, we have claimed European resources, which will be able to make a big difference in the years to come. 31 billion Recovery Fund, I personally negotiated it. Not 17 hours, five days, but I secured EUR 31 billion for the country, and this money is working everywhere.","Η τρίτη μου δέσμευση ήταν ότι θέλω μία χώρα ισχυρή και ασφαλή. Μία χώρα η οποία θα προστατεύει τα σύνορά της. Προστατεύσαμε τα σύνορα της πατρίδας με αποτελεσματικότητα. Έπαψε η πατρίδα μας, πια, να είναι «ξέφραγο αμπέλι». Εκπροσωπήσαμε, πιστεύω, με αξιοπρέπεια τη χώρα στο εξωτερικό, διεκδικήσαμε ευρωπαϊκούς πόρους, οι οποίοι θα μπορέσουν να κάνουν μια μεγάλη διαφορά τα επόμενα χρόνια. Ταμείο Ανάκαμψης 31 δισ. ευρώ, εγώ προσωπικά τα διαπραγματεύτηκα. Όχι 17 ώρες, 5 μέρες μάς πήρε, αλλά εξασφάλισα 31 δισ. ευρώ για την πατρίδα κι αυτά τα χρήματα πιάνουν τόπο παντού.",political agenda,other,other,0.8,0.0,0.0,"[['1. homeland', 'location', '1.0'], ['2. european', 'group of people', '1.0'], ['3. recovery fund', 'organization', '0.8'], ['4. eur', 'organization', '0.8'], ['5. country', 'location', '0.7'], ['6. borders', 'location', '0.6'], ['7. years to come', 'date', '0.5'], ['8. 31 billion', 'organization', '0.4']]"
15,"The new museum in Argostoli, 7 million, will be built with resources from the Recovery Fund. All of our schools, from grade 5 to grade 3, will have interactive whiteboards so that children can have a completely different experience of the modern learning process, with resources from the Recovery Fund. Just two examples of how something that is happening in Brussels can ultimately affect all of you.","Το νέο μουσείο στο Αργοστόλι, 7 εκατομμύρια, θα γίνει με πόρους του Ταμείου Ανάκαμψης. Όλα μας τα σχολεία, από την Ε’ δημοτικού μέχρι την Γ’ λυκείου θα αποκτήσουν διαδραστικούς πίνακες, έτσι ώστε να μπορούν τα παιδιά να έχουν μία τελείως διαφορετική εμπειρία της σύγχρονης διαδικασίας εκμάθησης, με πόρους του Ταμείου Ανάκαμψης. Δύο παραδείγματα μόνο, πώς κάτι το οποίο συμβαίνει στις Βρυξέλλες τελικά μπορεί να αφορά όλες και όλους σας. ",political agenda,other,other,0.5,0.0,0.0,"[['argostoli', 'location', '1.0'], ['recovery fund', 'organization', '1.0'], ['brussels', 'location', '1.0']]"
16,"So, we are approaching this electoral battle today with the certainty that we have been consistent in our commitments and that is why when we talk to you about our programme for the next four years we are very confident that we can deliver.Our central commitment is simple: we want the economy to grow much faster than the European average, we want to achieve a 25% increase in wages in four years and we can do it. Just as we raised the minimum wage from €650 to €780, we can take it from €780 to €950 over four years.","Άρα, εμείς σήμερα προσεγγίζουμε αυτή την εκλογική μάχη με τη βεβαιότητα ότι ήμασταν συνεπείς στις δεσμεύσεις μας και γι’ αυτό κι όταν σας μιλάμε για το πρόγραμμά μας για την επόμενη τετραετία έχουμε μεγάλη βεβαιότητα ότι μπορούμε να το υλοποιήσουμε.Η κεντρική μας δέσμευση είναι απλή: θέλουμε η οικονομία να αναπτύσσεται πολύ πιο γρήγορα από τον ευρωπαϊκό μέσο όρο, θέλουμε να πετύχουμε αύξηση στους μισθούς 25% σε μία τετραετία και μπορούμε να το πετύχουμε. Όπως αυξήσαμε τον κατώτατο μισθό από τα 650 στα 780 ευρώ, έτσι μπορούμε να τον πάμε από τα 780 στα 950 ευρώ σε ορίζοντα τετραετίας. ",political agenda,economy,wages,0.9,0.0,0.0,[]
17,"And of course the same applies to pensions.The faster the economy grows, the faster pensions will grow. We will make other provisions for pensioners, to give you the opportunity, if pensioners want to work, to be able to work without having so much additional cost to their pension. After all, we currently have a need in many areas; we have the opposite problem from what we had in the past, businesses cannot find workers. So for the pensioners, you should also know that you will have better pensions.","Και το ίδιο φυσικά ισχύει και για τις συντάξεις.Όσο πιο γρήγορα αναπτύσσεται η οικονομία, τόσο πιο γρήγορα θα αυξάνονται και οι συντάξεις. Θα κάνουμε και προβλέψεις άλλες για τους συνταξιούχους, να σας δίνεται η δυνατότητα, αν το θέλουν οι συνταξιούχοι να δουλεύουν, να μπορούν να δουλεύουν χωρίς να έχουν τόσο πρόσθετο κόστος στη σύνταξή τους. Έχουμε σήμερα, εξάλλου, ανάγκη σε πολλές περιοχές, έχουμε το ανάποδο πρόβλημα από αυτό που είχαμε στο παρελθόν, οι επιχειρήσεις δεν βρίσκουν εργαζόμενους. Άρα και για τους συνταξιούχους να ξέρετε ότι θα έχετε και καλύτερες συντάξεις.",political agenda,pensioners,pensions,0.6,0.0,0.0,[]
18,"And for those who are still in the grip of the Katrougal personal differential, I can tell you one thing: that just as we supported you now, we will continue to support those who would not see increases in their pensions because of the Katrougal personal differential, especially the low pensioners. Until this personal differential is finally erased.You know that one of the most painful and traumatic experiences of the third memorandum brought by the previous government was the Katrougalos law that cut pensions.","Και για όσους είναι ακόμα δέσμιοι της προσωπικής διαφοράς Κατρούγκαλου, ένα μπορώ να σας πω: ότι όπως σας στηρίξαμε τώρα, έτσι θα εξακολουθούμε να στηρίζουμε αυτούς οι οποίοι δεν θα έβλεπαν αυξήσεις στις συντάξεις τους λόγω της προσωπικής διαφοράς Κατρούγκαλου, ειδικά τους χαμηλοσυνταξιούχους. Μέχρι αυτή η προσωπική διαφορά να σβήσει οριστικά.Ξέρετε ότι μια από τις πιο επώδυνες και τραυματικές εμπειρίες του τρίτου μνημονίου που έφερε η προηγούμενη κυβέρνηση, ήταν ο νόμος Κατρούγκαλου που «πετσόκοψε» τις συντάξεις.",criticism,pensioners,pensions,-0.5,0.1,0.0,"[['katrougal', 'person', '0.9'], ['low pensioners', 'group of people', '0.9'], ['katrougalos', 'organization', '0.7'], ['government', 'organization', '0.6'], ['third memorandum', 'date', '0.6']]"
19,"We said from the very first moment that we would redress the injustices that have been done. But be careful, you will not hear from me any commitments that I cannot implement the next day. It would be very dishonest to come here and tell you things that I know cannot be done. And it is doubly insulting, I think, for the people, those who cut your pensions, cut the middle class and slashed their taxes, to come here now and say that they are going to do the exact opposite of what they did in the last four years.But, again, I said, I am not interested in getting too involved in what Syriza is saying, I am interested in putting more emphasis on what we are going to do.","Εμείς από την πρώτη στιγμή είπαμε ότι θα αποκαταστήσουμε τις αδικίες οι οποίες έγιναν. Όμως, προσέξτε, από εμένα δεν πρόκειται να ακούσετε δεσμεύσεις τις οποίες την επόμενη μέρα δεν μπορώ να υλοποιήσω. Θα ήταν πολύ ανέντιμο να έρθω εδώ και να σας πω πράγματα τα οποία γνωρίζω ότι δεν μπορούν να γίνουν. Και είναι διπλά προσβλητικό, πιστεύω, για τους πολίτες, αυτοί οι οποίοι σας έκοψαν τις συντάξεις, πετσόκοψαν τη μεσαία τάξη και την τσάκισαν στους φόρους, να έρχονται τώρα να λένε ότι θα κάνουν ακριβώς τα ανάποδα από αυτά τα οποία έκαναν την προηγούμενη τετραετία.Αλλά, πάλι σας είπα, δεν με ενδιαφέρει να ασχοληθώ πολύ με αυτά τα οποία λέει ο ΣΥΡΙΖΑ, με ενδιαφέρει να δώσω μεγαλύτερη έμφαση σε αυτά τα οποία θα κάνουμε εμείς.",political agenda,elections,other,0.0,0.0,0.0,"[['syriza', 'political party', '0.8'], ['the last four years', 'date', '0.8']]"
20,"Economy, health, better government, digitisation everywhere, evaluation everywhere. I am very insistent, you know, on the concept of evaluation, so that we can improve the performance of the state at all levels.You have seen the revolution that has already taken place with gov.gr. This revolution must spread everywhere and the state must become digital in all its aspects.","Οικονομία, υγεία, καλύτερο κράτος, ψηφιοποίηση παντού, αξιολόγηση παντού. Επιμένω πολύ, ξέρετε, στην έννοια της αξιολόγησης, για να μπορέσουμε να βελτιώσουμε την απόδοση του κράτους σε όλα τα επίπεδα.Είδατε την επανάσταση η οποία έχει ήδη γίνει με το gov.gr. Αυτή η επανάσταση πρέπει να εξαπλωθεί παντού και το κράτος να γίνει ψηφιακό σε όλες του τις εκφάνσεις.",political agenda,other,digital governance,0.6,0.0,0.0,"[['gov.gr', 'organization', '1.0'], ['state', 'organization', '0.7'], ['greece', 'country', '0.5']]"
21,"And, of course, to make a special mention of our policies for our most vulnerable citizens. For the first time the country has a coherent plan for people with disabilities - it has never had it at the level of horizontal policies - which we are implementing, overcoming chronic difficulties. You know how important the Personal Assistant is for people with severe disabilities. You know better than I do, the burden that is placed on a family who will now be able to have a person next to the person with a disability, to help them, but also for the disabled person to be able to build their life, to claim their own ambitions.All these are very important programmes. Supported living shelters everywhere where we need them, because there is no greater stress than a parent who has a child with a disability knowing that somehow that child can be safe in the event that the parent passes away.","Και, βέβαια, να κάνω μια ξεχωριστή μνεία στις πολιτικές μας για τους πιο αδύναμους συμπολίτες μας. Για πρώτη φορά η χώρα απέκτησε ένα συγκροτημένο σχέδιο για τα άτομα με αναπηρία -δεν το είχε ποτέ σε επίπεδο οριζόντιων πολιτικών- το οποίο υλοποιούμε ξεπερνώντας χρόνιες δυσκολίες.Προσωπικός Βοηθός. Ξέρετε πόσο σημαντικός είναι ο Προσωπικός Βοηθός για τα άτομα με βαριά αναπηρία. Εσείς το ξέρετε καλύτερα από εμένα, το βάρος το οποίο επιφορτίζεται μια οικογένεια η οποία τώρα θα μπορέσει να έχει έναν άνθρωπο δίπλα στο άτομο με αναπηρία, να το βοηθάει, αλλά και ο ανάπηρος να μπορεί να χτίσει τη ζωή του, να διεκδικήσει τις δικές του φιλοδοξίες.Όλα αυτά είναι πολύ σημαντικά προγράμματα. Στέγες υποστηριζόμενης διαβίωσης παντού εκεί που τις χρειαζόμαστε, γιατί δεν υπάρχει μεγαλύτερο άγχος από το γονιό, ο οποίος έχει ένα παιδί με αναπηρία, να ξέρει ότι αυτό το παιδί κάπως θα μπορεί να είναι ασφαλές σε περίπτωση που ο γονιός φύγει από τη ζωή.",political agenda,social state,vulnerable citizens,0.5,0.0,0.0,"[['1. disabilities', 'group of people', '0.6'], ['2. personal assistant', 'person', '0.8'], ['3. family', 'group of people', '0.3'], ['4. disabled person', 'person', '0.6'], ['5. supported living shelters', 'organization', '0.5'], ['6. parent', 'person', '0.3'], ['7. country', 'location', '0.8']]"
22,"All these are the real problems of the citizens. And it is these problems that we need to talk about, not the many procedural things that journalists ask us.You know, I often go to interviews and we are asked about various issues and I wonder, after all, are the things that journalists ask us about the things that are of concern to society? The answer is no. What you are concerned about is how you will have a better income, how your children will have better jobs, what will happen with health here in Lixouri, in Argostoli, how you will feel when you go to a hospital and have a decent access to health care. What the farmer will do with his harvest. What will happen if a natural disaster hits us on the head.","Όλα αυτά είναι τα πραγματικά προβλήματα των πολιτών. Και για αυτά τα προβλήματα πρέπει να μιλήσουμε, όχι για τα πολλά διαδικαστικά τα οποία μας ρωτούν οι δημοσιογράφοι.Ξέρετε, συχνά πηγαίνω σε συνεντεύξεις και μας ρωτάνε διάφορα θέματα και αναρωτιέμαι, τελικά, αυτά που μας ρωτάνε οι δημοσιογράφοι είναι αυτά τα οποία απασχολούν την κοινωνία; Η απάντηση είναι πως όχι. Αυτό το οποίο σας ενδιαφέρει είναι πώς θα έχετε καλύτερο εισόδημα, πώς τα παιδιά σας θα έχουν καλύτερες δουλειές, τι θα γίνει με την υγεία εδώ στο Ληξούρι, στο Αργοστόλι, πώς θα αισθάνεστε όταν θα πάτε σε ένα νοσοκομείο και θα έχετε μια αξιοπρεπή πρόσβαση στην υγεία. Τι θα κάνει ο αγρότης με τη σοδειά του. Τι θα γίνει αν μας πέσει στο κεφάλι μία φυσική καταστροφή.",political agenda,employment,cost of living,0.0,0.0,0.5,"[['lixouri', 'location', '0.8'], ['argostoli', 'location', '0.8']]"
23,"These are the problems that people are concerned about and we have to talk about them and we have answers. Have we done everything perfectly? No. I am the first to tell you that there were mistakes and failures. But I acknowledged them, always with courage, and whenever mistakes were made, I was the first to step forward, take responsibility and say: 'it is my duty to correct them'.","Αυτά είναι τα προβλήματα που απασχολούν τους πολίτες και για αυτά πρέπει να μιλήσουμε και για αυτά εμείς έχουμε απαντήσεις. Τα κάναμε όλα τέλεια; Όχι. Είμαι ο πρώτος ο οποίος θα σας πει ότι και λάθη έγιναν και αστοχίες υπήρξαν. Τις αναγνώρισα όμως, πάντα με θάρρος και όποτε έγιναν λάθη, βγήκα πρώτος μπροστά, ανέλαβα την ευθύνη και είπα: «χρέος μου είναι να τα διορθώσω».",political agenda,accountability,self reflection,0.5,0.0,0.0,[]
24,"But we have - and let me close with this - we have become much more experienced and much more confident. We have a plan for Greece for the next four years, and indeed the dilemma in this coming election is very simple: whether we continue on the path of progress, on the path of further tax cuts, of increased pensions, of job creation, of more investment, or whether we go back to an era of over-taxation and borrowing, which at some point our children and grandchildren will have to pay back.","Έχουμε όμως -και επιτρέψτε μου να κλείσω με αυτό- έχουμε γίνει πολύ πιο έμπειροι πια και πολύ πιο σίγουροι. Έχουμε σχέδιο για την Ελλάδα της επόμενης τετραετίας και πράγματι το δίλημμα σε αυτήν την κάλπη που έρχεται είναι πολύ απλό.Αν θα συνεχίσουμε στο δρόμο της προκοπής, στο δρόμο της περαιτέρω περικοπής των φόρων, της αύξησης των συντάξεων, της δημιουργίας θέσεων εργασίας, των περισσότερων επενδύσεων ή θα γυρίσουμε πίσω σε μία εποχή υπερφορολόγησης και δανεικών, τα οποία κάποια στιγμή τα παιδιά μας και τα εγγόνια μας θα κληθούν να τα ξεπληρώσουν. ",political agenda,other,tax cuts,0.5,0.1,0.0,"[['greece', 'location', '1.0'], ['election', 'date', '1.0']]"
25,"Whether we will continue on a path where the country will protect its borders or we will once again become a ""closed vineyard"". Whether we will be a country where our voice counts in Europe or whether we will engage in other kinds of third world pursuits, as was the case in the past.","Αν θα συνεχίσουμε σε μία πορεία όπου η χώρα θα προστατεύει τα σύνορά της ή θα ξαναγίνουμε «ξέφραγο αμπέλι». Αν θα είμαστε μία χώρα που η φωνή της θα μετράει στην Ευρώπη ή θα κάνουμε άλλου είδους τριτοκοσμικές αναζητήσεις, όπως συνέβαινε στο παρελθόν. ",political agenda,europe,borders,0.0,0.3,0.2,"[['europe', 'location', '0.75'], ['third world', 'group of people', '0.5']]"
