id,text,text_el,is_criticism,topic-context,subtopic-context,sentiment,polarization-definition,populism-definition,ner-limited
8,"How does looting work? How did they manage to make money out of someone's bankruptcy? It's simple, you know it, but we'll say it one more time to remind us. You have someone here in Larissa. He has bought a 150,000 property in the good times relatively had put 50,000 out of pocket. He took out a loan of 100. Has he paid it off? Within the first few years 50, that is, out of 150, he has put 100 in his pocket and has the loan of 50 left. The country is going bankrupt. He goes bankrupt, his shop loses his job, his pension is reduced. It doesn't matter. His income goes down and he can't service the 50 grand he has left that he owes and with the overdraft it becomes 100. The fund comes in from Ireland based in Delaware with a bank account in the Cayman Islands, gives him 3K 3 3 and buys the 100 loan. And it comes to him, takes it away, puts it under the hammer for 50. Think about that. He's put up 3 and he's made 47. And where's that gonna go? Cayman Island? And I want you to check this out and do a little research on your own. Don't just listen to what the politicians tell you. Do you know that exporting those 47,000 to Cayman is legal, no tax, no restrictions? It's legal, it's in Hercules, it's signed by the Greek Parliament and not only that. That's outrageous in itself, because you know they're going to make about 70 billion out of this shoddy economy. Think about it because that's a lot of big numbers. Let me tell you this, together for education and health care we give 11. For education and health, we give 11. And they get 70 to take to the Cayman Islands. Hear, hear. They've put a clause in this legislation that says the one public guarantee that if they don't get at least 23 billion, you know you're going to have to give it to them? You don't have it, we don't have it, and the state doesn't have it. The Greek state, the bankrupt Greek state, will have to borrow 23 billion from Mrs Lagarde, from which she will borrow all of it to give it to the funds, to go to the Cayman Islands.","Πώς λειτουργεί η λεηλασία; Πώς μπόρεσαν και καταφέρανε από την πτώχευση κάποιου να βγάλουν λεφτά; Είναι απλό, το ξέρετε, αλλά θα το πούμε άλλη μια φορά για να το θυμηθούμε. Έχεις κάποιον εδώ στη Λάρισα. Έχει αγοράσει ένα ακίνητο 150.000 στις καλές εποχές σχετικά είχε βάλει 50.000 απ την τσέπη. Πήρε ένα δάνειο των 100. Έχει αποπληρώσει; Μέσα στα πρώτα χρόνια τα 50, δηλαδή από τα 150, έχει βάλει στην τσέπη τα 100 και έχει μείνει το δάνειο των 50. Πτωχεύει η χώρα. Πτωχεύει, το μαγαζί του χάνει τη δουλειά του, μειώνεται η σύνταξή του. Δεν έχει σημασία. Μειώνονται τα εισοδήματά του και δεν μπορεί να εξυπηρετήσει τα 50 χιλιάρικα που έχουν μείνει που χρωστάει και με τα πανωτόκια γίνονται 100. Έρχεται το ταμείο από την Ιρλανδία με έδρα το Ντέλαγουερ και τραπεζικό λογαριασμό στα Κέιμαν Άϊλαντς, δίνει 3 Χιλιάρικα 3 3 και αγοράζει το δάνειο των 100. Και έρχεται του το παίρνει, το βγάζει στο σφυρί για 50. Για σκεφτείτε το αυτό. Έχει βάλει 3 και έχει βγάλει 47. Και που θα πάει αυτά; Στα Κέιμαν Άϊλαντ; Και θέλω να το ελέγξετε αυτό κάνετε και μια μικρή έρευνα μόνοι σας. Μην ακούτε μόνο τους πολιτικούς τι σας λένε. Ξέρετε ότι η εξαγωγή αυτών των 47.000 στα Kέιμαν είναι νόμιμη, χωρίς φορολόγηση, χωρίς κανένα περιορισμό; Είναι νόμιμη, είναι στον Ηρακλή μέσα, το έχει υπογράψει η Βουλή των Ελλήνων και όχι μόνο αυτό. Αυτό είναι εξωφρενικό από μόνο του, γιατί ξέρετε θα βγάλουν γύρω στα 70 δις από αυτή την έρμη οικονομία. Για σκεφτείτε το γιατί αυτά είναι πολλά μεγάλα νούμερα. Να σας πω το εξής, μαζί για παιδεία και υγεία δίνουμε 11. Για παιδεία και υγεία δίνουμε 11. Και θα πάρουν 70 να τα πάνε στα Κειμαν Αιλαντς. Άκουσον άκουσον. Έχουν βάλει μέσα σε αυτή τη νομοθεσία ρήτρα που λέει τη μία δημόσια εγγύηση ότι αν δεν βγάλουν τουλάχιστον 23 δισ., το ξέρετε ότι εσείς θα πρέπει να τους τα δώσετε; Εσείς δεν έχετε, ούτε εμείς έχουμε, ούτε το κράτος έχει. Θα πρέπει το ελληνικό δημόσιο, το πτωχευμένο ελληνικό δημόσιο να δανειστεί 23 δις από την κυρία Λαγκάρντ, απ όπου όλα θα τα δανειστεί για να τα δώσει στα ταμεία, να τα πάνε στα Κέιμαν Άϊλαντς.",criticism,corruption,bankruptcy,-0.8,0.2,0.2,"[['larissa', 'location', '0.8'], ['ireland', 'country', '0.6'], ['delaware', 'location', '0.8'], ['cayman islands', 'location', '0.8'], ['greek parliament', 'organization', '0.8'], ['mrs lagarde', 'person', '0.6']]"
9,"Friends, compañeras and compañeros. Fellow travellers, I will say something and tell me if it is sophisticated and far-fetched. I do not believe it is. The Wehrmacht did not manage to do this. During the occupation the Nazis did not think of it, they did not have the intelligence, the ingenuity to think of such an imaginative way to steal Greek property. Having said that, it is a disgrace, Mr Scherzo, to act as the ambassador of the Federal Republic of Germany and say that we are denying and should not demand German reparations. But that is the way it has always been the way it has always been with the sycophants. They were more royal than the king. More German than the Germans. I close the parenthesis. This is Hercules.","Φίλες και φίλοι, συντρόφισσες και σύντροφοι. Συνοδοιπόροι θα πω κάτι και πείτε μου αν είναι εξεζητημένο και τραβηγμένο. Δεν πιστεύω ότι είναι. Η Βέρμαχτ δεν κατάφερε να το κάνει αυτό. Επί κατοχής οι Ναζί δεν το σκέφτηκαν, δεν είχαν την εξυπνάδα, την ευστροφία να σκεφτούν ένα τόσο ευφάνταστο τρόπο να κλέψουμε περιουσίες Ελλήνων. Μιας και το λέω, αυτό είναι ντροπή, κύριε Σκέρτσο να λειτουργείτε ως ο πρέσβης της Ομοσπονδιακής Δημοκρατίας της Γερμανίας και να λέτε ότι απεμπολούμε και δεν πρέπει να απαιτήσουμε τις γερμανικές αποζημιώσεις. Αλλά έτσι ήταν πάντοτε έτσι ήταν πάντοτε οι δοσίλογοι. Ήταν βασιλικότεροι του βασιλέως. Γερμανικότεροι των Γερμανών. Κλείνω την παρένθεση. Αυτός είναι ο Ηρακλής. ",criticism,other,other,-0.6,0.0,0.0,"[['wehrmacht', 'group of people', '1.0', 'nazis', 'group of people', '1.0', 'greek', 'location', '1.0', 'germany', 'country', '1.0', 'federal republic of germany', 'organization', '1.0', 'hercules', 'person', '1.0']]"
10,"Well, look at the debate the other day. In a passage from his speech, the former comrade and former Prime Minister Alexis Tsipras, when asked about progressive governments and so on, said something that I liked. He said, he said, that what matters is the unity of the left. Did you hear that? Who would disagree? Will anyone disagree? Unity is everything. United we stand, divided, fragmented. We are defeated. Is there any doubt about that? That's why I'm so happy to see the People's Unity flags next to the Day 25 flags. Because we are united in action. Mr. Tsipras, what do you mean when you say unity of the left? For what we just said about Hercules, what are we going to do about it right now, you know? To raise your hand, because you have red loans. Yes, well, you know what humiliation means? You are called on the phone and humiliated every day by the crows, the predators who want to take fortunes from this country. And I'm not just talking about the issue of social inequality. It's not just taking it from the poor and going to the rich. They're going to take it to the Cayman Islands, they're not even going to eat it in the boomtowns here in Larissa to circulate some money in the area. They'll take it to the Bahamas to eat it with credit cards from Cayman Islands. Mr. Tsipras, what unity are we going to have on this? Are we going to abolish Hercules? Says SYRIZA, I read everyone's programs very carefully. He says, the first thing we're going to do is a PNA, a legislative act to abolish, he says, put a brake on all auctions for six months. And then. Thank you. Thank you. All together, guys. Varoufakis has no value on his own nothing I do nothing.","Λοιπόν, κοιτάξτε να δείτε τώρα στο ντιμπέιτ τις προάλλες. Σε μια αποστροφή του λόγου του, ο τεως σύντροφος και τέως πρωθυπουργός Αλέξης Τσίπρας όταν ρωτήθηκε για προοδευτικές κυβερνήσεις και τα λοιπά είπε κάτι που μου άρεσε. Είπε, λέει, αυτό που προέχει είναι η ενότητα της αριστεράς. Το ακούσατε; Ποιος θα διαφωνήσει; Θα διαφωνήσει κανένας; Η ενότητα είναι το παν. Ενωμένοι είμαστε όρθιοι, διαιρεμένοι, κατακερματισμένοι. Είμαστε ηττημένοι. Υπάρχει καμία αμφιβολία για αυτό; Γι αυτό χαίρομαι τόσο πολύ που βλέπω τις σημαίες της Λαϊκής Ενότητας δίπλα στις σημαίες του Μέρα 25. Γιατί εμείς είμαστε ενωμένοι στην πράξη. Κυρίε Τσίπρα, τι εννοείς όταν λες ενότητα της Αριστεράς; Για αυτό που είπαμε τώρα για τον Ηρακλή, τι θα κάνουμε για αυτό αυτή τη στιγμή, ξέρετε; Για να σηκώσετε χέρι, επί έχετε κόκκινα δάνεια. Ναι, εντάξει λοιπόν, ξέρετε τι σημαίνει εξευτελισμός; Σας παίρνουν στο τηλέφωνο και σας εξευτελίζουν καθημερινά τα κοράκια, τα αρπακτικά που θέλουν να πάρουν περιουσίες από αυτή τη χώρα. Και δεν λέω τώρα μόνο για το θέμα της κοινωνικής ανισότητας. Δεν είναι απλά να τα πάρουνε από τους φτωχούς και να πάνε στους πλούσιους. Θα τα πάνε στα Κέιμαν Άϊλαντς, δεν θα τα φάνε καν στα μπουζούκια εδώ στη Λάρισα να κυκλοφορήσει και λίγο χρήμα στην περιοχή. Θα τα πάνε στις Μπαχάμες να τα φάνε με πιστωτικές κάρτες από τα Κέιμαν Αϊλαντς. Κύριε Τσίπρα, τι ενότητα θα έχουμε σε αυτό; Θα καταργήσουμε τον Ηρακλή; Λέει ο ΣΥΡΙΖΑ, διαβάζω πολύ προσεκτικά τα προγράμματα όλων. Λέει, το πρώτο πράγμα που θα κάνουμε είναι μια ΠΝΠ, μια πράξη νομοθετικού περιεχομένου να καταργήσουν, λέει, να βάλουν φρένο σε όλους τους πλειστηριασμούς για ένα εξάμηνο. Και μετά. Ευχαριστώ. Ευχαριστώ. Όλοι μαζί, παιδιά. Ο Βαρουφάκης δεν έχει καμία αξία από μόνος του τίποτα δεν κάνω.",criticism,corruption,bank regulations,0.0,0.5,0.0,"[['alexis tsipras', 'person', 'high', ""people's unity"", 'group of people', 'medium', 'day 25', 'date', 'low', 'hercules', 'organization', 'medium', 'syriza', 'political party', 'high', 'larissa', 'location', 'low', 'bahamas', 'country', 'low', 'cayman islands', 'location', 'low', 'varoufakis', 'person', 'low].']]"
11,"So, let's get to the big and most important question. It says in the PASOK programme. And SYRIZA's. End to auctions first home protection in PASOK will talk about the Katseli law, which was a very positive law when it was passed, because it did put a brake on auctions? We can send and that was the only good thing that happened in the period from 2011 onwards. But today with Hercules, which was first passed by Syriza creating the digital secondary market for loans and then Mitsotakis came in and built Hercules on top of that. Now that there is Hercules. Think about it. Is it possible to protect the first home, the small business, the farmland? Why is farmland in this maelstrom of red loans? How are you going to protect these properties? At a time when there is Hercules, a market in which red loans are bought and sold at the speed of light all the time, in which the basic housing is in the red loans, in which the small shop is in the red loans, in which the agricultural land is in the red loans. How is this going to be done? Will the market collapse if you put it up for auction, or to put it another way. The fund I mentioned before from Ireland that has taken the red loan of the man I referred to. If he doesn't allow that fund to put it under the hammer, stop the auction. This fund loses whatever money it can get right. Which means what that means is the clause will be triggered with the public guarantee of 23 billion, which means a progressive administration will have to if we freeze the auctions, go to Lagarde, get 23 billion, get it into the funds. Well, they weren't slaughtered. That's what we're going to do, that's the unity of the left? So that's not possible. The only way to stop the public bailout from being activated is to abolish Hercules? PASOK, SYRIZA united determined, do not touch Hercules commitment to the Troika Hercules is untouched Hercules and dry bread, which means that they sell us fumaroles want unity to become ministers. We don't want unity to protect people. The only way to protect the world from Hercules is to abolish Hercules. Instituting, legislating Ulysses, a public company to manage red loans.
They take the red loans there you pay as a borrower a fixed fee every month, small not to exceed 1/6 of disposable income if you have below a certain level of income, you pay nothing, freeze the loan forever, you stay in. You operate in your shop, you farm your land. You can't sell it because that would be unfair to the person who paid off their loan. At some point an arrangement is made with Ulysses. Either you sell it or a way is found, there's a big haircut in perpetuity. The point is to stop the bleeding, stop the looting, stop the exportation of billions to the Cayman Islands. So Alexis Tsipras, do you want progressive governance? Let's talk about Hercules. When we proposed this 2 years ago to talk about him they did or we did something simple. We held a conference in Athens, in the arts, in Technopolis, in Gazi. If you remember the old Gazi and we invited them to come and talk. Years ago, from 2 years ago before the election campaign, calmly Fine tell us what you think we can tell you and we moment. Luca Katseli came because she's an old colleague at the University of Athens SYRIZA, zero zero, guerrilla zero. We continue. This is the first looting mechanism. I call it a goose that lays golden eggs for the oligarchy without borders.","Λοιπόν, πάμε στο μεγάλο και σημαντικότατο ερώτημα. Λέει το πρόγραμμα και του ΠΑΣΟΚ. Και του ΣΥΡΙΖΑ. Τέλος στους πλειστηριασμούς προστασία της πρώτης κατοικίας στο ΠΑΣΟΚ θα μιλάει για νόμο Κατσέλη, ο οποίος νόμος Κατσέλη ήταν πολύ θετικός όταν έγινε, γιατί όντως έβαλε φρένο στους πλειστηριασμούς; Μπορεί να στείλουμε και αυτό ήταν το μόνο καλό που έγινε την περίοδο του 2011 και μετά. Όμως σήμερα με τον Ηρακλή που πρώτος ψήφισε ο ΣΥΡΙΖΑ δημιουργώντας την ψηφιακή δευτερογενή αγορά των δανείων και μετά ήρθε ο Μητσοτάκης και έχτισε τον Ηρακλή πάνω σε αυτό. Τώρα που υπάρχει Ηρακλής. Για σκεφτείτε το. Είναι δυνατόν να προστατευτεί η πρώτη κατοικία, το μικρομάγαζο, η αγροτική γη; Γιατί είναι η αγροτική γη σε αυτό τον κυκεώνα των κόκκινων δανείων; Πώς θα προστατεύσεις αυτά τα ακίνητα; Την ώρα που υπάρχει Ηρακλής, μια αγορά στην οποία αγοράζονται και πωλούνται συνέχεια με ταχύτητα του φωτός τα κόκκινα δάνεια που έχουν μέσα τη βασική κατοικία που έχουν μέσα το μικρομάγαζο που έχουν μέσα την αγροτική γη. Πώς θα γίνει αυτό; Θα καταρρεύσει η αγορά αν βάλεις πλειστηριασμού, δηλαδή να το πω διαφορετικά. Το ταμείο που ανέφερε πριν από το από την Ιρλανδία που έχει πάρει το κόκκινο δάνειο του ανθρώπου στον οποίο αναφέρθηκα. Εάν δεν του επιτρέψει στο ταμείο αυτού να το βγάλει στο σφυρί, σταματήσει τον πλειστηριασμό. Το ταμείο αυτό χάνει ό, τι χρήματα να βγάλει σωστά. Το οποίο τι σημαίνει θα ενεργοποιηθεί η ρήτρα με τη δημόσια εγγύηση των 23 δισ. Δηλαδή θα πρέπει μια προοδευτική διακυβέρνηση εάν παγώσουμε τους πλειστηριασμούς, να πάμε στη Λαγκαρντ, να πάρουμε 23 δισ. Να τα δώσουμε στα ταμεία. Ε δεν σφάξανε. Αυτό θα κάνουμε, αυτή είναι η ενότητα της αριστεράς; Οπότε αυτό δεν γίνεται. Ο μόνος τρόπος να μην ενεργοποιηθεί η δημόσια εγγύηση είναι καταργήσουμε τον Ηρακλή; ΠΑΣΟΚ, ΣΥΡΙΖΑ ενωμένοι αποφασισμένοι, μην αγγίζετε τον Ηρακλή δέσμευση στην Τρόικα ο Ηρακλής είναι ανέγγιχτος Ηρακλής και ξερό ψωμί, το οποίο σημαίνει ότι μας πουλάνε φούμαρα θέλουν ενότητα για να γίνει υπουργοί. Δεν θέλουμε ενότητα για να προστατεύσουμε τον κόσμο. Ο μόνος τρόπος να προστατευτεί ο κόσμος από τον Ηρακλή είναι η κατάργηση του Ηρακλή. Η θεσμοθέτηση, η νομοθέτηση του Οδυσσέα, μια δημόσια εταιρεία διαχείρισης κόκκινων δανείων.
Πηγαίνουν τα κόκκινα δάνεια εκεί καταβάλεις ως δανειολήπτης ένα πάγιο τέλος κάθε μήνα, μικρό να μην ξεπερνάει το 1/6 των διαθέσιμων εισοδημάτων αν έχεις κάτω από ένα συγκεκριμένο επίπεδο εισοδημάτων, δεν καταβάλεις τίποτα, παγώνει το δάνειο για πάντα, μένεις μέσα. Λειτουργεί στο μαγαζί σου, καλλιεργείς τη γη σου. Δεν μπορείς να το πουλήσεις γιατί θα ταν άδικο σε αυτόν που το αποπλήρωσε το δάνειό του. Κάποια στιγμή γίνεται μια ρύθμιση με τον Οδυσσέα. Ή το πουλάς ή βρίσκεται ένας τρόπος, γίνεται ένα μεγάλο κούρεμα στο διηνεκές. Το θέμα είναι να σταματήσει η αφαίμαξη, να σταματήσει τη λεηλασία, να σταματήσει η εξαγωγή δισεκατομμυρίων στα Κέιμαν Αϊλαντς. Οπότε Αλέξη Τσίπρα θέλεις προοδευτική διακυβέρνηση; Έλα να μιλήσουμε για τον Ηρακλή. Όταν εμείς το προτείναμε αυτό πριν 2 χρόνια να μιλήσουμε για τον έκαναν ή κάναμε κάτι απλό. Κάναμε μια ημερίδα στην Αθήνα, στην τεχνών, στην Τεχνόπολη, στο Γκάζι. Αν θυμάστε το παλιό γκάζι και τους προσκαλέσαμε να έρθουν να μιλήσουμε. Χρόνια πριν, από 2 χρόνια πριν από την προεκλογική εκστρατεία, ήρεμα Ωραία πείτε μας εσείς τι νομίζετε να σας πούμε και εμείς στιγμή. Η Λούκα Κατσέλη ήρθε γιατί είναι παλιά συνάδελφος στο Πανεπιστήμιο Αθηνών ΣΥΡΙΖΑ, μηδέν μηδέν, ανταρσυα μηδέν. Εμείς συνεχίζουμε. Αυτός είναι ο πρώτος μηχανισμός λεηλασίας. Εγώ την ονομάζω μια χήνα που γεννά χρυσά αυγά για την ολιγαρχία χωρίς σύνορα. ",political agenda,housing,other,-0.8,0.2,0.3,[]
