id,text,text_el,is_criticism,topic-context,subtopic-context,sentiment,polarization-definition,populism-definition,ner-limited
25,"I want us to rebuild together this great progressive current of patriotism and creative modernisation that was built in 2019 and will be reinvigorated now to give us a similar, if not better, result. To be able to have the strong political legitimacy to make the big changes; we need stability and determination. We do not need unstable coalition governments where one undermines the other. That is the last thing we need today.",Θέλω να ξαναχτίσουμε μαζί αυτό το μεγάλο προοδευτικό ρεύμα του πατριωτισμού και του δημιουργικού εκσυγχρονισμού το οποίο χτίστηκε το 2019 και θα ξαναδυναμώσει τώρα για να μας δώσει αποτέλεσμα αντίστοιχο και αν όχι και καλύτερο. Για να μπορέσουμε να έχουμε την ισχυρή πολιτική νομιμοποίηση να κάνουμε τις μεγάλες αλλαγές.Χρειαζόμαστε σταθερότητα και αποφασιστικότητα. Δεν χρειαζόμαστε ασταθείς κυβερνήσεις συνεργασίας που ο ένας θα υπονομεύει τον άλλον. Είναι το τελευταίο το οποίο χρειαζόμαστε σήμερα.,political agenda,elections,coalition,0.7,0.0,0.0,"[['2019', 'date', '0.5'], ['political party', 'organization', '0.5'], ['current', 'group of people', '0.4'], ['patriotism', 'organization', '0.4'], ['modernisation', 'organization', '0.4'], ['coalition governments', 'group of people', '0.4']]"
26,"Watch out, in a week Turkey has elections. And a second election, probably on May 28th. We don't know what will happen with our neighbour. We have a good period now, but things could get difficult again the next day.The question is, who should manage a difficult neighbor in a difficult neighborhood. Who will ultimately defend the country's national sovereignty and sovereign rights? Who will be able to build the alliances that will enable our country to truly feel strong and secure.Our world is a very complicated one. And the difficulties, unfortunately, will not be absent in the day ahead.","Προσέξτε, σε μια εβδομάδα έχει εκλογές η Τουρκία. Και δεύτερες εκλογές, λογικά, στις 28 Μαΐου. Δεν ξέρουμε τι θα γίνει με τον γείτονά μας. Έχουμε τώρα μια καλή περίοδο, αλλά μπορεί τα πράγματα να ξαναδυσκολέψουν την επόμενη μέρα.Το ερώτημα είναι, ποιος πρέπει να διαχειριστεί έναν δύσκολο γείτονα σε μια δύσκολη γειτονιά. Ποιος θα υπερασπιστεί, τελικά, την εθνική κυριαρχία και τα κυριαρχικά δικαιώματα της χώρας; Ποιος θα μπορέσει να χτίσει τις συμμαχίες εκείνες ώστε πραγματικά η πατρίδα μας να αισθάνεται ισχυρή και ασφαλής.Ο κόσμος μας είναι πολύ περίπλοκος. Και οι δυσκολίες, δυστυχώς, δεν θα λείπουν και την επόμενη μέρα.",political agenda,national security,other,-0.2,0.2,0.0,"[['turkey', 'location', '1.0'], ['may 28th', 'date', '1.0']]"
27,"That is why experience and stability are so important. We have been tested in difficult times, we have been through fire and iron, we have learned from our mistakes, and today we are more experienced, more determined, more ready to move forward, to take Greece even faster, even more boldly forward.And I want you, the old fighters of New Democracy, from the times of Constantine Mitsotakis and before, to be my fellow participants and competitors in this struggle that we are going to give, the old fighters of New Democracy, from the times of Constantine Mitsotakis and before. Thank you for your support.","Γι’ αυτό και η εμπειρία και η σταθερότητα έχουν μεγάλη σημασία. Δοκιμαστήκαμε στα δύσκολα, περάσαμε διά πυρός και σιδήρου, μάθαμε από τα λάθη μας, είμαστε σήμερα πιο έμπειροι, πιο αποφασισμένοι, πιο έτοιμοι να προχωρήσουμε, να πάμε την Ελλάδα ακόμα πιο γρήγορα, ακόμα πιο τολμηρά μπροστά.Και σας θέλω συμμέτοχους και συναγωνιστές σε αυτόν τον αγώνα τον οποίον θα δώσουμε, τους παλιούς αγωνιστές της Νέας Δημοκρατίας, από τις εποχές του Κωνσταντίνου Μητσοτάκη και πιο πριν. Σας ευχαριστώ για τη στήριξή σας.",political agenda,elections,other,0.7,0.0,0.0,"[['constantine mitsotakis', 'person', '1.0'], ['new democracy', 'organization', '1.0'], ['greece', 'country', '1.0']]"
28,"But thanks also to the new friends, the young guys who are with us, from the section of Psakhi, which sections of Psakhi have taken over again. These are the universities of the future that we envision, universities that young children will enter and be rewarded for their efforts. They will not, in fact, all get in without exams.SYRIZA has told us that they want to abolish the minimum entry requirement, to get all children into universities. Soon he will tell us that he also wants to abolish exams in universities. Soon he will tell us that along with university admission he will also give young children a pension.That is not my vision for the youth, that is not my vision. I want competitive universities, children who can excel in universities. I want good technical education for the kids who don't get into universities, so that they too can get a good job.","Αλλά ευχαριστώ και τους νέους φίλους, τα νέα παιδιά που είναι μαζί μας, από το τμήμα των Ψαχνών, τα οποία τμήματα των Ψαχνών έχουν πάρει πάλι τα πάνω τους. Είναι τα πανεπιστήμια του μέλλοντος τα οποία οραματιζόμαστε, πανεπιστήμια στα οποία τα νέα παιδιά θα μπαίνουν και θα επιβραβεύονται για τους κόπους τους. Δεν θα μπαίνουν, ουσιαστικά, όλοι χωρίς εξετάσεις.Ο ΣΥΡΙΖΑ μάς είπε ότι ουσιαστικά θέλει να καταργήσει την ελάχιστη βάση εισαγωγής, να μπαίνουν όλα τα παιδιά στα πανεπιστήμια. Σε λίγο θα μας πει ότι θέλει να καταργήσει και τις εξετάσεις μέσα στα πανεπιστήμια. Σε λίγο θα μας πει ότι μαζί με την εισαγωγή στο πανεπιστήμιο θα βγάλει και στα νέα παιδιά σύνταξη.Δεν είναι αυτό το όραμά μου για τη νεολαία, δεν είναι αυτό το όραμά μου. Θέλω ανταγωνιστικά πανεπιστήμια, τα παιδιά τα οποία μπορούν να διακρίνονται στα πανεπιστήμια. Θέλω καλή τεχνική εκπαίδευση για τα παιδιά τα οποία δεν θα περάσουν στα πανεπιστήμια, για να μπορούν κι αυτά να βρουν μία καλή δουλειά.",political agenda,education,higher education,0.0,0.0,0.0,"[['psakhi', 'group of people', '1.0'], ['syriza', 'political party', '1.0']]"
29,"I want us to look to the future and not to the past. We know where we want to take Greece, we know that this Greece deserves and can do much better. Give me the strength to take Greece where it deserves to be.Be well, thank you very much. Good race, good strength and good luck again here in Chalkida, winners after the great election victory of May 21. Be well, good strength.
","Θέλω να στρέψουμε το βλέμμα μας στο μέλλον και όχι στο παρελθόν. Ξέρουμε πού θέλουμε να πάμε την Ελλάδα, ξέρουμε ότι αυτή η Ελλάδα αξίζει και μπορεί πολύ καλύτερα. Δώστε μου τη δύναμη να πάμε την Ελλάδα εκεί που της αξίζει.Να είστε καλά, σας ευχαριστώ πολύ. Καλό αγώνα, καλή δύναμη και με το καλό πάλι εδώ στη Χαλκίδα νικητές μετά τη μεγάλη εκλογική νίκη της 21ης Μαΐου. Να είστε καλά, καλή δύναμη.
",political agenda,elections,other,0.65,0.0,0.0,"[['greece', 'location', '1.0'], ['chalkida', 'location', '1.0'], ['may 21', 'date', '1.0']]"
