id,text,text_el,is_criticism,topic-context,subtopic-context,sentiment,polarization-definition,populism-definition,ner-limited
8,"The future for you, the young people, is not what it was for us, for my generation. And this was taken care of by the domestic Troika, the foreign Troika, Pasok, New Democracy and Syriza. They have built black holes in the Greek social economy and whatever they do, the black holes suck all the energy, all the matter out of the lives of young people. If at 62 I care about this project. It is not for our generation our generation, we are defeated. Again and again. Post-political which of you do you remember? The expectations we had after 74 for real socialist change. Who of you remember the disappointments of the split? That tragic 90s, when everything was overturned and we went lifestyle in the dislocation of social, cultural, political, economic life. That's when the loans started to be built that set up that armored economy, which collapsed one by one so it was done by wall street and it all came crashing down. Our generation is the loser.","Το μέλλον για σας, τους νέους και τις νέες δεν είναι αυτό που ήταν για μας, για τη δική μου γενιά. Και για αυτό φρόντισαν Τρόικα εσωτερικού, Τρόικα εξωτερικού, Πασοκ, νέα Δημοκρατία και ΣΥΡΙΖΑ. Έχτισαν μαύρες τρύπες μέσα στην ελληνική κοινωνική οικονομία οι όποιες αυτό κάνουν οι μαύρες τρύπες ρουφάνε όλη την ενέργεια, όλη την ύλη από τις ζωές των νέων ανθρώπων. Εάν στα 62 μου νοιάζομαι για αυτό το εγχείρημα. Δεν είναι για τη δική μας γενιά η δική μας γενιά, ηττηθήκαμε. Ξανά και ξανά. Μεταπολιτευτικά ποιοι από εσάς θυμάστε; Τις προσδοκίες που είχαμε μετά το 74 για πραγματική σοσιαλιστική αλλαγή. Ποιοι θυμάστε τις απογοητεύσεις της διάσπασεις; Εκείνη την τραγική δεκαετία του 90, που ανατράπηκαν όλα και πήγαμε στο lifestyle στην εκπόρνευση της κοινωνικής, πολιτισμικής, πολιτικής, οικονομικής ζωής. Τότε που άρχισαν να χτίζονται τα δάνεια που έστησαν εκείνη την θωρακισμένη οικονομία, η οποία κατέρρευσε με ένα ένα έτσι έγινε από την wall street και κατέρρευσαν όλα. Η δική μας γενιά είναι ηττημένη. ",criticism,economy,other,-0.8,0.2,0.2,"[['young people', 'person', '1.0'], ['us', 'group of people', '1.0'], ['my generation', 'group of people', '1.0'], ['troika', 'organization', '1.0'], ['pasok', 'political party', '1.0'], ['new democracy', 'political party', '1.0'], ['syriza', 'political party', '1.0'], ['greek', 'location', '1.0'], ['62', 'date', '1.0'], ['74', 'date', '1.0'], ['90s', 'date', '1.0'], ['wall street', 'organization', '1.0']]"
9,"If some of our generation in the Day 25 coalition for rupture are still standing and continuing to fight in the public, in the public sphere, it is because we want and really take at face value what you, the young people, are saying, young people to have a political capital that you can take and turn it into a profoundly radical overthrow of a rotten system, which is not being civilised, which is not being reformed, which is not being managed with marginal, marginal, marginal changes. ","Αν κάποιοι από τη δική μας γενιά στο Μέρα 25 συμμαχία για τη ρήξη, είμαστε ακόμα όρθιοι και συνεχίζουμε να παλεύουμε στο δημόσιο, στη δημόσια σφαίρα είναι γιατί θέλουμε και πραγματικά πάρτε το τοις μετρητοίς μετρητοίς αυτό που λέμε εσείς, οι νέοι, εσείς, οι νέες να έχετε ένα πολιτικό κεφάλαιο το οποίο εσείς να το πάρετε και να το μετατρέψετε σε μια βαθιά ριζοσπαστική ανατροπή ενός σάπιου συστήματος, το οποίο δεν εκπολιτίζεται, το οποίο δεν μεταρρυθμίζεται, το οποίο δεν γίνεται διαχειρίσιμο με παραμετρικές περιθωριακές μικρές αλλαγές. ",political agenda,other,youth,0.7,0.2,0.2,"[['day 25 coalition', 'group of people', '0.80'], ['young people', 'group of people', '0.90']]"
10,"Social democracy is dead and will never be reborn. What was happening in Germany under Billy Brandt in the late 60s and in the 70s under Bruno Krzysztynski in Austria. Under Labour in Britain. Social housing, a redistribution of wealth of income with strong unions. With social democratic governments acting as an arbiter between capital and the proletariat of the organised proletariat through the unions. Even here in Greece where there was a redistribution of income, as was done in 1981 by the first PASOK government. These are over and done with, because at the moment there is no sovereign state. Constantine Karamanlis, with all the bad things going wrong, had powers. He decided things at some point and was accused of socialism in 1977 to nationalize some banks. His android for anyone who remembers back then. So he decided to take the country out of NATO on the military side, when the Turks got into Cyprus, he had some powers, he did some things. Today the dummies that rule us, whether they are pink or green or purple what is blue. I wish they were purple, black is blue. They don't even have power, they have chairs. They can redistribute loot annuities to their company, but what Karamanlis did, old Papandreou did, they don't have the power to do. Do you know why? Because they handed it over. When all that debt was built, by entering the eurozone. And now because we're a little bit in the auditorium I'm not going to say things I would say in the square I'm going to make it a little bit more academic do you mind? It's very simple.","Η σοσιαλδημοκρατία πέθανε και δεν θα ξαναγεννηθεί ποτέ. Αυτά που γινόντουσαν στη Γερμανία, επί Μπίλι Μπραντ στα τέλη της δεκαετίας του 60 και του 70 επί Μπρούνο Κράισκι στην Αυστρία. Επί Εργατικών στη Βρετανία. Κοινωνικές κατοικίες, μια αναδιανομή του πλούτου του των εισοδημάτων με γερά συνδικάτα. Με κυβέρνησεις σοσιαλδημοκρατικές που λειτουργούσαν ως ένας διαιτητής μεταξύ του κεφαλαίου και του προλεταριάτου του οργανωμένου προλεταριάτου μέσα από τα συνδικάτα. Ακόμα και εδώ στην Ελλάδα που έγινε μια αναδιανομή εισοδήματος, όπως έγινε το 1981 από την πρώτη κυβέρνηση του ΠΑΣΟΚ. Αυτά τελειώσανε και τελειώσανε, γιατί αυτή τη στιγμή δεν υπάρχει κυρίαρχο κράτος. Ο Κωνσταντίνος Καραμανλής με όλα τα κακά τα στραβά, είχε εξουσίες. Αποφάσισε πράγματα κάποια στιγμή αποφάσισε και τον κατηγόρησαν για σοσιαλμανία το 1977 να εθνικοποιήσει κάποιες τράπεζες. Του ανδρεάδη για όποιους θυμούνται τότε. Έτσι αποφάσισε να βγάλει τη χώρα από το ΝΑΤΟ από το στρατιωτικό σκέλος, όταν μπήκαν οι Τούρκοι στην Κύπρο, είχε κάποιες εξουσίες, έκανε κάποια πράγματα. Σήμερα τα ανδρείκελα που μας κυβερνάνε, είτε είναι ροζ είτε είναι πράσινα, είτε είναι μωβ τι είναι μπλε. Μακάρι να ήταν μωβ, μαύρο μπλε είναι. Δεν έχουν καν εξουσία, καρέκλες έχουν. Μπορούνε να αναδιανέμουν προσόδους λάφυρα στην παρέα τους, αλλά αυτά που έκαναν ο Καραμανλής, ο παλιός ο Παπανδρέου, αυτοί δεν έχουν την εξουσία να τα κάνουν. Ξέρετε γιατί; Γιατί την παρέδωσαν. Όταν χτίστηκε όλο εκείνο το χρέος, μπαίνοντας στην ευρωζώνη. Και τώρα επειδή είμαστε και λίγο στο αμφιθέατρο δεν θα πω πράγματα που θα έλεγα στην πλατεία θα το κάνω λίγο πιο πανεπιστημιακό σας πειράζει; Είναι πολύ απλό. ",criticism,debt,bank bailouts,-0.4,0.2,0.2,"[['billy brandt', 'person', '0.7'], ['bruno krzysztynski', 'person', '0.6'], ['labour', 'political party', '0.7'], ['germany', 'country', '0.7'], ['austria', 'country', '0.6'], ['britain', 'location', '0.7'], ['greece', 'country', '0.7'], ['pasok', 'organization', '0.7'], ['constantine karamanlis', 'person', '0.7'], ['nato', 'organization', '0.7'], ['cyprus', 'location', '0.6'], ['papandreou', 'person', '0.7'], ['eurozone', 'organization', '0.7']]"
11,"Do you know why they put us in the European Economic Community? Because we had no debt. We had no debt. And it says to you, great they have their own houses, they have their own homes, they have their own farm, they have their own apartment building, they have their own apartment. They don't owe anybody. They have some factories here in Patras, in Elefsina, in Thriasio, in Volos, in Kozani, of course, in Thessaloniki. We will close them down, turn them into warehouses where instead of producing Pitsos Izola refrigerators they will bring them from Germany and put Pitsos or Izola on them. The cheapest fridges and that will give us the borrowed money to buy the German ones, which will replace the domestic ones that are now closing down. Right? That was the model. Of the European Economic Community and it is a model which is becoming turbo now is gone on steroids too hard steroids with the creation of the Euro, because with the Euro we got the mark the Euro is the mark don't kid yourself, Schaeuble told me at one point it got away from him. When I pressed him and I said to him don't tell me, if he agreed that the memorandum is disastrous for us, why do you insist? And he turns around and says, ""Don't you understand? France can't have the mark - he meant the euro - and run its budget. What if we let you go free? Grow. What message would I have given Paris that they can do their own thing? I will determine your national budget if you have the mark, he said. The second time he said it Euro he realised his mistake. But that is the story. So when we come in and there is a tsunami of money coming from Deutsche Bank from Finance Bank because these banks, the German banks had a huge drama in which these bankers were living in. Do you know what it is to be a German banker and to have money in your bank vaults because they were filled with money? Because when you export Mercedes to America, to China, to Japan, to France. What do you do? You put money into Germany and what goes in accumulates as surplus money in the banks in Frankfurt, the private banks. What is the drama of the banker having a lot of money and not being able to lend it out. The banker cannot sleep at night when he has too much money and cannot lend it out. He goes mad because the money is not his. It's his profits he makes by lending at a high rate of interest, but the Germans had saved why should they borrow all this pool of money that was coming in and piling up.","Ξέρετε γιατί μας βάλανε στην Ευρωπαϊκή Οικονομική Κοινότητα; Γιατι δεν ειχαμε χρεος. Δεν είχαμε χρέος. Και σου λέει, φοβεροί αυτοί έχουν τα δικά τους σπίτια έχουν αντίπαροχέςς, έχουν το αγρόκτημά τους, έχουν την πολυκατοικία τους έχουν το διαμερισματάκι τους. Δεν χρωστάνε σε κανέναν. Έχουν κάτι εργοστάσια εδώ στην Πάτρα, στην Ελευσίνα, στο Θριάσιο, στο Βόλο στην Κοζάνη βεβαίως στη Θεσσαλονίκη. Θα τους τα κλείσουμε, θα τα μετατρέψουμε σε αποθήκες όπου αντί να παράγουν Πιτσος Ιζολα ψυγεία θα τα φέρνουν από τη Γερμανία θα βάζουν Πίτσος ή Ιζόλα πάνω. Τα πιο φθηνά ψυγεία και αυτό θα μας δίνουν και τα χρήματα δανεικά για να αγοράζουμε τα γερμανικά, τα οποία θα υποκαταστήσουν τα εγχώρια που πλέον κλείνουν. Έτσι; Αυτό ήταν το μοντέλο. Της Ευρωπαϊκής Οικονομικής Κοινότητας και είναι ένα μοντέλο το οποίο γίνεται τούρμπο πια είναι πάει σε αναβολικά πάρα πολύ σκληρά αναβολικά με τη δημιουργία του Ευρώ, γιατί με το ευρώ αποκτήσαμε το μάρκο το ευρώ είναι το μάρκο μην κοροιδευομαστε μου το είπε ο Σόιμπλε κάποια στιγμή του ξέφυγε. Όταν τον πίεζα και του λέω δεν μου λες, αφού συμφώνησε ότι το μνημόνιο για μας είναι καταστροφικό, γιατί επιμένεις; Και γυρνάει και μου λέει δεν καταλαβαίνεις; Δεν μπορεί η Γαλλία να έχει το μάρκο εννοούσε το ευρώ και να κάνει κουμάντο στον προϋπολογισμό της. Και αν αφήσουμε εσάς ελεύθερους; Να αναπτυχθείτε. Τι μήνυμα θα έχω δεις δώσει στο Παρίσι ότι μπορούν να κάνουν και αυτοί του κεφαλιού τους; Εγώ θα προσδιορίζω τον εθνικό προϋπολογισμό σας αν έχετε το μάρκο αυτό μου είπε. Τη δεύτερη φορά το είπε Ευρώ κατάλαβε το λάθος του. Αλλά αυτή είναι η ιστορία. Όταν λοιπόν μπαίνουμε και έρχεται ένα τσουνάμι από χρήματα από την Deutsche Bank από την Finance Bank γιατί αυτές οι τράπεζες, οι γερμανικές τράπεζες είχαν ένα τεράστιο δράμα στο οποίο ζούσαν αυτοί οι τραπεζίτες. Ξέρετε τι είναι να είσαι γερμανός τραπεζίτης και να έχεις γεμίσει με χρήματα στα θησαυροφυλάκια της τράπεζας σου γιατί γέμιζαν με χρήματα; Γιατί όταν εξάγεις Μερσεντές στην Αμερική, στην Κίνα, στην Ιαπωνία, στη Γαλλία. Τι κάνεις; Βάζεις χρήμα μέσα στη Γερμανία και αυτό που πάει συσσωρεύεται ως πλεονασματικό χρήμα στις τράπεζες της Φρανκφούρτης, τις ιδιωτικές. Ποιο το δράμα του τραπεζίτη να έχει πολλά χρήματα και να μην μπορεί να τα δανείσει. Δεν μπορεί να κοιμηθεί ο τραπεζίτης το βράδυ όταν έχει πολύ χρήμα και δεν μπορεί να το δανείσει. Τρελαίνεται γιατί τα χρήματα δεν είναι δικά του. Δικά του είναι τα κέρδη που βγάζει δανείζοντας με υψηλό επιτόκιο, αλλά οι Γερμανοί είχαν αποταμιεύσει γιατί να δανειστούν όλη αυτή τη λίμνη του χρήματος που ερχόταν και συσσωρευόταν. ",criticism,debt,debt regulations,-0.7,0.3,0.2,"[['european economic community', 'organization', '1.0'], ['patras', 'location', '1.0'], ['elefsina', 'location', '1.0'], ['thriasio', 'location', '1.0'], ['volos', 'location', '1.0'], ['kozani', 'location', '1.0'], ['thessaloniki', 'location', '1.0'], ['germany', 'country', '1.0'], ['france', 'country', '1.0'], ['deutsche bank', 'organization', '1.0'], ['finance bank', 'organization', '1.0'], ['mercedes', 'organization', '1.0'], ['china', 'country', '1.0'], ['japan', 'country', '1.0'], ['frankfurt', 'location', '1.0']]"
12,"So they found us and the Portuguese and the Spanish and the Spaniards and the Italians in southern Italy and the Irish and they were a bargain, they have no debt. They have houses we'll take their houses if they don't pay the debts but we'll lend them money and we'll make money while they pay us back and we'll take them into the houses, they can't pay us back. That's the way HYPERImperialism works in the Eurozone within the European Union. With the same currency. And now when they all start to go bankrupt, because the German banks went bankrupt too. Why? They went bankrupt for the simple reason that they made all these funny bets on the United States, but I'm not going to get into that story.","Οπότε βρήκαν εμάς και τους Πορτογάλους και τους Ισπανούς και τους Ιταλούς της Νότιας Ιταλίας και τους Ιρλανδούς και ήταν κελεπούρια, δεν έχουν χρέος. Έχουν σπίτια θα τους πάρουμε τα σπίτια αν δεν αποπληρώσουν τα χρέη αλλά θα τους δανείσουμε και θα βγάλουμε χρήματα όσο μας αποπληρώνουν και θα τους πάρουμε στα σπίτια, δεν θα μπορούν να μας αποπληρώνουν. Έτσι λειτουργεί ο ΥΠΕΡιμπεριαλισμός στην ευρωζώνη εντός της Ευρωπαϊκής Ένωσης. Με το ίδιο νόμισμα. Και όταν πλέον αρχίζουν και πτωχεύουν όλοι, γιατί πτώχευσαν και οι γερμανικές τράπεζες. Γιατί; Πτώχευσαν για τον απλούστατο λόγο ότι έκαναν όλα αυτά τα στοιχήματα της πλάκας στις Ηνωμένες Πολιτείες, αλλά δεν θα μπλέξω σε αυτή την ιστορία. ",criticism,debt,other,-0.4,0,0,"[['portuguese', 'organization', '0.7'], ['spanish', 'group of people', '0.5'], ['spaniards', 'group of people', '0.5'], ['italians', 'group of people', '0.5'], ['irish', 'group of people', '0.5'], ['eurozone', 'location', '0.4'], ['european union', 'organization', '0.6'], ['german', 'organization', '0.4'], ['united states', 'country', '0.6']]"
13,"The government of George Papandreou, who is from the region, is starting, so I think he's coming down here, right? Black him out, guys. That's mercy, so to speak.",Αρχίζει η κυβέρνηση του Γιώργου Παπανδρέου που είναι απί την περιοχή έτσι νομίζω κατεβαίνει εδώ σωστά Ε; Μαυρίστε τον Ρε παιδιά. Δηλαδή έλεος ας πούμε.,criticism,elections,other,-0.5,0,0,"[['george papandreou', 'person', '0.85']]"
14,"He put us hand and foot in the prison of debt from beautiful sunny Castelorizo. And he saved us, the first saviour for you think about it. He took 110 billion loan is the biggest loan in human history. I'm not exaggerating. Look it up. Has there ever been a loan bigger than 110 billion? Never in history and I'm not talking in proportion to GDP and such in absolute terms. No country had ever taken 110 billion loans from anybody ever it was never for us of course. They went to the Treasury and went to Deutsche Bank, Societe General so that those banks would not collapse. And on terms of course what are the terms? Imagine if a friend of yours came to you and said you know what? I have a loan, I can't pay it because my salary has been reduced, but a banker comes and gives me a credit card to draw at a high interest rate, pretend to pay it, but then he puts a limit on it. I'll take a cut. 28% of my income not enough to pay off the loan will be reduced to 8% through austerity to give you a credit card to get you into more debt. If you hated this friend, but you had to hate him too much, but you must have been very cruel people to say take it, they took it and we have been handcuffed ever since","Χειροπόδαρα μας έβαλε στη φυλακή του χρέους από το όμορφο λαμπερό ηλιόλουστο Καστελόριζο. Και μας έσωσε, ο πρώτος ο σωτήρας για σκεφτείτε το. Πήρε 110 δισεκατομμύρια δάνειο είναι το μεγαλύτερο δάνειο στην ανθρώπινη ιστορία. Δεν υπερβάλλω. Ψάξτε να δείτε. Είχε υπάρξει ποτέ δάνειο μεγαλύτερο από 110 δισεκατομμύρια ευρώ; Ποτέ στην ιστορία και δεν μιλάω αναλογικά με το ΑΕΠ και τέτοια σε απόλυτες τιμές. Καμία χώρα δεν είχε πάρει δάνεια 110 δισεκατομμύρια από κανέναν ποτέ ποτέ δεν ήταν για μας βέβαια. Μπήκαν στο Υπουργείο Οικονομικών και πήγαν στην Deutsche Bank, στην Societe General για να μην καταρρεύσουν εκείνες οι τράπεζες. Και με όρους βέβαια ποιοί είναι οι όροι; Φανταστείτε να έρθει ένας φίλος σας να σας πει ξέρεις κάτι; Έχω ένα δάνειο, δεν μπορώ να το πληρώσω γιατί μειώθηκε μισθός μου, αλλά έρχεται ένας τραπεζίτης και μου δίνει μια πιστωτική κάρτα να τραβάω με ψηλό επιτόκιο, να προσποιούμαι ότι από πληρωνω αλλα μου βαζει και εναν ορο. Να μειώσω. 28% το εισόδημα μου το εισόδημα που δεν φτάνει να αποπληρώσει το δάνειο θα μειωθεί και στο 8% μέσα από τη λιτότητα για να σου δώσει μια πιστωτική κάρτα για να έχεις μεγαλύτερο χρέος. Αν τον μισούσατε αυτό το φίλο, αλλά έπρεπε να τον μισείτε πάρα πολύ, όμως πρέπει να ήσασταν πολύ σκληροί άνθρωποι για να του πείτε πάρτε το, πήραν και από τότε είμαστε χειροπόδαρα",criticism,debt,other,-0.9,0.3,0,"[['castelorizo', 'location', '0.9'], ['deutsche bank', 'organization', '0.9'], ['societe general', 'organization', '0.9'], ['treasury', 'organization', '0.9'], ['110 billion', 'date', '0.9'], ['28%', 'date', '0.9'], ['8%', 'date', '0.9']]"
