id,text,text_el,is_criticism,topic-context,subtopic-context,sentiment,polarization-definition,populism-definition,ner-limited
15,"In 2015, this brave people against an oligarchy that told them that we were in cahoots, that mocked them for all the loans taken by the oligarchy. It was terrorizing him with Armageddon if he dared to rise up, this people rose up. Don't forget that with Syriza we started it, we had a 4%. So a little parenthesis. All serious projects the big shooting starts as small when I tell you that we are laying the foundations. for the new big left that will govern this country, with you young people in the vanguard. I am speaking absolutely realistically, as long as we believe it and as long as we sweat the jersey of the day 25 alliance for rupture as long as we bleed it, as long as we give the fight, the good we can free ourselves. I close the parenthesis. The people in 15 were ahead, they were way ahead of the leadership. Our people went from 4 to 36%.","Το 2015 αυτός ο γενναίος λαός κόντρα σε μια ολιγαρχία που του λεγε ότι μαζί τα φάγαμε, που τον λοιδορούσε για όλα τα δάνεια που πήρε η ολιγαρχία. Τον τρομοκρατούσε με Αρμαγεδδώνα αν τολμήσει να ξεσηκωθεί, αυτός ο λαός ξεσηκώθηκε. Μην ξεχνάτε ότι με το ΣΥΡΙΖΑ το ξεκινήσαμε, είχαμε ένα 4%. Γι αυτό μια μικρή παρένθεση. Όλα τα σοβαρά εγχειρήματα τα μεγάλα γυρίσματα ξεκινούν ως μικρά όταν σας λέω ότι βάζουμε τις βάσεις. για τη νέα μεγάλη αριστερά που θα κυβερνήσει αυτό τον τόπο, με εσάς τους νέους και τις νέες στην πρωτοπορία. Μιλώ απολύτως ρεαλιστικά, εφόσον το πιστέψουμε και εφ όσον ίδρωσουμε τη φανέλα του μέρα 25 συμμαχία για τη ρήξη εφ όσον τη ματώσουμε, εφόσον δώσουμε τον αγώνα, τον καλό μπορούμε να απελευθερωθούμε. Κλείνω την παρένθεση. Ο λαός στο 15 ήταν μπροστάρης, ήταν πολύ πιο μπροστά από την ηγεσία. Ο λαός μας πήγε από το 4 στο 36%. ",political agenda,elections,other,0.5,0,0.9,"[['syriza', 'political party', '1.0'], ['25 alliance for rupture', 'political party', '1.0'], ['greece', 'country', '1.0'], ['2015', 'date', '1.0']]"
16,"And during that five months you had an oligarchy without borders, which only launched a nuclear war, which did not launch a nuclear war against us. You shut us down.","Και τη διάρκεια εκείνου του πενταμήνου που είχες μια ολιγαρχία χωρίς σύνορα, η οποία εξαπόλυσε μόνο πυρηνικό πόλεμο δεν εξαπέλυσε εναντίον μας. Μας κλείσατε ρευστότητα. ",criticism,economy,borders,0,0.5,0.4,[]
17,"The channels of interconnection and deception constantly bombarded our people with black and spidery propaganda. Against the attempt to make a break that some of us made, not all of us made.",Τα κανάλια της διαπλοκής και της εξαπάτησης συνεχώς βομβάρδιζαν το λαό μας με προπαγάνδα μαυρη και αραχνη. Εναντίον της προσπάθειας για μια ρήξη που κάναμε κάποιοι δεν την κάναμε όλοι.,criticism,media,other,-0.6,0.2,0,[]
18,"We did not make the effort, the break. We tried to make it. They closed the banks and for a week they threatened the people with desertification if they dared to vote no, the people voted NO. The people did their duty, some people tell me now what are you trying to do, John, with the leftist and leftist parties and such here this people don't understand what this people don't understand. When it was needed, it stood up, as it stood up in 1941, as it stood up in 1973 at the Polytechnic, again with the young people and the young leaders, as it stood up in 2015 with 62% of the Greek people saying no to the Troika. The only debt we have is the debt of disobedience to be disobedient and selfless. These people show that when given the opportunity when they see selflessness coming to the forefront of government to work in their favour. This people forget both their selfishness and their misery. And all the evils of fate that our people have, all peoples have what to do? And they emerge as heroes and heroines. I will never forget the Friday night 03/07/2015 in Syntagma Square, in that magnificent gathering for the NO. Where I was caught with Danae we were caught with Danae we were caught by people in their 80s in their 90s, poor. And they told us, boy, I don't care about my pension, you have to bow down for my grandchildren. Don't back break and she won 62%. That break that 90 year old man and his wife who was the same age told me. That leads us today in Patras so many years after that break we put in the parliament in 2019 cowardly alone a handful of people almost accidentally kushuloi as the Cretans say. We have invested this break now with a coherent well-worked 100-day government programme with a coherent programme for the next 100 days. A truly radical overthrow of capitalist relations, of feudal relations of production in this country.","Την προσπάθεια, τη ρήξη δεν την κάναμε. Προσπαθήσαμε να την κάνουμε. Κλείνουν τις τράπεζες και για μία εβδομάδα απειλούσαν τον λαό με ερημοποίηση αν τολμήσει να ψηφίσει όχι ο λαός ψήφισε ΟΧΙ. Ο λαός έκανε το καθήκον του, κάποιοι μου λένε τώρα τι πας να κάνεις βρε Γιάννη με την με κόμματα και με αριστερό πρόσημο και τέτοια εδώ αυτός ο λαός δεν κατάλαβαίνει τι δεν καταλαβαίνει αυτός ο λαός. Όταν χρειάστηκε, στάθηκε όρθιος, όπως στάθηκε το 1941, όπως στάθηκε το 1973 στο Πολυτεχνείο, πάλι με τους νέους και τις νέες μπροστάρηδες, όπως συστάθηκε το 2015 με το 62% του ελληνικού λαού να λέει όχι στην τρόικα. Το μόνο χρέος που έχουμε εμείς είναι το χρέος της ανυπακοής να είμαστε ανυπότακτοι και ανιδιοτελείς. Αυτός ο λαός δείχνει ότι όταν του δίνεται η ευκαιρία όταν βλέπει την ανιδιοτέλεια να έρχεται στα πρόθυρα των κυβερνητικών θώκων για να λειτουργήσει υπέρ του. Αυτός ο λαός ξεχνάει και την ιδιοτέλεια του και τη μιζέρια του. Και όλα τα κακά της μοίρας που έχει ο λαός μας, όλοι οι λαοί έχουμε τι να κάνουμε; Και αναδεικνύονται σε ήρωες και ηρωίδες. Δεν θα ξεχάσω ποτέ το βράδυ της Παρασκευής 03/07/2015 στην πλατεία Συντάγματος, σε εκείνη τη μεγαλειώδη συγκέντρωση για το ΟΧΙ. Που με πιάνανε μας πιάνανε με τη Δανάη  μας πιάνανε άνθρωποι μεροκαματιάρηδες στα 80 τους στα 90 τους, πάμφτωχοι. Και μας λέγαν αγόρι μου, δεν με νοιάζει η σύνταξή μου σεν πρέπει να υποκύψετε για τα εγγόνια μου. Μην κάνετε πίσω ρήξη και αυτή κέρδισε το 62%. Εκείνο το ρήξη που μου είχε πει εκείνος ο 90 χρονος με τη γυναίκα του που ήταν ίδιας ηλικίας. Εκείνο μας οδηγεί σήμερα στην Πάτρα τόσα χρόνια μετά αυτή τη ρήξη βάλαμε στη Βουλή το 2019 δειλά δειλά μόνοι μας μια χούφτα άνθρωποι σχεδόν τυχαία κουζουλοί που λένε και οι κρητικοί. Αυτή τη ρήξη την έχουμε επενδύσει τώρα με ένα συνεκτικό καλά δουλεμένο κυβερνητικό πρόγραμμα 100 ημερών με ένα συνεκτικό πρόγραμμα και για μετά τις 100 μέρες. Πραγματικά ριζοσπαστικής ανατροπής των καπιταλιστικών σχέσεων, των φεουδαρχικών σχέσεων παραγωγής σε αυτή τη χώρα. ",political agenda,democracy,troika,0,0.2,0.6,"[['john', 'person', '0.5'], ['troika', 'organization', '0.5'], ['greek', 'country', '1.0'], ['1941', 'date', '1.0'], ['1973', 'date', '1.0'], ['polytechnic', 'organization', '1.0'], ['2015', 'date', '1.0'], ['syntagma square', 'location', '1.0'], ['danae', 'person', '1.0'], ['patras', 'location', '1.0'], ['cretans', 'group of people', '0.5']]"
19,"Do you know of any other party that has a number of plans from institutions ready for legislation. A handful of MPs. We have lifted a huge burden. And I'm not talking about me, I'm talking about the comrades, the fellow travelers, those few who ultimately if you look at the legislative work they did is equivalent to, not to say greater than the 70 so many of Syriza. We are not starting from scratch. We have built a foundation stone. We have built it, and now it remains for these elections and the next ones, because we will certainly have second elections. You understand that on Sunday evening the real election campaign begins. This is a dress rehearsal to get fit, to warm up, and in a short while we will be back here in Patras and in all the cities. We will give it with great joy with a huge smile and the next race because let's not forget not to lose the sense of what is happening as we speak.","Ξέρετε άλλο κόμμα που να έχει μια σειρά από σχέδια από θεσμούς έτοιμους προς νομοθέτηση. Μια χούφτα βουλευτές. Σηκώσαμε ένα τεράστιο βάρος. Και δεν μιλάω για μένα, μιλάω για τους συντρόφους, για τους συνοδοιπόρους, για αυτούς τους λίγους που τελικά αν δείτε το νομοθετικό έργο που έκαναν είναι αντίστοιχο να μην σας πω μεγαλύτερο από ότι η 70 τόσοι του ΣΥΡΙΖΑ. Δεν ξεκινάμε από το μηδέν. Έχουμε χτίσει ένα θεμέλιο λίθο. Τον έχουμε φτιάξει τώρα μένει αυτές οι εκλογές και οι επόμενες, γιατί σίγουρα θα έχουμε και δεύτερες. Καταλαβαίνετε ότι την Κυριακή το βράδυ ξεκινάει ο πραγματικός προεκλογικός αγώνας. Αυτό είναι μια πρόβα τζενεράλε για να γυμναστούμε, να προθερμανθούμε,  σε λίγο θα είμαστε πάλι εδώ και στην Πάτρα και σε όλες τις πόλεις. Θα τον δώσουμε με μεγάλη χαρά με τεράστιο χαμόγελο και τον επόμενο αγώνα γιατί μην ξεχνάμε μη χάσουμε την αίσθηση του τι συμβαίνει αυτή τη στιγμή που μιλάμε. ",political agenda,elections,other,0.4,0,0,"[['syriza', 'political party', '0.8'], ['patras', 'location', '0.6']]"
20,"You have an oligarchic establishment. Can I make a little parenthesis again? The KKE accuses me of talking about oligarchy and not talking about capitalism. Can you tell me what Marx's critique of capitalism is? That you have the few owning the means of production and the many working in means of production that are not theirs. Capitalism is oligarchy based on the unequal distribution of capital. The same thing is once the oligarchy was based on the unequal distribution of land with the land grabbers. Or feudalism in Central Europe. Today the oligarchy is based, yes, on the unequal distribution of capital, but comrades fellow travellers, especially among young children. Let's not make a mistake. Here we do not have capitalism, which has a dynamic capitalist economy. The whole thing has collapsed. Think about the rich people at the moment, those who live in Ekali in Kolonaki, where do they make their money from? They used to make it, they had factories in Patras. They exploited the proletariat, the other guy went, he worked 8 hours, they paid him for 4, as Marx says in Capital, Volume One. He was selling the product of his labor, the value produced by the proletarian, the proletarians, many proletarian women, especially in the factories here in Patras, let's not forget that. So this surplus value was going a part of it to the bankers, a part of it to the.","Έχεις ένα ολιγαρχικό κατεστημένο. Να κάνω μια μικρή παρένθεση πάλι; Με κατηγορεί τον ΚΚΕ ότι μιλάω για ολιγαρχία και δεν μιλάω για καπιταλισμό. Δεν μου λέτε η κριτική του Μαρξ στον καπιταλισμό ποια είναι; Ότι έχεις τους λίγους τους ολίγους να έχουν στην κατοχή τους τα μέσα παραγωγής και τους πολλούς να δουλεύουν σε μέσα παραγωγής που δεν είναι δικά τους. Ο καπιταλισμός είναι η ολιγαρχία που βασίζεται στην άνιση κατανομή του κεφαλαίου. Το ίδιο πράγμα είναι κάποτε η ολιγαρχία ήταν στη βάση της άνισης κατανομής της γης με τους κοτζαμπάσηδες. Ή στην φεουδαρχία στην Κεντρική Ευρώπη. Σήμερα η ολιγαρχία βασίζεται ναι, στην άνιση κατανομή του κεφαλαίου, αλλά συντρόφισσες και σύντροφοι συνοδοιπόροι, ιδίως στα νέα παιδιά. Μην κάνουμε λάθος. Εδώ δεν έχουμε καπιταλισμό, ο οποίος να έχει μια δυναμική καπιταλιστικής οικονομίας. Έχει καταρρεύσει όλο αυτό το πράγμα. Σκεφτείτε οι πλούσιοι αυτή τη στιγμή αυτοί που ζουν στην Εκάλη στο Κολωνάκι, από που βγάζουν τα λεφτά τους; Κάποτε τα βγάζανε, είχαν εργοστάσια στην Πάτρα. Εκμεταλλεύονται το προλεταριάτο πήγε ο άλλος, δούλευε 8 ώρες τον πλήρωναν για 4 που λέει και ο Μαρξ το κεφάλαιο, τόμος ένα. Πούλαγε το προϊόν της εργασίας του, η αξία που παρήγαγε ο Προλετάριος, η Προλετάρια, πολλές προλετάριες γυναίκες, ιδίως στα εργοστάσια εδώ στην Πάτρα, μην το ξεχνάμε αυτό. Έτσι, αυτή η υπεραξία πήγαινε ένα κομμάτι της στους τραπεζίτες, ένα κομμάτι στους. ",criticism,economy,oligarchy,-0.8,0.1,0,"[['kke', 'organization', '0.5'], ['marx', 'person', '1.0'], ['capitalism', 'political party', '0.0'], ['central europe', 'location', '1.0'], ['ekali', 'location', '1.0'], ['kolonaki', 'location', '1.0'], ['patras', 'location', '1.0'], ['proletariat', 'group of people', '1.0'], ['surplus value', 'concept', '0.0'], ['bankers', 'organization', '0.3']]"
21,"The owners of the land and the rest was the profit of the capitalist today where do they profit from? From red loans. That is, the fund comes in which a local has made a local with a foreigner and 2 3 other friends. There are also some participations from the circle of Mitsotakis A E. But don't say it too much, I have told the channels, you don't say that. Tell me, do you hear me? They come, they get a loan. A man who's in debt, who's in debt. Because of the 100,000-dollar crisis, he takes it for three grand. He's got the house on 50, he's got 3, he's got 47. Is that capitalism? That's a primitive form of exploitation. It's not even capitalist exploitation. When the coalition of the Radical Left comes and fixes your energy stock exchange in the name of the Left and progress and ecology, so in the energy stock exchanges and you have Mytilineos in it, Peristeri the CVC or Latsis Vardinoyannis. And they sit around a virtual digital table, because they don't lie. Digital messages are exchanged every day and they decide among themselves how much to hack your electricity between them uncontrollably without any purchases. No rules, no caps. This is not Marx, he would tell you that this is not capitalism, it is no different than primitive plunder. This is what happens when a capitalism collapses and the only reason Greek capitalism is alive is because you have the European Central Bank having the Greek state bailing out the Greek banks and all these predators propping them up, threatening a government like the one we're going to create we're going to threaten no doubt that it will create a financial stranglehold on us, that it can shut us down at the ATMs.","Οι ιδιοκτήτες της γης και το υπόλοιπο ήταν το κέρδος του κεφαλαιοκράτη σήμερα απ όπου κερδίζουν; Από τα κόκκινα δάνεια. Δηλαδή έρχεται το ταμείο στο οποίο έχει φτιάξει ένας ντόπιος με ένα ξένο και άλλους 2 3 φίλους. Κάποιες συμμετοχές υπάρχουν και από τον κύκλο της Μητσοτάκης Α Ε αυτό Μην το πείτε όμως παραέξω τα έχω πει στα κανάλια, εσείς μην τα λέτε αυτά. Να τα λέτε με, ακούτε έτσι; Έρχονται, παίρνουν ένα δάνειο. Που χρωστάει ένας άνθρωπος που έχει εξοκείλει. Λόγω της κρίσης των 100.000, το παίρνει με 3 χιλιάρικα. Του βγάζει το σπίτι στο σπίτι με 50, έχει βάλει 3, έχει βγάλει 47. Αυτό είναι καπιταλισμός; Αυτό είναι μια πρωτόγονη μορφή εκμετάλλευσης. Δεν είναι καν καπιταλιστική εκμετάλλευση. Όταν έρχεται και σου φτιάχνει το χρηματιστήριο ενέργειας ο συνασπισμός της Ριζοσπαστικής Αριστεράς στο όνομα της Αριστεράς και της προόδου και της οικολογίας, έτσι και στα χρηματιστήρια ενέργειας και έχεις τον Μυτιληναίο μέσα, το Περιστέρη τη CVC ή τον Λάτση τον Βαρδινογιάννη. Και κάθονται γύρω γύρω από ένα εικονικό ψηφιακό τραπέζι, γιατί δεν βρίσκονται. Ψηφιακά μηνύματα ανταλλάσσουν κάθε μέρα και αποφασίζουν μεταξύ τους πόσο θα σας χαράτσοσουν στο ηλεκτρικό ρεύμα μεταξύ τους ανεξέλεγκτα χωρίς αγορές. Χωρίς κανόνες, χωρίς πλαφόν. Αυτό δεν είναι ο Marx, ο ίδιος θα σας έλεγε ότι αυτό δεν είναι καπιταλισμός, δεν διαφέρει από την πρωτόγονη λεηλασία. Αυτό συμβαίνει όταν καταρρέει ένας καπιταλισμός και ο μόνος λόγος που ο ελληνικός καπιταλισμός είναι ζωντανός είναι επειδή έχεις στην Ευρωπαϊκή Κεντρική Τράπεζα να έχει διασωλήνωσει το ελληνικό κράτος τις ελληνικές τράπεζες και όλα αυτά τα αρπακτικά να τα στηρίζει, να απειλεί μια κυβέρνηση σαν αυτή που θα δημιουργήσουμε εμείς θα μας απειλήσει μην έχετε καμία αμφιβολία ότι θα μας δημιουργήσει χρηματοδοτική ασφυξία, ότι θα μπορεί να μας κλείσει στα ΑΤΜ. ",criticism,economy,bank regulations,-0.9,0,0,"[['the owners', 'person', '0.8'], ['capitalist', 'organization', '0.7'], ['red loans', 'organization', '0.5'], ['mitsotakis a e', 'organization', '0.6'], ['coalition of the radical left', 'organization', '0.7'], ['mytilineos', 'organization', '0.5'], ['peristeri the cvc', 'organization', '0.4'], ['latsis vardinoyannis', 'organization', '0.5'], ['european central bank', 'organization', '0.8'], ['greek state', 'country', '0.6'], ['greek banks', 'organization', '0.6'], ['government', 'organization', '0.6'], ['atms', 'location', '0.6']]"
22,"We admit these things, we don't say, this mistake that 15 and I made, self-criticism here now, so. We did not prepare the Greek people, the people knew it and were behind us. We didn't prepare them by telling them exactly what rupture means. I didn't talk about the parallel payment system that has now become a hangman's noose. I did not talk about how we were going to stop the closure of the banks, threatening Draghi that if he closed them down we would cut the bonds he held were Greek law and would create a huge problem for him with Italy. I was keeping these as papers. Hoping that I will have the support of Alexis Tsipras to use them at the right time, as when you are in battle, you start in battle, you don't reveal your weapons to the enemy. But since Alexis Tsipras did not intend to fight this battle, but he wanted one thing, how not to fight this battle, how to stop me from using these weapons.","Εμείς τα παραδεχόμαστε αυτά δεν λέμε, αυτό το λάθος που κάναμε το 15 και εγώ, αυτοκριτική εδώ τώρα έτσι. Δεν ετοιμάσαμε τον ελληνικό λαό ο λαός το ήξερε και ήταν πίσω μας. Δεν ετοιμάσαμε λέγοντάς του ακριβώς τι σημαίνει ρήξη. Δεν μίλησα για το παράλληλο σύστημα πληρωμών που τώρα έγινε δήμητρα. Δεν μίλησα για το πώς θα σταματούσαμε το κλείσιμο των τραπεζών, απειλώντας τον Ντράγκι ότι αν μας τις έκλεινε θα του κουρέψουμε τα ομόλογα τα οποία κατείχε ήταν του ελληνικού δικαίου και θα του δημιουργούσε τεράστιο πρόβλημα με την Ιταλία. Αυτά τα κρατούσα ως χαρτιά. Ελπίζοντας ότι θα έχω τη στήριξη του Αλέξη Τσίπρα να τα χρησιμοποιήσουμε τη στιγμή που πρέπει, όπως όταν είσαι στη μάχη, ξεκινά στη μάχη, δεν αποκαλύπτεις στον εχθρό τα όπλα σου. Αλλά δεδομένου ότι ο Αλέξης Τσίπρας δεν είχε σκοπό να δώσει αυτή τη μάχη, αλλά ένα πράγμα ήθελε, πώς να μη δώσουμε αυτή τη μάχη, πώς να με σταματήσει από το να χρησιμοποιήσει αυτά τα όπλα. ",political agenda,economy,bank regulations,-0.4,0.2,0,"[['1. greek people', 'group of people', '0.5'], ['2. alexis tsipras', 'person', '0.8'], ['3. draghi', 'person', '0.5'], ['4. italy', 'country', '0.5'], ['5. banks', 'organization', '0.5'], ['6. greek law', 'organization', '0.5'], ['7. syriza', 'political party', '0.5'], ['8. rupture', 'date', '0.5']]"
