id,text,text_el,is_criticism,topic-context,subtopic-context,sentiment,polarization-definition,populism-definition,ner-limited
8,"However, apart from SYRIZA, the government of the New Democracy and PASOK also remember the returning citizens during the election campaign. They show a late interest in their acute problems, such as the one of housing loans, which have led to the suffocation of thousands of such families here in Kallithea... It is nothing but a deception for the sake of vote harvesting.If they really had the will to provide relief, then they would not have rejected the amendment tabled by the KKE on housing loans for returnees some time ago, last December! The KKE had proposed:the cancellation of all interest and the amounts corresponding to compounding and capitalisation of all forms of interest, a 50% reduction of the debts remaining after the interest has been cancelled, and the servicing of the amount remaining on terms that a popular family can afford. Therefore, therefore, these parties must pay for their deception and mockery, but also for their responsibility for the situation to which all these families have been led...","Εκτός, όμως, από τον ΣΥΡΙΖΑ, τους παλιννοστούντες θυμούνται προεκλογικά και η κυβέρνηση της ΝΔ και το ΠΑΣΟΚ. Δείχνουν όψιμο ενδιαφέρον για τα οξυμένα προβλήματά τους, όπως για παράδειγμα αυτό των στεγαστικών δανείων, που έχουν οδηγήσει σε ασφυξία χιλιάδες τέτοιες οικογένειες και εδώ στην Καλλιθέα… Δεν είναι παρά μία εξαπάτηση για την υφαρπαγή ψήφων.Αν πράγματι είχαν την βούληση να δώσουν ανάσες ανακούφισης, τότε δεν θα απέρριπταν λίγο καιρό πριν, τον περασμένο Δεκέμβριο, την τροπολογία που κατάθεσε το ΚΚΕ για τα στεγαστικά δάνεια των παλιννοστούντων! Το ΚΚΕ είχε προτείνει:τη διαγραφή όλων των τόκων και των ποσών που αντιστοιχούν σε ανατοκισμό και κεφαλαιοποίηση κάθε μορφής τόκων, τη μείωση κατά 50% των οφειλών που παραμένουν μετά τις διαγραφές των τόκων, και την εξυπηρέτηση του ποσού που απομένει με όρους που μπορεί να αντέξει μια λαϊκή οικογένεια. Γι’ αυτό λοιπόν, πρέπει να πληρώσουν τα κόμματα αυτά την εξαπάτηση και τον εμπαιγμό, αλλά και τις ευθύνες που έχουν για την κατάσταση που έχουν οδηγηθεί όλες αυτές οι οικογένειες...",criticism,housing,other,-0.5,0.2,0.2,[]
9,"Friends, compañeras and compañeros, Few days left! Next Sunday, our people will measure their strength, the strength with which they will stand up to the next unpopular government.And we say to them today, here in Kallithea, that they can surprise and strengthen the KKE as much as possible!Yes, they can surprise! With a strong KKE he will find himself stronger, more prepared against the attack that will follow when the election lights go out. When the parties that have ruled and brought us to this point share the ministerial chairs and get back to their usual work.Then their entire government programme will come out of the drawers... Because so far we have only seen the cover page, let alone the titles of the contents.  ","Φίλες και φίλοι, συντρόφισσες και σύντροφοι, Λίγες μέρες έμειναν! Την άλλη Κυριακή, ο λαός μας θα μετρήσει το ανάστημά του, τη δύναμη με την οποία θα βρεθεί απέναντι στην επόμενη αντιλαϊκή κυβέρνηση.Και εμείς του λέμε σήμερα και από εδώ, από την Καλλιθέα, ότι μπορεί να κάνει την έκπληξη και να ενισχύσει όσο γίνεται περισσότερο το ΚΚΕ!Ναι, μπορεί να κάνει την έκπληξη! Με ΚΚΕ δυνατό θα βρεθεί ο ίδιος πιο δυνατός, πιο προετοιμασμένος απέναντι στην επίθεση που θα ακολουθήσει όταν σβήσουν τα προεκλογικά φώτα. Όταν τα κόμματα που έχουν κυβερνήσει και μας έχουν φέρει ως εδώ, μοιράσουν τις υπουργικές καρέκλες και πιάσουν πάλι τη γνωστή τους δουλειά.Τότε απ’ τα συρτάρια θα βγει ολόκληρο το κυβερνητικό πρόγραμμά τους… Γιατί μέχρι τώρα έχουμε δει μόνο το εξώφυλλο, άντε και τους τίτλους των περιεχομένων.  ",political agenda,elections,election spending,0.2,0.2,0.2,"[['kke', 'organization', '1.0'], ['kallithea', 'location', '1.0'], ['greek government', 'organization', '0.5'], ['election day', 'date', '1.0']]"
10,"However, this government programme from its first pages includes over 350 unpopular preconditions until 2026 for the EU Recovery Fund, the super-memorandum of ND, SYRIZA and PASOK. What Varoufakis called ""a chance to do something good in the EU"".So you can see what is coming... All the more so as there are growing signs that a new capitalist crisis is on the horizon internationally. And you know who pays the price every time this happens. We saw it in 2010 with the huge unemployment, the wage and pension cuts, the memoranda... We saw it again in 2020 with the work stoppages, with the inflation brought about by the expansionist approach of governments to that crisis...","Όμως, αυτό το κυβερνητικό πρόγραμμα από τις πρώτες σελίδες, περιλαμβάνει πάνω από 350 αντιλαϊκά προαπαιτούμενα μέχρι το 2026 για το Ταμείο Ανάκαμψης της ΕΕ, το υπερμνημόνιο της ΝΔ, του ΣΥΡΙΖΑ και του ΠΑΣΟΚ. Αυτό που ο κ. Βαρουφάκης χαρακτήρισε «ευκαιρία να γίνει κάτι καλό στην ΕΕ».Καταλαβαίνετε, λοιπόν, τι έρχεται… Πόσο μάλλον που πληθαίνουν οι ενδείξεις ότι μια νέα καπιταλιστική κρίση βρίσκεται προ των πυλών διεθνώς. Και ξέρετε ποιοι την πληρώνουν κάθε φορά που συμβαίνει αυτό. Το ζήσαμε το 2010 με την τεράστια ανεργία, τις μειώσεις μισθών και συντάξεων, τα μνημόνια… Tο ζήσαμε και το 2020 με τις αναστολές εργασίας, με τον πληθωρισμό που έφερε, η επεκτατική αντιμετώπιση εκείνης της κρίσης από τις κυβερνήσεις… ",criticism,economy,other,-0.6,0.2,0.0,"[['varoufakis', 'person', '0.6'], ['nd', 'organization', '0.6'], ['syriza', 'political party', '0.6'], ['pasok', 'political party', '0.6'], ['eu recovery fund', 'organization', '0.6'], ['2010', 'date', '0.8'], ['2020', 'date', '0.8']]"
11,"That is why, as our people say, the children of the caring ones cook before they are hungry. In this case, the children of the caretakers vote for the JCP! To terrorize the terrorists, so that we can fight our battles from better positions! To stop them, to win victories, to finally pave the way for the radical changes we all long for.","Γι΄ αυτό, λοιπόν, όπως λέει και ο λαός μας, των φρονίμων τα παιδιά, πριν πεινάσουν μαγειρεύουν. Στην προκειμένη περίπτωση, των φρονίμων τα παιδιά ψηφίζουν ΚΚΕ! Για να τρομοκρατήσουμε τους τρομοκράτες, για να μπορέσουμε να δώσουμε τις μάχες μας από καλύτερες θέσεις! Να τους εμποδίσουμε, να αποσπάσουμε νίκες, να ανοίξουμε επιτέλους τον δρόμο για τις ριζικές αλλαγές που όλοι λαχταράμε",political agenda,elections,abstention,0.5,0.0,0.0,"[['jcp', 'organization', '1.0']]"
12,"Because up to now, we ourselves, we the many, the working people, the self-employed, the young people and the young women have been paying dearly for the notorious capitalist development. EUR 10.4 billion was the net profit of only 150 business groups, those listed on the stock exchange, in 2022, an increase of 303% compared to the previous year. In the same period, real wages fell by 7.4%, as a result of the anti-labour laws that all of them have passed over the last 15 years and remain in force, combined with huge inflation.And they have the audacity to ask the people, Mr Mitsotakis ""a chance to govern for the first time without national crises and difficulties"", and Mr Tsipras ""to govern for the first time without a memorandum""!","Γιατί μέχρι τώρα, εμείς οι ίδιοι, εμείς οι πολλοί, οι εργαζόμενοι, οι αυτοαπασχολούμενοι, οι νέοι και οι νέες  πληρώνουμε ακριβά και την περιβόητη καπιταλιστική  ανάπτυξη. 10,4 δισ. ευρώ ήταν το 2022 τα καθαρά κέρδη μόνο 150 επιχειρηματικών ομίλων, αυτών που είναι εισηγμένοι στο χρηματιστήριο, σημειώνοντας αύξηση 303% σε σχέση με την προηγούμενη χρονιά. Την ίδια περίοδο ο πραγματικός μισθός μειώθηκε κατά 7,4%, σαν αποτέλεσμα των αντεργατικών νόμων που έχουν ψηφίσει όλοι τους τα τελευταία 15 χρόνια και παραμένουν σε ισχύ, σε συνδυασμό με τον τεράστιο πληθωρισμό.Κι έχουν το θράσος να ζητούν από τον λαό, ο μεν κ. Μητσοτάκης «μια ευκαιρία να κυβερνήσει πρώτη φορά χωρίς εθνικές κρίσεις και δυσκολίες», ο δε κ. Τσίπρας να «κυβερνήσει πρώτη φορά χωρίς μνημόνιο»! ",criticism,other,other,-0.8,0.2,0.3,"[['we', 'person', '0.3'], ['working people', 'group of people', '0.7'], ['self-employed', 'group of people', '0.5'], ['young people', 'group of people', '0.5'], ['young women', 'group of people', '0.5'], ['business groups', 'organization', '0.7'], ['stock exchange', 'organization', '0.5'], ['real wages', 'organization', '0.3'], ['anti-labour laws', 'organization', '0.5'], ['inflation', 'organization', '0.3'], ['mr mitsotakis', 'person', '0.5'], ['mr tsipras', 'person', '0.5']]"
13,"No we answer! We don't give them a pass! We do not forget what the people have done to both of them! We know that the next day the unpopular laws that were passed both with and without memoranda will be here. The EU assessments and the difficulties of the system they serve will be here too! Again we will be told to be patient... And they will come after 4 years to ask us again, another ""first chance"" again...Mercy! Enough of this mockery! Our people are sick and tired of living the Groundhog Day! They want a better day to dawn at last! And this can only be achieved by the struggle of the people themselves and with a much stronger KKE!","Όχι απαντάμε! Δεν τους δίνουμε συγχωροχάρτι! Δεν ξεχνάμε τι τράβηξε ο λαός και με τους δυο τους! Ξέρουμε ότι την επόμενη μέρα θα είναι εδώ και οι αντιλαϊκοί νόμοι που πέρασαν και με μνημόνια και χωρίς μνημόνια. Θα είναι εδώ και οι αξιολογήσεις της ΕΕ και οι δυσκολίες του συστήματος που υπηρετούν! Και πάλι θα μας πουν να κάνουμε υπομονή... Και θα έρθουν μετά από 4 χρόνια να μας ζητήσουν πάλι, μια άλλη ξανά «πρώτη ευκαιρία»...Έλεος πια! Φτάνει αυτή η κοροϊδία! Ο λαός μας βαρέθηκε να ζει τη μέρα της Μαρμότας! Θέλει επιτέλους να ξημερώσει μια καλύτερη μέρα! Και αυτό μπορεί να το επιβάλει μονάχα ο ίδιος με τον αγώνα του και με πολύ πιο δυνατό το ΚΚΕ!",political agenda,elections,austerity,-0.5633,0.2,0.3,"[['kke', 'organization', '1.0'], ['greece', 'country', '1.0'], ['eu', 'organization', '1.0'], ['4 years', 'date', '1.0']]"
14,"Friends, From these popular neighbourhoods of Kallithea, with hundreds of small businesses in every street and neighbourhood struggling for daily survival, we address a militant call for solidarity to the thousands of freelancers in the country, to small traders, craftsmen, motorists.We call on them to use their experience, to take the step and support the KKE. Because the KKE is the only party that has been on their side in every problem, in every deadlock they have experienced and are living through all these last years.","Φίλες και φίλοι, Απ’ αυτές εδώ τις λαϊκές γειτονιές της Καλλιθέας, με τις εκατοντάδες μικροεπιχειρήσεις σε κάθε δρόμο και γειτονιά που παλεύουν για την καθημερινή επιβίωση, απευθύνουμε αγωνιστικό κάλεσμα συμπόρευσης και στους χιλιάδες ελεύθερους επαγγελματίες της χώρας, στους μικρούς εμπόρους, στους βιοτέχνες, στους αυτοκινητιστές.Τους καλούμε να αξιοποιήσουν την πείρα τους, να κάνουν το βήμα και να στηρίξουν το ΚΚΕ. Γιατί το ΚΚΕ είναι το μοναδικό Κόμμα που βρέθηκε στο πλευρό τους σε κάθε πρόβλημα, σε κάθε αδιέξοδο που έζησαν και ζουν όλα αυτά τα τελευταία χρόνια.",political agenda,employment,austerity,-0.1,0.2,0.2,"[['kallithea', 'location', '1.0'], ['kke', 'political party', '1.0']]"
15,"In these election days, the other parties, the New Democracy, SYRIZA, PASOK/KINAL, remember the freelancers. They shed crocodile tears for the ""backbone of the economy"", as they call you, and promise solutions.But even these vague pre-election promises have little value. And with this little phrase, which lumps together small and large businesses, businesses with a turnover of millions of euros and businesses that are living off the land without even securing their daily expenses, they reveal their true intentions. You know it as well as I do. The most dynamic businesses are the ones to which the programmes to support small and medium-sized enterprises announced by the EU and all governments are directed, and not, of course, every professional who relies on his own work, a few family members or at most 1-2 employees. This is demonstrated by the recent programmes announced by the government on 'Digital Transformation', which require at least 5 workers to join them.  In other words, they concern less than 10% of the country's enterprises. SYRIZA is moving in the same direction, supporting the largest and most dynamic companies, since its own promises also presuppose conditions of ""growth and extroversion""! Now what kind of ""growth and extroversion"" can be achieved by a small neighbourhood shop, a neighbourhood hairdresser's, a car repair shop, God forbid.","Αυτές τις μέρες τις προεκλογικές, και τα άλλα κόμματα, η ΝΔ, ο ΣΥΡΙΖΑ, το ΠΑΣΟΚ/ΚΙΝΑΛ, θυμούνται τους ελεύθερους επαγγελματίες. Χύνουν κροκοδείλια δάκρυα για τη “ραχοκοκκαλιά της οικονομίας”, όπως σας αποκαλούν και υπόσχονται λύσεις.Ακόμα και αυτές οι αόριστες προεκλογικές τους υποσχέσεις όμως, λίγη αξία έχουν.“Θα στηρίξουμε” λένε “τις μικρομεσαίες επιχειρήσεις”. Και με αυτή τη μικρή φρασούλα που τσουβαλιάζει στο ίδιο σακί μικρούς και μεγάλους, επιχειρήσεις τζίρου εκατομμυρίων ευρώ και επιχειρήσεις που φυτοζωούν χωρίς καν να εξασφαλίζουν τα καθημερινά έξοδα, αποκαλύπτουν τους πραγματικούς τους σκοπούς. Το ξέρετε και σεις καλά. Στις πιο δυναμικές επιχειρήσεις, κατευθύνονται τα προγράμματα στήριξης της μικρομεσαίας επιχειρηματικότητας που εξαγγέλλει η ΕΕ και όλες οι κυβερνήσεις και όχι, βέβαια, στον κάθε επαγγελματία που στηρίζεται στη δική του εργασία, σε κάποια μέλη της οικογένειάς του ή το πολύ σε 1-2 εργαζόμενους. Αυτό αποδεικνύεται και από τα πρόσφατα προγράμματα που εξήγγειλε η κυβέρνηση περί “Ψηφιακού Μετασχηματισμού”, που προϋποθέτουν τουλάχιστον 5 εργαζόμενους για να ενταχθεί κανείς σ’ αυτά.  Δηλαδή, αφορούν λιγότερο από το 10% των επιχειρήσεων της χώρας. Στην ίδια κατεύθυνση, στήριξης των μεγαλύτερων και πιο δυναμικών επιχειρήσεων, συγκλίνει και ο ΣΥΡΙΖΑ, αφού και οι δικές του υποσχέσεις, προϋποθέτουν όρους “μεγέθυνσης και εξωστρέφειας”! Τώρα τι σόι “μεγέθυνση και εξωστρέφεια” μπορεί να πετύχει ένα μικρό εμπορικό κατάστημα στη γειτονιά, ένα συνοικιακό κομμωτήριο, ένα συνεργείο αυτοκινήτων, ο θεός και η ψυχή τους.",criticism,other,other,-0.8,0.4,0.5,"[['new democracy', 'organization', '1.0'], ['syriza', 'political party', '1.0'], ['pasok/kinal', 'political party', '1.0'], ['eu', 'organization', '1.0'], ['government', 'organization', '1.0'], ['greece', 'country', '1.0'], ['digital transformation', 'organization', '1.0']]"
16,"This is the support promised by the bourgeois parties. And in it, as you already know very well, the vast majority of professionals do not fit! Because it is support tailored to the principles of the competitiveness of the Greek capitalist economy and in the context of these principles, you are considered a handicap, a disadvantage, a structural problem!!!That is why thousands of professionals and small businesses have paid, along with the working class, the consequences of the crisis, but also the strategic choices that accompanied the capitalist development at every step: the launching of taxation with the memoranda and the bloody surpluses, the crushing of social security and pensions, the deadlocks of lockdown in the pandemic, energy precision and so much more.That's why today, and after already counting over 200,000 lockouts in the past decade, 47.3% of small and micro businesses have at least one overdue debt, and thousands are on the electronic auction lists!","Αυτή είναι η στήριξη που υπόσχονται τα αστικά κόμματα. Και σε αυτή, όπως ήδη το ξέρετε και σεις πολύ καλά, δε χωρά η μεγάλη πλειοψηφία των επαγγελματιών! Γιατί είναι στήριξη κομμένη και ραμμένη στις αρχές της ανταγωνιστικότητας της ελληνικής καπιταλιστικής οικονομίας και στα πλαίσια, αυτών των αρχών, εσείς θεωρείστε φύρα, μειονέκτημα, διαρθρωτικό πρόβλημα!!!Γι΄ αυτό και οι χιλιάδες επαγγελματίες και μικρές επιχειρήσεις, πλήρωσαν και αυτοί μαζί με την εργατική τάξη τις συνέπειες της κρίσης, αλλά και τις στρατηγικές επιλογές που συνόδευσαν την καπιταλιστική ανάπτυξη σε κάθε της βήμα:Την εκτόξευση της φορολογίας με τα μνημόνια και τα ματωμένα πλεονάσματα,Το τσάκισμα της κοινωνικής ασφάλισης και των συντάξεων,Τα αδιέξοδα των lockdown στην πανδημία, την ενεργειακή ακρίβεια και τόσα άλλα.Γι’ αυτό και σήμερα και αφού ήδη μετράμε πάνω από 200.000 λουκέτα την προηγούμενη δεκαετία, το 47,3% των μικρών και πολύ μικρών επιχειρήσεων έχει τουλάχιστον μια ληξιπρόθεσμη οφειλή, ενώ χιλιάδες είναι αυτοί που εμπεριέχονται στις λίστες των ηλεκτρονικών πλειστηριασμών!",criticism,economy,other,-0.9,0.2,0.8,"[['bourgeois parties', 'political party', '1.0'], ['greek capitalist economy', 'organization', '1.0'], ['working class', 'group of people', '1.0'], ['crisis', 'date', '1.0'], ['taxation', 'organization', '1.0'], ['memoranda', 'organization', '0.8'], ['social security', 'organization', '1.0'], ['pensions', 'organization', '1.0'], ['lockdown', 'date', '1.0'], ['pandemic', 'date', '1.0'], ['energy precision', 'organization', '1.0'], ['lockouts', 'organization', '0.8'], ['small and micro businesses', 'group of people', '1.0'], ['electronic auction lists', 'organization', '1.0']]"
