id,text,text_el,is_criticism,topic-context,subtopic-context,sentiment,polarization-definition,populism-definition,ner-limited
18,"But, you will say to me, don't we have today in our country precision which nibbles away at incomes? I will tell you yes, of course we do have precision, but precision, my friends, is not something that we have caused, precision is something that the whole world has today. Accuracy is the result of a war that took place on our continent. Accuracy is the result of the fact that we found ourselves with gas prices that were 10 times higher than those we had known in the past.","Μα, θα μου πείτε, δεν έχουμε σήμερα στη χώρα μας ακρίβεια η οποία ροκανίζει τα εισοδήματα; Θα σας πω ναι, βεβαίως και έχουμε ακρίβεια, αλλά την ακρίβεια, φίλες και φίλοι, δεν την προκαλέσαμε εμείς, ακρίβεια έχει όλος ο κόσμος σήμερα. Η ακρίβεια είναι αποτέλεσμα ενός πολέμου ο οποίος έγινε στην ήπειρό μας. Η ακρίβεια είναι αποτέλεσμα του γεγονότος ότι βρεθήκαμε με τιμές φυσικού αερίου που ήταν 10 φορές υψηλότερες από αυτές τις οποίες είχαμε γνωρίσει στο παρελθόν.",political agenda,economy,other,0,0,0,"[['country', 'location', '1.0'], ['continent', 'location', '0.5'], ['gas prices', 'group of people', '0.2']]"
19,"And yet, and in fact, we were the ones who gave support to households through the Market Pass, we were the ones who did the Household Basket, which also made it somewhat easier with the prices. And I firmly believe that the worst days in terms of inflation are now behind us.","Κι όμως, και για την ακρίβεια, εμείς ήμασταν αυτοί που δώσαμε υποστήριξη στα νοικοκυριά μέσα από το «Market Pass», εμείς ήμασταν αυτοί που κάναμε το «Καλάθι του Νοικοκυριού» που και αυτό κάπως διευκόλυνε με τις τιμές. Και πιστεύω ακράδαντα ότι οι χειρότερες μέρες σε σχέση με τον πληθωρισμό είναι πια πίσω μας. ",political agenda,economy,inflation,0.6,0,0,"[['market pass', 'organization', '0.75'], ['household basket', 'organization', '0.75'], ['inflation', 'organization', '0.5']]"
20,So I would like to ask you here in Agrinio to judge the parties and the Prime Ministerial candidates objectively and to judge us harshly. See what we have achieved. What we have achieved in this four-year period and what the previous four-year period achieved in the previous four-year period.,"Θέλω λοιπόν να σας ζητήσω και εδώ, από το Αγρίνιο, να κρίνετε τα κόμματα και τους υποψήφιους Πρωθυπουργούς αντικειμενικά και να μας κρίνετε σκληρά. Να δείτε τι έχουμε πετύχει. Τι πετύχαμε εμείς αυτή την τετραετία και τι πέτυχαν οι προηγούμενοι, την προηγούμενη τετραετία.",political agenda,elections,other,,0,0,"[['agrinio', 'location', '0.9'], ['prime ministerial candidates', 'group of people', '0.9'], ['parties', 'group of people', '0.8'], ['previous four-year period', 'date', '0.8'], ['four-year period', 'date', '0.8']]"
21,"I heard Mr Tsipras speak again from Chios and say: this four-year term was, he says, four wasted years. Really? Four wasted years? With the best growth rates in Europe, from where we were lagging behind? With lower taxes than where we had higher taxes? With record investment? With record tourism? With a record in the resources that local government has to manage? Ask your regional governor, ask your mayor, when in the past have they had more resources to manage?  Then or now? Now, because it is precisely this government that has succeeded and created wealth, secured resources from Europe, enabled the Regional Governor to have a much larger NSRF. It has enabled the Mayor to manage a 'Tritsis' programme with major interventions to further improve this city.","Άκουσα τον κ. Τσίπρα πάλι από τη Χίο να μιλάει και να λέει: αυτή η τετραετία ήταν, λέει, τέσσερα χαμένα χρόνια. Αλήθεια; Τέσσερα χαμένα χρόνια; Με τους καλύτερους ρυθμούς ανάπτυξης στην Ευρώπη, από εκεί που ήμασταν ουραγοί; Με χαμηλότερους φόρους από εκεί που είχαμε υψηλότερους φόρους; Με ρεκόρ επενδύσεων; Με ρεκόρ στον τουρισμό; Με ρεκόρ στους πόρους που έχει να διαχειριστεί η Τοπική Αυτοδιοίκηση Β’ βαθμού και Α’ βαθμού; Για ρωτήστε τον Περιφερειάρχη σας, ρωτήστε τον Δήμαρχό σας, πότε στο παρελθόν είχαν περισσότερους πόρους να διαχειριστούν;  Τότε ή τώρα; Τώρα, γιατί ακριβώς αυτή η κυβέρνηση κατάφερε και δημιούργησε πλούτο, εξασφάλισε πόρους από την Ευρώπη, έδωσε τη δυνατότητα στον Περιφερειάρχη να έχει ένα πολύ μεγαλύτερο ΕΣΠΑ. Έδωσε τη δυνατότητα στον Δήμαρχο να διαχειρίζεται ένα πρόγραμμα «Τρίτσης» με σημαντικές παρεμβάσεις για την περαιτέρω αναβάθμιση αυτής της πόλης.",criticism,economy,other,0.9,0,0,"[['mr tsipras', 'person', '1.0'], ['chios', 'location', '1.0'], ['europe', 'location', '1.0'], ['nsrf', 'organization', '1.0'], ['tritsis programme', 'organization', '1.0']]"
22,"And we will be there to support you in the next four years. Two big issues that concern Agrinio. The first, an issue that is always raised. The connection, the safe road connection of Agrinio with the Ionian Road. The studies will be ready in the next year. I pledge that this connection, which will cost us around 100 million, will be put into practice by the government of the New Democracy.","Και θα είμαστε κοντά,  να σάς στηρίξουμε και την επόμενη τετραετία. Δύο μεγάλα θέματα τα οποία αφορούν το Αγρίνιο. Το πρώτο, ένα ζήτημα το οποίο τίθεται πάντα. Η σύνδεση, η ασφαλής οδική σύνδεση του Αγρινίου με την Ιόνια Οδό. Οι μελέτες θα ωριμάσουν μέσα στον επόμενο χρόνο. Δεσμεύομαι ότι αυτή η σύνδεση, που θα μας στοιχίσει περί τα 100 εκατομμύρια, θα γίνει πράξη από την κυβέρνηση της Νέας Δημοκρατίας.",political agenda,infrastructure,other,0.4,0,0,"[['agrinio', 'location', '1.0'], ['ionian road', 'location', '0.9'], ['new democracy', 'political party', '1.0']]"
23,"The second is the tobacco warehouses that you have here in the wider area. By '27 - we've talked to the mayor - we're going to have an exemplary cultural space, a museum that can really showcase the cultural footprint of the city as a whole.","Το δεύτερο είναι οι καπναποθήκες τις οποίες έχετε εδώ στην ευρύτερη περιοχή. Μέχρι το ’27 -έχουμε μιλήσει με τον Δήμαρχο- θα κάνουμε έναν υποδειγματικό χώρο πολιτισμού, ένα μουσείο το οποίο πραγματικά θα μπορέσει να αναδείξει συνολικά το πολιτιστικό αποτύπωμα της πόλης.",political agenda,culture,artists,0.6,0,0,"[['mayor', 'person', '0.8'], ['city', 'location', '0.4']]"
24,"Just as I was in Messolonghi today at noon and inaugurated the new Archaeological Museum - I was committed that the museum would be built and we completed it - and as we have built 15 museums across the country, we will continue to support the municipalities to make your everyday life and especially here in Agrinio greener, more digital, with a better quality of life for the next day.","Όπως βρέθηκα σήμερα το μεσημέρι στο Μεσολόγγι και εγκαινίασα το νέο Αρχαιολογικό Μουσείο -είχα δεσμευτεί ότι το μουσείο θα γίνει και το ολοκληρώσαμε-, όπως έχουμε φτιάξει 15 μουσεία σε ολόκληρη τη χώρα, έτσι θα συνεχίζουμε να στηρίζουμε τους Δήμους ώστε να κάνουμε την καθημερινότητά σας και ειδικά εδώ το Αγρίνιο πιο πράσινο, πιο ψηφιακό, με καλύτερη ποιότητα ζωής την επόμενη ημέρα.",political agenda,culture,other,0.7,0,0,"[['messolonghi', 'location', '0.9'], ['archaeological museum', 'organization', '0.9'], ['country', 'location', '0.7'], ['museums', 'organization', '0.6'], ['municipalities', 'organization', '0.6'], ['agrinio', 'location', '0.8']]"
25,"And speaking of digital, I want to remind you how your daily life was four years ago and how it is now: before gov.gr and after gov.gr. How we can use technology to make your life easier, so that you don't have to hassle, don't have to queue up in bureaucracy, don't have to run to the CCP for the simplest transaction.","Και μιας και μιλάμε για ψηφιακά, θέλω να θυμίσω πώς ήταν η καθημερινότητά σας πριν από τέσσερα χρόνια και πώς είναι τώρα: πριν από το gov.gr και μετά το gov.gr. Πώς μπορούμε να χρησιμοποιήσουμε την τεχνολογία για να κάνουμε τη ζωή σας πιο εύκολη, να μην ταλαιπωρείστε, να μην έχετε ουρές στη γραφειοκρατία, να μην τρέχετε στα ΚΕΠ για την πιο απλή συναλλαγή.",political agenda,public sector,digital governance,0.7,0,0,"[['gov.gr', 'organization', '0.8'], ['ccp', 'organization', '0.6.']]"
26,"All this, my friends, did not happen, it worked. And that is why we have to continue and by 2027 our whole state will be a digital state. And with a greater emphasis - let me say this is a personal bet of mine - on the new National Health System. Because I know very well that the NHS took a big hit during the pandemic years. And I want to say from here too a big ""thank you"" to all the staff of the National Health System. We were faced with an unprecedented situation. We stayed on our feet, but the National Health System also highlighted its strengths and weaknesses for the next day.","Όλα αυτά, φίλες και φίλοι, δεν έτυχαν, πέτυχαν. Και γι’ αυτό και πρέπει να τα συνεχίσουμε και μέχρι το 2027 όλο το κράτος μας πια να είναι ένα ψηφιακό κράτος. Και με μεγαλύτερη έμφαση -αυτό επιτρέψτε μου να πω είναι ένα προσωπικό μου στοίχημα- στο νέο Εθνικό Σύστημα Υγείας. Γιατί ξέρω πολύ καλά ότι το ΕΣΥ τράβηξε μεγάλο ζόρι τα χρόνια της πανδημίας. Και θέλω να πω και από εδώ ένα μεγάλο «ευχαριστώ» σε όλο το προσωπικό του Εθνικού Συστήματος Υγείας. Βρεθήκαμε αντιμέτωποι με μία πρωτόγνωρη κατάσταση. Μείναμε όρθιοι αλλά το Εθνικό Σύστημα Υγείας ανέδειξε και τα δυνατά του σημεία και τις αδυναμίες του της επόμενης ημέρας.",political agenda,health,digital governance,0.6,0,0,"[['2027', 'date', '1.0'], ['national health system', 'organization', '1.0'], ['nhs', 'organization', '0.5'], ['staff of the national health system', 'group of people', '1.0']]"
27,"The next four years will be the four years of the new NHS, with upgraded hospitals, upgraded emergency departments in all hospitals. We will essentially rebuild from scratch, with complete refurbishment, more than 150 Health Centres. We will expand the all-important institution of the Personal Doctor everywhere and we will also expand screening so that we can prevent illness before we get sick and run to hospitals. I attach great importance to this. Never before has there been a government that has done so much in terms of horizontal preventive health policies, and I think that has its own special significance.","Η επόμενη τετραετία θα είναι η τετραετία του νέου ΕΣΥ, με αναβαθμισμένα νοσοκομεία, αναβαθμισμένα τμήματα επειγόντων περιστατικών σε όλα τα νοσοκομεία. Θα ξαναχτίσουμε ουσιαστικά από την αρχή, με πλήρη ανακαίνιση, παραπάνω από 150 Κέντρα Υγείας. Θα επεκτείνουμε τον τόσο σημαντικό θεσμό του Προσωπικού Γιατρού παντού και θα επεκτείνουμε και τις προληπτικές εξετάσεις, ώστε να μπορούμε να προλαμβάνουμε τις ασθένειες πριν αρρωστήσουμε και τρέχουμε στα νοσοκομεία. Σε αυτό αποδίδω μεγάλη σημασία. Ποτέ στο παρελθόν δεν υπήρξε κυβέρνηση που να έκανε τόσα πολλά σε οριζόντιες προληπτικές πολιτικές υγείας και αυτό θεωρώ ότι έχει τη δικιά του ξεχωριστή σημασία.",political agenda,health,public health system,0.6,0,0,"[['nhs', 'organization', '1.0'], ['health centres', 'organization', '0.7'], ['personal doctor', 'organization', '0.6']]"
28,"And, of course, on security and defence issues, we are not going to ""put water in our wine"". We will continue to guard our borders. The fence on the Evros will be built in its entirety. The significant investments we are making in our Armed Forces will continue. He did not vote - our hon. Friend is right to say that - let me remind you that Tsipras did not vote for the defence agreement with the United States, he did not vote for the defence agreement with France, he did not vote for the significant arms spending that is what allows us today to all feel safe and to know that we can shield our national sovereignty at all times.","Και βέβαια, στα θέματα της ασφάλειας και της άμυνας δεν πρόκειται να «βάλουμε νερό στο κρασί μας». Θα εξακολουθούμε να φυλάμε τα σύνορά μας. Ο φράχτης στον Έβρο θα κατασκευαστεί ολόκληρος. Οι σημαντικές επενδύσεις που κάνουμε στις Ένοπλες Δυνάμεις μας θα συνεχιστούν. Δεν ψήφισε -καλά κάνει και το λέει ο φίλος μας- να σας θυμίσω ότι ο Τσίπρας δεν ψήφισε την αμυντική συμφωνία με τις Ηνωμένες Πολιτείες, δεν ψήφισε την αμυντική συμφωνία με τη Γαλλία, δεν ψήφισε τις σημαντικές εξοπλιστικές δαπάνες που είναι αυτές που μας επιτρέπουν σήμερα να αισθανόμαστε όλες και όλοι ασφαλείς και να ξέρουμε ότι μπορούμε να θωρακίσουμε ανά πάσα στιγμή την εθνική μας κυριαρχία.",criticism,national security,other,-0.2,0.6,0,"[['tsipras', 'person', '0.9'], ['united states', 'country', '0.9'], ['france', 'country', '0.9']]"
29,"Here, from a place, especially Aitoloakarnania - I said this before when I was in Messolonghi - which is so identified with our country's struggles for freedom, we must know one thing: freedom is a precondition for prosperity. And in defence of the homeland and sovereign rights, this party has given credentials for many decades.","Εδώ, από έναν τόπο, ειδικά την Αιτωλοακαρνανία -τα είπα και πριν όταν βρέθηκα στο Μεσολόγγι- που είναι τόσο ταυτισμένος με τους αγώνες της πατρίδας μας για ελευθερία, πρέπει να γνωρίζουμε ένα πράγμα: η ελευθερία είναι προϋπόθεση της ευημερίας. Και στην υπεράσπιση της πατρίδας και των κυριαρχικών δικαιωμάτων αυτή η παράταξη έχει δώσει διαπιστευτήρια πολλές δεκαετίες.",political agenda,national security,other,0.8,0,0,"[['aitoloakarnania', 'location', '0.9'], ['messolonghi', 'location', '0.8'], ['country', 'location', '0.7'], ['sovereign rights', 'organization', '0.6'], ['party', 'political party', '0.8'], ['homeland', 'location', '0.6'], ['decades', 'date', '0.6']]"
30,"And we're not going back. We always extend a hand of friendship to Turkey, to discuss our differences. Always in a good atmosphere and always on the basis of international law, but we will not accept any challenge to our sovereignty or our sovereign rights. There are ""red lines"" that are non-negotiable and we know how to defend them.","Και πίσω δεν πρόκειται να κάνουμε. Τείνουμε πάντα χείρα φιλίας στην Τουρκία, να συζητήσουμε τις διαφορές μας. Πάντα σε καλό κλίμα και πάντα με γνώμονα το Διεθνές Δίκαιο, αλλά δεν πρόκειται να δεχθούμε καμία αμφισβήτηση ούτε της κυριαρχίας, ούτε των κυριαρχικών μας δικαιωμάτων. Υπάρχουν «κόκκινες γραμμές» που είναι αδιαπραγμάτευτες και ξέρουμε πώς θα τις υπερασπιστούμε.",political agenda,external affairs,sea borders,0.2,0.2,0,"[['turkey', 'location', '0.8'], ['international law', 'organization', '0.6'], ['sovereignty', 'organization', '0.4']]"
31,"So all this, friends, I hope that it will be the subject of a fruitful election period. An election period in which we need to talk about what concerns you. Yes, we will talk and we must talk about the primary sector.","Όλα αυτά λοιπόν, φίλες και φίλοι, ελπίζω να αποτελέσουν το αντικείμενο μιας γόνιμης προεκλογικής περιόδου. Μιας προεκλογικής περιόδου στην οποία πρέπει να μιλήσουμε γι’ αυτά που σας απασχολούν. Ναι, θα μιλήσουμε και πρέπει να μιλήσουμε για τον πρωτογενή τομέα.",political agenda,agricultural policy,other,0,0,0,[]
32,You know that we have tried to be close to our farmers. You know that I was the one who negotiated and secured for the next six years the same resources so that we can continue to have subsidies that support farm income.,Ξέρετε ότι προσπαθήσαμε να σταθούμε κοντά στους αγρότες μας. Ξέρετε ότι εγώ ήμουν αυτός που διαπραγματεύτηκα και εξασφάλισα για την επόμενη εξαετία τους ίδιους πόρους για να εξακολουθούμε να έχουμε επιδοτήσεις οι οποίες στηρίζουν το αγροτικό εισόδημα.,political agenda,agricultural policy,other,0.85,0,0,"[['farmers', 'group of people', '0.75'], ['i', 'person', '0.7'], ['subsidies', 'organization', '0.5'], ['farm income', 'organization', '0.5'], ['six years', 'date', '0.3']]"
33,"We were the ones who reduced VAT, we were the ones who returned the excise duty on diesel. We are the ones who used tax incentives to encourage our farmers to work together, so that they can go from being farmers to being small producers, to link their product to the history of their land, to standardize their products, so that we can export more products. We set a record for exports in the primary sector.","Εμείς ήμασταν αυτοί που μειώσαμε τον ΦΠΑ, εμείς ήμασταν αυτοί που επιστρέψαμε τον Ειδικό Φόρο Κατανάλωσης στο πετρέλαιο κίνησης. Εμείς είμαστε αυτοί που χρησιμοποιήσαμε φορολογικά κίνητρα για να ενθαρρύνουμε τους αγρότες μας να συνεργάζονται, ώστε από αγρότες να γίνουν μικροί παραγωγοί, να συνδέσουν το προϊόν τους με την ιστορία του τόπου τους, να τυποποιήσουν τα προϊόντα τους, να μπορούμε να εξάγουμε περισσότερα προϊόντα. Κάναμε ρεκόρ εξαγωγών στον πρωτογενή τομέα.",political agenda,agricultural policy,other,0.8,0,0,"[['we', 'group of people', '1.0'], ['vat', 'organization', '0.6'], ['excise duty', 'organization', '0.4'], ['diesel', 'organization', '0.4'], ['farmers', 'group of people', '1.0'], ['small producers', 'group of people', '0.8'], ['primary sector', 'organization', '0.3'], ['exports', 'organization', '0.2.']]"
34,"And we have much more to do. Smart agriculture programmes.  I want all the young folks who are here to know that I'm going to be expanding the resources for young farmers even further. I want young kids to be able to go back to the field, to farming, to do this work and know that they can have a good income.","Και έχουμε πολλά περισσότερα ακόμα να κάνουμε. Προγράμματα ευφυούς γεωργίας.  Θέλω να γνωρίζουν όλα τα νέα παιδιά που είναι εδώ ότι θα επεκτείνω και άλλο τους πόρους για τους νέους αγρότες. Θέλω τα νέα παιδιά να μπορούν να γυρίσουν στο χωράφι, στην κτηνοτροφία, να κάνουν αυτή τη δουλειά και να ξέρουν ότι μπορούν να έχουν ένα καλό εισόδημα.",political agenda,agricultural policy,other,0.75,0,0,"[['smart agriculture programmes', 'organization', '0.5'], ['i', 'person', '1'], ['young folks', 'group of people', '0.9'], ['young farmers', 'group of people', '0.9'], ['young kids', 'group of people', '0.7'], ['the field', 'location', '0.8']]"
35,"I want to help farmers with the cost of production. Photovoltaics for farmers, small photovoltaics. I attach great importance to such interventions so that we can reduce the cost of production and support the primary sector as a whole.","Θέλω να βοηθήσω τους αγρότες με το κόστος παραγωγής. Φωτοβολταϊκά για τους αγρότες, μικρά φωτοβολταϊκά. Αποδίδω πολύ μεγάλη σημασία σε τέτοιες παρεμβάσεις, ώστε το κόστος παραγωγής να μπορούμε να το μειώσουμε και να στηρίξουμε συνολικά τον πρωτογενή τομέα.",political agenda,agricultural policy,green energy,0.5,0,0,"[['farmers', 'group of people', '1.0'], ['primary sector', 'organization', '0.8'], ['photovoltaics', 'organization', '0.7'], ['production', 'organization', '0.6.']]"
36,"So let our opponents - if they dare - come and discuss all this. I have been tired for weeks of hearing this debate talk: 'We do not want', he says, 'we do not want a debate, we do not want a debate'. Well, the debate was agreed today, as I had told them from the beginning.","Ας έρθουν λοιπόν οι αντίπαλοί μας -αν τολμούν- να τα συζητήσουμε όλα αυτά. Είχα κουραστεί εδώ και εβδομάδες να ακούω αυτή τη συζήτηση για το debate. «Δεν θέλουμε», λέει, «debate, δεν θέλουμε debate». Ε, συμφωνήθηκε σήμερα το debate, όπως τους είχα πει από την πρώτη στιγμή.",criticism,elections,other,,0,0,"[['1. opponents', 'group of people', '0.8'], ['2. debate', 'event', '0.8'], ['3. i', 'person', '0.6']]"
