id,text,text_el,is_criticism,topic-context,subtopic-context,sentiment,polarization-definition,populism-definition,ner-limited
37,"So let's all go together and talk about what we want to do, but let's also take off our masks. Because in the debate we will all be political leaders together, as it should be in a democracy. And let the other parties come and explain to us exactly how they understand this ""progressive governance"", this government of losers that some people want to launch.","Για πάμε όλοι μαζί, λοιπόν, να συζητήσουμε για αυτά τα οποία θέλουμε να κάνουμε, αλλά να πέσουν και οι μάσκες. Γιατί στο debate θα είμαστε όλοι μαζί οι πολιτικοί αρχηγοί, όπως πρέπει να είναι σε μια δημοκρατία. Και να έρθουν να μας εξηγήσουν τα υπόλοιπα κόμματα πώς ακριβώς αντιλαμβάνονται αυτή την «προοδευτική διακυβέρνηση», αυτή την κυβέρνηση των ηττημένων που κάποιοι θέλουν να δρομολογήσουν.",criticism,democracy,other,-0.4,0.1,0.2,"[['democracy', 'organization', '0.8'], ['political leaders', 'group of people', '1.0'], ['parties', 'group of people', '0.6'], ['progressive governance', 'organization', '0.6'], ['government', 'organization', '0.6'], ['losers', 'group of people', '0.4']]"
38,"This government that will possibly bring together, in their minds, SYRIZA, PASOK, Varoufakis, ""Demetra"". ""Demeter"" is not a joke. There is a subdivision of Demeter, you know. One hundred ""Demetroulas"", one ""Demeter"". But that would be funny if it weren't too dangerous. And it's dangerous because some people tried to do all this in '15. Some people brought us to the brink and at the last minute they had to make a spectacular fucking stunt, it cost us a lot of money, 100 billion or so, that fucking stunt.","Αυτή την κυβέρνηση που θα φέρει μαζί ενδεχομένως, στο μυαλό τους, τον ΣΥΡΙΖΑ, το ΠΑΣΟΚ, τον Βαρουφάκη, τη «Δήμητρα». Η «Δήμητρα» δεν είναι αστείο. Έχει και υποδιαίρεση η «Δήμητρα» ξέρετε. Εκατό «Δημητρούλες», 1 «Δήμητρα». Αλλά αυτά θα ήταν αστεία εάν δεν ήταν πολύ επικίνδυνα. Και είναι επικίνδυνα γιατί κάποιοι δοκίμασαν να τα κάνουν όλα αυτά το ’15. Κάποιοι μας έφτασαν στο χείλος του γκρεμού και την τελευταία στιγμή αναγκάστηκαν να κάνουν μια θεαματική κωλοτούμπα, μας στοίχισε πολλά λεφτά, 100 δισεκατομμύρια περίπου, αυτή η κωλοτούμπα.",criticism,debt,other,-0.4,0.2,0.2,"[['syriza', 'political party', '1.0'], ['pasok', 'political party', '1.0'], ['varoufakis', 'person', '1.0'], ['demetra', 'person', '1.0'], ['demeter', 'organization', '1.0'], ['demetroulas', 'group of people', '1.0'], [""'15"", 'date', '1.0']]"
39,"And now they may be thinking of doing the same thing again. There is only one way to ward off these thoughts: a powerful New Democracy in the ballot box on May 21. Once we are victorious by a wide margin over the second place finisher, all these scenarios go out the window.","Και τώρα μπορεί να σκέφτονται να ξανακάνουν τα ίδια. Ένας τρόπος υπάρχει για να αποκρούσουμε αυτές τις σκέψεις: πανίσχυρη Νέα Δημοκρατία στην κάλπη της 21ης Μαΐου. Από τη στιγμή που θα είμαστε νικητές με μεγάλη διαφορά από τον δεύτερο, όλα αυτά τα σενάρια πάνε περίπατο.",political agenda,elections,election spending,0.5,0.1,0,"[['new democracy', 'organization', '0.75'], ['may 21', 'date', '0.5']]"
40,"And I really want to ask you from the bottom of my heart to fight this good fight, to fight it together. Because we have achieved a lot in these four years. We've been tired, we've struggled, we've made mistakes. I never said I was infallible. The only one who is infallible is the one who does absolutely nothing.","Και θέλω πραγματικά από καρδιάς να σας ζητήσω να δώσουμε αυτό τον ωραίο αγώνα, να τον δώσουμε μαζί. Γιατί πετύχαμε πολλά αυτή την τετραετία. Κουραστήκαμε, αγωνιστήκαμε, κάναμε και λάθη. Εγώ ποτέ δεν είπα ότι είμαι αλάθητος. Αλάθητος είναι μόνο αυτός ο οποίος δεν κάνει απολύτως τίποτα.",political agenda,elections,other,0.6,0,0,"[['i', 'person', '0.9'], ['we', 'group of people', '0.7'], ['four years', 'date', '0.6']]"
41,"Whenever mistakes were made, however, I looked you in the eye, took my responsibility and said that I would correct the mistakes that were made. That is the demand that you must have from your leaders.","Όποτε έγιναν λάθη, όμως, σας κοίταξα στα μάτια, ανέλαβα την ευθύνη που μου αρμόζει και είπα ότι θα διορθώσω τα λάθη τα οποία έγιναν. Αυτή είναι η απαίτηση την οποία πρέπει να έχετε από τους ηγέτες σας.",political agenda,accountability,other,0.6,0,0,[]
42,"And this effort, which we have made with great effort to put our country back on its feet, to leave behind a difficult decade, so that young children can look to their future with more optimism, must not be left unfinished.","Και αυτή η προσπάθεια την οποία κάναμε με πολύ κόπο να ξαναπατήσει η πατρίδα μας στα πόδια της, να αφήσουμε πίσω μια δύσκολη δεκαετία, να μπορούν τα νέα παιδιά να ατενίζουν το μέλλον τους με περισσότερη αισιοδοξία, δεν πρέπει να μείνει ημιτελής.",political agenda,economy,economic crisis,0.5,0,0,"[['country', 'country', '0.95'], ['decade', 'date', '0.75']]"
43,"The country must not fall behind again. We must not experiment again with failed recipes. We must move the country forward with stability, with boldness, with a faster pace. You know, wherever I go, people do not tell me 'don't make changes', 'don't make reforms', they tell me, as a rule, 'run even faster', 'go faster, move the country forward faster'.","Δεν πρέπει η χώρα να ξανακυλήσει πίσω. Δεν πρέπει να πειραματιστούμε πάλι με αποτυχημένες συνταγές. Πρέπει να πάμε τη χώρα μπροστά με σταθερότητα, με τόλμη, με πιο γρήγορους ρυθμούς. Ξέρετε, όπου πηγαίνω οι πολίτες δεν μου λένε «μην κάνεις αλλαγές», «μην κάνεις μεταρρυθμίσεις», μου λένε, κατά κανόνα, «τρέξε ακόμα πιο γρήγορα», «πήγαινε πιο γρήγορα, πήγαινε πιο γρήγορα τη χώρα μπροστά».",political agenda,economy,reforms,0.8,0.2,0.2,[]
44,"And that is our commitment for the next four years. We are more experienced, we are more ready, we are more tested. We know where we want to take Greece. Give us the strength to make our country even stronger, all Greeks prosper with more social justice.","Και αυτή είναι η δέσμευσή μας για την επόμενη τετραετία. Είμαστε πιο έμπειροι, είμαστε πιο έτοιμοι, είμαστε πιο δοκιμασμένοι. Ξέρουμε πού θέλουμε να πάμε την Ελλάδα. Δώστε μας τη δύναμη να κάνουμε την πατρίδα μας ακόμα πιο ισχυρή, όλους τους Έλληνες να ευημερούν με περισσότερη κοινωνική δικαιοσύνη.",political agenda,social state,other,0.7,0,0,"[['greece', 'location', '1.0'], ['greeks', 'group of people', '1.0']]"
45,"We have a plan for the Greece of the future. We know where we want to take Greece and I am sure that here in Agrinio, from a constituency, ladies and gentlemen, here, colleagues, former colleagues, probably in parliament, because now you know that we are all candidates for parliament, but you know that Aitoloakarnania is always the region we look at when we want to have a miniature of the country.","Έχουμε σχέδιο για την Ελλάδα του μέλλοντος. Ξέρουμε πού θέλουμε να πάμε την Ελλάδα και είμαι σίγουρος ότι και εδώ από το Αγρίνιο, από μία εκλογική περιφέρεια, κυρίες και κύριοι, εδώ, συνάδελφοι, τέως συνάδελφοι μάλλον στο κοινοβούλιο, γιατί τώρα ξέρετε είμαστε όλοι υποψήφιοι βουλευτές, αλλά ξέρετε ότι η Αιτωλοακαρνανία πάντα είναι η Περιφέρεια την οποία κοιτάμε όταν θέλουμε να έχουμε μία μικρογραφία της χώρας.",political agenda,elections,other,,0,0,"[['greece', 'country', '1'], ['agrinio', 'location', '1'], ['aitoloakarnania', 'location', '1'], ['parliament', 'organization', '0.7']]"
46,"Well, here the message you send is of particular importance. I want higher percentages in Aitoloakarnania than we had in '19. And judging by your turnout today, we will achieve it. Be well. Good strength, good race and with victory. With New Democracy always strong, steady, bold, forward. Be well. Thank you very much. And good luck to Panitolikos who is playing now and that's why we thought we would finish early. Anyone who wants can go to the stadium. Be well. Bye. Thank you very much.","Λοιπόν, εδώ έχει ξεχωριστή σημασία το μήνυμα που θα στείλετε. Θέλω στην Αιτωλοακαρνανία υψηλότερα ποσοστά από αυτά που είχαμε το ’19. Και αν κρίνω από την προσέλευση σας σήμερα, θα τα πετύχουμε. Να είστε καλά. Καλή δύναμη, καλό αγώνα και με τη νίκη. Με τη Νέα Δημοκρατία πάντα ισχυρή, σταθερά, τολμηρά, μπροστά. Να είστε καλά. Ευχαριστώ πολύ. Και καλή επιτυχία στον Παναιτωλικό ο οποίος παίζει τώρα και γι’ αυτό είπαμε να τελειώσουμε νωρίτερα. Όποιος θέλει μπορεί να πάει και στο γήπεδο. Να είστε καλά. Γεια σας. Ευχαριστώ πολύ.",political agenda,elections,other,0.6,0,0,"[['aitoloakarnania', 'location', '1.0'], [""'19"", 'date', '1.0'], ['new democracy', 'political party', '1.0'], ['panitolikos', 'group of people', '1.0']]"