id,text,text_el,is_criticism,topic-context,subtopic-context,sentiment,polarization-definition,populism-definition,ner-limited
1,"Our message is being conveyed here today in Elatia. In the May elections, we took a step forward with the significant strengthening of the KKE here in my homeland of Fthiotida, with my election as a member of parliament. We set ourselves the goal of increasing the percentage of the KKE and electing a communist MP in Fthiotida, and we succeeded. Now let's aim for the next one, let's make the leap. Let's strengthen the KKE even more, especially in the towns and villages where working people, breadwinners who fight the daily battle for survival, reside. So let's go strong in the remaining days, so that even more people will arrive with the KKE ballot paper at the ballot box on June 25th, to secure the parliamentary seat in Fthiotida, which you all know will be a strength for the people of the region.","Το μήνυμα μας μεταφέρεται σήμερα εδώ στην Ελάτεια. Στις εκλογές του Μάη κάναμε ένα βήμα με τη σημαντική ενίσχυση του ΚΚΕ και εδώ στην πατρίδα μου τη Φθιώτιδα, με την εκλογή μου μάλιστα ως βουλευτή. Βάλαμε στόχο να ανεβάσουμε το ποσοστό του ΚΚΕ και να βγάλουμε κομμουνιστή βουλευτή στη Φθιώτιδα και το καταφέραμε. Πάμε τώρα για τα επόμενα, πάμε να κάνουμε το άλμα. Να ενισχυθεί ακόμα πιο πολύ το ΚΚΕ ειδικά στις πόλεις και τα χωριά όπου ζουν άνθρωποι εργαζόμενοι, βιοπαλαιστές που δίνουν  καθημερινά τη μάχη της επιβίωσης. Πάμε λοιπόν δυνατά, τις μέρες που απομένουν για να φτάσουν ακόμα περισσότεροι με το ψηφοδέλτιο του ΚΚΕ στην κάλπη της 25ης του Ιούνη, για να κατοχυρώσουμε τη βουλευτική έδρα στη Φθιώτιδα, η οποία όλοι και όλες ξέρετε πως θα είναι δύναμη για τον ίδιο τον λαό της περιοχής. ",political agenda,elections,campaigning,0.4,0,0,"[['elatia', 'location', '1.0'], ['kke', 'political party', '1.0'], ['fthiotida', 'location', '1.0'], ['mp', 'person', '1.0'], ['june 25th', 'date', '1.0']]"
2,"Of course, Mitsotakis is now continuing the blackmail story, saying ""self-reliance or elections in August"". He is doing it to grab as many votes as he can, but everyone understands that the margins are narrowing. In any case, there will be a government: either an independent government of the Southwest or a cooperation with some other willing parties, but there will be one. They have ensured this with the unfair electoral law they have made, which steals parliamentary seats from other parties and gives them as a bonus to the first party.","Βέβαια τώρα ο Μητσοτάκης το συνεχίζει το εκβιαστικό παραμύθι, λέγοντας “αυτοδυναμία ή εκλογές τον Αύγουστο”, και το κάνει για να αρπάξει όσες ψήφους μπορεί, αλλά όλοι καταλαβαίνουν πως τα περιθώρια στενεύουν και σε κάθε περίπτωση κυβέρνηση θα υπάρξει: είτε αυτοδύναμη της ΝΔ είτε συνεργασίας με ορισμένους άλλους πρόθυμους, πάντως θα υπάρξει. Έχουν φροντίσει γι αυτό και με τον άδικο εκλογικό νόμο που έχουν φτιάξει ο οποίος κλέβει βουλευτικές έδρες από τα υπόλοιπα κόμματα, και τις χαρίζει ως μπόνους στον πρώτο κόμμα. ",criticism,elections,election spending,-0.4,0.2,0,"[['mitsotakis', 'person', '0.8'], ['southwest', 'location', '0.8'], ['government', 'organization', '0.6'], ['electoral law', 'organization', '0.6'], ['parliamentary seats', 'organization', '0.6'], ['first party', 'political party', '0.6'], ['august', 'date', '0.5']]"
3,"Therefore, in order to keep our seats, the KKE must be further strengthened. The crucial thing for the people is who will be against this government.","Γι αυτό λοιπόν, για να κρατήσουμε τις έδρες μας πρέπει να ενισχυθεί κι άλλο το ΚΚΕ. Το κρίσιμο για το λαό είναι ποιος θα είναι απέναντι από αυτή την κυβέρνηση. ",political agenda,elections,other,0,0.2,0.2,"[['kke', 'organization', '0.8'], ['people', 'group of people', '1'], ['government', 'organization', '0.6']]"
4,"And let Mitsotakis try again to mislead by saying, ""In the elections, we vote for the government and not for the opposition.""","Κι ας προσπαθεί πάλι, να παραπλανήσει ο Μητσοτάκης λέγοντας πως “στις εκλογές ψηφίζουμε για κυβέρνηση και όχι για αντιπολίτευση”. ",criticism,elections,election spending,,0.1,0,"[['mitsotakis', 'person', '0.9'], ['government', 'organization', '0.8'], ['opposition', 'political party', '0.8'], ['elections', 'date', '0.6']]"
5,"In the upcoming elections, the crucial factor for the people is who will oppose the anti-people's government from the perspective of the working people's interests. The KKE is the only 100% militant, working people's opposition. There is no need to list what the KKE did during the four years of the ND government, when SYRIZA and PASOK voted 50% each for its anti-people's bills and 70% each for its anti-people's bills. It is unnecessary to say who revealed the unpopular content of the laws of the South-West to the workers and fought for them not to be passed or implemented when SYRIZA and PASOK were backing the South-West and disorienting the people. It is also unnecessary to say who stepped forward in the struggles so that the workers, the breadwinner farmers, and professionals would not have to pay the bills in all the difficult periods, but would also gain respite and be able to survive. Sometimes with the pandemic, sometimes with the crisis that came afterwards, sometimes with the precision and energy poverty, sometimes with the war that continues with the participation of our country, SYRIZA and PASOK were limited to cockfighting in the Parliament, and the KKE fought the battle everywhere in the towns and villages for our people to stand upright.","Στις εκλογές απ’ τις οποίες θα προκύψει η επόμενη αντιλαϊκή κυβέρνηση το κρίσιμο για το λαό είναι ποιος θα κάνει αντιπολίτευση από τη σκοπιά των εργατικών λαϊκών συμφερόντων. Και τέτοια 100% μαχητική, εργατική λαϊκή αντιπολίτευση μπορεί να είναι μόνο το ΚΚΕ. Δε χρειάζεται να απαριθμήσουμε τι έκανε το ΚΚΕ στα τέσσερα χρόνια διακυβέρνησης της ΝΔ, όταν ο ΣΥΡΙΖΑ και το ΠΑΣΟΚ ψήφιζαν κατά 50% ο ένας και κατά 70% ο άλλος τα αντιλαϊκά της νομοσχέδια. Δεν χρειάζεται να πούμε ποιος ήταν εκεί να αποκαλύπτει στους εργαζόμενους, στο λαό το αντιλαϊκό περιεχόμενο των νόμων της ΝΔ, να παλεύει για να μην περάσουν, για να μην εφαρμοστούν όταν ο ΣΥΡΙΖΑ και το ΠΑΣΟΚ έβαζαν πλάτη στη ΝΔ και αποπροσανατόλιζαν το λαό. Δε χρειάζεται να πούμε ποιος έμπαινε μπροστά στους αγώνες για να μην πληρώσουν οι εργαζόμενοι, οι βιοπαλαιστές αγρότες και επαγγελματίες τα σπασμένα σε όλες τις δύσκολες περιόδους, αλλά και να κερδίσουν ανάσες ανακούφισης και να μπορέσουν να επιβιώσουν. Πότε με την πανδημία, πότε με την κρίση που ήρθε μετά, πότε με την ακρίβεια και την ενεργειακή φτώχεια, πότε με τον πόλεμο που συνεχίζεται με τη συμμετοχή της χώρας μας, ο ΣΥΡΙΖΑ και το ΠΑΣΟΚ περιορίζονταν στις κοκορομαχίες μέσα στη Βουλή, και το ΚΚΕ έδινε τη μάχη παντού στις πόλεις και τα χωριά για να σταθεί όρθιος ο λαός μας. ",political agenda,elections,working class,0.5,0.8,0,"[['kke', 'organization', '1.0'], ['nd', 'political party', '0.5'], ['syriza', 'political party', '0.5'], ['pasok', 'political party', '0.5'], ['south-west', 'location', '1.0'], ['greece', 'country', '1.0']]"
6,"We are doing the same thing these days with the members and cadres of the KKE, as well as its deputies. Some of them may have only been deputies for a day, but they were there where the slogan was being put into practice: ""Only the people can save the people.""","Το ίδιο κάνουμε και τώρα αυτές τις μέρες, με μπροστάρηδες τα μέλη και τα στελέχη του ΚΚΕ, με τους βουλευτές του, που μπορεί να ήταν βουλευτές για μια μέρα, αλλά βρέθηκαν εκεί όπου κι αυτές τις μέρες γινόταν πράξη το σύνθημα: “Μόνο ο λαός σώζει το λαό”.",political agenda,elections,other,0,0,0.2,"[['kke', 'organization', '0.95'], ['deputies', 'group of people', '0.6'], ['people', 'group of people', '0.3.']]"
7,"And this is what happened in the Shipbuilding and Repair Zone in Perama, where a worker was killed because there were no safety measures. The collective labour agreement signed by the union provides for such measures to be compulsory, but neither the ND nor SYRIZA government made it so. We did it.","Κι αυτό συνέβη και στη Ναυπηγοεπισκευαστική Ζώνη στο Πέραμα όπου σκοτώθηκε ένας εργάτης γιατί δεν υπήρχαν μέτρα ασφαλείας, για να γίνει υποχρεωτική η συλλογική σύμβαση εργασίας που έχει υπογράψει το σωματείο και η οποία προβλέπει τέτοια, όμως καμιά κυβέρνηση ούτε της ΝΔ ούτε του ΣΥΡΙΖΑ την έκαναν υποχρεωτική. Τα καταφέραμε. ",criticism,employment,workers' rights,,0.1,0,"[['shipbuilding and repair zone', 'location', '1.0'], ['perama', 'location', '1.0'], ['worker', 'person', '1.0'], ['union', 'organization', '1.0'], ['nd', 'political party', '1.0'], ['syriza', 'political party', '1.0']]"
8,"It happened in Kalamia, Kozani, where the residents of a village managed to stop the installation of a huge photovoltaic park that literally surrounds their village. And we continue.",Συνέβη και στην Καλαμιά Κοζάνης εκεί όπου οι κάτοικοι ενός χωριού κατάφεραν να σταματήσουν τις εργασίες εγκατάστασης ενός τεράστιου φωτοβολταϊκού πάρκου το οποίο κυριολεκτικά περικυκλώνει το χωριό τους. Και συνεχίζουμε.,political agenda,energy,other,0,0,0,"[['kalamia', 'location', '0.9'], ['kozani', 'location', '0.9']]"
9,"It also happened that we wasted no time in taking initiatives everywhere to prevent innocent lives from being ruined again by tragic shortcomings in the public health system, as in Kos, Nea Makri, and Halkidiki. And we will not back down.","Συνέβη και όταν χωρίς να χάσουμε χρόνο πήραμε παντού αγωνιστικές πρωτοβουλίες για να μην ξαναθρηνήσουμε αθώες ζωές από τις τραγικές ελλείψεις στο δημόσιο σύστημα υγείας, όπως στην Κω, στη Νέα Μάκρη, στη Χακλιδική. Και δεν θα κάνουμε πίσω. ",political agenda,health,public health system,,0,0,"[['kos', 'location', '0.5'], ['nea makri', 'location', '0.5'], ['halkidiki', 'location', '0.5']]"
10,"It also happened in many neighborhoods where, together with other workers, friends, and neighbors, we prevented families from being thrown out on the street due to bank auctions and foreclosures. We succeeded.","Συνέβη και σε πολλές γειτονιές όπου μαζί με άλλους εργαζόμενους, φίλους και γείτονες αποτρέψαμε να πεταχτούν στο δρόμο λόγω πλειστηριασμών από τις τράπεζες και τα κοράκια λαϊκές οικογένειες. Τα καταφέραμε. ",political agenda,housing,foreclosures,1,0,0,"[['none', 'as there are no specific named entities mentioned in the text.']]"
11,This is where we will deposit the electoral power that the people will give us in the struggles of the working people. A strong KKE means a strong people and their movement.,"Να λοιπόν που θα καταθέσουμε εμείς την εκλογική δύναμη που θα μας δώσει ο λαός, στους εργατικούς λαϊκούς αγώνες. Γιατί δυνατό ΚΚΕ σημαίνει δυνατός ο λαός, το κίνημα του. ",political agenda,elections,working class,1,0.1,0.5,"[['kke', 'organization', '1.0'], ['working people', 'group of people', '0.7'], ['people', 'group of people', '0.7'], ['movement', 'group of people', '0.4']]"
12,"Already the fairy tales of stable growth for all with lower taxes, higher wages, and reduced inequalities have begun, and other tales of the Hallimae. Let them come here to tell it in Elatia, in Fthiotida, in a rural area that is experiencing the largest population decline in a decade, over 23%, mainly due to the blow to rural incomes. And yet we are talking about an area with a truly fertile plain with enormous productive potential between two mountain ranges, Kallidromos and Parnassos.","Ήδη έχουν αρχίσει τα παραμύθια περί σταθερής ανάπτυξης για όλους με μείωση φόρων, αύξηση μισθών και μείωση των ανισοτήτων... κι άλλα παραμύθια της Χαλιμάς. Ας έρθουν εδώ να τα πουν στην Ελάτεια, στη Φθιώτιδα σε μια αγροτική περιοχή που βιώνει τη μεγαλύτερη μείωση πληθυσμού μέσα σε μία δεκαετία, πάνω από 23%, λόγω κυρίως του πλήγματος που έχει υποστεί το αγροτικό εισόδημα. Κι όμως μιλάμε για μια περιοχή με έναν πραγματικά εύφορο κάμπο με τεράστιες παραγωγικές δυνατότητες ανάμεσα σε δύο ορεινούς όγκους, το Καλλίδρομο και  τον Παρνασσό. ",criticism,agricultural policy,other,-0.5,0,0,"[['elatia', 'location', '1.0'], ['fthiotida', 'location', '1.0'], ['kallidromos', 'location', '1.0'], ['parnassos', 'location', '1.0']]"
13,"Instead of building hydroelectric dams to irrigate organic farmers for free and produce energy for the region, energy conglomerates are destroying thousands of acres of highly productive land to install photovoltaic panels. This results in the energy conglomerates getting rich, while farmers struggle to afford irrigation and the people of the region pay high prices for electricity and cannot meet their needs.","Κι όμως αντί να φτιαχτούν υδροηλεκτρικά φράγματα για να αρδεύουν οι βιοπαλαιστές αγρότες δωρεάν και να παράγεται ενέργεια για τις ανάγκες της περιοχής, καταστρέφονται χιλιάδες στρέμματα υψηλής παραγωγικότητας για να μπουν φωτοβολταϊκά από τους ομίλους της ενέργειας. Με αποτέλεσμα οι ενεργειακοί όμιλοι να θησαυρίζουν ενώ οι αγρότες ποτίζουν με ασύμφορο κόστος και ο λαός της περιοχής πληρώνει πανάκριβα το ρεύμα και δεν μπορεί να καλύψει τις ανάγκες του. ",criticism,energy,other,-0.9,0.5,0.4,"[['energy conglomerates', 'organization', '0.9'], ['organic farmers', 'group of people', '0.75'], ['region', 'location', '0.5'], ['photovoltaic panels', 'group of people', '0.45']]"
14,"Everyone knows, both old and young, that important crops such as tobacco, which kept the region and countryside alive, have been devalued and abandoned due to CAP and EU guidelines.","Όλοι γνωρίζουν και οι παλιοί και οι νεότεροι πως σημαντικές καλλιέργειες που κρατούσαν ζωντανή την περιοχή και την ύπαιθρο, όπως η καπνοκαλλιέργεια, απαξιώθηκαν και εγκαταλείφθηκαν λόγω των κατευθύνσεων της ΚΑΠ και της ΕΕ.",criticism,agricultural policy,other,-0.7,0,0,"[['cap', 'organization', '0.6'], ['eu', 'organization', '0.6']]"
15,"Let them come here and say these big fake words when the health centre does not even remotely meet the health needs of the region due to understaffing, and the supposed regional clinics are also understaffed.","Ας έρθουν λοιπόν, να τα πουν εδώ, αυτά τα ψεύτικα τα λόγια τα μεγάλα όταν το κέντρο υγείας δεν καλύπτει ούτε κατά το ελάχιστο τις υγειονομικές ανάγκες της περιοχής, λόγω της υποστελέχωσης, ενώ και τα υποτιθέμενα περιφερειακά ιατρεία υπολειτουργούν.",criticism,health,public health system,-0.6,0.2,0,"[['health centre', 'organization', '0.5'], ['region', 'location', '0.5'], ['regional clinics', 'organization', '0.5'], ['understaffing', 'group of people', '0.2']]"
16,"Here, shops and small businesses are closing one after another due to sluggishness. Farmers and workers cannot afford to see their incomes decrease, as they cannot meet their basic needs because of inexactness and tax evasion.","Εδώ που τα μαγαζιά και οι μικρές επιχειρήσεις κλείνουν η μία μετά την άλλη, λόγω και της αναδουλειάς, αφού οι αγρότες και οι εργαζόμενοι δεν μπορούν να έχουν δει το εισόδημά τους να μειώνεται, δεν μπορούν να καλύψουν τις στοιχειώδεις ανάγκες τους και λόγω της ακρίβειας και της φορολεηλασίας.",criticism,entrepreneurship,tax evasion,-0.6,0,0.2,"[['farmers', 'person', '1.0'], ['workers', 'group of people', '1.0']]"
17,"Let them come and say this here in Elatia, an area with archaeological sites of great value that are on the verge of complete abandonment and devaluation.","Ας έρθουν να τα πουν αυτά εδώ στην Ελάτεια, σε μια περιοχή με μεγάλης αξίας αρχαιολογικούς χώρους οι οποίοι βρίσκονται στο φάσμα της πλήρους εγκατάλειψης και απαξίωσης. ",criticism,culture,other,-0.6,0,0,"[['elatia', 'location', '1.0']]"
18,"Here in an area where the railway line passes, the services that stop and serve the residents are few and far between. The tickets are very expensive, and of course, everyone thinks that the ""new Tempe"" is lurking. So, in order not to mourn new victims as in the tragedy of Tempe, here in this earthquake-prone region, it is literally a matter of life and death to take anti-seismic protection measures. The stability of public buildings has not been checked, etc.","Εδώ σε μια περιοχή που ενώ περνάει η σιδηροδρομική γραμμή, τα δρομολόγια που σταματάνε και εξυπηρετούν τους κατοίκους της περιοχής είναι ελάχιστα, τα εισιτήρια πανάκριβα και φυσικά όλοι σκέφτονται πως τα “νέα Τέμπη” καραδοκούν.Για να μη θρηνήσουμε λοιπόν, νέα θύματα όπως στην τραγωδία των Τεμπών, εδώ σ’ αυτή την περιοχή, η οποία είναι μια σεισμογενής περιοχής, είναι κυριολεκτικά ζήτημα ζωής και θανάτου να παρθούν μέτρα αντισεισμικής προστασίας καθώς ούτε η στατικότητα των δημόσιων κτιρίων δεν έχει ελεγχθεί κτλ. ",criticism,infrastructure,railway,-0.6,0,0,"[['railway line', 'location', '0.8'], ['tempe', 'location', '1.0'], ['earthquake-prone region', 'location', '0.8']]"
19,"We were reminded of this yesterday by the earthquake in the Atalanti area, where we suddenly started reading about the big Atalanti fault and whether it has been activated. What are they waiting for to proceed with the seismic reinforcement of the country? How long before they compromise the protection of human life and remove it from their government programs?","Ήρθε να μας το θυμίσει και ο χτεσινός σεισμός στην περιοχή της Αταλάντης, όπου ξαφνικά αρχίζαμε να διαβάζουμε για το μεγάλο ρήγμα της Αταλάντης και αν έχει ενεργοποιηθεί. Έλεος πια, τι περιμένουν για να προχωρήσουν την αντισεισμική θωράκιση της χώρας; Ως πότε θα κοστολογούν την προστασία της ανθρώπινης ζωής, και θα την πετάνε έξω από τα κυβερνητικά προγράμματα τους;",criticism,infrastructure,other,-0.7,0,0,"[['atalanti', 'location', '0.9'], ['government', 'organization', '0.6'], ['country', 'country', '0.5']]"
20,"This applies to all parties, including ND, SYRIZA, and PASOK, who argue about whether their programs are costed. In reality, the needs of the people have been excluded from their programs, and only the profits of the few conglomerates are considered.","Κι αυτό ισχύει για όλους και για τη ΝΔ και τον ΣΥΡΙΖΑ και για το ΠΑΣΟΚ που τσακώνονται για το αν είναι κοστολογημένα τα προγράμματα τους, όμως στην πραγματικότητα αν κάτι έχει κοστολογηθεί είναι οι λαϊκές ανάγκες, οι οποίες  έχουν πεταχτεί έξω από τα προγράμματα τους γιατί εκεί υπάρχουν μόνο τα κέρδη των λίγων, των ομίλων. ",criticism,economy,austerity,-0.7,0.6,0.2,"[['nd', 'organization', '0.8'], ['syriza', 'organization', '0.8'], ['pasok', 'organization', '0.8.']]"
21,"Tsipras admitted that the 15,000 recruitments in the NHS that he has in his program are much less than what is actually needed based on the hospital organizations, but there are limited budgetary possibilities.","Το παραδέχτηκε και ο Τσίπρας όταν είπε πως οι 15.000 προσλήψεις στο ΕΣΥ που έχει στο πρόγραμμά του είναι πολύ λιγότερες από αυτές που πραγματικά απαιτούνται με βάση τους οργανισμούς των νοσοκομείων, όμως υπάρχουν περιορισμένες δημοσιονομικές δυνατότητες.  ",criticism,health,public health system,-0.4,0,0,"[['tsipras', 'person', '0.8'], ['nhs', 'organization', '0.7'], ['hospital organizations', 'group of people', '0.6']]"
