id,text,text_el,is_criticism,topic-context,subtopic-context,sentiment,polarization-definition,populism-definition,ner-limited
7,"There is also our own narrative. It's not just our narrative, it's the guerrilla narrative. It's also the KKE's, it's also non-aligned. The one the networks call antisystemic. That's a long conversation. This characterization of our narrative is that this country is not sustainable. In this context. In which we have been placed. The meme-centric governments. This country is simply not sustainable. It doesn't even matter everyone. And all with one voice. Without any differentiation or conflict between us, all united. To lift this country up within this framework that our governments have agreed to since 2010. This country will be deserted with mathematical precision. It's not just the national debt. Which of course it is. It's the building material of which the prison, the debt prison that Greece is living in, has been built. Let me remind you that I have seen some young people who. No reason to remember that two thousand 10 in 2010 Greece went bankrupt because we had an income of 220. And to debt 300 and we went bankrupt. And we saw what happened to us over the years. 300 debt 220 income today. 192. Instead of 220. Equal, 400 this year. If we were failures in 2010, what are we now, the networks will tell you as a staicurus. Tsakalotos. They don't need to mention PASOK, it's not interesting. This PASOK, this gang called PASOK still. They tell us, yes, but our debt has been adjusted so that the payments are bearable; it is true, they have adjusted it this year they will pay relatively much less than we are required to pay in 2015 to the lenders though. Friends. This arrangement can in 5 minutes be changed. This regulation is. With conditions. At any time the lenders until 2060. Read the memorandum signed in August 2018 by Alexis Tsipras and Euclid Tsakalotos, the fourth memorandum, which of course they called it an exit from the memorandum. Because, as George Orwell explained in his 1984 novel, a truly authoritarian regime reverses the meaning of words.
You call what is the worst fourth, longest memorandum a post-memorandum, exit from the memorandum and it immediately becomes much more palatable. That's the principle of Goebbels' propaganda. You reverse the truth, create a huge lie and repeat it over and over again. That's what they do. But if you see. The details of this deal. Which is until 2060 the fourth memorandum, you'll see it's clear. The payments remain relatively small, not that they are small; relatively small. Provided. We keep to the terms. In other words. If you go to reduce VAT? Which in Greece is 24%, when in Germany it's 10.9%. And when in the midst of a pandemic Merkel fevered VAT from 24 and went from 19 and went to 16. I had asked our Finance Minister, then of Staikura saw we do it and we guys this does not let us? What do you think the poet meant? They do not leave us a condition to have a relatively small instalment this year We cannot do what we want to do, that is to be a sovereign country, to choose the VAT, which is compatible with the sustainability of the country. In other words, the debt remains; the weapon with which foreign lenders. Frankfurt, Brussels, Berlin, Berlin, Washington The weapon with which foreign lenders. Do not allow us to pursue policies that would be compatible with Greece's sustainability. This is the public debt, we know it.","Υπάρχει και το δικό μας αφήγημα. Δεν είναι μόνο το δικό μας, είναι και του ανταρσυα. Είναι και του ΚΚΕ είναι και ανένταχτων. Αυτόυ που ονομάζουν τα κανάλια αντισυστημικοι. Μια μεγάλη κουβέντα αυτό. Αυτός ο χαρακτηρισμός το δικό μας αφήγημα είναι ότι αυτή η χώρα δεν είναι βιώσιμη. Σε αυτό το πλαίσιο.Στο οποίο μας έχουν εντάξει. Οι μνημονιακές κυβερνήσεις. Αυτή η χώρα απλά δεν είναι βιώσιμη. Δεν έχει σημασία ακόμα και όλοι. Και όλες με μια φωνή. Χωρίς καμία διαφοροποίηση ή σύγκρουση μεταξύ μας, όλοι να ενωθούμε. Για να ανεβάσουμε αυτή τη χώρα μέσα σε αυτό το πλαίσιο, το οποίο έχουν συμφωνήσει οι κυβερνήσεις μας από το 2010 και μετά. Η χώρα αυτή θα ερημοποιηθεί με μαθηματική ακρίβεια. Δεν είναι μόνο το δημόσιο χρέος. Το οποίο βεβαίως είναι. Το υλικό το οικοδομικό υλικό από το οποίο έχει χτιστεί η φυλακή, η φυλακή χρέους μέσα στην οποία ζει η Ελλάδα. Να σας θυμίσω ίδιος έχω βλέπω και κάποια νέα παιδιά που. Δεν λόγο να τα θυμουνται αυτα το δυο χιλιάδες 10 το 2010 η Ελλάδα πτώχευσε γιατί είχαμε ένα εισόδημα 220. Και να χρέους 300 και πτωχεύσαμε. Και είδαμε τι πάθαμε τόσα χρόνια. 300 χρέος 220 εισόδημα σήμερα. 192. Αντί 220. Ισότιμα, 400 φετος. Αν είμαστε αποτυχημένοι το 2010 τι είμαστε τώρα θα σου πουν τα κανάλια ως σταϊκούρας. Τσακαλώτος. Το ΠΑΣΟΚ δεν χρειάζεται να το αναφέρουν, είναι εκτός. ενδιαφέροντος. Αυτό το ΠΑΣΟΚ, αυτή η συμμορία που λέγεται ΠΑΣΟΚ ακόμα. Μας λένε, ναι αλλά το χρέος μας έχει ρυθμιστεί έτσι ώστε οι δόσεις να είναι ανεκτές.Είναι αλήθεια, το έχουν ρυθμίσει φέτος θα πληρώσουν σχετικά πολύ λιγότερα από ότι καλούμαστε εμείς να πληρώσουμε το 2015 στους δανειστές όμως. Φίλες και φίλοι. Αυτή η ρύθμιση Μπορεί σε 5 λεπτά να αλλάξει. Αυτή η ρύθμιση είναι. Με όρους. Ανά πάσα στιγμή οι δανειστές μέχρι το 2060. Διαβάστε το μνημόνιο που υπέγραψε τον Αύγουστο του 2018 ο Αλέξης Τσίπρας με τον Ευκλείδη Τσακαλώτο, το τέταρτο μνημόνιο που βέβαια το ονόμασαν έξοδος από το μνημόνιο. Γιατί, όπως ο Τζορτζ Όργουελ είχε εξηγήσει στη Νουβέλα του το 1984 ένα πραγματικά απολυταρχικό καθεστώς αντιστρέφει την έννοια των λέξεων.
Το τι χειρότερο τέταρτο, πιο μακρύ μνημόνια το λες μετα μνημόνιο, έξοδος από το μνημόνιο και γίνεται αμέσως πολύ πιο ευχάριστο. Έτσι είναι η αρχή της προπαγάνδας του Γκεμπελς. Αντιστρέφεις την αλήθεια, δημιούργησε ένα τεράστιο ψέμα και το επαναλαμβάνεις συνέχεια. Αυτό κάνουν. Αν δείτε όμως. Τις λεπτομέρειες αυτής της συμφωνίας. Που είναι μέχρι το 2060 το τέταρτο μνημόνιο, θα δείτε ότι είναι ξεκάθαρο. Οι δόσεις παραμένουν σχετικά μικρές, όχι ότι είναι μικρές.Σχετικά μικρές. Εφόσον. Τηρούμε τους όρους. Με άλλα λόγια. Εάν πας να μειώσεις το ΦΠΑ; Που στην Ελλάδα είναι 24%, όταν στη Γερμανία είναι 10 9. Και όταν εν μέσω πανδημίας η Μέρκελ τον πυρετό ΦΠΑ από το 24 και το πήγε από το 19 και το πήγε στο 16. Εγώ είχα ρωτήσει τον υπουργό Οικονομικών μας, τότε του Σταϊκούρα είδε το κάνουμε και εμείς βρε παιδιά αυτό δεν μας αφηνουν; Τι νομίζετε ότι εννοούσε ο ποιητής; Δεν μας αφήνουν όρος για να έχουμε σχετικά μικρή δόση φέτος Δεν μπορούμε να κάνουμε εμείς ότι θέλουμε ότι κεφαλιού μας, δηλαδή να είμαστε μια κυρίαρχη χώρα, να επιλέξουμε το ΦΠΑ, ο οποίος είναι συμβατός με τη βιωσιμότητα της χώρας. Με άλλα λόγια, το χρέος παραμένει.Το όπλο με το οποίο οι ξένοι δανειστές. Φρανκφούρτη, Βρυξελλες, Βερολινο Ουασιγκτον Το όπλο με το οποίο οι ξένοι δανειστές. Δεν μας επιτρέπουν να ασκούμε την πολιτική που θα ήταν συμβατή με τη βιωσιμότητα της Ελλάδας. Αυτό είναι το δημόσιο χρέος, το ξέρουμε. ",political agenda,debt,debt regulations,-0.8,0.0,0.4,"[['guerrilla', 'group of people', '1.0'], ['kke', 'political party', '1.0'], ['greece', 'country', '1.0'], ['2010', 'date', '1.0'], ['pasok', 'political party', '1.0'], ['alexis tsipras', 'person', '1.0'], ['euclid tsakalotos', 'person', '1.0'], ['august 2018', 'date', '1.0'], ['george orwell', 'person', '1.0'], ['goebbels', 'person', '1.0'], ['merkel', 'person', '1.0'], ['frankfurt', 'location', '1.0'], ['brussels', 'location', '1.0'], ['berlin', 'location', '1.0'], ['washington', 'location', '1.0']]"
8,"They will never get their money back. When they gave us 110 billion in 2010, first memorandum, 130 billion in the second memorandum, 86 billion in the third memorandum, in the fourth memorandum they basically took away 110 more in August 18 They didn't give us money, what are they doing? They suspended payments. It doesn't matter if you owe money. They either give you more money to pay back or they suspend payments. it's the same thing. It was a memorandum loan. All of this is on the basis of what we in day 25 have always called debt servitude. Which according to our manifesto When we were founded in 2018 we said debt serfdom, because it's a problem because it leads to desertification The reason our children are leaving is that. They are joining a debt prison and it's not just the national debt. What happened in 2018 17 18 with the fourth memorandum. It was, something that will go down in history. Of international capitalism as an incredible first. look, remember in 2010 11 12 13 pretty much everybody was losing except for Sallas of Piraeus and some other crows who had a chunk of the memorandum loans going into their pockets, but even the bourgeoisie. Who had property in Kifissia of Athens in Kolonaki, even they may have had property, apartments, villas, bad they had no money, they had no cash, they were in trouble, they couldn't rent, they could sell. They lost almost all 99% of the Greek people from 2010 to 2017 18 they lost. From 2018 onwards they found ways of 20% of the Greek people. The occupiers, the oligarchs and their employees I'll put it simply. All of these sectors of activity, whether business consultants, were the brokers. The film law firms involved in PPPs in all these parties of the memorandum process. That 20%. It's doing better from 2018 to date than it ever has. That's why they applaud the troika that's why they applaud. Any government that passes these memorandums that desertify our country and our people, our young people; abroad.","Τα χρήματά τους δεν θα πάρουν ποτέ πίσω. Όταν μας δίνανε θυμάστε 110 δις το 2010, πρώτο μνημόνιο, 130 δις στο δεύτερο μνημόνιο, 86 δις στο τρίτο μνημόνιο στο τέταρτο μνημόνιο μας πήραν ουσιαστικά μας δώσουν άλλα 110 τον Αύγουστο 18 Δε δωσαν χρήμα τι κάνουν; Ανέστειλαν πληρωμές Δεν έχει σημασία αν χρωστάς. Ή σου δώσουν και άλλα χρήματα για να αποπληρώνεις ή σου αναστείλουν τις πληρωμές. το ίδιο πράγμα είναι και αυτό. Ένα μνημονιακό δάνειο ήταν. Όλα αυτά γίνονται στη βάση αυτού που εμείς στο μέρα 25 πάντα ονομάζαμε χρεοδουλοπαροικίας. Η οποία σύμφωνα και με το μανιφέστο μας Οταν Ιδρυθήκαμε το 2018 είπαμε η χρεοδουλοπαροικία, γιατί είναι πρόβλημα γιατί οδηγεί στην ερημοποίηση Ο λόγος που φεύγουν τα παιδιά μας είναι ότι. Εντάσσονται σε μια φυλακή χρέους και δεν είναι μόνο το δημόσιο χρέος. Αυτό που συνέβη το 2018 17 18 με το τέταρτο μνημόνιο. Ήταν. Κάτι το οποίο θα μείνει στην ιστορία. Του διεθνούς καπιταλισμού ως μια απίστευτη πρωτοτυπία.Κοιτάξτε, θυμάστε το 2010 11 12 13 λίγο πολύ όλοι έχαναν αν εξαιρέσεις το Σάλλα της Πειραιώς και κάποια άλλα κοράκια που ένα κομμάτι των μνημονιακών δανείων πήγαιναν στις τσέπες τους, αλλά ακόμα και η αστική τάξη. Που είχε περιουσία στην Κηφισιά των Αθηνών στο Κολωνάκι, ακόμα και εκείνη μπορεί να είχαν περιουσία, διαμερίσματα, βίλλες, κακό δεν είχαν χρήματα, δεν είχαν ρευστό, είχαν πρόβλημα, δεν μπορούσαν να νοικιάσουν, μπορούσαν να πουλήσουν. Χαναν σχεδόν όλοι το 99% του ελληνικού λαού από το 2010 μέχρι το 2017 18 έχαναν. Από το 2018 και μετά βρήκαν τρόπους ένα 20% του ελληνικού λαού. Οι κατέχοντες, οι ολιγάρχες και οι υπάλληλοί τους θα το πω απλά. Όλοι αυτοί οι τομείς δραστηριότητας, είτε είναι σύμβουλοι επιχειρήσεων, ήταν οι χρηματιστές. Η ταινία δικηγορικά γραφεία που συμμετέχουν σε ΣΔΙΤ σε όλα αυτά τα κόμματα της μνημονιακής διαδικασίας. Αυτό το 20%. Τα πάει καλύτερα από το 2018 μέχρι σήμερα από ότι τα πήγαινε ποτέ. Γι αυτό χειροκροτούνε την τρόικα για αυτό χειροκροτούνε. Όποια κυβέρνηση περνάει αυτά τα μνημόνια που ερημοποιούν τη χώρα και τον λαό μας, τους νέους μας.Στο εξωτερικό. ",criticism,economy,other,-0.9,0.1,0.8,"[['sallas of piraeus', 'person', '0.6'], ['greek people', 'group of people', '1.0'], ['occupiers', 'group of people', '0.7'], ['oligarchs', 'group of people', '0.6'], ['ppp law firms', 'organization', '0.8'], ['memorandum process parties', 'organization', '0.9'], ['troika', 'organization', '0.7'], ['government', 'organization', '0.8'], ['greece', 'country', '1.0'], ['athens', 'location', '0.9'], ['kifissia', 'location', '0.7'], ['kolonaki', 'location', '0.7'], ['2010', 'date', '1.0'], ['2018', 'date', '1.0'], ['august 18', 'date', '0.8']]"
9,"And how did they do it? What they did, they built industries and exploited workers with investments with machine nonsense. Private debt. A source of unbelievable wealth, because. It's red. When a fund comes in. And it takes it away. Your loan that you can't pay back anymore because of the crisis. It's a loan of 100,000 in it takes for 3. He's putting your house under the hammer, the store. For 50. Think about it. He's got three grand and he's got 47. In what country in the world are there profit margins like that? They don't exist in Silicon Valley, and you know it. A profit margin of over 10 23% is considered unheard of. Here, to calculate the percentage, they laid 3 eggs 47. Obviously, stockbrokers around the world are listening to Greece. Mitsotakis, Tsipras and applaud such rates of obscenity are nowhere to be found in Africa or in the Congo, where they go and condemn the people to civil war in order to take away their cobalt and copper. All these Metals they take from them don't have such profit rates there either. At least there they produce there and something here they come and have profit rates without producing from bankruptcy. Of households from the bankruptcy of the small and medium sized businesses.","Και πώς κατάφεραν; Τι έκαναν, χτίσανε οι βιομηχανίες και εκμεταλλεύτηκαν τους εργαζόμενους με επενδύσεις με μηχάνημα ανοησίες. Ιδιωτικό χρέος. Πηγή απίστευτου πλουτισμού, επειδή. Είναι κόκκινο. Όταν έρχεται ένα ταμείο. Και σου παίρνει.Το δάνειο σου το οποίο δεν μπορείς να το αποπληρώσεις πια λόγω της κρίσης. Είναι ένα δάνειο 100.000 στο παίρνει για 3. Σου βγάζει το σπίτι στο σφυρί το μαγαζί. Για 50. Μια σκεφτείτε έχει βάλει 3 χιλιάρικα και έχει βγάλει 47. Σε ποια χώρα του κόσμου Υπάρχουν τέτοια ποσοστά κέρδους; Στο silicon valey δεν υπάρχουν και το ξέρετε; Ποσοστό κέρδους πάνω από 10 23% θεωρείται αμύθητο. Εδώ για υπολογίσετε το ποσοστό βάλαν 3 αυγά 47. Προφανώς οι χρηματιστές ανά τον κόσμο ακούν Ελλάδα. Μητσοτάκη, Τσίπρα και χειροκροτάνε τέτοια ποσοστά αισχροκέρδειας δεν τα έχουν πουθενά ούτε στην Αφρική, ούτε στο Κονγκό, εκεί που πηγαίνουν και καταδικάζουν το λαό στον εμφύλιο πόλεμο για να του πάρουν το κοβάλτιο, το χαλκό. Όλα αυτά τα  Μέταλλα που τους παίρνουν ούτε εκεί δεν έχουν τέτοια ποσοστά κέρδους. Τουλάχιστον εκεί παράγουν και κάτι εδώ έρχονται και έχουν ποσοστά κέρδους χωρίς να παράγουν από την πτώχευση. Των νοικοκυριών από την πτώχευση των μικρομεσαίων. ",criticism,debt,bankruptcy,-0.8,0.2,0.0,"[['mitsotakis', 'person', '0.8'], ['tsipras', 'person', '0.8'], ['greece', 'country', '0.7'], ['africa', 'location', '0.8'], ['congo', 'location', '0.8']]"
