id,text,text_el,is_criticism,topic-context,subtopic-context,sentiment,polarization-definition,populism-definition,ner-limited
10,"This Hercules market. Where they are bought and sold.Digitally, like a stock exchange that is bought and sold. The pain. The pain of the households, the pain of the small shops. Crafts. This hercules. I insist it's the world's first, it didn't start here. First they had a dress rehearsal and it's no coincidence that I use an Italian expression in Italy. They built Hercules legally with all the institutional framework in Frankfurt and applied it in Italy on a small scale, small scale and since it was there, usually Greece is the dystopian laboratory for all these things.It was Italy with a much smaller number of red loans, it failed. The system there doesn't matter. The goal was never to succeed. The goal was to eat. And then they brought it here because here we have the highest percentage of red loans in the world. Do you know that? That we have the highest percentage of red loans in the world, we're the champion, like we had the harshest austerity in the human history of capitalism. We had the biggest loans, no. As a percentage of GDP in absolute terms, the memorandum loans were the largest loans ever made to any state by any state. So that's how we have the largest percentage of red loans. In history worldwide today yesterday the day before yesterday 30 years ago. These red loans. Essentially the banks have written them off. They've been backed by the European Central Bank. Do you know that when you're here?
There was no chance of getting a loan for your business from a bank, so for the last four years. Do you know that the Central Bank has lent our four banks 52 billion? To lend to the small and medium enterprises. They didn't even lend 1 euro. Do you know what they did? They kept it in the account held by the National Bank, the Eurobank, Piraeus or alpha, unlike you and us. We do not have an account with the European Central Bank. They gave them the 52 billion and they kept it. In Frankfurt and you know what happened? Because they gave it to them at an interest rate of -0.9% he knows what -0.9% means. It's like paying you to borrow money. That means negative interest. Fine they gave them money and they put an extra 0.9% on it because they borrowed it not because it was savings. Right? They kept it there, they got billions. They were supposed to give it to them so cheaply, at a negative rate. It's like giving you a potato and paying you to take it with the intention of giving it to someone else who needs it, to eat the potato. The middle class was not lent anything, they were eaten by the bankers and at the same time they set up predatory funds together with politicians, together with foreign oligarchs. Based in delaware, jersey. And a bank account in Kaman Island they spent. Your loans to these funds put your homes and cell phones and stores up for auction.And the profits in the Kayman Islands. To put it simply 70 billion and counting. They will leave Greece and go to the Kayman Islands in these accounts where they will never pay any target and no interest and no tax. This system that they've been working on for so many years. In Frankfurt they took it to Italy, they brought it here, it's called Hercules, my friends, compañeras and compañeros, it's called Hercules, right? If it is not abolished. This Hercules market does not save either the first basic houses or the small shops.","Αυτή η αγορά του Ηρακλή. Όπου αγοράζονται και πωλούνται.Ψηφιακά μάλιστα, έτσι σαν ένα χρηματιστήριο που αγοράζεται και πωλείται. Ο πόνος. Των νοικοκυριών ο πόνος των μικρομεσαίων μαγαζιών. Βιοτεχνιών. Αυτός ο ηρακλής. Επιμένω ότι είναι η παγκόσμια πρωτοτυπία, δεν ξεκίνησε εδώ. Πρώτα κανανε μια πρόβα τζενεράλε και δεν είναι τυχαίο ότι χρησιμοποιώ και ιταλική έκφραση στην Ιταλία. Τον Χτίσανε τον Ηρακλή νομικά με όλο όλο το θεσμικό πλαίσιο στη Φρανκφούρτη και το εφάρμοσαν στην Ιταλία σε μικρή κλίμακα, μικρή κλίμακα και αφού ήταν εκεί, συνήθως είναι η Ελλάδα το δυστοπικό εργαστήρι για όλα αυτά τα πράγματα.Ηταν Η Ιταλία με πολύ μικρότερο αριθμό κόκκινων δανείων, απέτυχε. Το σύστημα εκεί δεν έχει σημασία. Ο στόχος δεν ήταν ποτέ να πετύχει. Στόχος του ήταν να φάνε. Και μετά το φέρανε εδώ γιατί εδώ έχουμε το μεγαλύτερο ποσοστό κόκκινων δανείων στον κόσμο. Το ξέρετε αυτό; Ότι έχουμε το μεγαλύτερο ποσοστό κόκκινων δανείων στον κόσμο, είμαστε πρωταθλητές, όπως είχαμε τη σκληρότερη λιτότητα στην ανθρώπινη ιστορία του καπιταλισμού. Είχαμε τα μεγαλύτερα δάνεια, όχι. Ως ποσοστό του ΑΕΠ σε απόλυτες τιμές τα μνημονιακά δάνεια ήταν τα μεγαλύτερα δάνεια που δόθηκαν ποτέ σε κράτος οποιοδήποτε κράτος. Έτσι έτσι έχουμε και το μεγαλύτερο ποσοστό κόκκινων δανείων. Στην ιστορία παγκοσμίως σήμερα χθες προχθές πριν 30 χρόνια. Αυτά τα κόκκινα δάνεια. Ουσιαστικά οι τράπεζες τα έχουν διαγράψει. Τους έχουνε βάλει πλάτες με την Ευρωπαϊκή Κεντρική Τράπεζα. Το ξέρετε ότι όταν εσύ είσαι εδώ;
Δεν υπήρχε πιθανότητα να βρείτε δάνειο για την επιχείρησή σας από τράπεζα, έτσι τα τελευταία 4 χρόνια. Ξέρετε ότι η Κεντρική Τράπεζα έχει δανείσει στις 4 δικές μας τράπεζες 52 δισεκατομμύρια; Για να δανείσουν στους μικρομεσαίους. Ούτε 1 € δεν δάνεισαν. Ξέρετε τι τα κάνανε τα κράτησαν στον λογαριασμό που κρατάνε η εθνική, η eurobank , η Πειραιώς ή αλφα τα κράτησαν αυτοι αντίθετα με εσάς και εμάς Εμείς δεν έχουμε λογαριασμό στην Ευρωπαϊκή Κεντρική Τράπεζα αυτή έχουν. Τους δώσαν τα 52 δις τα κράτησαν. Στην Φρανκφούρτη και ξέρετε τι έγινε; Επειδή τους τα δώσανε με επιτόκιο -0,9% ξέρει τι σημαίνει -0,9%. Είναι σαν να σε πληρώνουμε για να δανείζεσαι.Αυτό σημαίνει αρνητικό επιτόκιο. Ωραία τους δώσανε χρήματα και τους βάζανε και 0,9% επιπλέον επειδή τα δανείστηκαν όχι επειδή ήταν αποταμίευση. Έτσι; Τα κράτησαν εκεί, πήραν δισεκατομμύρια. Αυτά υποτίθεται ότι τους τα δωσαν τόσο φθηνά φθηνά, με αρνητική τιμή. Είναι σαν να σου δίνω μια πατάτα και να σε πληρώνουν, να την πάρεις με στόχο να τη δώσεις σε κάποιον άλλον που το έχει ανάγκη, να φάει την πατάτα. Το μικρομεσαίο δε δάνεισαν τίποτα, τα φάγανε οι τραπεζίτες και ταυτόχρονα φτιάξανε και αρπακτικά ταμεία μαζί με πολιτικούς, μαζί με ξένους ολιγάρχες. Με έδρα το delaware το jersey. Και τραπεζικό λογαριασμό  στα κέιμαν Άϊλαντ πέρασαν. Τα δάνεια σας σε αυτά τα ταμεία βγάζουν τα σπίτια σας και τα κινητά σας και τα μαγαζιά σας στον πλειστηριασμό.Και τα κέρδη στα Kayman Islands. Να το πω απλά 70 δισεκατομμύρια κια. Θα φύγουν από την Ελλάδα και θα πάνε στα  Kayman Islands σε αυτούς τους λογαριασμούς όπου δεν θα πληρώσουν και πότε κανένα στόχο και κανένα τόκο κανένα φόρο. Αυτό το σύστημα που το δουλεύουν τόσα χρόνια. Στη Φρανκφούρτη το πήγαν στην Ιταλία, το φέρανε εδώ λέγεται Ηρακλής φίλες και φίλοι συντρόφισσες και σύντροφοι συνοδοιπόροι λέγεται Ηρακλής, έτσι; Εάν δεν καταργηθεί. Αυτή η αγορά του Ηρακλή δεν σώζονται ούτε οι πρώτες βασικές κατοικίες, ούτε τα μικρομάγαζα. ",criticism,debt,bankers,-0.8,0.2,0.2,"[['hercules', 'organization', '1.0'], ['frankfurt', 'location', '1.0'], ['italy', 'country', '0.8'], ['greece', 'country', '0.8'], ['european central bank', 'organization', '1.0'], ['national bank', 'organization', '1.0'], ['piraeus', 'organization', '1.0'], ['alpha', 'organization', '1.0'], ['delaware', 'location', '1.0'], ['jersey', 'location', '1.0'], ['cayman island', 'location', '1.0']]"
11,"When Tsipras says that he will protect the first home and he presents a plan, which sounds very complicated. But we know about complicated plans and we have read it. Do you know what this plan does? I will tell you remember the 100,000 loan that takes 3 and sells 50. What is the great innovation of the Syriza plan that it says the loan will be cut, it says by 50% and then the process will be done. And not be like giving aspirin to the dead. It does no harm. But it doesn't help. Why did the fund wait until it got 100,000? By buying the 100,000 loan, not 50 it wanted to get. Syriza what does it ensure him?In the context of the protection offered by the radical left in many quotes to the borrower.","Όταν λέει ο Τσίπρας.Ότι θα προστατεύσει την πρώτη κατοικία και καταθέτει και μάλιστα σχέδιο, το οποίο ακούγεται και πολύ περίπλοκο. Εμείς όμως ξέρουμε από περίπλοκα σχέδια και το διαβάζαμε. Ξέρετε τι κάνει αυτό το σχέδιο; Θα σας πω θυμάστε το δάνειο των 100.000 που το παίρνει 3 και το πουλάει 50. Ποια είναι η μεγάλη καινοτομία του σχεδίου του ΣΥΡΙΖΑ ότι λέει το δάνειο Θα κουρευτεί, λέει κατά 50% και μετά θα γίνει η διαδικασία. Και να μην είναι σαν να δίνεις ασπιρίνη στο νεκρό. Κακό δεν κάνει. Αλλά δεν βοηθάει. Γιατί το ταμείο περίμενε πότε θα πάρει 100.000; Αγοραζοντας το δάνειο των 100.000, Όχι 50 ήθελε να πάρει. Τον ΣΥΡΙΖΑ τι κάνει του το εξασφαλίζει;Στο πλαίσιο της προστασίας που προσφέρει η ριζοσπαστική αριστερά μέσα σε πολλά εισαγωγικά στον δανειολήπτη. ",criticism,housing,other,0.0,0.2,0.1,"[['tsipras', 'person', '0.8'], ['syriza', 'political party', '0.9']]"
12,"This Hercules system is a. A magic goose that spins golden eggs for the coffers. To be considered today by the channels of misery. The oligarchy. The means of mass deception to be taken seriously, Why don't you say crazy things? Have you heard what they say about us? You must promise not to touch that goose that lays the golden eggs for the oligarchy. If you say you will touch it as we say with the Ulysses system that creates a public company to manage red loans, go the loans there is no auction, you stay in, you pay a fee. To freeze your loan. 1/6 of your citizen disposable income and if it's below a certain level your income you pay no fee and you stay there in perpetuity without getting kicked out without getting shut down. It's a shop. That's the public red loan management company; red loans and when at some point. You sell it because the market has gone up, you keep the percentage that's already paid off over the years? And you sort it out. That's the solution, it's really technocratically structured. We've even filed a bill. In December 2000 2020 in Parliament no one dared to criticize, no one dared to criticize our Ulysses, with whom we will replace Hercules. What they are doing is demonizing. He will close the banks. He's a narcissist. You tell them, guys, what are we going to do with Hercules? Varoufakis is a narcissist, guys, what are we going to do with the predatory funds that we will have and you know we have guaranteed them 22 billion 23 If they don't get a minimum of 23 billion out I told you 70 we have guaranteed them 23 we will give them 23 from what money from what money we don't have we will borrow again from the predators to give to the predators? When we say that, the answer, you know, is that Varoufakis was recording the Eurogroups. He is not credible. So we are honoured and proud of their hatred, the hatred of the troika, of Schäuble, of Gollum, of the European Central Bank, of Lagarde, of Draghi. Mitsotakis and Tsipras we love their hate, we want their hate, if they didn't hate and try to change the debate, then we would have an existential problem. We would be in agony.","Αυτό το σύστημα Ηρακλής είναι μια. Μαγική χήνα που γυρνάει χρυσά αυγά για τα ταμεία. Για να θεωρείσαι σήμερα από τα κανάλια της συμφοράς. Της ολιγαρχίας. Τα μέσα μαζικής εξαπάτησης για να θεωρήσει ότι είσαι σοβαρό, Γιατί δεν λες τρελά πράγματα; Έχετε ακούσει τι λένε για μας; Πρέπει να υποσχεθείς ότι δεν θα αγγίξεις αυτή τη χήνα που γεννάει τα χρυσά αυγά για την ολιγαρχία. Αν πεις ότι θα την αγγίξεις όπως λέμε εμείς με το σύστημα Οδυσσέας που δημιουργεί μια δημόσια εταιρεία διαχείρισης των κόκκινων δανείων, πάνε τα δάνεια εκεί δεν γίνεται κανένας πλειστηριασμός, μένεις μέσα, καταβάλλεις  ένα τέλος. Για να παγώσει το δάνειό σου. Το 1/6 των πολιτών διαθέσιμων εισοδημάτων σου και αν είναι κάτω από ένα συγκεκριμένο επίπεδο τα εισοδήματά σου δεν καταβάλεις κανένα τέλος και μένεις εκεί στο διηνεκές χωρίς να πετάξουν έξω χωρίς να σου κλείσουν το μαγαζί. Είναι μαγαζί. Αυτή είναι η δημόσια εταιρεία διαχείρισης κόκκινων δανείων.Κόκκινων δανείων και όταν κάποια στιγμή. Το πουλήσεις γιατί έχει ανέβει η αγορά, κρατάς το ποσοστό που έχει ήδη αποπληρώσει όλα αυτά τα χρόνια; Και ξεσκαρτάρεις. Αυτή είναι η λύση, είναι αλήθεια τεχνοκρατικά δομημένη. Έχουμε καταθέσει και πρόταση νόμου. Το Δεκέμβρη του 2000 2020 στη Βουλή κανένας δεν τόλμησε να ασκήσει κριτική, κανένας δεν τόλμησε να ασκήσει κριτική στον Οδυσσέα μας, με τον οποίο θα αντικαταστήσουμε τον Ηρακλή. Τι κανουν δαιμονοποιούν. Αυτός θα κλείσει τις τράπεζες. Αυτός είναι νάρκισσος τους λες παιδιά, Τι θα κάνουμε με τον Ηρακλή; Ο Βαρουφάκης είναι νάρκισσος παιδιά, Τι θα κάνουμε με τα αρπακτικά ταμεία που θα τους έχουμε και το ξερετε τους εχουμε εγγυηθει 22 δισεκατομμύρια 23 Εαν δεν βγάλουν μίνιμουμ 23 δισεκατομμύρια έξω Εγώ σας είπα 70 τους έχουμε εγγυηθεί τα 23 θα τους τα δώσουμε από ποια χρήματα από αυτά που δεν έχουμε θα δανειστούμε δηλαδή πάλι από τα αρπακτικά για να δώσουμε στα αρπακτικά; Όταν το λέμε αυτό.Η απάντηση, ξέρετε, είναι ο βαρουφάκης ηχογραφούσε τα eurogroup. Δεν είναι αξιόπιστος. Έτσι τιμή μας και καμάρι μας το μίσος τους, το μίσος της τρόικας, του Σόιμπλε, του Γκόλουμ, της Ευρωπαϊκής Κεντρικής Τράπεζας, της Λαγκάρντ, του Ντράγκι. Του Μητσοτάκη αλλά και του Τσίπρα το αγαπάμε το μίσος τους, το θέλουμε το μίσος τους, αν δεν μισούσαν και δεν προσπαθούσαν να αλλάξουν τη συζήτηση, τότε θα είχαμε υπαρξιακό πρόβλημα. Θα είχαμε αγωνία. ",political agenda,debt,other,0.0,0.2,0.0,"[['hercules system', 'organization', '1.0'], ['oligarchy', 'group of people', '1.0'], ['ulysses system', 'organization', '0.8'], ['parliament', 'organization', '1.0'], ['varoufakis', 'person', '1.0'], ['eurogroups', 'organization', '0.8'], ['troika', 'organization', '1.0'], ['schäuble', 'person', '1.0'], ['gollum', 'person', '0.8'], ['european central bank', 'organization', '1.0'], ['lagarde', 'person', '1.0'], ['draghi', 'person', '1.0'], ['mitsotakis', 'person', '1.0'], ['tsipras', 'person', '1.0']]"
