id,text,text_el,is_criticism,topic-context,subtopic-context,sentiment,polarization-definition,populism-definition,ner-limited
16,"And of course, when you have these three sacred geese, when you have the debt serfdom. With the national debt the complete dependency. A dependency of which there are many. You arrive in a city in the country, for example? Let's say it's called Kalamata and you take a squadron of the air force and give it to the Israeli air force to train Turks and Israelis in. Types of warfare that certainly have nothing to do with arming our country and our national independence. You have a country that. There's a war going on right next to us. And instead of intervening? As we have an internationalist duty, first of all to condemn the invader, I've been out, I've got a hair on my tongue condemning Putin. At the same time at the same time. To demand an immediate ceasefire and the return of troops from all sides. To their camps, thirdly, suggest. The way in which this peace process will be conducted here, what do we have? Do you have a SYRIZA? Whose leader has accepted the thanks, not only of Latsis. But also of a Mr. Pyatt. You remember Mr. Pyatt was the United States Ambassador here until relatively recently, until Mr. Tsunis. Whoever Pawat. When he left Greece, he formally thanked, he was no longer Prime Minister Tsipras Mr. Tsipras because he says he showed me Alexandroupolis as a very good base for the U.S. military. That has never been done before. Until now, that is, since 1946, when the colonial baton passed from Britain to the United States and the United States took over. And we moved on. Into the second part of the civil war, under; the Americans since then the Americans have been coming in and saying, this is what I want. I want this and I want this and I want that. There was no chance that he didn't want something and a Greek prime minister would go and say you know what? This is very, very good. Take it and that something is Alexandroupolis. Do you know we have 120 flights every day? With war material we don't know, the flights are dark. They come, service takes off. We don't know where they're going, what they're carrying. They certainly don't carry. The message. To Putin on one side and to Gelensky on the other side, that it's time to stop killing Ukrainians, it's time to kill, no more killing Russians. It is time to stop pushing things into a nuclear war, to stop adding fuel to the fire of a new Cold War between China and the United States. How can there be a proud independent national policy?When we go and give them Alexandroupolis in the name of the Left. And we certainly put it in the sights of nuclear warheads. Both on one side and the other.","Και βεβαίως, όταν έχεις αυτές τις 3 ιερές χήνες, όταν έχεις τη χρεοδουλοπαροικία. Με το δημόσιο χρέος την πλήρη εξάρτηση. Μιας εξάρτησης πολλές έπονται. Φτάνεις για παράδειγμα σε μια πόλη της χώρας; Ας πούμε που τη λένε Καλαμάτα και παίρνεις μια μοίρα της αεροπορίας και τη δίνεις στις ισραηλινή αεροπορία για να εκπαιδεύονται Τούρκοι και Ισραηλινοί σε. Τύπους πολέμου που σίγουρα δεν έχουν καμία σχέση με τη θωράκιση της χώρας μας και της εθνικής μας ανεξαρτησίας. Έχεις μια χώρα που. Γίνεται πόλεμος δίπλα μας.Κι εμείς αντί να παρέμβουμε; Όπως έχουμε διεθνιστικό καθήκον, πρώτον να καταδικάσουμε τον εισβολέα, έχω βγει, έχει μαλλιάσει η γλώσσα μου να καταδικάζω τον Πούτιν. Ταυτόχρονα ταυτόχρονα. Να ζητάμε άμεση εκεχειρία και επιστροφή των στρατευμάτων όλων των μεριών. Στα στρατόπεδα τους τρίτον, να προτείνεις. Τον τρόπο με τον οποίο θα γίνει αυτή η ειρηνευτική διαδικασία εδώ τι έχουμε; Έχεις ένα ΣΥΡΙΖΑ; Του οποίου αρχηγός έχει δεχθεί Τις ευχαριστίες, όχι μόνο του Λάτση. Αλλά και ενός κυρίου Πάιατ τον Θυμάσαι τον κύριο Πάιατ ήταν ο πρέσβης των Ηνωμένων Πολιτειών εδώ μέχρι σχετικά πρόσφατα, μέχρι που ο κύριος Τσούνης. Ό οποιος Παιατ. Όταν αποχωρούσε από την Ελλάδα, ευχαρίστησε επισήμως, δεν ήταν πια πρωθυπουργός ο Τσίπρας τον κύριο Τσίπρα επειδή λέει μου κατέδειξε μου κατέδειξε την Αλεξανδρούπολη ως μια πολύ καλή βάση για τον αμερικανικό στρατό. Αυτό δεν έχει ξαναγίνει. Μέχρι τώρα, δηλαδή από το 1946, που η σκυτάλη της αποικιοκρατίας πήγε από τη Βρετανία στις Ηνωμένες Πολιτείες και ανέλαβαν οι Ηνωμένες Πολιτείες. Και προχωρήσαμε. Στο δεύτερο κομμάτι του εμφυλίου πολέμου, υπό.Τους Αμερικανούς από τότε οι Αμερικανοί ερχόντουσαν και λέγανε, αυτό το θέλω. Θέλω και αυτό ετύλιξε μου και εκείνο. Δεν είχε υπάρξει περίπτωση να μη θέλει κάτι και να πάει έλληνας πρωθυπουργός να πει ξέρεις κάτι; Αυτό είναι πάρα πολύ καλό. Πάρτο και αυτό το κάτι είναι η Αλεξανδρούπολη. Ξέρετε ότι έχουμε 120 πτήσεις κάθε μέρα; Με πολεμικό υλικό δεν ξέρουμε, είναι σκοτεινές οι πτήσεις. Έρχονται, απογειώνεται υπηρεσιών. Δεν ξέρουμε πού πηγαίνουν, τι πηγαίνουν τη μεταφέρουν. Σίγουρα δεν μεταφέρουν. Το μήνυμα. Στον Πούτιν από τη μια μεριά και στον ζελένσκι από την άλλη μεριά, ότι ήρθε η ώρα να σταματήσουν να σκοτώνονται Ουκρανοί, ήρθε η ώρα να σκοτώνουν, να μην σκοτώνονται πλέον Ρώσοι. Ήρθε η ώρα να μην εξωθούμε τα πράγματα σε ένα πυρηνικό πόλεμο, να μη βάζουμε κι άλλο λάδι στη φωτιά ενός νέου Ψυχρού πολέμου μεταξύ Κίνας και Ηνωμένων Πολιτειών. Πώς μπορεί να υπάρξει περήφανη ανεξάρτητη εθνική πολιτική;Όταν πηγαίνουμε και τους δίνουμε στο όνομα της Αριστεράς, την Αλεξανδρούπολη. Και τη βάζουμε βεβαίως και στο στόχαστρο πυρηνικών κεφαλών. Και της μιας μεριάς και της άλλης μεριάς. ",criticism,external affairs,other,-0.8,0.0,0.0,"[['kalamata', 'location', '1.0'], ['israeli air force', 'organization', '1.0'], ['turks', 'group of people', '1.0'], ['national debt', 'organization', '1.0'], ['country', 'location', '1.0'], ['war', 'organization', '1.0'], ['putin', 'person', '1.0'], ['ceasefire', 'date', '1.0'], ['u.s.', 'country', '1.0'], ['syriza', 'political party', '1.0'], ['latsis', 'person', '1.0'], ['pyatt', 'person', '1.0'], ['united states', 'country', '1.0'], ['tsunis', 'person', '1.0'], ['alexandroupolis', 'location', '1.0'], ['greece', 'country', '1.0'], ['civil war', 'organization', '1.0'], ['britain', 'country', '1.0'], ['russia', 'country', '1.0'], ['ukrainians', 'group of people', '1.0'], ['gelensky', 'person', '1.0'], ['china', 'country', '1.0'], ['cold war', 'organization', '1.0']]"
17,"Friends, fellow travellers, compañeras and comrades. We say break for the first time. Because there has never been a rupture before to those who say to you, but what have we tried the 15-month rupture, you guys, and it didn't work? It's impossible to try something again when you haven't tried it. Previously the 15 hasn't, there hasn't been a rupture some of us were working on the rupture. Some of us were speaking the language of the breach. We were killing ourselves working on the eurogroup and the recording was part of the rupture. Because inside the Eurogroup but they were saying other things outside and they were saying it inside.
And only when I told them and looked them in the eye and I said I was sorry, but I'm writing it down since you're not keeping a record of it. I will write them down so that you can't say other things outside of what you say inside and then they stopped talking against it too. That was something. That was a small form of a break from a minister alone, as it turned out Mr. Tsipras, he did me a great honour basically the other day he admitted. That. Elsewhere I was in the struggle for the break elsewhere he was. On the road to capitulation. There was no break in 15. Do you know when there would have been a break on the night of the referendum if a brave Prime Minister had come out and said, if you have not opened up the liquidity of the banks by Wednesday lunchtime, we are activating the parallel payment system which is the beginning of the hangman's noose. We are cutting the bonds we owe you. And we are putting in place procedures for our own currency if we have to, then we would have a throwing and then we would see what would happen this was never tried. We. We're not going to do anything. No aggressive move against Brussels. Against Frankfurt, no nothing. We will be elected. And we will legislate our programme. We'll abolish Hercules. We'll abolish, we'll put in Ulysses. Whoever is absolute, by the way. Absolutely enforceable within these flimsy rules of the European Union. Not in line with what the memeonists have signed, but what the memeonists have signed. And I say this clearly and I denounce it. They have nothing to do with European law. They thought it up themselves.","Φίλες και φίλοι, συνοδοιπόροι, συντρόφισσες και σύντροφοι. Λέμε πρώτη φορά ρήξη. Γιατί δεν έχει ξαναγίνει ρήξη σε όσους σας λένε, μα τι δοκιμασαμε τη ρήξη των 15 βρε παιδιά και δεν δούλεψε; Είναι αδύνατο να δοκιμάσεις ξανά κάτι όταν δεν το έχεις δοκιμάσει. Προηγουμένως το 15 δεν έχει, δεν υπήρξε ρήξη κάποιοι από εμάς δουλεύαμε για τη ρήξη. Κάποιοι από εμάς μιλούσαμε τη γλώσσα της ρήξης. Σκοτωνόμαστε στη δουλειά στο eurogroup και η ηχογραφηση ήταν κομμάτι της ρήξης. Γιατί μέσα στο eurogroup αλλά λέγανε και άλλα λέγανε απ έξω τη λέγανε μέσα.
Και μόνο όταν τους είπα και τους κοίταξε στα μάτια και τους είπα εγώ συγγνώμη, αλλά τα γράφω μιας και δεν τα κρατάτε πρακτικά. Εγώ θα τα γράψω για να μην μπορείτε να λετε άλλα πράγματα έξω από αυτά που λέτε μέσα και τότε σταμάτησαν να μιλάνε κατά και αυτό. Κάτι ήταν και αυτό. Αυτό ήταν μια μικρή μορφή ρήξης από έναν υπουργό μόνο του, όπως απεδείχθη κύριος Τσίπρας, μου έκανε μεγάλη τιμή ουσιαστικά τις προάλλες παραδέχτηκε. Ότι. Αλλού ήμουν εγώ στον αγώνα για τη ρήξη αλλού ήταν εκείνος. Στο δρόμο προς τη συνθηκολόγηση. Δεν υπήρξε ρήξη το 15. Ξέρετε πότε θα υπήρχε ρήξη το βράδυ του δημοψηφίσματος αν ένας γενναίος πρωθυπουργός έβγαινε και έλεγε;Εάν δεν έχετε ανοίξει τη ρευστότητα των τραπεζών μέχρι την Τετάρτη το μεσημέρι, εμείς ενεργοποιούμε το παράλληλο σύστημα πληρωμών που είναι η απαρχή της δήμητρας. Κουρεύουμε τα ομόλογα που σας χρωστάμε. Και βάζουμε μπροστά διαδικασίες για δικο μας νόμισμα ο μη γένοιτο αν χρειαστεί, τότε θα είχαμε ρίξη και τότε θα βλέπαμε τι θα γινόταν αυτό δεν δοκιμάστηκε ποτέ. Εμείς. Δεν πρόκειται να κάνουμε τίποτα. Καμία επιθετική κίνηση εναντίον των Βρυξελλών. Εναντίον της Φρανκφουρτης, καμία τίποτα. Θα εκλεγούμε. Και θα νομοθετήσουμε το πρόγραμμα μας. Θα καταργήσουμε τον Ηρακλή.θα καταργήσουμε, θα βάλουμε τον Οδυσσέα. Όποιος είναι παρεμπιπτόντως απόλυτος. Απολύτως εφαρμόσιμος εντός αυτών των σαθρών κανόνων της Ευρωπαϊκής Ένωσης. Δεν συνάδει με αυτά που έχουν υπογράψει οι μνημονιακοί, αλλά αυτά που έχουν υπογράψει μνημονιακοι. Και το λέω ευθαρσώς και το καταγγέλλω. Δεν έχουν καμία σχέση με το ευρωπαϊκό δίκαιο. Το σκέφτηκαν μόνοι τους. ",political agenda,economy,other,0.0,0.0,0.0,"[['fellow travellers', 'group of people', '0.5'], ['compañeras', 'group of people', '0.5'], ['comrades', 'group of people', '0.5'], ['eurogroup', 'organization', '0.5'], ['mr. tsipras', 'person', '0.5'], ['prime minister', 'person', '0.5'], ['brussels', 'location', '0.5'], ['frankfurt', 'location', '0.5'], ['european union', 'organization', '0.5'], ['memeonists', 'political party', '0.5'], ['european law', 'political party', '0.5']]"
18,"There is no rule of the European Union, no treaty of the European Union that is consistent with these memorandum commitments, they say, we cannot reduce VAT from 24 to 15%. Europe will not let us. Who is Europe? The European treaties are nothing for VAT. They are clear that VAT is a matter for the national government. What are they saying, we are not left by the troika that is supposed to have left and only some obsessed oddballs like Varoufakis continue to say so? We will legislate what we have a duty to do. For the Greek people to breathe a sigh of relief so that this society can become viable again. Now? Between us. If some people come, whether they are from Frankfurt or aliens. and tell us that if you legislate what you have to legislate, we will close your banks. Because you know we don't mince words. We don't mince our words, they closed them down once, I'll close them down. I don't believe it. That they'll necessarily close it again. In fact, I don't think they'll dare to do it again. Especially if we have a truly militant government of the left. But after all, why are we here? All for the euro; or all for the Greeks. We don't. We claim there won't be a cost from such a break. The rupture is no walk in the park. Just as the NO on 28/10/1940 was not a walk in the park, the Greek people believed that saying no would be glorified in history and there would be no cost. The revolt against the colonels at the Polytechnic. The students who did it at the Polytechnic believed that they would be glorified by history at no cost. What does virtue and daring mean? According to Calvo, whatever freedom wants. Cost.","Δεν υπάρχει κανένας κανόνας της Ευρωπαϊκής Ένωσης, καμία Συνθήκη της Ευρωπαϊκής Ένωσης που να συνάδουν με τις μνημονιακές αυτές δεσμεύσεις λένε λέει, δεν μπορούμε να μειώσουμε το ΦΠΑ από το 24 στο 15%. Δεν μας αφήνει η Ευρώπη. Ποια είναι η Ευρώπη; Οι ευρωπαϊκές συνθήκες δεν είναι τίποτα για το ΦΠΑ. Είναι ξεκάθαρες ο ΦΠΑ είναι θέμα της εθνικής κυβέρνησης. Αυτοί τι λένε, δεν μας αφήνει η τρόικα που υποτίθεται ότι έχει φύγει και μόνο κάποιοι περίεργοι με εμμονές όπως ο βαρουφάκης συνεχίζουν να αναφέρουν έτσι; Εμείς θα νομοθετήσουμε αυτά που έχουμε καθήκον. Για να ανασάνει ο ελληνικός λαός για να γίνει βιώσιμη αυτή η κοινωνία ξανά. Τώρα; Μεταξύ μας. Αν έρθουν κάποιοι, είτε είναι από τη Φρανκφούρτη, είτε είναι εξωγήινοι. και μας πούνε ότι αν νομοθετήσετε αυτά που πρέπει να νομοθετήσετε, εμείς θα σας κλείσουμε τις τράπεζες.Ε κλείστε τις. Γιατί ξέρετε εμείς δεν μασάμε τα λόγια μας. Δεν μασάμε τα λόγια μας τις έκλεισαν μια φορά να κλείσω. Εγώ δεν πιστεύω. Ότι αναγκαστικά θα την ξανακλείσουν εγώ. Για την ακρίβεια πιστεύω δεν θα το τολμήσουν να το κάνουμε ξανά. Ιδίως άμα έχουμε μια πραγματικά αγωνιστική κυβέρνηση της Αριστεράς. Αλλά σε τελική ανάλυση, γιατί είμαστε εδώ; Όλα για το ευρώ; η όλα για τους Έλληνες και τις Ελληνίδες. Εμείς δεν. Ισχυριζόμαστε, δεν θα υπάρχει ένα κόστος από μια τέτοια ρήξη. Η ρήξη δεν είναι περίπατος. Όπως δεν ήταν το ΟΧΙ την 28/10/1940 περίπατος πιστεύε ελληνικός λαός ότι είπε ένα όχι θα δοξαστεί στην ιστορία και δεν θα υπάρχει κόστος. Η εξέγερση εναντίον των συνταγματαρχών στο Πολυτεχνείο. Οι φοιτητές που την κάνανε στο Πολυτεχνείο πίστεψαν ότι θα δοξαστούν από την ιστορία χωρίς κόστος. Τι σημαίνει αρετή και τόλμη; Σύμφωνα με τον Κάλβο, ότι θέλει η ελευθερία. Κόστος.",criticism,europe,hospital privatization,,0.25,0.0,"[['european union', 'organization', '1.0'], ['greek', 'group of people', '0.8'], ['troika', 'organization', '0.7'], ['varoufakis', 'person', '0.6'], ['frankfurt', 'location', '0.6'], ['euro', 'currency', '0.6'], ['left', 'political party', '0.4'], ['greeks', 'group of people', '0.4'], ['polytechnic', 'location', '0.4'], ['28/10/1940', 'date', '0.4']]"
19,"Rupture wants you to be ready to pay in costs and you know what? If you're ready to make the break and the cost is minimized. The only cost that increases forever is the cost of the yesman. That says yes to everything. Who tries to give credentials to Solts to Vardinoyannis, to Latsis, to Turna, to Mytileneus, to Alafouzos and of course today. And look at the channels at Marinakis. We. We look at them and say. Strike. Because as long as you strike, it means we are doing the right thing. First break. Because it's a prerequisite to freeing this country to become a viable country, to not lose the rest of our children. If we say yes to everything all the time as we have been saying for so many years a few will leave a few will become a Kosovo with nice beaches. Whoever goes to Kosovo, what will they see? A country country region say what you want. No youth, only old people. Do they have EURO? You know if you go to Pristina and put your Piraeus National Bank card in an ATM and pull out €50 you will get Euros.Enjoy. Let them enjoy it.","Η ρήξη θέλει να είσαι έτοιμος να καταβάλει στο κόστος και ξέρετε κάτι; Αν είσαι έτοιμος να κάνεις τη ρήξη και το κόστος ελαχιστοποιείται. Το μόνο κόστος που αυξάνεται για πάντα είναι το κόστος του yesman. Που λέει ναι σε όλα. Που προσπαθεί να δίνει διαπιστευτήρια στο Σολτς στο Βαρδινογιάννη, στο Λατση, στην Τερνα, στον Μυτιληναίο, στον Αλαφούζο και βεβαίως σήμερα. Και κοιτάξτε τα κανάλια στο Μαρινάκη. Εμείς. Τους κοιτάμε και τους λέμε. Χτυπάτε. Γιατί όσο χτυπάτε σημαίνει ότι κάνουμε το σωστό. Πρώτη φορά ρήξη. Γιατί είναι προαπαιτούμενο για την απελευθέρωση αυτής της χώρας για να γίνει βιώσιμη χώρα, να μην χάσουμε και τα υπόλοιπα παιδιά μας. Εάν πούμε ναι σε όλα συνέχεια όπως λέμε τόσα χρόνια θα φεύγουν λίγα λίγα λίγα θα γίνουμε ένα Κόσοβο με ωραίες παραλίες. Όποιος πάει στο Κόσοβο, τι θα δει; Μια χώρα χώρα περιφέρεια πείτε ότι όπως θέλετε. Χωρίς νεολαία, μόνο γέροι. Εχουν ΕΥΡΩ; Το ξέρετε αν πάτε στην Πρίστινα και βάλετε την κάρτα της Εθνικής Πειραιώς σε ένα ΑΤΜ και τραβήξτε 50 € θα βγουν ευρώ.Να τα χαίρονται. Να το χαίρονται. ",political agenda,other,other,-0.6,0.2,0.0,"[['rupture', 'organization', '1.0'], ['solts', 'organization', '0.5'], ['vardinoyannis', 'person', '0.5'], ['latsis', 'person', '0.5'], ['turna', 'person', '0.5'], ['mytileneus', 'person', '0.5'], ['alafouzos', 'person', '0.5'], ['marinakis', 'person', '0.5'], ['kosovo', 'country', '0.9'], ['euro', 'currency', '0.5'], ['pristina', 'location', '0.5'], ['piraeus national bank', 'organization', '0.5'], ['atm', 'organization', '0.5'], ['€50', 'currency', '0.5']]"
