id,text,text_el,is_criticism,topic-context,subtopic-context,sentiment,polarization-definition,populism-definition,ner-limited
1,"
Not even rain can save him. The mnemonics. I'm glad to see you. It would be nicer in the square. That's all right. We'll be here in a month. It's a marathon for us, for the left. Elections are a pretext. It's a means, not an end in itself. It is our goal and I am really very happy to see us here united frontally all together.We started on day 25. The comrades of popular unity. Non-attached of the left non-attached of the movements who finally all join in this common struggle. It is a great joy after 2015 that our roads have. Reunited. And where? It shows. On their own; they are disengaged by our presence in the electoral struggle, by the fact that they did not like the predictions that the militant, disobedient, disobedient, selfless left will not only not exist in Parliament again, but we will use it. The electoral process with one election, two elections, three elections, 300 elections. We are not interested in building the great left, the great selfless left. Non-compromising left that this people need. And which really is the nightmare. Of the oligarchy's power brokers. It is. These are important days because we are all the losers of the referendum, the defeated. Invincible losers.","
Ούτε μια βροχή δε του σώζει. Τους μνημονιακούς. Χαίρομαι που σας βλέπω θα ήταν πιο ωραία στην πλατεία. Δεν πειράζει σε ένα μήνα εδώ θα είμαστε. Δεν ξαναέχουμε εκλογές είναι μαραθώνιος έτσι κι αλλιώς για μας, για την αριστερά. Οι εκλογές είναι μια πρόφαση. Είναι ένα μέσο, δεν είναι αυτοσκοπός. Στόχος μας είναι και πραγματικά χαίρομαι πάρα πολύ που μας βλέπω εδώ ενωτικά μετωπικά όλοι μαζί.Εμείς που ξεκινήσαμε το μέρα 25. Οι σύντροφοι της λαϊκής ενότητας. Ανένταχτοι της Αριστεράς ανένταχτοι των κινημάτων που τελικά όλοι εντασσόμαστε σε αυτό τον κοινό αγώνα. Είναι μεγάλη χαρά μετά το 2015 που οι δρόμοι μας έχουν. Επανασυγκλίνει. Και που; Φαίνεται. Από μόνοι τους.Αποσυντονίζονται με την παρουσία μας στον εκλογικό αγώνα, με το γεγονός ότι δεν τους κάθονταν οι προβλέψεις ότι η αγωνιστική, οι ανυπάκουοι, οι ανυπότακτοι, η ανιδιοτελης αριστερά δεν θα υπάρχει ξανά στο Κοινοβούλιο, όχι μόνο θα υπάρχει στο Κοινοβούλιο, αλλά θα χρησιμοποιήσουμε αυτή. Την εκλογική διαδικασία με μία εκλογή, 2 εκλογές, τρεις εκλογές, 300 εκλογές. Δεν μας ενδιαφέρει για να χτίσουμε τη μεγάλη αριστερά, τη μεγάλη ανιδιοτελή. Μη συμβιβασμένη αριστερά που έχει ανάγκη αυτός ο λαός. Και που πραγματικά είναι ο εφιάλτης. Των εξουσιαστών της ολιγαρχίας. Είναι. Σημαντικές μέρες αυτές γιατί εμείς είμαστε όλοι ηττημένοι του δημοψηφίσματος, οι νικημένοι. Ανίκητοι ηττημένοι.",political agenda,elections,other,0.0,0.0,0.0,[]
2,"When our own faction. Took that magnificent OXI of the Greek people's resistance and overturned it. To come together again. To give the people breath again. And to do it again as we do it again as day 25 alliance for rupture to believe that the political parliamentary process can lead again. In a vision of government, comrades, fellow travellers, friends, we do not. We will settle for a 3, 4, 5, 6%. Our goal is to create the prospect of subversion and reversal. It means taking power into the hands of the people, not ours; that is the stakes for us. It is a very long road, but it will be a very, very beautiful road and I look forward to walking it together all together starting from Kalamata tonight.","Όταν η δική μας η παράταξη. Πήρε εκείνο το μεγαλειώδες ΟΧΙ της αντίστασης του ελληνικού λαού το ανέτρεψε. Το να ξαναβρεθούμε όλοι μαζί. Να ξαναδώσουμε στον κόσμο ανάσες. Και να το ξανακάνουμε όπως το ξανακάνουμε ως μέρα 25 συμμαχία για τη ρήξη να πιστέψει ότι η πολιτική κοινοβουλευτική διαδικασία μπορεί να ξαναοδηγήσει. Σε ένα όραμα κυβέρνησης συντρόφισσες και σύντροφοι, συνοδοιπόροι, φίλες και φίλοι, εμείς δεν. Θα αρκεστούμε σε ένα 3, 4, 5, 6%. Στόχος μας είναι να δημιουργήσουμε προοπτική ανατροπής και ανατροπή. Σημαίνει να πάρουμε την εξουσία στα χέρια του λαού, Όχι τα δικά μας.Αυτό είναι το διακύβευμα για εμάς. Είναι πολύ μακρύς ο δρόμος, αλλά θα είναι πάρα πολύ όμορφος ο δρόμος και προσμένω πως και πως να τον περπατήσουμε όλες μαζί όλοι μαζί ξεκινώντας και από την Καλαμάτα σήμερα το βράδυ. ",political agenda,elections,other,0.6,0.0,0.2,"[['greek people', 'group of people', '0.8'], ['day 25 alliance for rupture', 'organization', '0.8'], ['comrades', 'group of people', '0.6'], ['fellow travellers', 'group of people', '0.6'], ['friends', 'group of people', '0.6'], ['kalamata', 'location', '0.8'], ['greek', 'country', '0.5']]"
3,"And know that after the elections, when we have proven that we are here for the people, not for the offices. When we have proven that this night has lasted too long and the light is coming, the light of resistance, others will join us. Others who are hesitant will come. Are they still telling you now what they will do in coalition with Tsipras? No, we will not join the government with Tsipras. We know that, but there are some who don't know it yet. I can't believe he's telling you, he can't some ministry will lure them, he won't lure us ministry Here you are here, I am. There is no possibility of us getting into a race for ministerial cars, for posts and for this game of so-called realism. The only realism is resistance until a governmental perspective for disobedience, for insubordination is created.","Και να ξέρετε ότι μετά τις εκλογές, όταν θα έχουμε αποδείξει ότι εμείς είμαστε εδώ για τους ανθρώπους, όχι για τα αξιώματα. Όταν θα έχουμε αποδείξει ότι αυτή η νύχτα κράτησε πολύ και έρχεται το φως, το φως της αντίστασης θα έρθουν κι άλλοι μαζί μας. Θα έρθουν κι άλλοι που είναι διστακτικοί. Ακόμα σου λέει τώρα αυτοί τι θα κάνουν συγκυβερνήση με τον Τσίπρα; Ε Όχι, δεν θα κάνουμε στην κυβέρνηση με τον Τσίπρα. Εμείς το ξέρουμε αυτό, αλλά υπάρχουν κάποιοι που δεν το ξέρουν ακόμα. Δεν το πιστεύω ότι σου λέει, δεν μπορεί κάποιο υπουργείο θα τους δελεάσει, δεν θα μας δελεάσει υπουργείο Εδώ είστε εδώ, είμαι. Δεν υπάρχει πιθανότητα να μπούμε σε ένα αλισβερίσι για υπουργικά αυτοκίνητα, για θώκους και για αυτό το παιχνίδι δήθεν του ρεαλισμού. Ο μόνος ρεαλισμός είναι η αντίσταση έως ότου δημιουργηθεί κυβερνητική προοπτική για την ανυπακοή, για την ανυποταξία. ",political agenda,elections,coalition,,0.0,0.2,"[['tsipras', 'organization', '0.3'], ['greece', 'country', '1.0'], ['elections', 'date', '1.0']]"
4,"Our movement, which should give power to those who do not have it. Who are the many? The overwhelming majority because what we have is certainly not a democracy. It is very, very good that we can speak without being booed. It's too good that we can vote; it's too good, they have generations. Sacrificed to have the right to this process of bourgeois democracy, but it is not democracy. Democracy means. To be able the majority to rule for themselves and not to be in the state. Of complete occupation and dependencies on foreign and local oligarchic interests. In this struggle. Which struggle is it? In the Peloponnese, in Greece, in Europe, we have here comrades from Berlin who have come today to support us in the context of the progressive international, whether it is in Brazil or in Nigeria, whether it is in Germany itself or in the whole of Africa. We. We know how to fight the struggle in parallel. In our village, in our neighborhood, in our city and in the whole planet at the same time. Because that's what a leftist means. That's what it means to be a patriot to be an internationalist.","Κίνημά μας, το οποίο θα πρέπει να δώσει την εξουσία σε αυτούς που δεν την έχουν. Ποιοι οι πολλοί; Η συντριπτική πλειοψηφία γιατί αυτό που έχουμε βεβαίως δεν είναι δημοκρατία. Είναι πάρα πολύ καλό ότι μπορούμε να μιλάμε χωρίς να μας μπουζουριάζουν. Είναι πάρα πολύ καλό ότι μπορούμε να ψηφίζουμε.Είναι πάρα πολύ καλό, έχουν γενιές. Θυσιαστεί για να έχουμε το δικαίωμα σε αυτή τη διαδικασία της αστικής δημοκρατίας, αλλά δημοκρατία δεν είναι. Δημοκρατία σημαίνει. Να μπορεί η πλειοψηφία να κυβερνά για πάρτη της και όχι να βρίσκεται στην κατάσταση. Της πλήρους κατοχής και εξαρτήσεις από ξένα και ντόπια ολιγαρχικά συμφέροντα. Σε αυτό τον αγώνα. Όποιος αγώνας είναι; Αγώνες στην Καλαμάτα.Στην Πελοπόννησο, στην Ελλάδα, στην Ευρώπη έχουμε εδώ και συντρόφισσες από το Βερολίνο που έχει έρθει σήμερα να μας συμπαρασταθεί στο πλαίσιο της προοδευτικής διεθνούς, είτε είναι στη Βραζιλία είτε είναι στη Νιγηρία, είτε είναι στη Γερμανία την ίδια είτε είναι στην Αφρική ολόκληρη. Εμείς. Ξέρουμε πώς να δίνουμε τον αγώνα παράλληλα. Στο χωριό μας, στη γειτονιά μας, στην πόλη μας αλλά και σε ολόκληρο τον πλανήτη ταυτόχρονα. Γιατί αυτό σημαίνει ένας αριστερός. Αυτό σημαίνει να είσαι πατριώτης να είσαι διεθνιστής. ",political agenda,democracy,other,0.0,0.2,0.2,"[['peloponnese', 'location', '1.0'], ['greece', 'country', '1.0'], ['europe', 'location', '1.0'], ['berlin', 'location', '1.0'], ['progressive international', 'organization', '1.0'], ['brazil', 'country', '1.0'], ['nigeria', 'country', '1.0'], ['germany', 'country', '1.0'], ['africa', 'location', '1.0']]"
5,"In this context I want to welcome. The internationalists, the patriots. The international 3 patriots who in this village in this city. In this district you will fight the fight. I have my card so I don't make any mistakes. Petroulla Dulami. Our Petroulla. I know her, Dora Theodoropoulou. Get upstairs. Usual suspects for day 25. George Kanellis. George. Vassilis Kyvelos. Hello, Vassilis. Maria Mitsi. Is Jason Bakas with us or not? He's not with us, Bakas will be. And Yiota Christopoulou, Yiota, Panagiota Christopoulou. Here these are our people in Messinia, it's a difficult region of Messinia, who wants to learn from the younger of you. What did it mean to be a leftist in this region? Let him read the Dead Division, the first and second volumes to see why the region is so far right, why the Leftists were wiped out in 1949 from this region from Messinia, from Sparta in general from the Peloponnese. Heroes, the Leftists who remained correct and even more heroes when after the great victory of the people on 05/07/2015 and after the capitulation of our own party. Again in the struggle, because every generation anyway. Again this is a message to the young people. We were the new generation doomed, like the previous generations, to fight the same fight again and again and again the same fight. That is how history goes forward. Thank you very much for a very good fight.","Στο πλαίσιο αυτό θέλω να χαιρετίσω. Τους διεθνιστές, τους πατριώτες. Τις διεθνείς 3 τις πατριώτισσες που σε αυτό εδώ το χωριό σε αυτή την πόλη. Σε αυτή την περιφέρεια θα δώσετε τον αγώνα. Έχω το χαρτάκι μου για να μην κάνω κανένα λάθος. Πετρούλα Δουλάμη. Η Πετρούλα μας. Αυτή την ξέρω η Δώρα Θεοδωροπούλου Ανέβα πάνω. Συνήθεις ύποπτοι του μέρα 25. Ο Γιώργος Κανέλλης. Γιώργο. Βασίλης Κυβέλος. Γεια σου Βασίλη. Μαρία Μήτση. Ο Ιάσων Μπάκας είναι μαζί μας ή όχι; Δεν είναι μαζί μας, ο Μπακας θα είναι. Και γιώτα χριστοπούλου, γιώτα, παναγιώτα χριστοπούλου. Εδώ αυτοί είναι οι άνθρωποί μας στη Μεσσηνία, είναι μια δύσκολη περιοχή Μεσσηνία, ο οποίος θέλει να μάθει από τους νεότερους από εσάς. Τι σήμαινε το να είσαι αριστερός σε αυτή την περιοχή; Ας διαβάσει την Νεκρή Μεραρχία, τον πρώτο και το δεύτερο τόμο για να δει γιατί είναι τόσο ακροδεξιά η περιοχή, γιατί οι Αριστεροί ξεκληρίστηκαν το 1949 από αυτή την περιοχή από τη Μεσσηνία, από τη Σπάρτη γενικότερα από την Πελοπόννησο. Ήρωες, οι Αριστεροί που έμειναν ορθοί και ακόμα πιο  ήρωες όταν μετά τη μεγάλη νίκη του λαού την 05/07/2015 και μετά τη συνθηκολόγηση του δικού μας κόμματος.Είμαστε πάλι εδώ. Πάλι στον αγώνα, γιατί έτσι κι αλλιώς κάθε γενιά. Πάλι αυτό είναι ένα μήνυμα προς τους νέους. Ήμαστε ήσαστε η νέα γενιά καταδικασμένη, όπως και οι προηγούμενες γενιές να δίνουμε ξανά τον ίδιο αγώνα ξανά και ξανά και ξανά τον ίδιο αγώνα. Έτσι έτσι πηγαίνει μπροστά η ιστορία. Ευχαριστώ παρα πολύ καλό αγώνα.",political agenda,culture,other,0.0,0.0,0.0,"[['petroulla dulami', 'person', '1.0'], ['dora theodoropoulou', 'person', '1.0'], ['george kanellis', 'person', '1.0'], ['vassilis kyvelos', 'person', '1.0'], ['maria mitsi', 'person', '1.0'], ['jason bakas', 'person', '1.0'], ['yiota christopoulou', 'person', '1.0'], ['panagiota christopoulou', 'person', '1.0'], ['messinia', 'location', '1.0'], ['sparta', 'location', '1.0'], ['peloponnese', 'location', '1.0'], ['05/07/2015', 'date', '1.0']]"
6,"Elections. Every election process. It raises a big question. Depending on the times, one was 1981, one was 1991, one was 2010 11. 12 those 3 elections were held together. Today let me. I am conveying to you my assessment of what is the key question and I am not talking now about us we know. We know what our goal is, we know what our analysis is, but for the people out there. The big question that I would ask someone or someone who is not affiliated with a party, who may not even consider voting for us. And. looking for what to throw on the ballot box?What I would say to them is this. There are 2 narratives. For our country there are 2 narratives in our country right now. The dominant narratives. One is. That. This country is sustainable. This society is viable, with its problems, with its difficulties. It has a European framework, that's what the channels and the media are saying. The parties of the mendicant parties; it has some agreements and commitments in Brussels in NATO. In the global power structure, but. We are no longer under the memoranda, that's not what they say. And within that European and American-driven they say it globally. Framework. It's in our hands in the hands of the Greek parliamentary process of the institutions of our state, whether it's the government, whether it's the ADAE, whether it's the courts of the institutions, our own. Shall we get our act together? Let's pull ourselves together; and let's do well. That is the dominant narrative.","Εκλογες. Κάθε εκλογική διαδικασία. Θέτει ένα μεγάλο ερώτημα. Ανάλογα με τις εποχές, άλλο ήταν το 1981, άλλο ήταν το 1991, άλλο ήτανε το 2010 11. 12 έγιναν εκείνες οι δυο 3 εκλογές μαζί. Σήμερα επιτρέψτε μου να. Σας μεταφέρω την εκτίμηση μου για το ποιο είναι το βασικό ερώτημα και δεν μιλάω τώρα για μας εμείς ξέρουμε. Εμείς ξέρουμε ποιος είναι ο στόχος μας, ξέρουμε ποια είναι η ανάλυσή μας, αλλά για τον κόσμο εκεί έξω. Το μεγάλο ερώτημα αυτό που θα ρώταγα κάποιον ή κάποιαν που δεν είναι ενταγμένοι σε κάποιο κόμμα, που μπορεί και να μην σκέφτεται καν να ψηφίσει εμάς. Και. Το ψάχνει τι θα ρίξει στην κάλπη;Αυτό που θα τους έλεγα είναι το εξής. Υπάρχουν 2 Αφηγήματα. Για τη χώρα μας 2 είναι τα αφηγήματα στη χώρα μας αυτή τη στιγμή. Τα κυρίαρχα αφηγήματα. Το ένα είναι. Ότι. Η χώρα αυτή είναι βιώσιμη. Η κοινωνία αυτή είναι βιώσιμη, με τα προβλήματά της, με τις δυσκολίες της. Έχει ένα ευρωπαϊκό πλαίσιο, έτσι το λένε τα κανάλια και. Τα μνημονιακά κόμματα.Έχει κάποιες συμφωνίες και δεσμεύσεις στις Βρυξέλλες στο ΝΑΤΟ. Στο παγκόσμιο εξουσιαστικό στερέωμα, αλλά. Δεν είμαστε πια στα μνημόνια, αυτό δεν λένε. Και εντός αυτού του ευρωπαοκού και αμερικανοκίνητου το λένε παγκοσμίως. Πλαισίου. Είναι στα χέρια μας στα χέρια της ελληνικής κοινοβουλευτικής διαδικασίας των θεσμών του κράτους μας, είτε είναι η κυβέρνηση, είτε είναι η ΑΔΑΕ, είτε είναι τα δικαστήρια των θεσμών, των δικών μας. Να συμμαζευτούμε; Να ανασκουμπωθούμε.Και να πάμε καλά. Αυτό είναι το κυρίαρχο αφήγημα. ",political agenda,elections,other,0.0,0.1,0.0,"[['1981', 'date', '0.8'], ['1991', 'date', '0.8'], ['2010', 'date', '0.8'], ['11', 'date', '0.8'], ['12', 'date', '0.8'], ['european', 'organization', '0.7'], ['nato', 'organization', '0.7'], ['greek parliamentary', 'organization', '0.6']]"
