id,text,text_el,is_criticism,topic-context,subtopic-context,sentiment,polarization-definition,populism-definition,ner-limited
11,"And of course, lest we forget, this is the government that was able to finally take the sledgehammers out of the universities. Because we are with the libraries, not the sledgehammers. And whenever the police had to intervene here at Zographou's in order to take out evidence that had nothing to do with the universities, we did not hesitate to do so.We will be the ones who will ensure the next day that our universities will be real centres of knowledge, that the children who are working hard today to pass their national exams will not be deceived by those who today say to them ""come on, get into universities without even having to take exams"". This approach does not honour all the young people who are working hard today to get into the school they want.Our universities, our public universities, will get the infrastructure they need, will open their wings to the world, will finally connect with the world of production, will offer degrees with impact. That is what young children want, and that is what you families want, who have invested in free public education, which our own government has shown that it can support.","Και βέβαια, για να μην ξεχνάμε, αυτή είναι η κυβέρνηση, η οποία μπόρεσε και έβγαλε επιτέλους τις βαριοπούλες από τα πανεπιστήμια. Διότι εμείς είμαστε με τις βιβλιοθήκες και όχι με τις βαριοπούλες. Και όποτε χρειάστηκε η Αστυνομία να παρέμβει εδώ στου Ζωγράφου για να βγάλουμε από μέσα στοιχεία τα οποία δεν είχαν να κάνουν με τα πανεπιστήμια, δεν διστάσαμε να το κάνουμε.Θα είμαστε εμείς που θα εξασφαλίσουμε την επόμενη μέρα ότι τα πανεπιστήμιά μας θα είναι πραγματικές εστίες γνώσης, ότι τα παιδιά τα οποία δουλεύουν σκληρά σήμερα για να δώσουν πανελλαδικές εξετάσεις δεν θα εξαπατηθούν από κάποιους που τους λένε σήμερα «ελάτε, μωρέ, μπείτε αβέρτα στα πανεπιστήμια χωρίς να χρειαστεί καν να δώσετε εξετάσεις». Δεν τιμά αυτή η προσέγγιση όλα τα νέα παιδιά τα οποία δουλεύουν σκληρά σήμερα για να περάσουν στη σχολή την οποία θέλουν.Τα πανεπιστήμιά μας, τα δημόσια πανεπιστήμιά μας, θα αποκτήσουν τις υποδομές που χρειάζονται, θα ανοίξουν τα φτερά τους στον κόσμο, θα συνδεθούν επιτέλους με τον κόσμο της παραγωγής, θα προσφέρουν πτυχία με αντίκρισμα. Αυτό θέλουν τα νέα παιδιά κι αυτό θέλετε και εσείς οι οικογένειες, που έχουν επενδύσει στη δημόσια δωρεάν παιδεία, την οποία η δικιά μας κυβέρνηση απέδειξε ότι μπορεί να στηρίξει.",political agenda,education,other,0.6,0,0,"[['zographou', 'location', '0.7'], ['government', 'organization', '0.8'], ['universities', 'group of people', '0.6'], ['libraries', 'organization', '0.6'], ['police', 'organization', '0.6'], ['children', 'group of people', '0.7'], ['national exams', 'date', '0.6'], ['young people', 'group of people', '0.6'], ['public universities', 'organization', '0.8'], ['world', 'location', '0.6'], ['production', 'organization', '0.6'], ['degrees', 'group of people', '0.6'], ['families', 'group of people', '0.7'], ['public education', 'organization', '0.6.']]"
12,"So you see, friends, I am not talking about our opponents at all. I am avoiding any personal characterisation, I am only talking about the future, the future is what I want us all to talk about in these last six days between now and the elections. It is extremely critical, because nothing that we have achieved in this four-year period can be taken for granted.The effort must continue and must be intensified. And it can only continue with a strong New Democracy, the big winner on the evening of 21 May.","Βλέπετε, λοιπόν, φίλες και φίλοι, ότι δεν μιλάω καθόλου για τους αντιπάλους μας. Αποφεύγω κάθε προσωπικό χαρακτηρισμό, μιλώ μόνο για το μέλλον, για το μέλλον θέλω να μιλήσουμε όλοι αυτές τις τελευταίες έξι μέρες που μεσολαβούν από τώρα μέχρι τις εκλογές.Μη ξεχνάτε ότι αυτή η κάλπη έχει τεράστια κρισιμότητα. Έχει τεράστια κρισιμότητα, γιατί τίποτα από αυτά τα οποία πετύχαμε αυτήν την τετραετία δεν πρέπει να θεωρείται δεδομένο.Η προσπάθεια πρέπει να συνεχιστεί και πρέπει να εντατικοποιηθεί. Και μπορεί να συνεχιστεί μόνο με ισχυρή Νέα Δημοκρατία, τη μεγάλη νικήτρια το βράδυ της 21ης Μαΐου.",political agenda,elections,election spending,0.7,0.1,0,"[['new democracy', 'political party', '1.0'], ['21 may', 'date', '1.0']]"
13,"I know, you'll say, ""We have a proportional representation ballot and we don't know how the government will be formed the next day."" I will tell you one thing: the stronger New Democracy is on the evening of 21 May, the more confident I will be that the next four years will once again be the four years of New Democracy, of a self-reliant New Democracy, of a self-reliant Greece. That is why, when I talk about the simple dilemma of ""forward or backward"", that is exactly what I mean.","Ξέρω, θα μου πείτε «έχουμε κάλπη απλής αναλογικής και δεν ξέρουμε πώς θα σχηματιστεί η κυβέρνηση την επόμενη μέρα». Εγώ σας λέω ένα πράγμα: όσο πιο ισχυρή είναι η Νέα Δημοκρατία το βράδυ της 21ης Μαΐου, τόσο πιο σίγουρος θα είμαι ότι η επόμενη τετραετία θα είναι και πάλι η τετραετία της Νέας Δημοκρατίας, της αυτοδύναμης Νέας Δημοκρατίας, της αυτοδύναμης Ελλάδος.Δεν πρέπει, λοιπόν, σε καμία περίπτωση, να επιτρέψουμε στον τόπο να κυλήσει πίσω. Γι’ αυτό και όταν μιλάω για το απλό δίλημμα «μπροστά η πίσω» ακριβώς αυτό εννοώ.",political agenda,elections,election spending,0.5,0.2,0,"[['new democracy', 'organization', '0.9'], ['new democracy', 'organization', '0.9'], ['greece', 'country', '0.9'], ['21 may', 'date', '0.9']]"
14,"Will we continue on the path of cutting taxes and raising wages or will we go back to an environment of overtaxing the middle class?Will we continue to support pensioners or will we go back to the Katrougalos law that crushed pensions? Will we continue to guard our borders as we have done for four years or will we go back to the open door, ""butte dogs grind"" logic?Will we continue to invest in our Armed Forces and honour the alliances we have signed with our strategic partners or will we whistle indifferently in search of third world alliances that have not worked out well for us in the past?All this, then, is now up to you to decide. I have no doubt that we will be the big winners in the elections.","Θα συνεχίσουμε στο δρόμο της μείωσης των φόρων και της αύξησης των μισθών ή θα ξαναγυρίσουμε σε ένα περιβάλλον υπερφορολόγησης της μεσαίας τάξης;Θα εξακολουθούμε να στηρίζουμε τους συνταξιούχους ή θα γυρίσουμε πίσω στον νόμο Κατρούγκαλου που τσάκισε τις συντάξεις; Θα εξακολουθούμε να φυλάμε τα σύνορα μας όπως το κάναμε τέσσερα χρόνια ή θα ξαναγυρίσουμε στη λογικής της ανοιχτής πόρτας, του «μπάτε σκύλοι αλέστε»;Θα εξακολουθούμε να επενδύουμε στις Ένοπλες Δυνάμεις μας και να τιμούμε τις συμμαχίες που έχουμε υπογράψει με στρατηγικούς μας εταίρους ή θα σφυρίζουμε αδιάφορα αναζητώντας τριτοκοσμικές συμμαχίες, που δεν μας βγήκαν σε καλό στο παρελθόν;Όλα αυτά, λοιπόν, εναπόκεινται πια σε εσάς να τα αποφασίσετε. Εγώ δεν έχω καμία αμφιβολία ότι εμείς θα είμαστε οι μεγάλοι νικητές των εκλογών.",political agenda,elections,tax cuts,0,0.9,0,[]
15,"But I want to tell you one more thing. Because I am addressing old fighters of New Democracy, first and foremost, a big thank you to all those who kept this party standing in difficult times and never abandoned us, because we also went through great difficulties.But I also want to say a big thank you to them and to those who joined us for the first time in 2019 in a great current of progressive modernisation and responsible patriotism. I also want to say a big thank you to those who will vote for us for the first time in this election. Precisely because they have seen, they have been convinced and they know that we honour our word, we do not fool the citizens.Whenever mistakes are made, we look you in the eye with courage and we acknowledge them, but we also have a plan and the experience now, so that we can change this country and really move it forward.","Θέλω όμως να σας πω και κάτι ακόμα. Επειδή απευθύνομαι σε παλιούς αγωνιστές της Νέας Δημοκρατίας, πρώτα και πάνω απ’ όλα ένα μεγάλο ευχαριστώ σε όλους όσοι κράτησαν αυτήν την παράταξη όρθια και σε δύσκολες στιγμές και δεν μας εγκαταλείψατε ποτέ, γιατί περάσαμε και μεγάλες δυσκολίες.Αλλά θέλω να πω κι ένα μεγάλο ευχαριστώ σε αυτές και σε αυτούς οι οποίοι συμπορεύτηκαν μαζί μας για πρώτη φορά το 2019 σε ένα μεγάλο ρεύμα προοδευτικού εκσυγχρονισμού και υπεύθυνου πατριωτισμού. Θέλω να πω κι ένα μεγάλο ευχαριστώ σε αυτούς που θα μας ψηφίσουν για πρώτη φορά σε αυτές τις εκλογές. Ακριβώς επειδή είδαν, πείστηκαν και ξέρουν ότι εμείς τιμούμε το λόγο μας, δεν κοροϊδεύουμε τους πολίτες.Όποτε γίνονται σφάλματα με θάρρος σας κοιτάμε στα μάτια και τα αναγνωρίζουμε, αλλά έχουμε και σχέδιο και την εμπειρία πια, για να μπορέσουμε να αλλάξουμε αυτή τη χώρα και να την πάμε πραγματικά προς τα μπροστά.",political agenda,elections,other,0.8,0,0,"[['new democracy', 'organization', '1.0'], ['2019', 'date', '1.0'], ['election', 'date', '0.8 (ambiguous)'], ['country', 'location', '0.8 (ambiguous)']]"
16,"So I want to ask you, in closing, with only six days left, not to allow our enthusiasm, our smiles, our optimism, which I see today, to turn into complacency. Let us make this positive energy even more powerful, so that we can go looking, find every last contestable vote, and convince our thinking fellow citizens that we are really worthy; we deserve to continue this work, to ask them to judge us objectively for what we have done in the four years, to compare us with what we did in the previous four years. Because, let's not kid ourselves, the issue here is very simple: do we want a New Democracy government and Prime Minister Mitsotakis or a Syriza government and Prime Minister Tsipras? There is no third option, that is the dilemma.","Οπότε θέλω να σας ζητήσω κλείνοντας, καθώς έμειναν μόνο έξι μέρες, να μην επιτρέψουμε στον ενθουσιασμό μας, στο χαμόγελό μας, στην αισιοδοξία μας, που τη βλέπω σήμερα, να μετατραπεί σε εφησυχασμό. Να κάνουμε αυτή τη θετική ενέργεια ακόμα μεγαλύτερη δύναμη, για να πάμε να ψάξουμε, να βρούμε μέχρι και την τελευταία διεκδικήσιμη ψήφο, να πείσουμε και τους σκεπτόμενους συμπολίτες μας ότι πραγματικά αξίζουμε.Αξίζουμε να συνεχίσουμε αυτό το έργο, να τους ζητήσουμε αντικειμενικά να μας κρίνουν γι’ αυτά που κάναμε την τετραετία, να μας συγκρίνουν με αυτά τα οποία έγιναν την προηγούμενη τετραετία. Διότι, μην κοροϊδευόμαστε, το ζήτημα εδώ είναι πολύ απλό: θέλουμε κυβέρνηση Νέα Δημοκρατία και Πρωθυπουργό Μητσοτάκη ή κυβέρνηση ΣΥΡΙΖΑ και Πρωθυπουργό Τσίπρα; Τρίτη επιλογή δεν υπάρχει, αυτό είναι το δίλημμα.",political agenda,elections,other,0.7,0.6,0,"[['prime minister mitsotakis', 'person', '1.0'], ['syriza', 'political party', '0.9'], ['prime minister tsipras', 'person', '0.9'], ['new democracy', 'political party', '0.8']]"
17,"Don't forget, friends - I keep saying this, but it's true - on election day, when the polling stations open, all the polling stations are empty. They are all empty. At the end of the day, especially here in the South Sector, they must be filled with too many New Democracy ballots and that is your job.I am sure, Mayor and Mr. President here of our Prefecture, that when we meet again here in Zografou - after all, I never forget that I started my political journey 20 years ago from the then united North Athens.If you, gentlemen candidates in the South Sector, think that what you are going through is difficult, let me tell you that I had to run all over the North Athens. But I know I have many old friends here who have supported me personally.A big thank you and let's go together for the big win. Let us celebrate together the victory of New Democracy, the victory of Greece. Be well, thank you very much, good strength, good fight and with victory. Thank you very much.
 ","Μην ξεχνάτε, φίλες και φίλοι -το λέω συνέχεια αλλά είναι αλήθεια-, την ημέρα των εκλογών, όταν θα ανοίξουν τα εκλογικά τμήματα, όλες οι κάλπες είναι άδειες. Όλες είναι άδειες. Στο τέλος της ημέρας, ειδικά εδώ στο Νότιο Τομέα, πρέπει να έχουν γεμίσει με πάρα πολλά ψηφοδέλτια της Νέας Δημοκρατίας και αυτή είναι δική σας δουλειά.Είμαι σίγουρος, Δήμαρχε και κ. Πρόεδρε εδώ της Νομαρχιακής μας, ότι όταν ξαναβρεθούμε εδώ στου Ζωγράφου -εξάλλου δεν ξεχνώ ποτέ ότι εγώ ξεκίνησα την πολιτική μου διαδρομή πριν από 20 χρόνια από την ενωμένη τότε Β΄ Αθηνών.Αν νομίζετε εσείς, κύριοι υποψήφιοι στο Νότιο Τομέα, ότι είναι δύσκολο αυτό που περνάτε, ελάτε να σας πω εγώ που έπρεπε να τρέχω σε όλη τη Β΄ Αθηνών. Αλλά ξέρω ότι εδώ έχω πολλούς παλιούς φίλους που με στήριξαν κι εμένα προσωπικά.Ένα μεγάλο ευχαριστώ και πάμε μαζί για τη μεγάλη νίκη. Να γιορτάσουμε μαζί τη νίκη της Νέας Δημοκρατίας, τη νίκη της Ελλάδος. Να είστε καλά, σας ευχαριστώ πολύ, καλή δύναμη, καλό αγώνα και με τη νίκη. Ευχαριστούμε πολύ.
 ",political agenda,elections,other,0,0,0,"[['zografou', 'location', '1.0'], ['south sector', 'location', '1.0'], ['new democracy', 'political party', '1.0'], ['greece', 'country', '1.0'], ['north athens', 'location', '1.0'], ['mayor', 'person', '1.0'], ['president', 'person', '1.0'], ['20 years ago', 'date', '1.0']]"