id,text,text_el,is_criticism,topic-context,subtopic-context,sentiment,polarization-definition,populism-definition,ner-limited
18,"The next four years, of course, will be the four years in which we will be much more concerned with a chronic problem of our country, which is none other than the state of the national health system. You know how difficult we all had a hard time, all countries are difficult in their difficult years of the pandemic we supported the national system, the national system put back a big thank you to doctors, nurses, all the staff of the NHS, they made us white-faced despite the chronic and we took steps, changes must be made in the national health system and it is a personal bet of the four years to be able to achieve a number of specific goals, to build all the emergency departments in our hospitals, to rebuild all the health centres, personal doctor, to apply to all and for all and to expand the preventive examinations which are so important so that we can prevent diseases before they knock on our door and we are forced to go to the hospital and the next four years will be the four years in which we will build a new national health system with 10.000 recruitments of nurses and doctors with an emphasis on quality. with evaluation everywhere with the introduction of technology that can greatly help our productivity, a national health care system that we deserve and we deserve.","Επόμενη τετραετία βέβαια θα είναι η τετραετία, στην οποία θα ασχοληθούμε πολύ περισσότερο με ένα χρόνιο πρόβλημα της πατρίδας μας, που δεν είναι άλλο από την κατάσταση του εθνικού συστήματος υγείας. Ξέρετε πόσο δύσκολα περάσαμε όλοι μας, Όλες τις χώρες είναι δύσκολη τους δύσκολα τα δύσκολα χρόνια της πανδημίας στηρίξαμε το εθνικό σύστημα, το εθνικό σύστημα έβαλε πλάτη ένα μεγάλο ευχαριστώ σε γιατρούς, νοσηλευτές, όλο το προσωπικό του ΕΣΥ, μας έβγαλαν ασπρόπρόσωπους παρά τις χρόνιες και καναμε βήματα, πρέπει να γίνουν αλλαγές στο εθνικό σύστημα υγείας και είναι ένα προσωπικό του στοίχημα μέσα σε μια τετραετία να μπορούμε να πετύχουμε μια σειρά από συγκεκριμένους στόχους, να φτιάξουν όλα τα τμήματα επειγόντων περιστατικών στα νοσοκομεία μας, να ξαναφτιάξουμε όλα τα κέντρα υγείας, προσωπικός γιατρός, να ισχύει για όλες και για όλους και να επεκτείνουμε τις προληπτικές εξετάσεις οι οποίες είναι τόσο σημαντικές για να μπορούμε να προλαμβάνουμε τα νοσήματα πριν αυτά χτυπήσουν την πόρτα μας και αναγκαστούμε να οδηγηθούμε στο νοσοκομείο και η επόμενη τετραετία θα είναι η τετραετία, στην οποία θα οικοδομήσουμε ένα νέο εθνικό σύστημα υγείας με 10.000 προσλήψεις νοσηλευτών και γιατρών Με έμφαση στην ποιότητα. με αξιολογηση παντου με εισοδο της τεχνολογιας που μπορεί να βοηθησει πολύ την παραγωγικότητά μας, ένα εθνικό σύστημα υγείας που το αξίζουμε και μας αξίζει. ",political agenda,health,other,0.7,0.0,0.0,"[['four years', 'date', '1.0'], ['country', 'location', '1.0'], ['national health system', 'organization', '1.0'], ['countries', 'group of people', '0.75'], ['pandemic', 'event', '0.75'], ['nhs', 'organization', '1.0'], ['doctors', 'person', '1.0'], ['nurses', 'person', '1.0'], ['staff', 'group of people', '0.75'], ['emergency departments', 'organization', '0.75'], ['hospitals', 'organization', '0.75'], ['health centres', 'organization', '0.75'], ['personal doctor', 'group of people', '0.75'], ['preventive examinations', 'organization', '0.75'], ['diseases', 'event', '0.75'], ['hospital', 'organization', '0.75'], ['10.000 recruitments', 'organization', '0.75'], ['nurses', 'person', '1.0'], ['doctors', 'person', '1.0'], ['technology', 'organization', '0.75']]"
19,"I don't want to say much more about our programme, because I could go on for a long time and it's May Day today and you want to spend time with your families.","Δεν θέλω να πω πολλά περισσότερα για το πρόγραμμά μας, γιατί θα μπορούσα να μιλώ πολύ ώρα και είναι Πρωτομαγιά σήμερα και θέλετε να περάσετε χρόνο με τις οικογένειές σας. ",political agenda,other,other,0.0,0.0,0.0,"[['may day', 'date', '1.0']]"
20,"I just want to make the counterpoint between a party that has a costed and well thought-out programme and an opposition party that promises benefits of more than 70 billion without saying anything else concrete, trying to fool the citizens again, as it did in 2015.I answer them here, from the North Sector, from Kifissia, that 2023 is not 2015. The citizens have suffered and learned. They do not want a second time in the disaster. They will give a second mandate to progress. And that message, especially here from the North Sector, we will send it and we will send it in a deafening way. It is a message of democratic vigilance.","Θέλω μόνο να κάνω την αντίστιξη μεταξύ ενός κόμματος το οποίο έχει ένα κοστολογημένο και μελετημένο πρόγραμμα και μιας αξιωματικής αντιπολίτευσης η οποία υπόσχεται παροχές που ξεπερνούν τα 70 δισ. χωρίς να λέει τίποτα άλλο συγκεκριμένο, αναζητώντας και πάλι να κοροϊδέψει τους πολίτες, όπως το έκανε το 2015.Τους απαντώ εδώ, από το Βόρειο Τομέα, από την Κηφισιά, ότι το 2023 δεν είναι 2015. Οι πολίτες έπαθαν και έμαθαν. Δεν θέλουν δεύτερη φορά στη συμφορά. Θα δώσουν δεύτερη εντολή στην προκοπή. Και αυτό το μήνυμα, ειδικά εδώ από το Βόρειο Τομέα, θα το στείλουμε και θα το στείλουμε με τρόπο εκκωφαντικό. Είναι ένα μήνυμα δημοκρατικής εγρήγορσης.",criticism,elections,election spending,0.6,0.1,0.0,"[['kifissia', 'location', '1.0'], ['2015', 'date', '1.0'], ['2023', 'date', '1.0'], ['democratic', 'organization', '0.2'], ['north sector', 'location', '1.0']]"
21,"And speaking of democratic vigilance, I cannot help but comment on an event that is unacceptable in the extreme. Yesterday, the deadline for the parties to submit memos on the case, which is being heard in the First Chamber of the Supreme Court, on whether the Golden Dawn cutthroats will be able to form combinations and run in the national elections, ended.New Democracy submitted a memo arguing on the merits of the case. PASOK submitted a memorandum. SYRIZA was absent. Absent once again from democratic duty. From the democratic duty to keep out of Parliament those who dress in the guise of a party, when in reality they are a criminal gang.I regret that some people are still turning a blind eye to the extremes and fishing for votes in murky waters.","Και μιας και μιλώ για δημοκρατική εγρήγορση, δεν μπορώ να μη σχολιάσω ένα γεγονός το οποίο είναι επιεικώς απαράδεκτο. Χθες τελείωσε η προθεσμία για την κατάθεση υπομνημάτων από τα κόμματα για την υπόθεση η οποία εκδικάζεται στο Α’ Τμήμα του Αρείου Πάγου, εάν οι μαχαιροβγάλτες της Χρυσής Αυγής θα μπορέσουν να συγκροτήσουν συνδυασμούς και να κατέβουν στις εθνικές εκλογές.Η Νέα Δημοκρατία κατέθεσε υπόμνημα επιχειρηματολογώντας επί της ουσίας της υπόθεσης. Το ΠΑΣΟΚ κατέθεσε υπόμνημα. Ο ΣΥΡΙΖΑ ήταν απών. Απών ακόμα μια φορά από το δημοκρατικό καθήκον. Από το δημοκρατικό καθήκον να κρατήσουμε έξω από τη Βουλή αυτούς οι οποίοι ενδύονται τον μανδύα ενός κόμματος, ενώ στην πραγματικότητα είναι μια εγκληματική συμμορία.Λυπάμαι που κάποιοι εξακολουθούν να κλείνουν το μάτι στα άκρα και να ψαρεύουν ψήφους σε θολά νερά.",criticism,democracy,other,-0.7,0.2,0.5,"[['new democracy', 'organization', '1.0'], ['pasok', 'organization', '1.0'], ['syriza', 'political party', '1.0'], ['greek', 'country', '1.0'], ['yesterday', 'date', '1.0'], ['the first chamber of the supreme court', 'organization', '0.7'], ['parliament', 'organization', '0.7'], ['golden dawn', 'group of people', '0.7']]"
22,"In any case, as we go into the elections, we will always speak coherently, politically, without complacency, without arrogance, without seeking either aggravation or polarisation.We have things to say about what we have done. We have courageously acknowledged our mistakes and we are committed to correcting them. But above all we have a plan for the Greece of the next day.","Εμείς σε κάθε περίπτωση, καθώς θα πηγαίνουμε προς τις εκλογές, θα μιλάμε πάντα συγκροτημένα, πολιτικά, χωρίς αυταρέσκεια, χωρίς αλαζονεία, χωρίς να επιδιώκουμε ούτε την όξυνση ούτε την πόλωση.Έχουμε πράγματα να πούμε για αυτά τα οποία κάναμε. Έχουμε αναγνωρίσει με θάρρος τα λάθη μας και έχουμε δεσμευτεί ότι θα τα διορθώσουμε. Αλλά κυρίως έχουμε σχέδιο για την Ελλάδα της επόμενης μέρας",political agenda,elections,campaigning,0.75,0.0,0.0,"[['greece', 'country', '1.0'], ['greece', 'location', '0.4'], ['elections', 'organization', '0.5'], ['mistakes', 'organization', '0.2'], ['plan', 'organization', '0.2']]"
23,"We want to oppose politically both the grey and the black of SYRIZA, which describes a Greece that exists only in their own historical imagination. We contrast the Greece of optimism, of smiles, of self-confidence, especially of those young children who want and honour a Greece that is more powerful and that gives them the opportunity to live a life better than the one their parents have created.
So let's go and fight this fight together, I always say, and I now have enough electoral experience. I recognize that elections are not won by us, by the prime ministerial candidate, by the parliamentary candidates, and we have an excellent ticket here in the northern sector. Ultimately they are won by each and every one of you, no vote should be wasted, and I stress that because the May 21 election is the only election to which we have all our focus at this time. There is no second ballot for us, there is only one good one and it is May 21. If we want to close every loophole in so-called progressive coalition governments involving all those who want to replace your Euros with Demetrios, there is only one way to do it, a strong new democracy on the night of 21 May. I am absolutely sure that we will succeed.","Θέλουμε να αντιπαρατεθούμε πολιτικά και στο γκρίζο και το μαύρο του ΣΥΡΙΖΑ που περιγράφει μια Ελλάδα η οποία υπάρχει μόνο στη δική τους ιστορική φαντασία. Εμείς αντιπαραβάλουμε την Ελλάδα της αισιοδοξίας του χαμόγελου, της αυτοπεποίθησης, κυρίως αυτών των νέων παιδιών που θέλουν και τιμούν μια Ελλάδα πιο ισχυρη που θα τους δίνει τη δυνατότητα να ζήουν μια ζωη καλυτερη απο αυτη που εξησαν οι γονεις τους.
Πάμε λοιπόν να τον δώσουμε αυτό τον αγώνα μαζί πάντα λέω και έχω πια αρκετή εκλογική εμπειρία. Αναγνωρίζω ότι οι εκλογές δεν κερδίζονται από εμάς, από τον υποψήφιο πρωθυπουργό, από τους υποψήφιους βουλευτές και έχουμε ένα εξαιρετικό ψηφοδέλτιο εδώ πέρα στο βόρειο τομέα. Τελικά κερδίζονται από την καθεμία και από τον καθένα από σας καμία ψήφος δεν πρέπει να πάει χαμένη, το τονίζω αυτό διότι οι εκλογές της 21ης Μαιου είναι οι μόνες εκλογές στις οποίες έχουμε αυτή τη στιγμή στοχευμένη όλη μας την προσήλωση. Δεν υπάρχει δεύτερη κάλπη για μας, υπάρχει μια καλή μόνο και είναι η 21η Μαιου. Αν θέλουμε να κλείσουμε κάθε χαραμάδα σε κυβερνήσεις δήθεν προοδευτικής συνεργασίας στις οποίες θα συμμετέχουν όλοι αυτοί που θέλουν να αντικαταστήσουν τα ευρώ σας με Δήμητρες, ένας τρόπος υπάρχει μόνο ισχυρή νέα δημοκρατία το βράδυ της 21ης μαίου. Είμαι απολυτως σίγουρος ότι θα το πετύχουμε.",political agenda,elections,election spending,0.5,0.2,0.0,"[['syriza', 'political party', '1.0'], ['greece', 'country', '1.0'], ['may 21', 'date', '1.0'], ['new democracy', 'organization', '1.0'], ['demetrios', 'person', '1.0']]"
24,"Citizens are looking for hard work, they are looking for results, they are looking for politicians who understand that in the complex problems of today's world there are no doubts and they are looking for that model of governance that the new democracy brought to the country, this new democracy, the party of Constantine Karamanlis, which comes from far away, goes far away. The only party has only one party, which has remained powerful since it was founded. Which ultimately does not divide but unites.","Οι πολίτες αναζητούν σκληρή δουλειά, αναζητούν αποτέλεσμα, αναζητούν πολιτικούς που να καταλαβαίνουνε ότι στα σύνθετα προβλήματα του σημερινού κόσμου δεν υπάρχουν αμφισβητήσεις και αναζητούν τελικά αυτό το πρότυπο διακυβέρνησης, το οποίο η νέα Δημοκρατία έφερε στον τόπο αυτή η νέα δημοκρατία, η παράταξη του Κωνσταντίνου Καραμανλή που έρχεται από μακριά, πηγαίνει μακριά. Η μόνη παράταξη έχει μόνη παράταξη, η οποία παραμένει πανίσχυρη από τη στιγμή που ιδρύθηκε. Η οποία τελικά δεν διχάζει αλλά ενώνει.",political agenda,democracy,other,0.8,0.1,0.1,"[['constantine karamanlis', 'person', '1.0'], ['new democracy', 'organization', '1.0'], ['country', 'location', '1.0.']]"
25,"In which our fellow citizens, our friends, who did not traditionally belong to the new democracy, can also participate in this great effort, but who are now coming and joining this great common effort, because they understand what the elections are all about. They know very well that the country must keep moving forward, aiming high, will not turn back with your help, support with your help. We will be the big winners. Be well. I wish you a good race. Good strength, good May Day. Be well. Thank you very much for this amazing gathering.
","Στην οποία μπορούν να συμμετέχουν σε αυτή τη μεγάλη προσπάθεια και συμπολίτες φίλοι μας, οι οποίοι δεν ανήκαν παραδοσιακά στη νέα δημοκρατία, αλλά έρχονται τώρα και συστρατευονται σε αυτή τη μεγάλη κοινη προσπάθεια, διότι καταλαβαίνουν ποιο είναι το ζητούμενο των εκλογών. Ξέρουν πολύ καλά ότι η χώρα πρέπει να συνεχίσει να πηγαίνει μπροστά, να στοχεύει ψηλά, δεν θα γυρίσει πίσω με την δικιά σας, στηρίξει με τη δικιά σας βοήθεια. Θα είμαστε οι μεγάλοι νικητές. Να είστε καλά. Ευχαμαι καλό αγώνα. καλη δυναμη καλή Πρωτομαγια. Να στε καλα ευχαριστω πολύ γι αυτην την καταππληκτική συγκεντρωση.
",political agenda,elections,other,0.5,0.0,0.0,"[['may day', 'date', '1.0'], ['new democracy', 'organization', '0.9'], ['country', 'location', '0.8'], ['elections', 'organization', '0.7'], ['citizens', 'group of people', '0.6'], ['friends', 'group of people', '0.6']]"
