id,text,text_el,is_criticism,topic-context,subtopic-context,sentiment,polarization-definition,populism-definition,ner-limited
1,"Good month, good victorious month for our New Democracy party. Thank you from the bottom of my heart for this spectacular participation in our call. To be with you today in my municipality in Kifissia and to see among you many old friends with whom we have been marching since 2004 and have fought many victorious battles together. This battle we will win. I did not expect such a turnout today on May Day, 20 days before the national elections which will decide whether our country will continue on the path of progress, progress and national self-confidence or whether it will turn back to a past that we all want to forget.","Καλό μήνα, καλό νικηφόρο μήνα για την παράταξή μας τη Νέα Δημοκρατία. Σςα ευχαριστώ από καρδιάς γι αυτην την θεαματική συμμετοχή στο κάλεσμα μας. Να βρεθώ σήμερα κοντα σας στο δήμο μου στην Κηφισιά και να δω αναμεσα σας πολλούς παλιους φίλους με τους οποίους πορευτήκαμε από το 2004 και δώσεμα μαζι πολλές νικηφόρες μάχες. Αυτή τη μαχη θα την κερδίσουμε. Δεν περίμενα τέτοια προσέλευση σήμερα Πρωτομαγια, 20 μέρες πριν από τις εθνικες εκλογές οι οποίες θα κρίνουν αν η χώρα μας θα συνεχίσει στο δρόμο της προόδου της προκοπής της εθνικης αυτοπεποιηθησης ή αν θα γυρίσει πίσω σ ένα παρελθον το οποιο ολοι και ολες θελουμε να ξεχασουμε. ",political agenda,other,other,0.8,0.0,0.0,"[['1. new democracy party', 'organization', 'high probability'], ['2. kifissia', 'location', 'high probability'], ['3. may day', 'date', 'high probability'], ['4. 2004', 'date', 'low probability'], ['5. 20 days before the national elections', 'date', 'high probability'], ['6. country', 'location', 'high probability.']]"
2,"Spyro you said something in your introduction 4 years ago we remember that they were asking us to find them slaves and now so many companies are looking for workers and raising wages so they can find them. This is the great success of our policy.Since today is May Day - workers' day - it is perhaps also an opportunity to finally think about who the party is, who the party is, who the government is that fought for the interests of the workers.","Σπύρο είπες κάτι στην εισαγωγή σου πριν από 4 χρόνια θυμαστε ότι μας ζητούσανε να τους βρούμε δούλεια και τώρα τόσες επιχειτήσεις ψάχνυν για εργαζόμενους κι αυξάνουν τους μισθους για να μπορέσουν να τους βρουν. Αυτή είναι η μεγαλη επιτυχία της δικής μας πολιτικής.Μιας και σήμερα είναι Πρωτομαγιά -η μέρα των εργαζομένων- είναι ίσως και μια ευκαιρία να σκεφτούμε τελικά ποιο είναι το κόμμα, ποια είναι η παράταξη, ποια είναι η κυβέρνηση που αγωνίστηκε για τα συμφέροντα των εργαζόμενων.",political agenda,employment,workers' rights,0.6,0.2,0.2,"[['spyro', 'person', '0.9'], ['may day', 'date', '0.9']]"
3,Who are the ones who increased the basic wage by 20% and took it to 780 euros. Who are the ones who introduced the digital job card so that all overtime could be recorded.Who are the ones who increased maternity and paternity leave for the first time. For the first time we have paternity leave.Who are they who have strengthened labour market controls,"Ποιοι είναι αυτοί, που αύξησαν τον βασικό μισθό κατά 20% και τον πήγαν στα 780 ευρώ. Ποιοι είναι αυτοί που εισήγαγαν την ψηφιακή κάρτα εργασίας για να μπορέσουν όλες οι υπερωρίες να καταγράφονται.Ποιοι είναι αυτοί που αύξησαν τις άδειες μητρότητας και πατρότητας, για πρώτη φορά. Για πρώτη φορά έχουμε άδεια πατρότητας.Ποιοι είναι αυτοί, που ενίσχυσαν τους ελέγχους στην αγορά εργασίας",political agenda,employment,other,1.0,0.2,0.2,[]
4,"New Democracy is with May Day and Tsipras is with April Fool's Day. Because nothing but lies. He is a month behind.
Our friend tells us that pensions have been given. Mr Tsipras found a pensioner in Chios who did not receive his pension, but he did not tell us that he owed 40,000 to the funds. What the pensioners know is that pensions are now being paid in two months where they took two years to be paid.","Η Νέα Δημοκρατία είναι με την Πρωτομαγιά και ο Τσίπρας είναι με την Πρωταπριλιά. Διοτι από ψεμματα άλλο τίποτα. Έχει μέινει ένα μήνα πίσω.
Δόθηκαν συνταξεις μας λέει ο φίλος μας. Βρήκε ο κ. Τσίπρας κάποιον συνταξιουχο στη Χίο που δεν πήρε λέει την σύνταξή του αλλά δεν μας είπε ότι χρωστούσε και 40.000 στα ταμεία. Αυτό το οποίο γνωρίζουν οι συνταξιουχοι είναι ότι οι συντάξεις δίνονται πια σε δυο μήνες εκεί που θέλανε 2 χρόνια για να δοθουμε.",criticism,pensioners,pensions,-0.8,0.9,0.2,"[['new democracy', 'organization', '0.9'], ['may day', 'date', '1.0'], ['tsipras', 'person', '0.9'], [""april fool's day"", 'date', '1.0'], ['mr tsipras', 'person', '0.9'], ['chios', 'location', '0.8']]"
5,"Our economy is now an economy that is growing much faster than the eurozone's medium term, it is creating jobs, see here, the commercial centre of Kifissia and more, investments are coming to our country much more than they used to. Despite the difficulties, the country can look to the future again with optimism and self-confidence. And I assure you that none of what we have achieved has been easy. When we signed the truth agreement in 2019, I looked you in the eye and committed to 3 things: I would cut taxes and I cut taxes for all and for everyone. ENVIA, Parent Benefit, Introductory Tax Rate, Employer Contributions.","Η οικονομια μας πια είναι μια οικονομια η οποία αναπτύσετε πολύ γρηγόροτερα από το μεσο ορο της ευρωζωνης, δημιουργει θεσεις εργασίας, δείτε εδώ περα σφίζει το εμπορικό κέντρο της Κηφισιάς κι όχι μόνο, επενδύσεις ερχονται στην πατρίδα μας πολλες περισσότερες απ αυτές που ερχόντουσαν ποτε. Η χώρα μπορεί παρα τις δυσκολίες να ατενιζει και πάλι το μέλλον με αισιοδοξια και αυτοπεποιθηση. Και σας διαβεβαιωνω ότι τιποτα από όλα αυτά που πετύχαμε δεν ήταν εύκολο. Όταν το 2019 υπογραψαμε τη συμφωνια αληθειας σας είχα κοιταξει στα ματια και σας είχα δεσμευτεί για 3 πράγματα: Θα μειώσω τους φόρους και μείωσα τους φόρους για όλες και για όλους. ΕΝΦΙΑ, Γονικη Παροχή, εισαγωγικό φορολογικό συντελεστή, εργοδοτικές εισφορές. ",political agenda,other,tax cuts,0.8,0.0,0.0,"[['1. kifissia', 'location', '1.0'], ['2. greece', 'country', '1.0'], ['3. 2019', 'date', '1.0']]"
6,"I told you that I would make the country an attractive country for investment again and yes this government has created 300,000 new jobs. And when we talk about social policy, there is no policy with a bigger footprint than a policy that can lift an unemployed person out of poverty and finally give them the opportunity to get ahead, to work with a decent income. And I told you a third thing, I will make our country safe and proud again. And yes, we have fortified our borders.","Σας είχα πει ότι Θα ξανακάνω τη χώρα μια ελκυστική χώρα για επενδύσεις και ναι αυτή κυβέρνηση δημιούργησε 300.000 νέες θέσεις εργασίας. Κι όταν μιλάμε για κοινωνική πολιτική, δεν υπάρχει πολιτική με μεγαλύτερο αποτύπωμα από την πολιτική, η οποία μπορεί να βγάζει ένα άνεργο από την ανέχεια και να του δίνει επιτέλους την ευκαιρία να προκόψει, να εργαστεί με αξιοπρεπές εισόδημα. Και σας είχα πει και κάτι τρίτο, θα ξανακάνω τη χώρα μας ασφαλή και υπερήφανη. Και ναι θωρακίσαμε τα σύνορα μας.",political agenda,employment,employment,0.9,0.0,0.0,"[['country', 'location', '1.0'], ['government', 'organization', '1.0'], ['social policy', 'organization', '0.7'], ['person', 'person', '0.5'], ['policy', 'organization', '0.5'], ['unemployed person', 'person', '0.9'], ['poverty', 'organization', '0.5'], ['third thing', 'organization', '0.5'], ['borders', 'location', '1.0']]"
7,"Mr Tsipras went to Chios and did not say a word about the refugee issue. Because obviously, if this discussion were opened, people would remind him of all the nice things he said, that the sea has no borders, that everyone can enter our country without any controls. I am proud, friends, that we have implemented a strict but fair immigration policy. The country has borders and must protect them on land and sea.","Πήγε ο κ. Τσίπρας στη Χίο και δεν είπε κουβέντα για το προσφυγικό. Γιατί προφανώς αν ανοιγε αυτή η συζήτηση, θα του θύμιζαν διάφοροι όλα αυτά τα ωραία, τα οποία έλεγε ότι η θάλασσας δεν έχει σύνορα, ότι μπορούν όλοι να περνούν στην πατρίδα μας χωρίς κανέναν έλεγχο. Είμαι υπερήφανος φίλες και φίλοι που εφαρμόσαμε μια αυστηρή αλλά δίκαιη μεταναστευτική πολιτική. Η χώρα έχει σύνορα και πρέπει να τα προφυλάσσει και στη θάλασσα και στην ξηρά.",political agenda,migration,sea borders,-0.5,0.2,0.0,"[['mr tsipras', 'person', '0.95'], ['chios', 'location', '0.95'], ['refugee issue', 'group of people', '0.70'], ['country', 'location', '0.75'], ['immigration policy', 'political party', '0.60'], ['land', 'location', '0.55'], ['sea', 'location', '0.50']]"
8,Others are with cloves. I prefer roses.,Άλλοι είναι με γαρύφαλλα. Εγώ προτιμώ τα τριαντάφυλλα.,,other,other,0.5,0.0,0.0,[]
9,"So this policy of strengthening the armed forces, of strengthening the credibility of the country, a country that counts again in Europe and in the world, a country whose voice is heard not only when it speaks about our national interests, when it speaks about important European issues. This is a country today that is more on its feet and I am really very impressed.","Αυτή την πολιτική λοιπόν,  της ενίσχυσης των ενόπλων δυνάμεων, της ενίσχυσης της αξιοπιστίας της χώρας, μια χώρα η οποία μετρά και πάλι στην Ευρώπη και στον κόσμο μια χώρα της οποίας η φωνή  ακούγεται όχι μόνο όχι μόνο όταν μιλάει για τα εθνικά μας συμφέροντα, όταν μιλάει για τα σημαντικά ευρωπαϊκά ζητήματα. Αυτή η χώρα είναι μια χώρα σήμερα η οποία πατάει πιο καλά στα πόδια της και πραγματικά μου κάνει πολύ εντύπωση. ",political agenda,other,defense spending,0.9,0.0,0.0,"[['europe', 'location', '0.9'], ['world', 'location', '0.8'], ['national', 'group of people', '0.5'], ['european', 'group of people', '0.5'], ['country', 'location', '0.5']]"
10,"I was watching - maybe you saw them too - the SYRIZA advertising campaign spots, grey and black everywhere. And I wonder if this is the Greece that Greek citizens are experiencing today. The answer is ""no"", my friends; the Greece of grey and misery was their Greece that we left behind for good in 2019. Ours is a more optimistic, brighter Greece.","Έβλεπα -ίσως τα είδατε και εσείς- τα σποτάκια της διαφημιστικής καμπάνιας του ΣΥΡΙΖΑ, γκρίζο και μαύρο παντού. Και αναρωτιέμαι αν αυτή είναι η Ελλάδα την οποία βιώνουν σήμερα οι Έλληνες πολίτες. Η απάντηση είναι “όχι”, φίλες και φίλοι.Η Ελλάδα του γκρίζου και της μιζέριας ήταν η δική τους Ελλάδα που την αφήσαμε για τα καλά πίσω το 2019. Η δική μας Ελλάδα είναι πιο αισιόδοξη, πιο φωτεινή.",political agenda,elections,campaigning,0.8,0.0,0.1,"[['syriza', 'organization', '0.9'], ['greece', 'country', '1'], ['greek citizens', 'group of people', '0.9'], ['2019', 'date', '1']]"
11,"Be careful, it is not a Greece without problems. We were the first to say that we have managed many difficulties and that we must continue to support society. Accuracy is still here and it is eating away at people's income. That is why we rushed in and supported households with a number of tools to be able to alleviate this great difficulty of imported precision.","Προσέξτε, δεν είναι μια Ελλάδα χωρίς προβλήματα. Πρώτοι εμείς είπαμε ότι διαχειριστήκαμε πολλές δυσκολίες και ότι πρέπει να εξακολουθούμε να στηρίζουμε την κοινωνία. Η ακρίβεια είναι ακόμα εδώ και ροκανίζει το εισόδημα των πολιτών. Γι’ αυτό και σπεύσαμε και στηρίξαμε τα νοικοκυριά, με μια σειρά από εργαλεία για να μπορέσουμε να απαλύνουμε αυτή τη μεγάλη δυσκολία της εισαγόμενης ακρίβειας.",political agenda,economy,cost of living,0.1,0.0,0.0,"[['greece', 'country', '1.0'], ['society', 'group of people', '0.6'], ['households', 'group of people', '0.6']]"
12,"But there is no doubt that if you ask any objective citizen today - I'm not necessarily referring to citizens who vote for New Democracy - if the country is in a better state today than it was in 19, they will say yes. Greece today is on the right track.","Αλλά δεν υπάρχει καμία αμφιβολία ότι αν ρωτήσετε οποιονδήποτε αντικειμενικό πολίτη σήμερα -δεν αναφέρομαι κατ’ ανάγκη σε πολίτες που ψηφίζουν τη Νέα Δημοκρατία- αν η χώρα είναι σε καλύτερη κατάσταση σήμερα από ό,τι ήταν το ’19, θα σας πουν καταφατικά “ναι”. Η Ελλάδα σήμερα είναι στο σωστό δρόμο.",political agenda,economy,economic crisis,0.75,0.0,0.0,"[['greece', 'country', '1.0'], ['new democracy', 'political party', '0.5']]"
13,"And this path that is being recognised, this path that is now recognised by all, by all, by the foreign houses, by the foreign analysts, is a path that must continue.","Και αυτός ο δρόμος που αναγνωρίζεται, αυτή η πορεία που αναγνωρίζεται πια από όλες και από όλους, από τους ξένους οίκους, από τους ξένους αναλυτές, είναι μια πορεία η οποία πρέπει να συνεχιστεί.",political agenda,economy,other,0.8,0.0,0.0,"[['foreign houses', 'organization', '0.9'], ['foreign analysts', 'group of people', '0.9']]"
14,"We talk a lot about the investment grade. And typically that's the reason we used to take the country to the polls a month before the end of our term of office, I remind you. Remember I told you a long time ago that I would run out the term and we did run out the term It's another commitment that we kept.",Μιλάμε πολύ για την επενδυτική βαθμίδα. Και τυπικά αυτός είναι και ο λόγος τον οποίον χρησιμοποιήσαμε για οδηγήσουμε τη χώρα σε κάλπες ένα μήνα θυμίζω νωρίτερα από τη λήξη της θητείας μας. Θυμάστε ότι σας είχα πει πριν από καιρό ότι εγώ θα εξαντλήσω τη θητεία και εξαντλήσαμε τη θητεία μας Είναι ακόμα μία δέσμευση που διατηρησαμε.,political agenda,elections,other,0.2,0.0,0.0,"[['investment grade', 'organization', '0.7'], ['country', 'location', '0.5'], ['polls', 'organization', '0.4'], ['term of office', 'organization', '0.5']]"
15,"But reaching the investment tier is of huge importance not only for the country's finances, for the finances of every household, because it means that our country is finally getting access to other funds and the cost of borrowing will be reduced and all households and all businesses will benefit from that. And one thing is certain, the country will gain an investment grade the day after the new democracy wins a significant, a strong victory in the elections. Because we need stable and effective government today.","Αλλά η επίτευξη της επενδυτική βαθμίδας έχει τεράστια σημασία όχι μόνο για τα οικονομικά της πατρίδας, για τα οικονομικά του κάθε νοικοκυριού, διότι σημαίνει ότι επιτέλους η χώρα μας αποκτά πρόσβαση σε άλλα κεφάλαια και το κόστος δανεισμού θα μειωθεί και απ αυτό θα ωφεληθούν όλα τα νοικοκυριά και όλες επιχειρήσεις. Και ένα πράγμα είναι βέβαιο, η χώρα θα αποκτήσει επενδυτική βαθμίδα την επόμενη μέρα που η νέα δημοκρατία θα καταγάγει μια σημαντική, μια ισχυρή νίκη στις εκλογές. Γιατί χρειαζόμαστε σήμερα σταθερη κι αποτελεσματική κυβερνηση.",political agenda,economy,investments,0.7,0.0,0.0,"[['country', 'location', '1.0'], ['households', 'group of people', '1.0'], ['businesses', 'organization', '1.0'], ['democracy', 'political party', '1.0'], ['elections', 'date', '1.0']]"
16,"A government that will continue this work, which we have already started, a government that will implement a programme that is costed and well thought out. A few days ago I had the opportunity to present my vision for Greece for the next four years in a different way from the usual ones. I had first and foremost the young people in mind.
What will Greece live in in 2027, in 2030 How will we continue on the path of recovery? How - and this is my first priority - young children will be able to find better wages. In 2019 I committed to you and I delivered on my pledge to cut taxes, so now I commit to you that the next four years will be a four-year period of better wages for all and for all. It will be the four years of more investment.","Μια κυβέρνηση η οποία θα συνεχίσει αυτή τη δουλειά, την οποία έχουμε ήδη ξεκινήσει μια κυβέρνηση η οποία θα εφαρμόσει ένα πρόγραμμα το οποίο είναι κοστολογημένο και μελετημένο. Πριν από λίγες μέρες είχα την ευκαιρία να παρουσιάσω με έναν διαφορετικό τρόπο από τους συνηθισμένους το όραμά μου για την Ελλάδα της επόμενης τετραετίας. Είχα πρωτίστως υποψη μου τα νέα παιδια.
Σε τι η Ελλάδα θα ζήσουν το 2027, το 2030 Πώς θα συνεχίσουμε την πορεία ανάκαμψης; Πως -κι αυτή είναι η πρώτη μου προτεραιότητα- τα νέα παιδιά θα μπορούν βρουν καλύτερους μισθούς. Το 2019 σας δεσμευτικά και υλοποίησα τη δέσμευσή του ότι θα μειώσω τους φόρους, έτσι και τώρα δεσμεύομαι απέναντί σας ότι η επόμενη τετραετία θα είναι τετραετία των καλύτερων μισθών για όλες και για όλους. Ιδιωτικούς και δημοσίους υπαλλήλους.Θα είναι η τετρατία των περισσότερων επενδύσεων.",political agenda,other,wages,0.8,0.0,0.0,"[['greece', 'country', '1.0'], ['2027', 'date', '1.0'], ['2030', 'date', '1.0'], ['2019', 'date', '1.0']]"
17,"It will be a four-year term in which we will make even more leaps in the digital state.Few of you remember your life, our life before gov.gr. We made a revolution, we revolutionized the way citizens and businesses communicate with the state. The queues we used to know are now a thing of the past, but we still have many steps to take to make the state truly digital and the behaviours of state officials, all behaviours worthy of your expectations in one thing I will not back down: evaluation everywhere and for everyone; and rewarding effort and results. That is what we expect, that is what you expect and that is what we can make happen in the next four years.","Θα είναι τετραετία στην οποία θα κάνουμε ακόμα περισσότερα άλματα στο ψηφιακό κράτος.Λίγοι από εσάς Θυμάστε τη ζωή σας τη ζωή μας πριν από τον gov.gr. Κάναμε μια επανάσταση, κάναμε μια επανάσταση στον τρόπο με το οποίο επικοινωνεί ο πολίτης και η επιχείρηση με το κράτος. Οι ουρές που ξέραμε ανήκουν πια στο παρελθόν, αλλά έχουμε πολλά βήματα να κάνουμε ακόμα για να γίνει το κράτος πραγματικά ψηφιακό και οι συμπεριφορές των κρατικών λειτουργών, όλες τις συμπεριφορές να είναι αντάξιες των προσδοκιών σας σε ένα πράγμα δεν πρόκειται να κάνω πίσω: αξιολόγηση παντού και για όλους.Κι επιβράβευση της προσπαθειας και του αποτελεσματος. Αυτό περιμένουμε αυτό περιμενετε κι εσείς κι αυτό μπορούμε να κάνουμε πράξη την επόμενη τετραετία. ",political agenda,other,digital governance,0.5,0.0,0.0,"[['gov.gr', 'organization', '0.7'], ['state', 'political party', '0.5'], ['four-year term', 'date', '0.7']]"
