id,text,text_el,is_criticism,topic-context,subtopic-context,sentiment,polarization-definition,populism-definition,ner-limited
17,"Do you deserve a Prime Minister who eavesdrops and peers from the Predator keyhole in his office at half the political system? A prime minister who collects material to blackmail half of Greece? We may not agree on much, but there's one thing I'm sure we'll agree on: That this is the most immoral thing any Greek prime minister has ever done in this country. So even if you do not disagree with Mitsotakis' policies, I am sure you disagree with his ethics. So don't give him a blank cheque with your vote so that he can be laundered and spend the next four years doing even worse for democracy. We all have a responsibility with our vote.","Σας αξίζει ένας πρωθυπουργός που κρυφακούει και κρυφοκοιτάζει από την κλειδαρότρυπα του Predator στο γραφείο του το μισό πολιτικό σύστημα; Ένας πρωθυπουργός που συλλέγει υλικό για να εκβιάζει τη μισή Ελλάδα; Μπορεί να μη συμφωνούμε σε πολλά, για ένα πράγμα όμως είμαι σίγουρος ότι θα συμφωνήσουμε: Ότι αυτό είναι ό,τι πιο ανήθικο έχει κάνει ποτέ στη χώρα οποιοσδήποτε Έλληνας πρωθυπουργός. Ακόμα λοιπόν και αν δεν διαφωνείτε με την πολιτική Μητσοτάκη, είμαι βέβαιος ότι διαφωνείτε με την ηθική του. Μην του δώσετε λοιπόν λευκή επιταγή με την ψήφο σας για να ξεπλυθεί και τα επόμενα τέσσερα χρόνια, να κάνει ακόμα χειρότερα για τη δημοκρατία. Έχουμε όλοι ευθύνη με την ψήφο μας. ",criticism,accountability,wiretapping,-0.9,0.6,0,"[['mitsotakis', 'person', '0.6'], ['greece', 'country', '1.0'], ['four years', 'date', '1.0']]"
18,"So I was saying that Mr Mitsotakis, I was saying that he doesn't care. But do you want me to tell you something? He doesn't care about many people. There are some he cares about. There are a few that he cares about and he is misunderstood. The houses that are being lost, some people are snatching them up. That's who he cares about. Out of the wages of poverty come the profits of wealth. For those who make it, he cares. From obscenity in electricity, supermarket, fuel, some people stuff bills in tax havens. That's who he cares about. And they, you know what? They didn't work, they worked. Because that was his policy. Right before our eyes he has embarked, with plan and cynicism, on the greatest redistribution of wealth and property since World War II to date. And woe betide him if there is a second four-year term. He is capable of giving even Knossos to the funds and evicting you.","Ο κ. Μητσοτάκης, έλεγα λοιπόν, ότι δεν νοιάζεται. Θέλετε όμως να σας πω και κάτι; Δεν νοιάζεται για τους πολλούς. Υπάρχουν κάποιοι για τους οποίους νοιάζεται. Υπάρχουν κάποιοι λίγοι για τους οποίους νοιάζεται και παρανοιάζεται. Τα σπίτια που χάνονται, κάποιοι τα αρπάζουν κοψοχρονιά. Γι' αυτούς νοιάζεται. Από τους μισθούς της φτώχειας, βγαίνουν τα κέρδη του πλούτου. Γι' αυτούς που τα βγάζουν, νοιάζεται. Από την αισχροκέρδεια στο ρεύμα, το σούπερ μάρκετ, τα καύσιμα, κάποιοι μπουκώνουν λογαριασμούς σε φορολογικούς παραδείσους. Γι' αυτούς νοιάζεται. Κι αυτά, ξέρετε κάτι; Δεν έτυχαν, πέτυχαν. Γιατί αυτή ήταν η πολιτική του. Μπροστά στα μάτια μας έχει αρχίσει με σχέδιο και κυνισμό, τη μεγαλύτερη αναδιανομή πλούτου και περιουσιών από τον Β’ Παγκόσμιο Πόλεμο ως σήμερα. Και αλίμονο αν υπάρξει δεύτερη τετραετία. Αυτός είναι ικανός να δώσει στα funds ακόμη και την Κνωσό και να σας κάνει έξωση.",criticism,corruption,other,-0.9,0.8,0.8,"[['mitsotakis', 'person', '0.9'], ['world war ii', 'date', '0.7'], ['knossos', 'location', '0.5']]"
19,"Because, citizens of Heraklion, he cares for a few and powerful. It cares about the army of day labourers who have distributed billions from direct commissions, companies set up a few days before the tenders, the blue children and, as we have aptly named them, the 'blue locusts'. He cares about the big business groups that took the money from the Recovery Fund instead of giving it to infrastructure for the public good, while the small and medium sized businesses, 96% of the businesses in our country, cannot even get past the banks, not to sit at the counter for loans. He cares about these 15 listed companies that have set a 20-year record of profitability, with over 1 billion in profits each in '22. Yes, he cares about them.","Γιατί, πολίτες του Ηρακλείου, νοιάζεται για κάποιους λίγους και ισχυρούς. Νοιάζεται για τον στρατό των ημετέρων που μοιράστηκε δισεκατομμύρια από τις απευθείας αναθέσεις, εταιρείες που φτιάχτηκαν λίγες μέρες πριν τους διαγωνισμούς, για τα γαλάζια παιδιά και, όπως εύστοχα τις ονοματίσαμε, για τις «γαλάζιες ακρίδες». Νοιάζεται για τους μεγάλους επιχειρηματικούς ομίλους που πήραν τα λεφτά από το Ταμείο Ανάκαμψης, αντί να δοθούν για υποδομές για το δημόσιο συμφέρον, ενώ οι μικρομεσαίοι, το 96% των επιχειρήσεων στη χώρα μας, δεν μπορούν να περάσουν ούτε έξω από τις τράπεζες, όχι να καθίσουν στο γκισέ για δανειοδότηση. Νοιάζεται γι' αυτές τις 15 εισηγμένες στο Χρηματιστήριο εταιρείες που έχουν κάνει ρεκόρ κερδοφορίας εικοσαετίας, με πάνω από 1 δισεκατομμύριο κέρδη η κάθε μια το ’22. Ναι, γι' αυτούς νοιάζεται. ",criticism,corruption,banking profits,-0.8,0.2,0.5,"[['heraklion', 'location', '1.0'], ['recovery fund', 'organization', '1.0'], ['15 listed companies', 'organization', '1.0'], ['22', 'date', '1.0'], ['day labourers', 'group of people', '0.9'], ['blue children', 'group of people', '0.9'], ['blue locusts', 'group of people', '0.9'], ['big business groups', 'group of people', '0.9'], ['small and medium sized businesses', 'group of people', '0.9'], ['public', 'political party', '0.5']]"
20,"And what does he want? To forget everything that has happened over the years by going to the polls. What did he tell us yesterday? ""Nobody votes for what happened yesterday, but for the future."" Really now, Mr Mitsotakis? Is this what you say when your whole election campaign is about what we did in '15? So nobody cares, do they? What does it say to the voters? Forget what happens to you when you go to the supermarket and you see the prices and you find that the bill is not coming out.","Και τι θέλει; Να τα ξεχάσουμε όλα όσα έγιναν αυτά τα χρόνια, πηγαίνοντας στην κάλπη. Τι μας είπε χτες; «Κανένας δεν ψηφίζει γι' αυτά που έγιναν χτες, αλλά για το μέλλον». Αλήθεια τώρα, κ. Μητσοτάκη; Τα λέτε εσείς αυτά που όλη σας η προεκλογική εκστρατεία είναι τι κάναμε εμείς το ’15; Κανείς δεν νοιάζεται λοιπόν, έτσι; Τι λέει στους ψηφοφόρους; Ξεχάστε τι παθαίνετε όταν μπαίνετε στα σούπερ μάρκετ και βλέπετε τις τιμές και διαπιστώνετε ότι δεν βγαίνει ο λογαριασμός. ",criticism,economy,cost of living,-0.7,0.4,0.2,"[['mitsotakis', 'person', '0.9'], [""'15"", 'date', '0.5']]"
21,"Forget if you are a young couple and you can't open a house because the salaries in Greece are Bulgarian salaries and the rents are British, London rents.","Ξεχάστε αν είστε νέο ζευγάρι και δεν μπορείτε να ανοίξετε σπίτι γιατί οι μισθοί στην Ελλάδα είναι μισθοί Βουλγαρίας και τα ενοίκια είναι ενοίκια Βρετανίας, Λονδίνου. ",criticism,housing,affordable housing,-0.9,0,0,"[['greece', 'country', '0.5'], ['bulgarian', 'location', '0.5'], ['british', 'location', '0.5'], ['london', 'location', '0.5']]"
22,"Forget, he says, if you are a shopkeeper, the debt collectors who are after you and have become your nightmare.","Ξεχάστε, σας λέει, αν είστε καταστηματάρχης, τις εισπρακτικές που σας κυνηγάνε κι έχουν γίνει εφιάλτης σας. ",criticism,debt,other,-0.8,0,0,[]
23,"Forget if you are a pensioner, the 13th pension given to you by Syriza. I promised to keep it and I cut it off.","Ξέχνα αν είσαι συνταξιούχος, τη 13η σύνταξη που σου έδωσε ο ΣΥΡΙΖΑ. Υποσχέθηκα ότι θα την κρατήσω και στην έκοψα.",criticism,pensioners,pensions,-0.8,0,0,"[['syriza', 'organization', '0.65']]"
24,"Forget it, if you are a farmer and you are devastated by the prices of fertilizers, animal feed, oil, forget it all!","Ξέχνα, αν είσαι αγρότης και έχεις καταστραφεί από τις τιμές στα λιπάσματα, τις ζωοτροφές, το πετρέλαιο, ξέχνα τα όλα! ",criticism,agricultural policy,prices,-0.9,0,0,"[['farmer', 'person', '100%'], ['fertilizers', 'organization', '100%'], ['animal feed', 'organization', '100%'], ['oil', 'organization', '100%']]"
25,"Forget everything that happened four years ago and everything you've been dragging out. Forget it when you go behind the screen. And give Mr Mitsotakis a chance to move on. To do what to you, that is? Finish you off. Trust the future to the man who burned our present and our past! No, Mr. Mitsotakis. The past four years describe in the darkest colours the four years you are preparing. That is why the Greek people, with their vote, will not let you complete this project! That is why we say that the future of the country is political change. And if tomorrow is a change, it is because your yesterday, Mr Mitsotakis, needed it, as you have done for four years.","Ξέχνα όλα όσα έγιναν τέσσερα χρόνια τώρα κι όσα τραβάς. Ξέχνα τα όταν πας πίσω από το παραβάν. Και δώσε μια ευκαιρία στον κ. Μητσοτάκη να συνεχίσει. Να σε κάνει τι, δηλαδή; Να σε αποτελειώσει. Να εμπιστευθούμε το μέλλον σ’ εκείνον που μας έκαψε το παρόν και το παρελθόν! Όχι κ. Μητσοτάκη. Η τετραετία που πέρασε περιγράφει με τα πιο μελανά χρώματα την τετραετία που ετοιμάζετε. Γι' αυτό και με την ψήφο του ο ελληνικός λαός δεν θα σας αφήσει να ολοκληρώσετε αυτό το έργο! Γι' αυτό λοιπόν λέμε ότι το αύριο του τόπου είναι η πολιτική αλλαγή. Και αν έγινε το αύριο αλλαγή, αυτό είναι γιατί την έκανε ανάγκη το δικός σας χτες, κ. Μητσοτάκη, όσα κάνατε τέσσερα χρόνια. ",criticism,elections,election spending,-0.7,0.9,0.2,"[['mitsotakis', 'person', '0.7'], ['greek people', 'group of people', '0.9'], ['country', 'location', '0.5'], ['political change', 'organization', '0.6'], ['yesterday', 'date', '0.3'], ['four years ago', 'date', '0.5'], ['four years', 'date', '0.5']]"
26,"But it tells us that change means adventures, SYRIZA means adventures, while its regime means stability. Stability in obscenity, stability in injustice, stability in inequality, stability in family rule. Good stability!
But what does he mean by saying that? Especially to young people? Sit on your haunches, that is what he is saying. Do not speak. Don't resist, don't even dream. So I answer this: His own stability is insecurity, worry, anxiety for the many. Because there is no stability anywhere in the world, nor in our country, without justice. There is no stability without democracy. There is no stability without social cohesion. Which is to say, there is no prospect of stability in the country without change. That is why the real dilemma ultimately for the people is: Mitsotakis or stability? And the answer is: SYRIZA on Sunday for a government of progressive cooperation, for a government of stability and longevity.","Μας λέει, όμως, ότι η αλλαγή σημαίνει περιπέτειες, ΣΥΡΙΖΑ σημαίνει περιπέτειες, ενώ το καθεστώς του σημαίνει σταθερότητα. Σταθερότητα στην αισχροκέρδεια, σταθερότητα στην αδικία, σταθερότητα στις ανισότητες, σταθερότητα στην οικογενειοκρατία. Ωραία σταθερότητα! 
Τι θέλει να πει όμως λέγοντάς το αυτό; Ιδίως στις νέες και στους νέους; Καθίστε στ’ αυγά σας, θέλει να πει. Μη μιλάτε. Μην αντιστέκεστε, μην ονειρεύεστε καν. Απαντώ λοιπόν σ’ αυτό: Η δική του σταθερότητα είναι η ανασφάλεια, η ανησυχία, η αγωνία για τους πολλούς. Γιατί δεν υπάρχει σταθερότητα πουθενά στον κόσμο, ούτε στον τόπο μας, χωρίς δικαιοσύνη. Δεν υπάρχει σταθερότητα χωρίς δημοκρατία. Δεν υπάρχει σταθερότητα χωρίς κοινωνική συνοχή. Που πάει να πει, δεν υπάρχει προοπτική σταθερότητας στον τόπο χωρίς αλλαγή. Γι' αυτό και το αληθινό δίλημμα τελικά για το λαό, είναι: Μητσοτάκης ή σταθερότητα; Και η απάντηση είναι: ΣΥΡΙΖΑ την Κυριακή για μια κυβέρνηση προοδευτικής συνεργασίας, για μια κυβέρνηση σταθερότητας και μακράς πνοής. ",political agenda,democracy,other,0.25,0.9,0.2,"[['syriza', 'political party', '1.0'], ['family rule', 'group of people', '0.8'], ['mitsotakis', 'person', '1.0'], ['syriza', 'political party', '1.0'], ['sunday', 'date', '1.0']]"
27,"Because, indeed, SYRIZA, the great force for change, is the most effective force for stability in the country. Because stability means security in people's lives. Stability means modern public health care, modern public education, support for the vulnerable. Stability means a sense of security at work. Pillars of stability are not big words, but what the Contract for Change that SYRIZA published the day before yesterday, with its 11 articles, is binding. We, you know, have kept Greece standing in the difficult times. We were tested under siege. We learned to measure every step we take by the good of the country and not the good of the party.","Γιατί, πράγματι, ο ΣΥΡΙΖΑ, η μεγάλη δύναμη της αλλαγής, είναι η πιο αποτελεσματική δύναμη σταθερότητας στον τόπο. Γιατί σταθερότητα σημαίνει ασφάλεια στη ζωή των ανθρώπων. Σταθερότητα σημαίνει σύγχρονη δημόσια Υγεία, σύγχρονη δημόσια Παιδεία, στήριξη των ευάλωτων. Σταθερότητα σημαίνει αίσθημα ασφάλειας στη δουλειά. Πυλώνες σταθερότητας δεν είναι τα μεγάλα λόγια, αλλά όσα δεσμευτικά  προβλέπει το Συμβόλαιο για την Αλλαγή που έδωσε στη δημοσιότητα ο ΣΥΡΙΖΑ προχθές, με τα 11 άρθρα του. Εμείς, ξέρετε, κρατήσαμε όρθια την Ελλάδα στα δύσκολα. Δοκιμαστήκαμε σε συνθήκες πολιορκίας. Μάθαμε να μετράμε κάθε μας βήμα με κριτήριο το καλό της πατρίδας και όχι του κόμματος. ",political agenda,elections,other,0.8,0.1,0,"[['syriza', 'organization', '1.0'], ['greece', 'country', '0.9']]"
28,"We led Greece out of the memoranda, into the markets. We endowed the stability of the country with 37 billion left in the public coffers, because our hands were honest. People's money that we respected to the last euro. Let us not be lectured on stability by the Party that threw the country into the maelstrom of bankruptcy, left it in 2009 with a 15% deficit and in '15 with empty coffers. It is too much for you to talk to us about stability! And this time, we can say it with certainty: We know how to get the country out of the crisis, we can get the country out of the crisis. We know, we can. That is the assurance we give.","Οδηγήσαμε την Ελλάδα έξω από τα μνημόνια, μέσα στις αγορές. Προικίσαμε τη σταθερότητα του τόπου με 37 δισεκατομμύρια που αφήσαμε στα δημόσια ταμεία, γιατί τα χέρια τα δικά μας ήταν έντιμα. Λεφτά του λαού που σεβαστήκαμε ως το τελευταίο ευρώ. Μη μας κάνει  και μαθήματα σταθερότητας η Παράταξη που έριξε τη χώρα στη δίνη της χρεοκοπίας, την άφησε το 2009 με 15% έλλειμμα και το ’15 με άδεια Ταμεία. Πάει πολύ να μας μιλάτε εσείς για σταθερότητα! Και τούτη την ώρα, μπορούμε να το πούμε με σιγουριά: Ξέρουμε πώς θα βγάλουμε τον τόπο από την κρίση, μπορούμε να βγάλουμε τον τόπο από την κρίση. Ξέρουμε, μπορούμε. Αυτή είναι η διαβεβαίωση που δίνουμε. ",criticism,economy,austerity,0.6,0.2,0,"[['greece', 'location', '1.0'], ['37 billion', 'date', '1.0'], ['party', 'political party', '0.7'], ['2009', 'date', '1.0'], [""'15"", 'date', '0.6']]"
29,We know and we can breathe life into the economy by raising the minimum wage to €880 and introducing indexation.,Ξέρουμε και μπορούμε να δώσουμε πνοή ανάπτυξης στην οικονομία αυξάνοντας τον κατώτατο μισθό στα 880 ευρώ και θεσπίζοντας την τιμαριθμική αναπροσαρμογή.,political agenda,employment,wages,0.8,0,0,"[['minimum wage', 'organization', '0.6'], ['indexation', 'organization', '0.6'], ['€880', 'organization', '0.4.']]"
30,"We know and we can protect the first home, commercial housing, agricultural land from auctions.","Ξέρουμε και μπορούμε να προστατεύσουμε την πρώτη κατοικία, την επαγγελματική στέγη, την αγροτική γή από τους πλειστηριασμούς. ",political agenda,housing,other,1,0,0.2,[]
31,"We know and we can support the middle class with tax relief, incentives for financing from European and domestic resources, with a reduction of bureaucracy.","Ξέρουμε και μπορούμε να στηρίξουμε τη μεσαία τάξη με ελάφρυνση της φορολογίας, κίνητρα χρηματοδότησης από ευρωπαϊκούς και εγχώριους πόρους με μείωση της γραφειοκρατίας.",political agenda,economy,tax cuts,0.5,0,0,"[['middle class', 'group of people', '1.0'], ['european union', 'organization', '1.0']]"
32,We know and we can decisively strengthen the welfare state.,Ξέρουμε και μπορούμε να ενισχύσουμε αποφασιστικά το κοινωνικό κράτος.,political agenda,social state,public welfare,0.6,0,0,[]
33,We know and can open up a path to education and employment for young children.,Ξέρουμε και μπορούμε να ανοίξουμε έναν δρόμο μόρφωσης και απασχόλησης στα νέα παιδιά.,political agenda,education,youth,0.5,0,0,[]
34,"We know and we can protect our cultural heritage, to upgrade our culture. We have the knowledge, the experience, but above all we can. Because we are asking not for a second chance, but for the first chance to govern without memoranda, without the Troika, without coercion. To govern with our will, with our programme and not with our musts! And we have the people to achieve this.","Ξέρουμε και μπορούμε να προστατεύσουμε την πολιτιστική μας κληρονομιά, να αναβαθμίσουμε τον πολιτισμό μας. Έχουμε τη γνώση, την εμπειρία, κυρίως όμως μπορούμε. Γιατί ζητάμε όχι μια δεύτερη ευκαιρία, αλλά την πρώτη ευκαιρία να κυβερνήσουμε χωρίς μνημόνια, χωρίς τρόικα, χωρίς καταναγκασμούς. Να κυβερνήσουμε με τα θέλω μας, με το πρόγραμμά μας και όχι με τα πρέπει! Και έχουμε και τους ανθρώπους για να το πετύχουμε αυτό. ",political agenda,culture,troika,0.4,0.1,0,[]
35,"I want that motto shouted four nights from now. On Sunday coming up, I want you to shout that motto. And we can make it happen! We can achieve the great victory of the people and of democracy and form a progressive government on May 22. Once again Crete will set the tone in this battle. And once again it will be Crete that will drive the Right and a Mitsotakis from the Maximou Mansion! You can be sure of that. It is getting close!",Θέλω το σύνθημα αυτό να το φωνάζετε σε τέσσερα βράδια από τώρα. Την Κυριακή που μας έρχεται να το φωνάζετε το σύνθημα αυτό. Και μπορούμε να το κάνουμε πράξη! Μπορούμε να πετύχουμε τη μεγάλη νίκη του λαού και της δημοκρατίας και να σχηματίσουμε προοδευτική κυβέρνηση στις 22 του Μάη. Για άλλη μια φορά η Κρήτη θα δώσει τον τόνο σ’ αυτή τη μάχη. Και για άλλη μια φορά η Κρήτη θα είναι αυτή που θα διώξει τη Δεξιά και έναν Μητσοτάκη από το Μέγαρο Μαξίμου! Να είστε βέβαιοι γι' αυτό. Κοντοζυγώνει η ώρα!,political agenda,elections,other,0.6,0.2,0.4,"[['sunday', 'date', '0.5'], ['may 22', 'date', '0.5'], ['crete', 'location', '0.9'], ['right', 'political party', '0.6'], ['mitsotakis', 'person', '0.7'], ['maximou mansion', 'location', '0.6']]"
